題目,作答,立意,結構,修辭,敘述,啟發,總分
"甲
(陶潛)為彭澤令。不以家累自隨，送一力給其子，書曰：「汝旦夕之費，自給為難。今遣此力，助汝薪水（打柴汲水）之勞。此亦人子也，可善遇之。」(《南史．隱逸．陶潛傳》)
乙
飯後，眾人各自有事離去，留下貞觀靜坐桌前獃想。她今日的這番感慨，實是前未曾有的。
阿啟伯摘瓜，乃她親眼所見。今早，她突發奇想，陪著外公去巡魚塭，回來時，祖孫二人，都在門口停住了，因為後門虛掩，阿啟伯拿著菜刀，正在棚下摘瓜，並未發覺他們，祖孫二個都閃到門背後。貞觀當時是真愣住了，在那種情況下，是前進呢？抑是後退？她不能很快作選擇。然而這種遲疑也只有幾秒鐘，她一下就被外公拉到門後，正是屏息靜氣時，老人家又帶了她拐出小巷口，走到前街來。
貞觀人到了大路上，心下才逐漸明白：外公躲那人的心，竟比那偷瓜的人所做的遮遮掩掩更甚！貞觀以為懂得了外公的心意：他怕阿啟伯當下撞見自己的那種難堪。事實上，他還有另一層深意，貪當然不好，而貧的本身沒有錯。外公不以阿啟伯為不是，是知道他家中十口，有菜就沒飯，有飯就沒菜。(改寫自蕭麗紅《千江有水千江月》)
陶潛或者外公對他人的善意，你可能也曾見聞或經歷過，請以「溫暖的心」為題，寫一篇文章，分享你的經驗及體會。
文長至少600字。

","溫暖的心



現在的人都在玩手機，很少會關心別人。但是我覺得溫暖的心很重要，因為可以讓別人感覺到被關心。



我記得我剛上高中的時候，換了新環境很不習慣。雖然交到了一些新朋友，但是感覺都不太熟，不像國中的朋友那麼好。那時候我很難過，因為外公過世了，阿姨也出國工作，我覺得很孤單。



有一天我在教室哭，坐我旁邊的同學看到了。他沒有馬上來問我怎麼了，只是等我哭完，然後跟我開玩笑。我覺得他這樣很好，因為他沒有一直問我為什麼哭，讓我可以自己冷靜下來。



我覺得溫暖的心不一定要說出來，有時候默默關心別人也是一種溫暖。像那個同學雖然沒有說什麼，但是他的行為讓我感覺很溫暖。所以我們要學會關心別人，但是不要太多管閒事，這樣才是真正的溫暖。",2,1,1,2,1,7
