題目,作答,立意,結構,修辭,敘述,啟發,總分
"    記憶可以被編輯或刪除嗎？2004年美國電影《王牌冤家》（Eternal Sunshine of the Spotless Mind），敘述一對怨偶在一次激烈的爭吵後，先後踏入提供記憶刪除服務的「忘情診所」，主動要求洗去記憶。女主角成功地洗去兩人的戀愛記憶，男主角則在記憶清掃的過程中，因為看見舊日時光的美好，想保留一切甜蜜與悲傷的記憶，而開始和電腦清除系統搏鬥。2017年，臺灣導演陳玉勳將自己的短片〈海馬洗頭〉改為長片《健忘村》。〈海馬洗頭〉的創意發想，來自於「人的記憶都存在大腦的海馬迴裡」，電影中因此有「海馬洗頭店」，專職幫人洗去記憶。《健忘村》則有一件寶物「忘憂神器」，可以清除記憶。村長為了一己私利，引誘村人「忘憂」，刪除村人的部分記憶。
    電影裡的想像也許有一天會發生。2019年澳洲皇家墨爾本理工大學的研究團隊，利用「光遺傳學」技術影響海馬迴，開發類腦晶片，可模仿大腦儲存和刪除訊息的方式，能精準刪除老鼠腦中特定的記憶。這項科技將有望應用於心理創傷者、藥物成癮者的治療，清除其長時間的負面與病理性記憶。此外，也有政治哲學教授諾齊克提出「經驗機器」思想實驗：假設有一臺機器可以提供所有想要的幸福經驗，甚至可以定期修改，無論是領袖群倫、環遊世界……，使用者想要的「幸福人生」，都可以事先設定。面對這樣的機器，人類將如何抉擇？
假設「經驗機器」存在並且運作穩定，可以讓人享受虛擬的「幸福人生」，你認為將對人類產生什麼影響？權衡利弊，你會支持開放這樣的機器上市嗎？請以「編織記憶：幸福可以被設定！？」為題，運用文中相關資訊，並結合經驗與見聞，闡明自己的意見。
文長至少600字。

","編織記憶：幸福可以被設定！？



現在的科技越來越厲害，可以做到很多以前做不到的事情。像是題目說的那個經驗機器，可以讓人得到想要的幸福，但是我覺得這樣不太好。



我認為記憶是不能被改變的，因為記憶都是很珍貴的。雖然有些記憶會讓人覺得不開心，但是這些記憶也是很重要的。如果把不開心的記憶都刪掉，那我們就不會記得教訓了。



我以前跟朋友吵架過，那次吵架讓我很難過。但是因為這件事，我後來就知道要控制自己的脾氣，不要隨便跟人吵架。如果我把這個記憶刪掉，可能我現在還是會常常跟人吵架。



而且每個人的記憶都不一樣，這樣才能讓每個人都是獨特的。如果大家都用機器來改記憶，那每個人可能都會變得一樣。所以我覺得不應該用這種機器，我們應該保留自己真實的記憶。



總之，我不贊成用這種經驗機器，因為這樣對人不好。我們應該接受所有的記憶，不管是開心的還是不開心的。這樣才是真實的人生。",2,1,1,2,1,7
