題目,作答,立意,結構,修辭,敘述,啟發,總分
"二十一世紀資訊量以驚人的速度暴增，有人認為網路資訊易於取得，會使記憶力與思考力衰退，不利於認知學習；也有人視網際網路為人類的外接大腦記憶體，意味著我們毋須記憶大量知識，可以專注在更重要、更有創造力的事物上。對於以上兩種不同的觀點，你的看法為何？請以「網海浮沉之我思」為題，結合自己的相關經驗，探討創造力與思考力之間的關係。
文長至少600字。

","網海浮沉之我思



網路就像一個大海，裡面有很多資訊和知識。現在的人都很喜歡用網路，因為可以查到很多東西，不用記那麼多。我也很常用網路，覺得網路很方便。



我用網路可以查到很多不懂的東西。以前要問老師和爸媽才知道的事情，現在用手機查一下就知道了。我覺得這樣很好，因為可以學到更多東西，也不用花太多時間去找資料。



但是網路也有壞處，像是會讓人一直玩手機遊戲，或是一直看社群軟體。有時候看到一些消息也不知道是真的還是假的。我自己也常常這樣，花很多時間在網路上，但是都沒有學到什麼。



所以我覺得網路雖然方便，但是要小心使用。不要一直玩手機，要想一想看到的東西是不是真的。這樣才不會被網路害到，可以好好利用網路學習。",1,1,1,1,1,5
