題目,作答,立意,結構,修辭,敘述,啟發,總分
"二十一世紀資訊量以驚人的速度暴增，有人認為網路資訊易於取得，會使記憶力與思考力衰退，不利於認知學習；也有人視網際網路為人類的外接大腦記憶體，意味著我們毋須記憶大量知識，可以專注在更重要、更有創造力的事物上。對於以上兩種不同的觀點，你的看法為何？請以「網海浮沉之我思」為題，結合自己的相關經驗，探討創造力與思考力之間的關係。
文長至少600字。

","網海浮沉之我思



現在的網路很厲害，就像一個大海一樣，裡面有很多知識和資訊。雖然很多人說網路會讓人變笨，但我覺得網路很好用，可以幫我記住很多東西，這樣我就不用自己記了。



我覺得網路就像我們的眼睛一樣，可以讓我們看到很多東西。以前只能問老師和爸媽，現在有不懂的東西就可以上網查，所以我很喜歡用網路。網路讓我可以知道很多事情，我想知道什麼就可以查什麼。



不過網路也有不好的地方，像是社交軟體和遊戲都很容易讓人上癮。我自己也常常在網路上浪費很多時間，一直滑手機。而且網路上的資訊不一定是真的，所以我們要小心一點，不要相信所有看到的東西。



總之，我覺得網路雖然有好有壞，但是對我來說還是很方便的工具。只要我們小心使用，不要被網路騙到就好了。我很喜歡用網路，希望以後可以繼續享受網路帶來的方便。",2,1,2,2,1,8
