題目,作答,立意,結構,修辭,敘述,啟發,總分
"林語堂說：「（我）所愛的不是晚秋，是初秋，那時暄氣初消，月正圓，蟹正肥，桂花皎潔，也未陷入懍烈蕭瑟氣態，這是最值得賞樂的。」楊牧則是在美麗的春天世界裡，萬物復甦，卻聽到「一片樹葉提早轉黃的聲音。」（〈夭〉）普魯斯特（Proust, M.）在《追憶逝水年華》中說：「一小時不僅僅是一個小時，它是一只充滿香氣、聲響、念頭和氛圍的花缽」，說明時間的認知與感官知覺及感受有關。請以「季節的感思」為題，寫一篇文章，描寫你對季節的感知經驗，並抒發心中的感受與領會。
文長至少600字。

","季節的感思



我最近在看手機相簿的時候，看到一張以前和朋友的合照，讓我想起了以前的事情。那時候是夏天，天氣很熱，我和朋友一起去買冰吃，我們很開心。



我記得那時候我們常常一起玩，一起聊天，一起吃東西。夏天的太陽很大，但是我們還是很喜歡出去玩。有一次我們去了水樂園，坐火車的時候看到外面的風景，我們都很開心。



後來到了秋天，天氣變冷了，樹葉也開始掉了。我的朋友要搬家了，我很難過。我看著天空，覺得好灰暗。我們都很捨不得分開，但是沒有辦法。



到了冬天，朋友已經搬走了，我覺得很孤單。冬天的風很冷，讓我更想念我的朋友。我常常在想她什麼時候會回來，但是都不知道。



現在又是春天了，我看著那張照片，覺得時間過得真快。雖然朋友已經不在身邊，但是那些回憶還在我心裡。",2,2,1,2,1,8
