題目,作答,立意,結構,修辭,敘述,啟發,總分
"二十一世紀資訊量以驚人的速度暴增，有人認為網路資訊易於取得，會使記憶力與思考力衰退，不利於認知學習；也有人視網際網路為人類的外接大腦記憶體，意味著我們毋須記憶大量知識，可以專注在更重要、更有創造力的事物上。對於以上兩種不同的觀點，你的看法為何？請以「網海浮沉之我思」為題，結合自己的相關經驗，探討創造力與思考力之間的關係。
文長至少600字。

","網海浮沉之我思



現在的網路發展很快，每個人都在用網路找資料。有人說這樣會讓我們變笨，因為都不用記東西；有人說這樣很好，可以讓我們做更多事情。



我覺得網路是好是壞要看我們怎麼用。如果我們只會用網路查資料，什麼都不記，那當然會變笨。但是如果我們會把找到的資料記下來，那就不會有問題。就像我以前讀書的時候，雖然會用網路查資料，但是我都會把重要的東西記在筆記本上。



有些人說網路就像是我們的第二個大腦，這樣說也沒錯。因為網路可以幫我們找到很多資料，讓我們做事情比較快。但是我覺得我們不能太依賴網路，因為網路有時候會壞掉，或是找不到我們要的東西。



我覺得最重要的是要學會控制自己用網路的方式。不能讓網路控制我們的生活，而是要讓網路變成幫助我們的工具。這樣我們才不會被網路害得什麼都不會想，什麼都不會記。



所以我認為網路不是好或壞的問題，重要的是我們要怎麼用它。如果能好好利用網路，它就會變成對我們有幫助的工具；如果不會控制，那網路就會變成讓我們變笨的東西。",2,2,1,2,1,8
