題目,作答,立意,結構,修辭,敘述,啟發,總分
"二十一世紀資訊量以驚人的速度暴增，有人認為網路資訊易於取得，會使記憶力與思考力衰退，不利於認知學習；也有人視網際網路為人類的外接大腦記憶體，意味著我們毋須記憶大量知識，可以專注在更重要、更有創造力的事物上。對於以上兩種不同的觀點，你的看法為何？請以「網海浮沉之我思」為題，結合自己的相關經驗，探討創造力與思考力之間的關係。
文長至少600字。

","網海浮沉之我思



現在的網路很方便，大家都在用網路找資料。有些人說網路會讓人變笨，記憶力變差，但也有人說網路很好用，可以幫我們記東西。我覺得這兩種說法都有道理。



我自己很常用網路，覺得網路對我們的生活有好處。比如說我在寫功課的時候，可以很快找到答案，不用花很多時間去圖書館找書。而且網路上的資料很多，可以讓我們學到很多東西。



但是我也發現，現在的人都太依賴網路了。像是我的同學上課都在玩手機，不認真聽老師講課。有時候問他們問題，他們都說：「等一下，我查一下。」這樣子其實不太好，因為什麼都靠網路查，自己的腦袋就不會思考了。



我覺得網路應該只是一個工具，不能完全依賴它。我們還是要自己思考，自己記東西。像是美國的研究說聰明人記憶力比較差，但我覺得這不是藉口，我們還是要努力學習。



所以我認為，網路雖然方便，但是不能讓它變成我們的依賴。我們要學會平衡使用網路，該記的東西還是要記，該想的還是要想。這樣才能真正提升我們的能力。",2,2,1,2,1,8
