題目,作答,立意,結構,修辭,敘述,啟發,總分
"    糖對身體是有好處的，運動過後或飢餓時，適當地補充糖會讓我們迅速恢復體力。科學研究也發現，大腦細胞的能量來源主要來自葡萄糖，當血糖濃度降低時，大腦難以順利運轉，容易注意力不集中，學習或做事效果不佳。不過，哈佛醫學院等多個研究機構指出，高糖飲食會增加罹患乳癌及憂鬱症等疾病的風險；世界衛生組織也指出，高糖飲食是造成體重過重、第二型糖尿病、蛀牙、心臟病的元兇，並建議每日飲食中「添加糖」的攝取量不宜超過總熱量的10%。以每日熱量攝取量2000大卡為例，也就是50公克糖。我國國民健康署於民國103年至106年的「國民營養健康狀況變遷調查」中，有關國人飲用含糖飲料的結果顯示，國民中小學生在飲用比例上為各年齡之冠，其中男性又高於女性。
    基於國民營養及健康飲食原則，目前中小學校園禁止出現含糖飲料，以避免孩子在校園攝取過多糖份。但反對者認為，孩子回到家還是可能會喝含糖飲料，無法治本。
    對於「中、小學校園禁止含糖飲料」，你贊成或反對？請以「禁止含糖飲料進入中、小學之我見」為題，撰寫一篇文章，提出你的看法與論述。
文長至少600字。


","禁止含糖飲料進入中小學之我見



我認為禁止含糖飲料進入中小學是對的。因為含糖飲料喝太多對身體不好，會讓人變胖，還會得糖尿病。學校禁止含糖飲料可以讓學生少喝一點，對健康比較好。



我自己以前很愛喝含糖飲料，每天都要喝。後來老師說喝太多會蛀牙，我就慢慢改成喝白開水。雖然剛開始不習慣，但是現在已經覺得還好了。所以我覺得學校禁止含糖飲料是對的，可以讓同學改掉愛喝甜飲料的習慣。



但是有些人說就算學校禁止也沒用，因為回家還是可以喝。我覺得至少在學校的時候可以少喝一點，總比一直喝好。而且在學校喝含糖飲料會讓人沒精神上課，喝了會想睡覺，這樣上課就聽不懂了。



所以我支持學校禁止含糖飲料，這樣對學生的健康比較好，上課也會比較有精神。希望大家可以喝白開水，少喝含糖飲料。",1,1,1,1,1,5
