題目,作答,立意,結構,修辭,敘述,啟發,總分
"二十一世紀資訊量以驚人的速度暴增，有人認為網路資訊易於取得，會使記憶力與思考力衰退，不利於認知學習；也有人視網際網路為人類的外接大腦記憶體，意味著我們毋須記憶大量知識，可以專注在更重要、更有創造力的事物上。對於以上兩種不同的觀點，你的看法為何？請以「網海浮沉之我思」為題，結合自己的相關經驗，探討創造力與思考力之間的關係。
文長至少600字。

","網海浮沉之我思



現在的科技真的很厲害，每個人都離不開手機和電腦。我覺得這樣其實不太好，因為大家都太依賴網路了。



以前我們要找東西吃，都要自己出門逛街，現在只要用手機點一點就可以了。要查字典也不用翻書，直接上網查就好。這樣雖然方便，但是我覺得人會變得很懶惰。



現在的人工智慧更厲害，它可以畫畫、寫文章、做音樂，好像什麼都會。如果遇到不會的事情，大家都會直接問人工智慧，這樣久了，人類自己就不會思考了。



我覺得科技雖然很強大，但是我們不能完全依賴它。因為如果太依賴科技，人類的腦袋就會變得很笨，什麼都不會想。而且網路上的東西也不一定都是對的，所以我們還是要自己多思考。



希望大家可以少用一點手機，多用自己的腦袋想事情。這樣才不會被科技控制，變成一個什麼都不會的人。",2,1,2,1,1,7
