題目,作答,立意,結構,修辭,敘述,啟發,總分
"關於地球的記憶
被文字固禁在課本裡
我們的筆尖游走在山脈和海洋
翻譯每片花瓣的嬌嫩和露水的清新
所有的言語 答案
都靜放在我們的課本裡
等待我們翻起這一切的序幕（節錄自薛憶婷〈我們的課本〉）

    以上這首詩，從課本啟動天馬行空的遐想，瞥見知識豐富的樣貌。科學頑童費曼（Richard P. Feynman）曾說觀察轉動的餐盤，讓他得到很大的啟發，領略了興之所至的樂趣。物理課可讓我們發現萬物運行的迷人，生物課帶領我們進入細胞核遊歷，外語課讓我們聽見世界不同的文化。國文課堂上「採菊東籬下，悠然見南山」或「輕羅小扇撲流螢」，詩中情境也往往能讓人神遊於現實之外。過往的課程內容，是否曾經點燃你對知識的熱情？打開課本時，不知能否如〈我們的課本〉所述，揭開知識想像的序幕。
    若能從不同角度切入課本，進入知識的想像，或許可以讓課本帶領我們經歷驚奇的旅程。請以「當我打開課本」為題，寫一篇文章，敘述任一學科課本對你的意義，書寫你探索課本內容、知識的經驗與體會。
文長至少600字。


","當我打開課本



課本是每個學生每天都會用到的東西。我們打開課本，有的人是為了學習新知識，有的人是為了考試。不管是什麼原因，都代表要進入書本的世界了。



我覺得課本就是考試要用的工具。我打開課本只是為了找答案，沒有感受到新知識帶來的興奮。像是數學課本，我只會看題目然後套公式解決，這樣很無聊。這樣不只學不到東西，還會讓我更不想學習。



但是自然科學的課本比較有趣。它教我們人體器官的知識，還有外太空的恆星和行星。我可以知道人類和宇宙是怎麼來的。自然科學讓我覺得很有趣，比其他科目好玩多了。當我看自然課本的時候，好像在世界各地旅行一樣。



每個人對課本的想法都不一樣。最重要的是要找到自己喜歡的東西，這樣才會想要繼續學習下去。",1,1,1,1,1,5
