題目,作答,立意,結構,修辭,敘述,啟發,總分
"林語堂說：「（我）所愛的不是晚秋，是初秋，那時暄氣初消，月正圓，蟹正肥，桂花皎潔，也未陷入懍烈蕭瑟氣態，這是最值得賞樂的。」楊牧則是在美麗的春天世界裡，萬物復甦，卻聽到「一片樹葉提早轉黃的聲音。」（〈夭〉）普魯斯特（Proust, M.）在《追憶逝水年華》中說：「一小時不僅僅是一個小時，它是一只充滿香氣、聲響、念頭和氛圍的花缽」，說明時間的認知與感官知覺及感受有關。請以「季節的感思」為題，寫一篇文章，描寫你對季節的感知經驗，並抒發心中的感受與領會。
文長至少600字。

","季節的感思



春夏秋冬每年都會來，每個季節都有不同的感覺。春天有很多花，夏天很熱，秋天有楓葉，冬天很冷。這些季節組成了一年，讓我們有不同的感受。



我記得有一次春天的時候，下了很大的雷雨。我在睡覺，被雷聲嚇醒了。那時候我想起前一天在學校發生的事情，有個學妹在樹下跟我告白。我當時很緊張，後來就睡著了。



夏天的時候，我騎著新買的腳踏車到處跑。那時候很熱，蟬一直在叫。我騎得很開心，覺得自己像是在玩遊戲一樣。但是後來撞到了樹根，摔倒了，膝蓋很痛。汗水一直流，蟬還在不停地叫。



每個人的生活都會經過這些季節，每個季節都會讓我們有不同的感覺和回憶。這就是我對季節的想法。",1,1,1,1,1,5
