題目,作答,立意,結構,修辭,敘述,啟發,總分
"    看到山上那麼多參天大樹時，會勾起我的惻隱之心。在無法順暢呼吸的空間裡，樹木之間為了生存必須展開激烈的競爭。為了能多接受一些陽光，它們只能拼命向上生長。
但是，只為生存而競爭的森林卻漸次死亡，因為陽光無法到達地面，所以溫度不夠高，無法讓幼小的生命萌芽。小樹和花、草，以及與它們一起生活的小昆蟲沒有生存的空間。雖然表面上看起來非常完美，但這種森林其實與沒有希望的不孕之地無異。
根據我的經驗，密集栽種的樹苗體型壯大數十倍時，就需要開始砍樹，否則樹木會抱怨空間太窄，活不下去。要想確保樹木能充分接受陽光照射的空間，就必須做出犧牲。因此，幾年期間強行進行砍伐，樹木間距剛開始時是一公尺，現已擴大到七公尺。也就是說，即使是粗略估算，也可知七棵樹中有六棵為之消失。
森林要想成為孕育新生命的希望之地，就需要有縫隙。如果樹木壽命結束或因為意外災害而倒下，該位置就會產生空間，那麼，溫暖的陽光就會照射進來，被陽光照射的地面混雜著前一年秋天凋落的樹葉，於是積聚起能夠孕育新生命的養分。因此，樹木的縫隙，既是結束和開始共存的空間，也是由缺乏轉化為希望的空間。（改寫自禹鐘榮著、盧鴻金譯《樹木教我的人生課》）
    根據上文所述，為什麼森林需要縫隙？由此聯想，人生是否也需要縫隙？請以「縫隙的聯想」為題，寫一篇文章，結合生活經驗或見聞，書寫你的感思與體悟。
文長至少600字。


","縫隙的聯想



生活中處處都有縫隙，像是桌子和桌子之間的空隙，或是牆壁上的裂縫。我覺得縫隙不只是看得見的空間，還可以代表其他意思。



就像文章說的，森林裡的樹木需要縫隙才能讓陽光照進來，小樹苗才能長大。如果樹木太密集，反而會讓森林慢慢死掉。這讓我想到人生也是一樣，需要一些空間和時間來休息。



上班族每天工作很累，週末放假就是他們的縫隙，可以好好休息。學生讀書也需要適當的休息時間，不能一直讀書。這些休息的時間就像是森林裡的縫隙一樣重要。



我自己的經驗是，每天放學後會給自己一點時間玩手機或看電視，這樣才不會覺得太累。這些小小的縫隙讓我能夠繼續努力讀書。所以我認為縫隙是很重要的，可以讓我們在忙碌的生活中喘口氣。



總之，縫隙不只是空間，也代表著休息和希望。就像森林需要縫隙才能長出新的生命，人生也需要適當的休息，才能繼續往前走。",2,2,1,2,1,8
