題目,作答,立意,結構,修辭,敘述,啟發,總分
"糖對身體是有好處的，運動過後或飢餓時，適當地補充糖會讓我們迅速恢復體力。科學研究也發現，大腦細胞的能量來源主要來自葡萄糖，當血糖濃度降低時，大腦難以順利運轉，容易注意力不集中，學習或做事效果不佳。不過，哈佛醫學院等多個研究機構指出，高糖飲食會增加罹患乳癌及憂鬱症等疾病的風險；世界衛生組織也指出，高糖飲食是造成體重過重、第二型糖尿病、蛀牙、心臟病的元兇，並建議每日飲食中「添加糖」的攝取量不宜超過總熱量的10%。以每日熱量攝取量2000大卡為例，也就是50公克糖。
讀完以上材料，對於「中、小學校園禁止含糖飲料」，你贊成或反對？請撰寫一篇短文，提出你的看法與論述。文長600字以上。","我覺得學校不應該禁止含糖飲料，因為這樣對學生不好。



我知道糖吃太多會讓人生病，但是學生如果想喝含糖飲料，禁止也沒有用。像我以前在學校的時候，老師說不能喝含糖飲料，結果大家都偷偷在外面買來喝，反而喝得更多。



而且學生在學校的時間不多，回家後還是可以喝含糖飲料，所以禁止也沒有意義。有些學生會自己控制，有些學生就是管不住，學校禁止也沒有用。



我覺得學校應該要教學生喝含糖飲料的壞處，這樣比較有用。如果只是禁止，學生不懂為什麼不能喝，就不會聽話。所以我不贊成學校禁止含糖飲料。",2,1,1,2,1,7
