題目,作答,立意,結構,修辭,敘述,啟發,總分
"    記憶可以被編輯或刪除嗎？2004年美國電影《王牌冤家》（Eternal Sunshine of the Spotless Mind），敘述一對怨偶在一次激烈的爭吵後，先後踏入提供記憶刪除服務的「忘情診所」，主動要求洗去記憶。女主角成功地洗去兩人的戀愛記憶，男主角則在記憶清掃的過程中，因為看見舊日時光的美好，想保留一切甜蜜與悲傷的記憶，而開始和電腦清除系統搏鬥。2017年，臺灣導演陳玉勳將自己的短片〈海馬洗頭〉改為長片《健忘村》。〈海馬洗頭〉的創意發想，來自於「人的記憶都存在大腦的海馬迴裡」，電影中因此有「海馬洗頭店」，專職幫人洗去記憶。《健忘村》則有一件寶物「忘憂神器」，可以清除記憶。村長為了一己私利，引誘村人「忘憂」，刪除村人的部分記憶。
    電影裡的想像也許有一天會發生。2019年澳洲皇家墨爾本理工大學的研究團隊，利用「光遺傳學」技術影響海馬迴，開發類腦晶片，可模仿大腦儲存和刪除訊息的方式，能精準刪除老鼠腦中特定的記憶。這項科技將有望應用於心理創傷者、藥物成癮者的治療，清除其長時間的負面與病理性記憶。此外，也有政治哲學教授諾齊克提出「經驗機器」思想實驗：假設有一臺機器可以提供所有想要的幸福經驗，甚至可以定期修改，無論是領袖群倫、環遊世界……，使用者想要的「幸福人生」，都可以事先設定。面對這樣的機器，人類將如何抉擇？
假設「經驗機器」存在並且運作穩定，可以讓人享受虛擬的「幸福人生」，你認為將對人類產生什麼影響？權衡利弊，你會支持開放這樣的機器上市嗎？請以「編織記憶：幸福可以被設定！？」為題，運用文中相關資訊，並結合經驗與見聞，闡明自己的意見。
文長至少600字。

","編織記憶：幸福可以被設定！？



經驗機器可以讓人得到想要的幸福人生，但是我覺得這樣不好，因為會讓人變得很懶惰，所以我不支持這種機器上市。



我是一個學生，如果有了經驗機器，大家就可以不用讀書也能得到好成績的記憶，也可以不用努力就能得到成功的感覺。這樣子的話，我們就不會想要認真學習了，因為反正可以靠機器得到想要的記憶。而且我們也不會知道失敗是什麼感覺，這樣對我們的成長很不好。



大人們也是一樣，有了經驗機器就不用工作也能有賺大錢的記憶，不用努力也能有環遊世界的經驗。這樣子大家就會變得很懶惰，不想要真的去工作和努力。我覺得這樣對社會不好，因為沒有人想要真的去做事情。



所以我認為經驗機器會讓人變得很懶惰，大家都只想要靠機器得到假的幸福，不想要真的去努力。這樣子的話，我們的社會就不會進步，反而會退步。現在科技一直在進步，但是如果我們都變得很懶惰，那就不好了。",1,1,1,1,1,5
