題目,作答,立意,結構,修辭,敘述,啟發,總分
"關於地球的記憶
被文字固禁在課本裡
我們的筆尖游走在山脈和海洋
翻譯每片花瓣的嬌嫩和露水的清新
所有的言語 答案
都靜放在我們的課本裡
等待我們翻起這一切的序幕（節錄自薛憶婷〈我們的課本〉）

    以上這首詩，從課本啟動天馬行空的遐想，瞥見知識豐富的樣貌。科學頑童費曼（Richard P. Feynman）曾說觀察轉動的餐盤，讓他得到很大的啟發，領略了興之所至的樂趣。物理課可讓我們發現萬物運行的迷人，生物課帶領我們進入細胞核遊歷，外語課讓我們聽見世界不同的文化。國文課堂上「採菊東籬下，悠然見南山」或「輕羅小扇撲流螢」，詩中情境也往往能讓人神遊於現實之外。過往的課程內容，是否曾經點燃你對知識的熱情？打開課本時，不知能否如〈我們的課本〉所述，揭開知識想像的序幕。
    若能從不同角度切入課本，進入知識的想像，或許可以讓課本帶領我們經歷驚奇的旅程。請以「當我打開課本」為題，寫一篇文章，敘述任一學科課本對你的意義，書寫你探索課本內容、知識的經驗與體會。
文長至少600字。


","當我打開課本



我最喜歡的課本是地理課本，因為裡面有很多漂亮的圖片和地圖。每次打開課本的時候，我都會很開心，因為可以看到世界上不同的地方。



我很想去旅遊，但是因為沒有錢，所以只能看課本裡的圖片。課本裡有很多地方，有太平洋、大西洋，還有喜馬拉雅山。地圖上用不同的顏色來表示高山和峽谷，看起來很漂亮。我覺得去世界各地旅遊其實不會很難。



我也很喜歡看課本裡講氣候的部分。台灣的天氣很舒服，但是其他地方就不一樣了。有的地方很熱很潮濕，有的地方很冷。南極的高原上都是冰，一定很冷。海洋也很大，有很多不同的洋流。



看地理課本就像坐飛機去旅行一樣，可以去很多地方。雖然只是想像，但是我覺得很開心。我希望以後可以真的去這些地方看看。",2,1,2,1,1,7
