題目,作答,立意,結構,修辭,敘述,啟發,總分
"關於地球的記憶
被文字固禁在課本裡
我們的筆尖游走在山脈和海洋
翻譯每片花瓣的嬌嫩和露水的清新
所有的言語 答案
都靜放在我們的課本裡
等待我們翻起這一切的序幕（節錄自薛憶婷〈我們的課本〉）

    以上這首詩，從課本啟動天馬行空的遐想，瞥見知識豐富的樣貌。科學頑童費曼（Richard P. Feynman）曾說觀察轉動的餐盤，讓他得到很大的啟發，領略了興之所至的樂趣。物理課可讓我們發現萬物運行的迷人，生物課帶領我們進入細胞核遊歷，外語課讓我們聽見世界不同的文化。國文課堂上「採菊東籬下，悠然見南山」或「輕羅小扇撲流螢」，詩中情境也往往能讓人神遊於現實之外。過往的課程內容，是否曾經點燃你對知識的熱情？打開課本時，不知能否如〈我們的課本〉所述，揭開知識想像的序幕。
    若能從不同角度切入課本，進入知識的想像，或許可以讓課本帶領我們經歷驚奇的旅程。請以「當我打開課本」為題，寫一篇文章，敘述任一學科課本對你的意義，書寫你探索課本內容、知識的經驗與體會。
文長至少600字。


","當我打開課本



課本是學校裡每天都要用的東西。每次上課時，老師都會叫我們翻開課本，跟著老師一起讀課文。



我覺得課本裡面有很多知識。每次上課時，我都會看課本裡的內容。有時候會看到一些有趣的東西，但大部分時候都覺得很無聊。因為課本裡的東西都很難懂，而且要背很多東西。



以前的人寫了很多東西在課本裡，讓我們可以學習。但是我覺得課本寫得太難了，有時候看不懂在說什麼。雖然老師會解釋，但是還是覺得很困難。



現在上了大學，課本變得更難了。不只要讀課本，還要讀很多其他的書。我覺得這樣很辛苦，但是為了學習，只好繼續讀下去。



希望以後可以把課本讀得更懂一點，這樣就不會這麼辛苦了。",1,1,1,1,1,5
