題目,作答,立意,結構,修辭,敘述,啟發,總分
"    我覺得童年是一種氣味的記憶。
    我的童年，有許多果樹氣味的記憶。夏天暑熱的午後，廟埕後有一棵巨大的龍眼樹。我從小學翻牆出來，背著書包，爬上龍眼樹，躲在密密的枝葉裡。外面日光葉影搖晃，隱約聽見老師或母親尋來，在樹下叫著我的名字，但那呼喚的聲音，被蟬聲的高音淹沒了。我一動不動，找到一處適合蜷窩身體的枝椏，好像變成樹的一部分，而那時，龍眼樹密密的甜熟的氣味就包圍著我。我閉起眼睛，好像在假寐，也像在作夢，夢裡一串一串纍纍的龍眼，招來許多蜜蜂果蠅。我童年的夢，很甜很香，好像一整個夏天都窩在那棵樹上，包圍在濃郁的氣味裡做了一個醒不來的夢。（改寫自蔣勳《給青年藝術家的信》）
    生活中充斥各種氣味。氣味透過嗅覺傳遞，喚起人們的記憶和感受，一如文中龍眼樹甜熟的氣味喚起作者的童年記憶。請以「花草樹木的氣味記憶」為題，寫一篇文章，書寫你熟悉的花草樹木的氣味，及其所召喚的記憶和感受。

文長至少600字。

","花草樹木的氣味記憶



有一天放學的時候，我走在回家的路上，看到了以前的幼兒園。我從圍牆的縫隙往裡面看，發現以前那棵櫻花樹還在那裡。看到櫻花樹，我就想起了以前在幼兒園的時候。



我記得那時候下課的時候，我和朋友們都會跑到櫻花樹下面玩。櫻花樹的香味很好聞，每次跑過去的時候都可以聞到。我們最喜歡在樹下玩遊戲，因為那裡很涼快，而且有花香。



後來冬天來了，櫻花樹的葉子和花都掉光了。我們平常玩的地方都是花瓣，香味也沒有了。我覺得很難過，因為我很喜歡那棵櫻花樹。現在長大了，每次經過那裡都會想起以前的事情。



我覺得花草樹木的香味真的很特別，可以讓人想起很多事情。雖然現在已經不能像以前一樣在櫻花樹下玩，但是那個香味我一直都記得。希望以後還可以看到那棵櫻花樹，聞到那個香味。",2,1,1,2,1,7
