題目,作答,立意,結構,修辭,敘述,啟發,總分
"二十一世紀資訊量以驚人的速度暴增，有人認為網路資訊易於取得，會使記憶力與思考力衰退，不利於認知學習；也有人視網際網路為人類的外接大腦記憶體，意味著我們毋須記憶大量知識，可以專注在更重要、更有創造力的事物上。對於以上兩種不同的觀點，你的看法為何？請以「網海浮沉之我思」為題，結合自己的相關經驗，探討創造力與思考力之間的關係。
文長至少600字。

","網海浮沉之我思



現在的科技發展很快，大家都在用手機和電腦上網找資料。我覺得這樣不太好，因為會讓人變得很懶惰，什麼都不想記，什麼都要靠網路。



像是現在的年輕人都在看短影片，看到什麼就學什麼，都不會自己想。很多人都在模仿別人，沒有自己的想法。還有人工智慧也可以寫歌，這樣以後就沒有好聽的歌了。



我自己也有不好的經驗。以前我得了皮膚病，上網找了很多方法，什麼都試，結果皮膚越來越糟。後來才知道應該要去看醫生，不能只相信網路上的東西。



所以我覺得網路雖然方便，但是不能太依賴它。我們要自己多想一想，不要什麼都相信網路。這樣才不會被網路害到，也才能有自己的想法。",2,1,1,2,1,7
