題目,作答,立意,結構,修辭,敘述,啟發,總分
"二十一世紀資訊量以驚人的速度暴增，有人認為網路資訊易於取得，會使記憶力與思考力衰退，不利於認知學習；也有人視網際網路為人類的外接大腦記憶體，意味著我們毋須記憶大量知識，可以專注在更重要、更有創造力的事物上。對於以上兩種不同的觀點，你的看法為何？請以「網海浮沉之我思」為題，結合自己的相關經驗，探討創造力與思考力之間的關係。
文長至少600字。

","網路科技的發展讓我們的生活變得很方便，但是我覺得這樣不太好。因為現在的人都太依賴網路了，什麼事情都要上網查，都不會自己想。像是我看到很多同學都在用手機，上課也不認真聽，這樣對學習很不好。



我覺得網路雖然方便，但是會讓人變懶。像是現在很多人都在用ChatGPT寫作業，這樣根本就學不到東西。我以前做作業都是自己想，雖然比較辛苦，但是至少學到了知識。現在的人都不願意動腦，只會用手機查答案，這樣對自己一點幫助都沒有。



我認為科技應該是要幫助人類，不是要讓人變笨。如果大家都只會用網路，不會思考，那以後一定會有問題。而且網路上的資料也不一定對，如果都不會判斷，很容易被騙。所以我希望大家可以少用一點網路，多用自己的腦袋想事情。這樣對自己比較好。",2,1,2,2,1,8
