題目,作答,立意,結構,修辭,敘述,啟發,總分
"二十一世紀資訊量以驚人的速度暴增，有人認為網路資訊易於取得，會使記憶力與思考力衰退，不利於認知學習；也有人視網際網路為人類的外接大腦記憶體，意味著我們毋須記憶大量知識，可以專注在更重要、更有創造力的事物上。對於以上兩種不同的觀點，你的看法為何？請以「網海浮沉之我思」為題，結合自己的相關經驗，探討創造力與思考力之間的關係。
文長至少600字。

","網海浮沉之我思



現在的資訊發展很快，從以前的瀏覽器到現在的谷歌，讓我們可以查到很多東西。像是地圖、郵箱、表單這些東西，都讓我們的生活變得比較方便。



我覺得創造力就是要用網路上的資料去做一些對社會有幫助的事情。但是很多人都只會跟著別人做，這樣就不太好，因為這樣會讓我們的思考能力變差。如果要有好的想法，就要多嘗試新的事物。



思考力就是要會選擇對自己有用的資訊，然後用這些資訊去做出自己想要的東西。我認為創造力和思考力是互相幫助的，因為要創造新的東西就要先思考，要思考就要先有一些資訊。



現在的年輕人都很會用網路，所以常常被叫做Z世代。但是我覺得我們要小心使用網路，不能什麼都相信。尤其是現在有AI這種新科技，我們更要學會分辨哪些資訊是對的，哪些是錯的。



總之，我們要好好利用網路，但是不能完全依賴它。要記得用自己的腦袋思考，這樣才能真的學到東西。",2,2,1,2,1,8
