題目,作答,立意,結構,修辭,敘述,啟發,總分
"甲
(陶潛)為彭澤令。不以家累自隨，送一力給其子，書曰：「汝旦夕之費，自給為難。今遣此力，助汝薪水（打柴汲水）之勞。此亦人子也，可善遇之。」(《南史．隱逸．陶潛傳》)
乙
飯後，眾人各自有事離去，留下貞觀靜坐桌前獃想。她今日的這番感慨，實是前未曾有的。
阿啟伯摘瓜，乃她親眼所見。今早，她突發奇想，陪著外公去巡魚塭，回來時，祖孫二人，都在門口停住了，因為後門虛掩，阿啟伯拿著菜刀，正在棚下摘瓜，並未發覺他們，祖孫二個都閃到門背後。貞觀當時是真愣住了，在那種情況下，是前進呢？抑是後退？她不能很快作選擇。然而這種遲疑也只有幾秒鐘，她一下就被外公拉到門後，正是屏息靜氣時，老人家又帶了她拐出小巷口，走到前街來。
貞觀人到了大路上，心下才逐漸明白：外公躲那人的心，竟比那偷瓜的人所做的遮遮掩掩更甚！貞觀以為懂得了外公的心意：他怕阿啟伯當下撞見自己的那種難堪。事實上，他還有另一層深意，貪當然不好，而貧的本身沒有錯。外公不以阿啟伯為不是，是知道他家中十口，有菜就沒飯，有飯就沒菜。(改寫自蕭麗紅《千江有水千江月》)
陶潛或者外公對他人的善意，你可能也曾見聞或經歷過，請以「溫暖的心」為題，寫一篇文章，分享你的經驗及體會。
文長至少600字。

","溫暖的心



我想分享我外婆的故事。她是個很好的人，常常幫助別人。她住家對面有一戶人家，他們家裡有兩個小孩都生病了。大兒子因為車禍腦部受傷，小女兒因為發燒沒及時治療變成小兒麻痺。



外婆知道這家人很辛苦，所以常常拿東西給他們。她會說自己煮太多菜，或是買太多水果，就拿去給他們吃。雖然那家的媽媽以為外婆是在看他們笑話，但外婆還是繼續幫助他們。因為外婆覺得人在困難的時候需要別人關心。



我覺得不是每個人都有溫暖的心。有些人幫助別人是想要得到回報，但我外婆不是這樣。她只是單純想幫助需要幫助的人。她不在乎別人怎麼想她，也不希望別人回報她。她就是覺得既然有能力幫助別人，那就去幫助。這就是為什麼我覺得外婆是個善良的人。",1,1,1,1,1,5
