題目,作答,立意,結構,修辭,敘述,啟發,總分
"二十一世紀資訊量以驚人的速度暴增，有人認為網路資訊易於取得，會使記憶力與思考力衰退，不利於認知學習；也有人視網際網路為人類的外接大腦記憶體，意味著我們毋須記憶大量知識，可以專注在更重要、更有創造力的事物上。對於以上兩種不同的觀點，你的看法為何？請以「網海浮沉之我思」為題，結合自己的相關經驗，探討創造力與思考力之間的關係。
文長至少600字。

","網海浮沉之我思



現在的人都在用網路，每天都在滑手機查資料。以前要找資料要去圖書館或問別人，現在只要用手機就可以了。這樣雖然方便，但是也讓我們的記憶力變差了。



我覺得網路還是有好處的。因為一個人不可能記得所有事情，時間和記憶力都是有限的。用網路可以讓我們快速找到需要的資料，不用花太多時間去記不重要的事情。這樣我們就可以把時間用在學習更重要的事情上面。



而且網路可以讓我們知道世界上發生了什麼事。像是其他國家的新聞，或是最新的科技發展，都可以馬上知道。這樣我們就可以跟上時代的腳步，不會落後。



以前的人可能想不到，現在我們只要拿出手機就可以跟很遠的人聊天，或是查到想要的資料。這就是科技進步帶給我們的好處。所以我覺得網路雖然會讓我們記憶力變差，但是好處還是比較多。



我們應該要好好利用網路，把時間花在重要的事情上。這樣才能讓自己進步，跟上這個快速發展的時代。",2,2,1,2,1,8
