題目,作答,立意,結構,修辭,敘述,啟發,總分
"關於地球的記憶
被文字固禁在課本裡
我們的筆尖游走在山脈和海洋
翻譯每片花瓣的嬌嫩和露水的清新
所有的言語 答案
都靜放在我們的課本裡
等待我們翻起這一切的序幕（節錄自薛憶婷〈我們的課本〉）

    以上這首詩，從課本啟動天馬行空的遐想，瞥見知識豐富的樣貌。科學頑童費曼（Richard P. Feynman）曾說觀察轉動的餐盤，讓他得到很大的啟發，領略了興之所至的樂趣。物理課可讓我們發現萬物運行的迷人，生物課帶領我們進入細胞核遊歷，外語課讓我們聽見世界不同的文化。國文課堂上「採菊東籬下，悠然見南山」或「輕羅小扇撲流螢」，詩中情境也往往能讓人神遊於現實之外。過往的課程內容，是否曾經點燃你對知識的熱情？打開課本時，不知能否如〈我們的課本〉所述，揭開知識想像的序幕。
    若能從不同角度切入課本，進入知識的想像，或許可以讓課本帶領我們經歷驚奇的旅程。請以「當我打開課本」為題，寫一篇文章，敘述任一學科課本對你的意義，書寫你探索課本內容、知識的經驗與體會。
文長至少600字。


","當我打開課本



打開課本時，我看到了很多知識。每個科目都有不同的內容，讓我們可以學到不同的東西。數學有計算，物理有公式，文學有故事，每一科都在教我們不同的事情。



我最喜歡生物課本，因為可以學到生命的知識。生物課本裡有很多細胞的圖片，還有很多專有名詞要記。雖然有些內容很難懂，但是老師都會解釋給我們聽。細胞膜和葉綠體這些名詞，我都記得很清楚。



課本讓我知道了很多以前不知道的事情。我現在知道植物是怎麼長大的，也知道動物是怎麼活的。這些知識都是從課本上學來的，所以課本對我來說很重要。



我覺得學習課本的內容很有趣，因為可以知道很多新的東西。雖然有時候會覺得很難，但是只要多讀幾遍就會懂了。希望以後可以學到更多知識。",1,1,1,1,1,5
