題目,作答,立意,結構,修辭,敘述,啟發,總分
"關於地球的記憶
被文字固禁在課本裡
我們的筆尖游走在山脈和海洋
翻譯每片花瓣的嬌嫩和露水的清新
所有的言語 答案
都靜放在我們的課本裡
等待我們翻起這一切的序幕（節錄自薛憶婷〈我們的課本〉）

    以上這首詩，從課本啟動天馬行空的遐想，瞥見知識豐富的樣貌。科學頑童費曼（Richard P. Feynman）曾說觀察轉動的餐盤，讓他得到很大的啟發，領略了興之所至的樂趣。物理課可讓我們發現萬物運行的迷人，生物課帶領我們進入細胞核遊歷，外語課讓我們聽見世界不同的文化。國文課堂上「採菊東籬下，悠然見南山」或「輕羅小扇撲流螢」，詩中情境也往往能讓人神遊於現實之外。過往的課程內容，是否曾經點燃你對知識的熱情？打開課本時，不知能否如〈我們的課本〉所述，揭開知識想像的序幕。
    若能從不同角度切入課本，進入知識的想像，或許可以讓課本帶領我們經歷驚奇的旅程。請以「當我打開課本」為題，寫一篇文章，敘述任一學科課本對你的意義，書寫你探索課本內容、知識的經驗與體會。
文長至少600字。


","當我打開課本



我每次拿到新課本都很開心，因為可以看到很多新的東西。以前我不懂數學，只會簡單的加減，但是上學以後就學到更多數學知識。



我記得剛拿到新課本的時候，看到很多沒看過的數學符號和公式，雖然不太懂，但是很想知道是什麼意思。有時候看著看著就過了很久，因為很多東西都很新奇。



每次學新的東西，我都會有很多問題想問。為什麼要這樣算？為什麼會這樣？雖然有時候想不通，但是慢慢學習就會懂了。如果沒有課本教我，我可能到現在還是不會算數學。



我覺得課本很重要，因為裡面有很多知識。雖然也可以問別人，但是自己看課本比較好，因為可以一直看，想看幾次都可以。而且每個人看課本的想法都不一樣，這樣也很有趣。",1,1,1,1,1,5
