題目,作答,立意,結構,修辭,敘述,啟發,總分
"二十一世紀資訊量以驚人的速度暴增，有人認為網路資訊易於取得，會使記憶力與思考力衰退，不利於認知學習；也有人視網際網路為人類的外接大腦記憶體，意味著我們毋須記憶大量知識，可以專注在更重要、更有創造力的事物上。對於以上兩種不同的觀點，你的看法為何？請以「網海浮沉之我思」為題，結合自己的相關經驗，探討創造力與思考力之間的關係。
文長至少600字。

","網海浮沉之我思



現在的網路很方便，大家都可以很容易找到想要的資料。但是這樣子好不好呢？我覺得這樣不太好，因為大家都不會思考了。



我自己也常常用網路。每次做功課的時候都會上網查答案，這樣很快就可以完成作業。但是這樣子其實不太好，因為我都沒有真的學到東西。像是數學作業，如果都只是抄答案，到考試的時候就會不會寫。



不過網路也不是完全不好。有時候跟同學一起做報告，我們會先查資料，然後再討論要怎麼做。這樣子也是一種學習方式，但是不能太依賴網路。



所以我覺得網路要看怎麼用。用得好的話可以幫助我們，用不好的話反而會讓我們變笨。這就要看我們自己要怎麼選擇了。",1,1,1,1,1,5
