題目,作答,立意,結構,修辭,敘述,啟發,總分
"林語堂說：「（我）所愛的不是晚秋，是初秋，那時暄氣初消，月正圓，蟹正肥，桂花皎潔，也未陷入懍烈蕭瑟氣態，這是最值得賞樂的。」楊牧則是在美麗的春天世界裡，萬物復甦，卻聽到「一片樹葉提早轉黃的聲音。」（〈夭〉）普魯斯特（Proust, M.）在《追憶逝水年華》中說：「一小時不僅僅是一個小時，它是一只充滿香氣、聲響、念頭和氛圍的花缽」，說明時間的認知與感官知覺及感受有關。請以「季節的感思」為題，寫一篇文章，描寫你對季節的感知經驗，並抒發心中的感受與領會。
文長至少600字。

","季節的感思



我覺得一年四季每個季節都不一樣，有冷有熱，天氣也會變來變去。我最喜歡夏天，最討厭冬天。住在城市裡面，看不太到季節的變化，而且現在地球暖化，季節好像都亂掉了。



我對夏天和冬天的感覺最深。夏天代表放假，可以不用讀書，雖然天氣很熱，但是比冬天舒服多了。夏天不會有很吵的風聲，只有蟬在叫，這種聲音很好聽，讓人可以睡得很好。但是冬天就很討厭，天氣冷得要命，要一直穿衣服脫衣服很麻煩，穿太多衣服走路也不方便。而且冬天常常要考試，壓力很大，所以我很不喜歡冬天。



現在的天氣越來越奇怪，夏天太熱了，熱到冬天都還是熱的，有時候夏天又會很冷，感覺季節都亂掉了，跟以前完全不一樣。我覺得這樣子很不好，希望天氣可以正常一點。",2,1,1,2,1,7
