題目,作答,立意,結構,修辭,敘述,啟發,總分
"甲
我們的感情是冰箱，打開來看，明亮可喜，關起門後是嗡嗡的黑暗。什麼都不會壞掉，埋在霜雪的角落。我們的感情是冰箱，有時很滿有時很空，一切都可以保存很久，冷冷的，可是很新鮮，看起來都像昨天。（柯裕棻〈冰箱〉）
乙
農曆年前我媽換了新冰箱。雖然舊的其實也還好，十數年如一日修長高冷玉面如銀，該凍肉時凍肉，該製冰時製冰，門沒關緊永遠忠實地響警告聲。燈泡甚至沒有壞過一次。只是我媽長期嫌它不得力，冷藏室裝一隻生雞一鍋燉肉就周轉不過來，胃口那樣地小，像一個節食的人，廚房裡最不需要的就是一個節食的人。我常常看見她蹲在那兒，腳邊圍滿生鮮，鬥盡心智排列組合，在最有限空間裡籌備出最大的寬容，冰箱門好像看牙醫的嘴開太久不斷嗶嗶叫，簡直像在哭了。感覺兩方都十分苦惱。
我認為運用如常的器物毋需特別汰換，也主張大家都不妨少吃一點。顯然我媽不作此想。她說：「總之我就是想要一臺大冰箱啦。」但如此一來，我反倒領悟了，這完全是某商品宣傳詞「豈止於大」（Bigger than bigger）的道理：一座夠大的新冰箱也豈止於冰箱，它是一種想像，一種意境，一種可能性，它富有召喚家庭生活最好願景的潛力。（改寫自黃麗群〈如果在冬天，一座新冰箱〉）
    冰箱可以很滿，可以很空，當你打開冰箱，通常想尋找什麼？又看見什麼？假如有一座屬於你的新冰箱，你會有怎樣的想像？冰藏什麼（虛實皆可）會符合你所期待的美好生活？請以「如果我有一座新冰箱」為題，撰文一篇，
文長至少600字。

","如果我有一座新冰箱



我想要一座新冰箱，因為現在的冰箱已經很舊了。以前沒有冰箱的時候，大家都很辛苦，要把食物放在河邊才能吃到冰涼的東西。我爺爺常常跟我說以前的故事，他說那時候夏天很熱，食物很容易壞掉，所以大家都要趕快把東西吃完。



現在的冰箱真的很方便，可以放很多東西，而且食物都不會壞。我最喜歡打開冰箱拿飲料喝，有時候也會放一些水果在裡面。媽媽常常會煮很多菜放在冰箱，這樣我們就可以吃很久。



如果我有一座新冰箱，我一定會好好愛護它。因為冰箱真的很重要，沒有冰箱的話，我們就不能吃到冰的東西，也不能存放食物。我希望大家都可以珍惜冰箱，不要浪費食物，也要記得關好冰箱門。



我覺得冰箱是一個很棒的發明，讓我們的生活變得更好。以前的人沒有冰箱很辛苦，但是現在我們有了冰箱，生活變得很方便。所以我們要感謝有冰箱，也要好好使用它。",2,1,1,2,1,7
