題目,作答,立意,結構,修辭,敘述,啟發,總分
"    我覺得童年是一種氣味的記憶。
    我的童年，有許多果樹氣味的記憶。夏天暑熱的午後，廟埕後有一棵巨大的龍眼樹。我從小學翻牆出來，背著書包，爬上龍眼樹，躲在密密的枝葉裡。外面日光葉影搖晃，隱約聽見老師或母親尋來，在樹下叫著我的名字，但那呼喚的聲音，被蟬聲的高音淹沒了。我一動不動，找到一處適合蜷窩身體的枝椏，好像變成樹的一部分，而那時，龍眼樹密密的甜熟的氣味就包圍著我。我閉起眼睛，好像在假寐，也像在作夢，夢裡一串一串纍纍的龍眼，招來許多蜜蜂果蠅。我童年的夢，很甜很香，好像一整個夏天都窩在那棵樹上，包圍在濃郁的氣味裡做了一個醒不來的夢。（改寫自蔣勳《給青年藝術家的信》）
    生活中充斥各種氣味。氣味透過嗅覺傳遞，喚起人們的記憶和感受，一如文中龍眼樹甜熟的氣味喚起作者的童年記憶。請以「花草樹木的氣味記憶」為題，寫一篇文章，書寫你熟悉的花草樹木的氣味，及其所召喚的記憶和感受。

文長至少600字。

","花草樹木的氣味記憶



我家有一個蓮霧園，從小我就住在那裡。每年到了開花的時候我就很開心，因為蓮霧花很漂亮，像天上的煙花一樣，花的香味也是甜甜的。



我記得在國小三年級的時候，我常常去田裡幫忙。工作很累，但是我知道爸媽更累。有一次花開得很慢，爸媽很擔心，因為這關係到我們的生活。他們還為這件事吵架，這是我第一次看到他們吵架。後來花終於開了，大家都很高興。



每次收成後，爸媽都會帶我去吃大餐。我覺得很開心，因為之前的辛苦都值得了。我長大後更常去幫忙，也知道爸媽的壓力很大。以前我常常覺得工作很累，但是現在我知道爸媽比我更辛苦。



小時候我很想離開這個地方，但是真的離開後反而很想念。我發現蓮霧園是我最喜歡的地方，也是我的家。現在我最想念的不是這個地方，而是我的爸媽。",2,1,1,2,1,7
