題目,作答,立意,結構,修辭,敘述,啟發,總分
"甲
　　夜飲東坡醒復醉，歸來彷彿三更。家童鼻息已雷鳴，敲門都不應，倚杖聽江聲。　　長恨此身非我有，何時忘卻營營？夜闌風靜縠紋平，小舟從此逝，江海寄餘生。（蘇軾〈臨江仙〉）
乙
　　山居中的恬靜最使人心生歡喜，覺得充滿了幸福。但這種感覺完全是屬於我個人私己的，難以和他人分享。當深夜沉寂，偶爾會有一部卡車從山腰轟隆急馳而過，聲音在峽谷間響應激盪，久久停留，我往往就會從安寧的心緒中驚覺過來。車上至少有一個聚精會神在奔波的人，重山曲流外就是苦樂混合著沸騰的紅塵，那裡面也有著我的妻女和親友，而我卻一個人上山來獨自享受清靜。那麼，我的幸福是不是純由逃避式的懶散得來的呢？山居只是自己刻意經營的一種看似空靈其實奢侈的生活？心安理得會不會是虛幻而脆弱的？
　　至少，我不希望如此，因為人間是我的根本用情處。（陳列《地上歲月‧山中書》）
請回答下列問題：
甲文中，蘇軾面對夜闌風靜，意欲「小舟從此逝」，遠離塵世；乙文中，陳列則從山居中的恬靜，興發「人間是我的根本用情處」的情思，二者顯然不同。請以「靜夜情懷」為題，連結甲文或乙文的體悟，寫一篇文章抒發你對靜夜的體驗及感受。
文長至少600字。


","寂靜的夜晚，街道上很安靜，只有一些風聲和蟲鳴。偶爾有幾輛車子開過，發出轟隆的聲音。這樣的時候，我就會開始想很多事情。



我喜歡在夜晚的時候去山上看城市的燈光。站在高處往下看，城市裡的燈光很漂亮，讓我覺得自己好像離開了煩惱的世界。看著這些景色，我就會想到時間過得真快，很多事情都變得不一樣了。



我常常會想，自己有沒有進步？還是只是在原地踏步？但是我覺得我還是有在努力，每天都想要讓自己變得更好。



我也喜歡去海邊，聽著海浪的聲音。海浪一直拍打著沙灘，讓我的心情變得平靜。在這樣的時候，我會想到和朋友在一起的時光。我們一起聊天，一起玩耍，這些都是我最珍貴的回憶。



夜晚很安靜，城市的燈光很美，讓我可以想很多事情。這些時候，我覺得很幸福，因為可以好好地想一想生活。",2,2,1,2,1,8
