題目,作答,立意,結構,修辭,敘述,啟發,總分
"甲
我們的感情是冰箱，打開來看，明亮可喜，關起門後是嗡嗡的黑暗。什麼都不會壞掉，埋在霜雪的角落。我們的感情是冰箱，有時很滿有時很空，一切都可以保存很久，冷冷的，可是很新鮮，看起來都像昨天。（柯裕棻〈冰箱〉）
乙
農曆年前我媽換了新冰箱。雖然舊的其實也還好，十數年如一日修長高冷玉面如銀，該凍肉時凍肉，該製冰時製冰，門沒關緊永遠忠實地響警告聲。燈泡甚至沒有壞過一次。只是我媽長期嫌它不得力，冷藏室裝一隻生雞一鍋燉肉就周轉不過來，胃口那樣地小，像一個節食的人，廚房裡最不需要的就是一個節食的人。我常常看見她蹲在那兒，腳邊圍滿生鮮，鬥盡心智排列組合，在最有限空間裡籌備出最大的寬容，冰箱門好像看牙醫的嘴開太久不斷嗶嗶叫，簡直像在哭了。感覺兩方都十分苦惱。
我認為運用如常的器物毋需特別汰換，也主張大家都不妨少吃一點。顯然我媽不作此想。她說：「總之我就是想要一臺大冰箱啦。」但如此一來，我反倒領悟了，這完全是某商品宣傳詞「豈止於大」（Bigger than bigger）的道理：一座夠大的新冰箱也豈止於冰箱，它是一種想像，一種意境，一種可能性，它富有召喚家庭生活最好願景的潛力。（改寫自黃麗群〈如果在冬天，一座新冰箱〉）
    冰箱可以很滿，可以很空，當你打開冰箱，通常想尋找什麼？又看見什麼？假如有一座屬於你的新冰箱，你會有怎樣的想像？冰藏什麼（虛實皆可）會符合你所期待的美好生活？請以「如果我有一座新冰箱」為題，撰文一篇，
文長至少600字。

","如果我有一座新冰箱



我家的冰箱已經很舊了，每天都在嗡嗡響，我常常會想要一個新的冰箱。每次打開冰箱的時候，我都會看到裡面亂七八糟的東西，有時候會找不到要拿的東西，很麻煩。



我最喜歡在冰箱裡找東西吃，有時候會找到媽媽買的蛋糕或是冰棒，這樣很開心。但是冰箱裡面常常都是一些菜和飲料，都亂放在那裡，看起來很亂。冰箱門上也有很多調味料，有時候會掉下來，很煩。



如果我有一個新冰箱，我一定要放很多我喜歡的東西，像是無糖茶和冰棒。我不會管它們要怎麼放，反正放進去就好了。我覺得冰箱裡的東西亂亂的也沒關係，因為這樣比較有趣，每次打開都不知道會看到什麼。



我覺得每個人都應該要有一個冰箱，雖然它不是很重要，但是可以讓生活變得比較有趣。我喜歡看冰箱裡的東西怎麼排列，有時候飲料會倒下來，看起來很好笑。冰箱就像一個小世界一樣，很有趣。",2,1,1,2,1,7
