題目,作答,立意,結構,修辭,敘述,啟發,總分
"關於地球的記憶
被文字固禁在課本裡
我們的筆尖游走在山脈和海洋
翻譯每片花瓣的嬌嫩和露水的清新
所有的言語 答案
都靜放在我們的課本裡
等待我們翻起這一切的序幕（節錄自薛憶婷〈我們的課本〉）

    以上這首詩，從課本啟動天馬行空的遐想，瞥見知識豐富的樣貌。科學頑童費曼（Richard P. Feynman）曾說觀察轉動的餐盤，讓他得到很大的啟發，領略了興之所至的樂趣。物理課可讓我們發現萬物運行的迷人，生物課帶領我們進入細胞核遊歷，外語課讓我們聽見世界不同的文化。國文課堂上「採菊東籬下，悠然見南山」或「輕羅小扇撲流螢」，詩中情境也往往能讓人神遊於現實之外。過往的課程內容，是否曾經點燃你對知識的熱情？打開課本時，不知能否如〈我們的課本〉所述，揭開知識想像的序幕。
    若能從不同角度切入課本，進入知識的想像，或許可以讓課本帶領我們經歷驚奇的旅程。請以「當我打開課本」為題，寫一篇文章，敘述任一學科課本對你的意義，書寫你探索課本內容、知識的經驗與體會。
文長至少600字。


","當我打開課本



我最不喜歡的就是數學課本，每次打開都讓我很煩惱。從小學開始，數學就一直是我最不會的科目，看到那些數字和公式就頭痛。



剛開始學數學的時候，我還覺得還好，因為很簡單。可是後來越學越難，公式越來越多，我都記不住。每次考試都考得很差，我都不想再學了。老師教得很快，我都跟不上，看著課本上的題目都不知道要怎麼解。



後來我爸媽幫我找了家教老師，他教得比較慢，我才慢慢懂一些。家教老師很有耐心，會一直教到我會為止。雖然還是不太會，但是比以前好多了。



現在我打開數學課本，雖然還是會害怕，但是至少不會像以前那樣完全不懂。我知道數學很重要，所以我會繼續努力學習。希望以後可以更進步，不要再害怕數學了。",2,1,2,2,1,8
