題目,作答,立意,結構,修辭,敘述,啟發,總分
"林語堂說：「（我）所愛的不是晚秋，是初秋，那時暄氣初消，月正圓，蟹正肥，桂花皎潔，也未陷入懍烈蕭瑟氣態，這是最值得賞樂的。」楊牧則是在美麗的春天世界裡，萬物復甦，卻聽到「一片樹葉提早轉黃的聲音。」（〈夭〉）普魯斯特（Proust, M.）在《追憶逝水年華》中說：「一小時不僅僅是一個小時，它是一只充滿香氣、聲響、念頭和氛圍的花缽」，說明時間的認知與感官知覺及感受有關。請以「季節的感思」為題，寫一篇文章，描寫你對季節的感知經驗，並抒發心中的感受與領會。
文長至少600字。

","季節的感思



我最喜歡的季節是秋天，但是我也很討厭秋天。每年到了秋天，天氣變得涼爽，不會太熱也不會太冷，這樣的天氣讓人感覺很舒服。



秋天來的時候，代表一年快要結束了。陽光不像夏天那麼熱，路邊的花草也慢慢枯萎了。每到這個時候我都會覺得很難過，因為要開始新的生活，要認識新朋友，要去新的地方，這些都讓我很不習慣。



不過秋天也提醒我生日快到了。我想我應該要開心一點，不要老是想著不開心的事情。秋天的風吹在臉上很舒服，好像在安慰我說沒關係。



我覺得我應該要改變自己了。雖然我還是會害怕，但是秋天告訴我，新的改變不一定是壞事，只要我願意試試看，就一定可以做到。



秋天是夏天和冬天中間的季節，它要適應這兩種不同的天氣。所以我也要學習秋天，勇敢面對困難。",1,1,1,1,1,5
