題目,作答,立意,結構,修辭,敘述,啟發,總分
"    我覺得童年是一種氣味的記憶。
    我的童年，有許多果樹氣味的記憶。夏天暑熱的午後，廟埕後有一棵巨大的龍眼樹。我從小學翻牆出來，背著書包，爬上龍眼樹，躲在密密的枝葉裡。外面日光葉影搖晃，隱約聽見老師或母親尋來，在樹下叫著我的名字，但那呼喚的聲音，被蟬聲的高音淹沒了。我一動不動，找到一處適合蜷窩身體的枝椏，好像變成樹的一部分，而那時，龍眼樹密密的甜熟的氣味就包圍著我。我閉起眼睛，好像在假寐，也像在作夢，夢裡一串一串纍纍的龍眼，招來許多蜜蜂果蠅。我童年的夢，很甜很香，好像一整個夏天都窩在那棵樹上，包圍在濃郁的氣味裡做了一個醒不來的夢。（改寫自蔣勳《給青年藝術家的信》）
    生活中充斥各種氣味。氣味透過嗅覺傳遞，喚起人們的記憶和感受，一如文中龍眼樹甜熟的氣味喚起作者的童年記憶。請以「花草樹木的氣味記憶」為題，寫一篇文章，書寫你熟悉的花草樹木的氣味，及其所召喚的記憶和感受。

文長至少600字。

","花草樹木的氣味記憶



夏日的午後，蟬鳴此起彼落，我漫步在榕樹成蔭的小徑上，深深吸入一口氣，那股獨特的幽香喚醒了沉睡已久的記憶。樹葉間灑落的陽光在地面上織出斑駁的光影，恍如時光的印記，將我帶回那段純真無憂的歲月。



記得高中求學時期，為了追求更好的教育資源，我離開了鄉下老家，來到繁華的都市。在這裡，混凝土叢林取代了自然綠意，汽機車的廢氣與冷氣機的人工冷風充斥在每個角落。每當走在街頭，呼吸間盡是城市特有的喧囂氣息，那份記憶中榕樹帶來的清新涼意，彷彿成了一場遙不可及的夢。



都市生活的緊湊步調，課業的重擔壓得我喘不過氣。在一個特別疲憊的週末，我決定逃離這座繁華的牢籠，搭上返鄉的公車。當車門開啟的那一刻，熟悉的榕樹幽香撲面而來，如同一把溫柔的鑰匙，打開了塵封已久的回憶之門。



腦海中浮現出兒時在榕樹下追逐嬉戲的畫面，樹蔭下的歡笑聲，與玩伴們無拘無束奔跑的自由，一幕幕鮮活地重現眼前。那時的我們，不曾被功名利祿所困，不必為未來焦慮，只需在榕樹的懷抱中盡情遊玩，讓清新的樹香沁入心脾。



站在兒時熟悉的榕樹下，我終於明白，在追求成長的路上，我們總是匆匆向前，卻漸漸遺忘了最初的純真與快樂。榕樹的氣息像是一位智者，默默提醒著我：真正的自由，或許不在遙不可及的未來，而是藏在那些單純美好的當下。



如今，每當我感到疲憊或迷惘時，總會想起那棵榕樹的氣息。它不僅是我童年的見證，更成為我生命中一道永恆的風景。在快節奏的現代生活中，這份來自大自然的氣息提醒著我，要在追逐夢想的同時，也別忘了停下腳步，感受生命中最純粹的美好。",4,4,4,4,4,20
