題目,作答,立意,結構,修辭,敘述,啟發,總分
"    看到山上那麼多參天大樹時，會勾起我的惻隱之心。在無法順暢呼吸的空間裡，樹木之間為了生存必須展開激烈的競爭。為了能多接受一些陽光，它們只能拼命向上生長。
但是，只為生存而競爭的森林卻漸次死亡，因為陽光無法到達地面，所以溫度不夠高，無法讓幼小的生命萌芽。小樹和花、草，以及與它們一起生活的小昆蟲沒有生存的空間。雖然表面上看起來非常完美，但這種森林其實與沒有希望的不孕之地無異。
根據我的經驗，密集栽種的樹苗體型壯大數十倍時，就需要開始砍樹，否則樹木會抱怨空間太窄，活不下去。要想確保樹木能充分接受陽光照射的空間，就必須做出犧牲。因此，幾年期間強行進行砍伐，樹木間距剛開始時是一公尺，現已擴大到七公尺。也就是說，即使是粗略估算，也可知七棵樹中有六棵為之消失。
森林要想成為孕育新生命的希望之地，就需要有縫隙。如果樹木壽命結束或因為意外災害而倒下，該位置就會產生空間，那麼，溫暖的陽光就會照射進來，被陽光照射的地面混雜著前一年秋天凋落的樹葉，於是積聚起能夠孕育新生命的養分。因此，樹木的縫隙，既是結束和開始共存的空間，也是由缺乏轉化為希望的空間。（改寫自禹鐘榮著、盧鴻金譯《樹木教我的人生課》）
    根據上文所述，為什麼森林需要縫隙？由此聯想，人生是否也需要縫隙？請以「縫隙的聯想」為題，寫一篇文章，結合生活經驗或見聞，書寫你的感思與體悟。
文長至少600字。


","縫隙的聯想



生活中有很多事情要做，就像是一個一個的方塊，有讀書、工作、玩樂等等。這些方塊中間會有一些空隙，就是我們休息和玩樂的時間。



我從高中畢業後變成大學生，覺得一切都很新鮮。大學生活跟高中很不一樣，可以自己安排時間，但是有時候不知道要做什麼，就浪費了很多時間。我看到很多同學都在忙著參加社團和交朋友，但是好像也沒有想清楚自己要什麼。



我覺得生活中的空隙很重要，不能一直忙碌。有時候要停下來想一想，不然會很累。像我現在就覺得要慢慢來，不要急著把時間都排滿，這樣才能找到自己喜歡的事情。



所以我認為縫隙就是讓我們休息的時間，不要把它填滿沒用的事情，也不要浪費掉。有時候停下來休息一下也是很好的。",2,1,1,2,1,7
