題目,作答,立意,結構,修辭,敘述,啟發,總分
"關於地球的記憶
被文字固禁在課本裡
我們的筆尖游走在山脈和海洋
翻譯每片花瓣的嬌嫩和露水的清新
所有的言語 答案
都靜放在我們的課本裡
等待我們翻起這一切的序幕（節錄自薛憶婷〈我們的課本〉）

    以上這首詩，從課本啟動天馬行空的遐想，瞥見知識豐富的樣貌。科學頑童費曼（Richard P. Feynman）曾說觀察轉動的餐盤，讓他得到很大的啟發，領略了興之所至的樂趣。物理課可讓我們發現萬物運行的迷人，生物課帶領我們進入細胞核遊歷，外語課讓我們聽見世界不同的文化。國文課堂上「採菊東籬下，悠然見南山」或「輕羅小扇撲流螢」，詩中情境也往往能讓人神遊於現實之外。過往的課程內容，是否曾經點燃你對知識的熱情？打開課本時，不知能否如〈我們的課本〉所述，揭開知識想像的序幕。
    若能從不同角度切入課本，進入知識的想像，或許可以讓課本帶領我們經歷驚奇的旅程。請以「當我打開課本」為題，寫一篇文章，敘述任一學科課本對你的意義，書寫你探索課本內容、知識的經驗與體會。
文長至少600字。


","當我打開課本



我最喜歡的課本是數學課本，因為它讓我覺得很有趣。每次打開數學課本的時候，我都會看到很多數字和圖形，雖然剛開始不太懂，但是慢慢就學會了。



我以前不喜歡數學，覺得很難，但是後來發現數學其實沒有那麼可怕。我開始學會解題目，也知道了數學在生活中很重要。像是買東西要算錢，或是量東西的長度，都要用到數學。



數學課本裡面有很多不同的題目，有時候很簡單，有時候很難。我最喜歡的是學習方程式，雖然一開始看不懂那些符號，但是老師教了之後就懂了。現在我的數學成績進步了很多，也變得比較喜歡數學了。



我覺得數學課本教會我很多東西，讓我變得更聰明。希望以後可以學到更多數學知識，這樣就可以解決更多問題了。",2,1,1,2,1,7
