題目,作答,立意,結構,修辭,敘述,啟發,總分
"    我覺得童年是一種氣味的記憶。
    我的童年，有許多果樹氣味的記憶。夏天暑熱的午後，廟埕後有一棵巨大的龍眼樹。我從小學翻牆出來，背著書包，爬上龍眼樹，躲在密密的枝葉裡。外面日光葉影搖晃，隱約聽見老師或母親尋來，在樹下叫著我的名字，但那呼喚的聲音，被蟬聲的高音淹沒了。我一動不動，找到一處適合蜷窩身體的枝椏，好像變成樹的一部分，而那時，龍眼樹密密的甜熟的氣味就包圍著我。我閉起眼睛，好像在假寐，也像在作夢，夢裡一串一串纍纍的龍眼，招來許多蜜蜂果蠅。我童年的夢，很甜很香，好像一整個夏天都窩在那棵樹上，包圍在濃郁的氣味裡做了一個醒不來的夢。（改寫自蔣勳《給青年藝術家的信》）
    生活中充斥各種氣味。氣味透過嗅覺傳遞，喚起人們的記憶和感受，一如文中龍眼樹甜熟的氣味喚起作者的童年記憶。請以「花草樹木的氣味記憶」為題，寫一篇文章，書寫你熟悉的花草樹木的氣味，及其所召喚的記憶和感受。

文長至少600字。

","雨



我住在台灣，常常下雨。每次下雨前都會聞到雨的味道，這讓我想起小時候的事情。



小時候我很喜歡下雨。每次聞到雨的味道就很開心，因為可以打傘去玩水。我喜歡看雨滴掉在地上，喜歡聽雨打在傘上的聲音。那時候下雨對我來說是很快樂的事。



長大後我不喜歡下雨了。因為下雨很麻煩，會弄濕衣服和鞋子。書包也會濕掉，課本會變皺。所以那時候我很討厭下雨。



現在我看到下雨就會想到以前。看到小朋友在雨中玩耍，就想到自己小時候。我不知道為什麼同樣是下雨，感覺卻不一樣了。



我覺得雨的味道沒有變，變的是我自己。因為長大了，所以想的事情比較多。但是我還是喜歡雨，只是感覺不一樣而已。",1,1,1,1,1,5
