題目,作答,立意,結構,修辭,敘述,啟發,總分
"    我覺得童年是一種氣味的記憶。
    我的童年，有許多果樹氣味的記憶。夏天暑熱的午後，廟埕後有一棵巨大的龍眼樹。我從小學翻牆出來，背著書包，爬上龍眼樹，躲在密密的枝葉裡。外面日光葉影搖晃，隱約聽見老師或母親尋來，在樹下叫著我的名字，但那呼喚的聲音，被蟬聲的高音淹沒了。我一動不動，找到一處適合蜷窩身體的枝椏，好像變成樹的一部分，而那時，龍眼樹密密的甜熟的氣味就包圍著我。我閉起眼睛，好像在假寐，也像在作夢，夢裡一串一串纍纍的龍眼，招來許多蜜蜂果蠅。我童年的夢，很甜很香，好像一整個夏天都窩在那棵樹上，包圍在濃郁的氣味裡做了一個醒不來的夢。（改寫自蔣勳《給青年藝術家的信》）
    生活中充斥各種氣味。氣味透過嗅覺傳遞，喚起人們的記憶和感受，一如文中龍眼樹甜熟的氣味喚起作者的童年記憶。請以「花草樹木的氣味記憶」為題，寫一篇文章，書寫你熟悉的花草樹木的氣味，及其所召喚的記憶和感受。

文長至少600字。

","花草樹木的氣味記憶



我小時候住的地方有很多樹木，每次走出家門就可以看到很大的樹林。那時候的樹林裡有一種特別的味道，是草木的香味，現在想起來那就是自由的味道。



我常常跟朋友一起在樹林裡玩耍，那時候真的很開心。樹林裡的草木香味讓我覺得很舒服，但是現在長大了就聞不到這種味道了，因為家門前的樹林都變成大樓了。



我覺得小時候的回憶都很美好，但是現在的環境已經完全改變了。以前的樹林不見了，那種自由的草木香味也找不到了。這些回憶就像照片一樣一直存在我的腦海裡，但是那種感覺再也回不來了。



我很懷念以前的時光，但是現在的生活已經不一樣了。雖然很想再聞到那種草木香，但是已經不可能了。這就是生活吧，有些東西一旦失去就再也找不回來了。",2,1,1,2,1,7
