題目,作答,立意,結構,修辭,敘述,啟發,總分
"    我覺得童年是一種氣味的記憶。
    我的童年，有許多果樹氣味的記憶。夏天暑熱的午後，廟埕後有一棵巨大的龍眼樹。我從小學翻牆出來，背著書包，爬上龍眼樹，躲在密密的枝葉裡。外面日光葉影搖晃，隱約聽見老師或母親尋來，在樹下叫著我的名字，但那呼喚的聲音，被蟬聲的高音淹沒了。我一動不動，找到一處適合蜷窩身體的枝椏，好像變成樹的一部分，而那時，龍眼樹密密的甜熟的氣味就包圍著我。我閉起眼睛，好像在假寐，也像在作夢，夢裡一串一串纍纍的龍眼，招來許多蜜蜂果蠅。我童年的夢，很甜很香，好像一整個夏天都窩在那棵樹上，包圍在濃郁的氣味裡做了一個醒不來的夢。（改寫自蔣勳《給青年藝術家的信》）
    生活中充斥各種氣味。氣味透過嗅覺傳遞，喚起人們的記憶和感受，一如文中龍眼樹甜熟的氣味喚起作者的童年記憶。請以「花草樹木的氣味記憶」為題，寫一篇文章，書寫你熟悉的花草樹木的氣味，及其所召喚的記憶和感受。

文長至少600字。

","花草樹木的氣味記憶



我家客廳有一些花草，是媽媽在外面採回來的。媽媽把它們放在桌子上，有三朵雞蛋花躺在小碟子裡。我聞到花香的時候，就想到了小時候的事情。



我小時候很喜歡出去玩，常常看到很多花花草草。我最喜歡的是雞蛋花，因為它長得很漂亮，黃黃白白的，聞起來也很香。我常常把雞蛋花摘下來插在頭髮上，然後假裝自己是一個漂亮的小姑娘。每次玩到晚上，奶奶叫我回家吃飯，我都不太想回去。



後來我上了國中，就很少出去玩了，因為要讀書。現在看到媽媽擺在桌上的雞蛋花，聞到那個香味，就想起以前的事情。我覺得小時候真的很快樂，可是現在長大了，很多事情都變了。



我的童年很快樂，有很多雞蛋花的香味。雖然現在很多東西都不見了，但是我還記得那些香味和快樂的感覺。",2,1,1,2,1,7
