題目,作答,立意,結構,修辭,敘述,啟發,總分
"二十一世紀資訊量以驚人的速度暴增，有人認為網路資訊易於取得，會使記憶力與思考力衰退，不利於認知學習；也有人視網際網路為人類的外接大腦記憶體，意味著我們毋須記憶大量知識，可以專注在更重要、更有創造力的事物上。對於以上兩種不同的觀點，你的看法為何？請以「網海浮沉之我思」為題，結合自己的相關經驗，探討創造力與思考力之間的關係。
文長至少600字。

","網海浮沉之我思



現在的網路很方便，大家都可以用手機上網找資料。不管是在家裡、學校或是公司，到處都在用網路，生活也因此有很多改變。



在學校，老師常常叫我們寫作業，要我們思考上課學到的東西。但是現在的學生都喜歡用網路找答案，有的人會用Google，有的人會用AI，還有人會在社群媒體上問別人。因為現在的學生從小就會用這些東西，所以比大人更會找資料。



有些同學會先想一想，不懂的地方才去查，但有些同學就直接把答案抄下來。雖然抄答案的人分數可能比較高，但這樣不太好。我覺得這只是每個人用網路的方式不一樣而已。



科技一直在進步，我們要學會怎麼用這些新的東西。要想清楚怎麼用網路才是對的，這是我們要一直學習的事情。",1,1,1,1,1,5
