題目,作答,立意,結構,修辭,敘述,啟發,總分
"關於地球的記憶
被文字固禁在課本裡
我們的筆尖游走在山脈和海洋
翻譯每片花瓣的嬌嫩和露水的清新
所有的言語 答案
都靜放在我們的課本裡
等待我們翻起這一切的序幕（節錄自薛憶婷〈我們的課本〉）

    以上這首詩，從課本啟動天馬行空的遐想，瞥見知識豐富的樣貌。科學頑童費曼（Richard P. Feynman）曾說觀察轉動的餐盤，讓他得到很大的啟發，領略了興之所至的樂趣。物理課可讓我們發現萬物運行的迷人，生物課帶領我們進入細胞核遊歷，外語課讓我們聽見世界不同的文化。國文課堂上「採菊東籬下，悠然見南山」或「輕羅小扇撲流螢」，詩中情境也往往能讓人神遊於現實之外。過往的課程內容，是否曾經點燃你對知識的熱情？打開課本時，不知能否如〈我們的課本〉所述，揭開知識想像的序幕。
    若能從不同角度切入課本，進入知識的想像，或許可以讓課本帶領我們經歷驚奇的旅程。請以「當我打開課本」為題，寫一篇文章，敘述任一學科課本對你的意義，書寫你探索課本內容、知識的經驗與體會。
文長至少600字。


","當我打開課本



每個人都要讀書，所以都要用課本。我最喜歡的是歷史課本，因為它讓我知道很多以前發生的事情。



我以前不喜歡讀書，只喜歡看漫畫和看電視。但是後來我發現歷史課本很有趣，裡面有很多故事，讓我可以想像以前的人在做什麼。我覺得比數學和英文有趣多了，因為那些科目都很難。



歷史課本讓我的生活有了改變。我開始去圖書館找歷史的書來看，回家也會看歷史劇。以前我都只看卡通，現在我覺得歷史比較好看。因為歷史課本，我的歷史考試都考得很好。



我覺得歷史課本對我來說很重要，它讓我知道很多事情。我希望以後還可以繼續看歷史課本，學到更多東西。",2,1,1,2,1,7
