題目,作答,立意,結構,修辭,敘述,啟發,總分
"    糖對身體是有好處的，運動過後或飢餓時，適當地補充糖會讓我們迅速恢復體力。科學研究也發現，大腦細胞的能量來源主要來自葡萄糖，當血糖濃度降低時，大腦難以順利運轉，容易注意力不集中，學習或做事效果不佳。不過，哈佛醫學院等多個研究機構指出，高糖飲食會增加罹患乳癌及憂鬱症等疾病的風險；世界衛生組織也指出，高糖飲食是造成體重過重、第二型糖尿病、蛀牙、心臟病的元兇，並建議每日飲食中「添加糖」的攝取量不宜超過總熱量的10%。以每日熱量攝取量2000大卡為例，也就是50公克糖。我國國民健康署於民國103年至106年的「國民營養健康狀況變遷調查」中，有關國人飲用含糖飲料的結果顯示，國民中小學生在飲用比例上為各年齡之冠，其中男性又高於女性。
    基於國民營養及健康飲食原則，目前中小學校園禁止出現含糖飲料，以避免孩子在校園攝取過多糖份。但反對者認為，孩子回到家還是可能會喝含糖飲料，無法治本。
    對於「中、小學校園禁止含糖飲料」，你贊成或反對？請以「禁止含糖飲料進入中、小學之我見」為題，撰寫一篇文章，提出你的看法與論述。
文長至少600字。


","禁止含糖飲料進入中、小學之我見



我覺得學校不應該禁止含糖飲料，因為糖對身體是有好處的。喝含糖飲料可以讓人開心，也可以讓人有精神。像是運動完或是肚子餓的時候，喝一瓶含糖飲料就會覺得很舒服。



我們班上很多同學都喜歡喝含糖飲料，如果學校禁止的話，大家一定會很不開心。而且有些同學會偷偷帶飲料來學校，這樣反而會造成更多問題。像是有些人會偷偷賣飲料給其他同學，這樣很不好。



我認為與其禁止含糖飲料，不如限制每個人可以買多少。比如說每個人一天只能買一瓶，這樣就不會喝太多。或是規定飲料不能太甜，糖分要控制在一定的範圍內。



總之，我覺得學校應該要讓學生有選擇的機會，不要什麼都禁止。這樣學生才會學會自己做決定，也不會偷偷做一些不好的事情。",2,1,2,1,1,7
