題目,作答,立意,結構,修辭,敘述,啟發,總分
"關於地球的記憶
被文字固禁在課本裡
我們的筆尖游走在山脈和海洋
翻譯每片花瓣的嬌嫩和露水的清新
所有的言語 答案
都靜放在我們的課本裡
等待我們翻起這一切的序幕（節錄自薛憶婷〈我們的課本〉）

    以上這首詩，從課本啟動天馬行空的遐想，瞥見知識豐富的樣貌。科學頑童費曼（Richard P. Feynman）曾說觀察轉動的餐盤，讓他得到很大的啟發，領略了興之所至的樂趣。物理課可讓我們發現萬物運行的迷人，生物課帶領我們進入細胞核遊歷，外語課讓我們聽見世界不同的文化。國文課堂上「採菊東籬下，悠然見南山」或「輕羅小扇撲流螢」，詩中情境也往往能讓人神遊於現實之外。過往的課程內容，是否曾經點燃你對知識的熱情？打開課本時，不知能否如〈我們的課本〉所述，揭開知識想像的序幕。
    若能從不同角度切入課本，進入知識的想像，或許可以讓課本帶領我們經歷驚奇的旅程。請以「當我打開課本」為題，寫一篇文章，敘述任一學科課本對你的意義，書寫你探索課本內容、知識的經驗與體會。
文長至少600字。


","當我打開課本時



課本裡面有很多知識，是以前的人留給我們的東西。每次打開課本，我都會看到很多作家寫的文章，他們都寫得很好，讓我學到很多東西。



我最喜歡看余光中的詩，因為他寫的東西很浪漫，讓我覺得生活很美好。我也喜歡看蔣勳的文章，因為他很會寫大自然的美。還有蘇軾的詞也很好，雖然我不知道他經歷過什麼，但是看了他的文章我也會感動。這些作家的文字都很厲害，可以讓我們了解以前的事情。



國文課本裡面不只有文章，還有老師教我們怎麼想這些文章的意思。像是陶淵明，我一開始以為他只是不想工作，後來才知道他是想要過自己喜歡的生活。他寫的桃花源記我也很喜歡，因為寫得很好。



所以我覺得課本很重要，可以讓我們學到很多東西。這些作家寫的文章都很有意思，讓我知道了很多道理，也學會了要多想一想。",2,1,2,1,1,7
