題目,作答,立意,結構,修辭,敘述,啟發,總分
"甲
(陶潛)為彭澤令。不以家累自隨，送一力給其子，書曰：「汝旦夕之費，自給為難。今遣此力，助汝薪水（打柴汲水）之勞。此亦人子也，可善遇之。」(《南史．隱逸．陶潛傳》)
乙
飯後，眾人各自有事離去，留下貞觀靜坐桌前獃想。她今日的這番感慨，實是前未曾有的。
阿啟伯摘瓜，乃她親眼所見。今早，她突發奇想，陪著外公去巡魚塭，回來時，祖孫二人，都在門口停住了，因為後門虛掩，阿啟伯拿著菜刀，正在棚下摘瓜，並未發覺他們，祖孫二個都閃到門背後。貞觀當時是真愣住了，在那種情況下，是前進呢？抑是後退？她不能很快作選擇。然而這種遲疑也只有幾秒鐘，她一下就被外公拉到門後，正是屏息靜氣時，老人家又帶了她拐出小巷口，走到前街來。
貞觀人到了大路上，心下才逐漸明白：外公躲那人的心，竟比那偷瓜的人所做的遮遮掩掩更甚！貞觀以為懂得了外公的心意：他怕阿啟伯當下撞見自己的那種難堪。事實上，他還有另一層深意，貪當然不好，而貧的本身沒有錯。外公不以阿啟伯為不是，是知道他家中十口，有菜就沒飯，有飯就沒菜。(改寫自蕭麗紅《千江有水千江月》)
陶潛或者外公對他人的善意，你可能也曾見聞或經歷過，請以「溫暖的心」為題，寫一篇文章，分享你的經驗及體會。
文長至少600字。

","溫暖的心



現在的社會很冷漠，大家都很忙，沒有時間關心別人。不過我的外婆是個很好的人，她總是幫助別人。



我記得小時候去外婆家，她總是在做鹹菜。外婆做的鹹菜很好吃，我們全家都喜歡。她把鹹菜放在屋外風乾，我很擔心會不會被偷。



有一天早上，我看到二伯在偷外婆的鹹菜。我很生氣，想要衝出去罵他，但是外婆把我拉住了。外婆告訴我，二伯家裡很窮，他的兒子不回家，女兒還小，老婆又生病，所以他們家常常沒飯吃。



外婆知道二伯的情況，所以故意讓他來拿鹹菜。她不想讓二伯覺得不好意思，就假裝不知道。我覺得外婆真的很善良，希望我也可以像她一樣有愛心。



我希望以後的社會可以多一些像外婆這樣的人，這樣世界就會變得更溫暖。",1,1,1,1,1,5
