題目,作答,立意,結構,修辭,敘述,啟發,總分
"    看到山上那麼多參天大樹時，會勾起我的惻隱之心。在無法順暢呼吸的空間裡，樹木之間為了生存必須展開激烈的競爭。為了能多接受一些陽光，它們只能拼命向上生長。
但是，只為生存而競爭的森林卻漸次死亡，因為陽光無法到達地面，所以溫度不夠高，無法讓幼小的生命萌芽。小樹和花、草，以及與它們一起生活的小昆蟲沒有生存的空間。雖然表面上看起來非常完美，但這種森林其實與沒有希望的不孕之地無異。
根據我的經驗，密集栽種的樹苗體型壯大數十倍時，就需要開始砍樹，否則樹木會抱怨空間太窄，活不下去。要想確保樹木能充分接受陽光照射的空間，就必須做出犧牲。因此，幾年期間強行進行砍伐，樹木間距剛開始時是一公尺，現已擴大到七公尺。也就是說，即使是粗略估算，也可知七棵樹中有六棵為之消失。
森林要想成為孕育新生命的希望之地，就需要有縫隙。如果樹木壽命結束或因為意外災害而倒下，該位置就會產生空間，那麼，溫暖的陽光就會照射進來，被陽光照射的地面混雜著前一年秋天凋落的樹葉，於是積聚起能夠孕育新生命的養分。因此，樹木的縫隙，既是結束和開始共存的空間，也是由缺乏轉化為希望的空間。（改寫自禹鐘榮著、盧鴻金譯《樹木教我的人生課》）
    根據上文所述，為什麼森林需要縫隙？由此聯想，人生是否也需要縫隙？請以「縫隙的聯想」為題，寫一篇文章，結合生活經驗或見聞，書寫你的感思與體悟。
文長至少600字。


","縫隙的聯想



大樹為了得到陽光，會長得很高很大，這樣下面的小草和小花就得不到陽光。所以森林需要有縫隙，讓陽光照進來，讓下面的植物也能活下去。



我覺得人生也需要縫隙。就像我每天都要上課和補習，從早上七點到晚上九點半，真的很累。但是下課後，我最喜歡去便利商店休息。那裡的冷氣很舒服，還可以買一些打折的食物。這就是我生活中的縫隙，讓我可以休息一下。



便利商店的自動門打開時，冷氣會從縫隙吹出來，讓我很舒服。我常常會在那裡買東西吃，等公車回家。雖然要等很久，但是可以在便利商店休息，我覺得還不錯。



所以我覺得縫隙很重要，不管是森林還是人生，都需要有休息的時候。就像便利商店是我每天的休息地方一樣，讓我可以放鬆一下，然後繼續面對生活。",2,1,1,2,1,7
