題目,作答,立意,結構,修辭,敘述,啟發,總分
"甲
我們的感情是冰箱，打開來看，明亮可喜，關起門後是嗡嗡的黑暗。什麼都不會壞掉，埋在霜雪的角落。我們的感情是冰箱，有時很滿有時很空，一切都可以保存很久，冷冷的，可是很新鮮，看起來都像昨天。（柯裕棻〈冰箱〉）
乙
農曆年前我媽換了新冰箱。雖然舊的其實也還好，十數年如一日修長高冷玉面如銀，該凍肉時凍肉，該製冰時製冰，門沒關緊永遠忠實地響警告聲。燈泡甚至沒有壞過一次。只是我媽長期嫌它不得力，冷藏室裝一隻生雞一鍋燉肉就周轉不過來，胃口那樣地小，像一個節食的人，廚房裡最不需要的就是一個節食的人。我常常看見她蹲在那兒，腳邊圍滿生鮮，鬥盡心智排列組合，在最有限空間裡籌備出最大的寬容，冰箱門好像看牙醫的嘴開太久不斷嗶嗶叫，簡直像在哭了。感覺兩方都十分苦惱。
我認為運用如常的器物毋需特別汰換，也主張大家都不妨少吃一點。顯然我媽不作此想。她說：「總之我就是想要一臺大冰箱啦。」但如此一來，我反倒領悟了，這完全是某商品宣傳詞「豈止於大」（Bigger than bigger）的道理：一座夠大的新冰箱也豈止於冰箱，它是一種想像，一種意境，一種可能性，它富有召喚家庭生活最好願景的潛力。（改寫自黃麗群〈如果在冬天，一座新冰箱〉）
    冰箱可以很滿，可以很空，當你打開冰箱，通常想尋找什麼？又看見什麼？假如有一座屬於你的新冰箱，你會有怎樣的想像？冰藏什麼（虛實皆可）會符合你所期待的美好生活？請以「如果我有一座新冰箱」為題，撰文一篇，
文長至少600字。

","如果我有一座新冰箱



每個人的生命中，總有些珍貴的時刻想要永恆保存。若我有一座新冰箱，我想將那些稍縱即逝的溫暖時光，那些細膩動人的愛意，都小心翼翼地封存在這個時光保險箱裡。



「你可以回去，但那裡已經沒有人在了。」這句話總是在深夜裡迴盪。生命中的離別如四季更迭，無可避免。然而，若能將那些珍貴的記憶妥善保存，或許能讓離別不再那麼令人感傷。這座新冰箱，將成為我收藏回憶的方舟。



在這個想像中的冰箱裡，我要珍藏那些深夜裡的溫柔時光：母親縱容我熬夜時的無奈眼神，祖母為我準備宵夜時的慈愛笑容。每一個細節都像是一顆晶瑩的冰晶，在冰箱的燈光下閃爍著動人的光芒。那些被遺忘在時光縫隙中的愛意，都將在這裡重現光彩。



這座冰箱也將收藏那些無條件的信任與支持：家人對我夢想的支持，朋友給予的溫暖鼓勵，以及所有那些不求回報的付出。這些情感的結晶，將在冰箱中永不融化，成為我生命中最珍貴的養分。



我深知人生而孤獨，相遇與離別都是必經之路。但在這座時光冰箱裡，所有美好的回憶都將完整保存。即使歲月流逝，那些被封存的愛意依然鮮活如初。這不僅是對逝去時光的懷念，更是對未來的期許——在往後的日子裡，我也要繼續創造值得保存的美好時刻。



這座新冰箱，不只是一個儲存記憶的容器，更是一面映照生命溫度的鏡子。它提醒著我：即使身處寒冷的現實，心中依然可以保有溫暖；即使面對離別，愛的痕跡永遠不會消失。感謝所有在我生命中留下溫暖印記的人，是你們讓我懂得：最理想的生活，不在遙遠的未來，而在當下能夠真摯付出與接納愛的每一刻。",5,4,4,4,4,21
