題目,作答,立意,結構,修辭,敘述,啟發,總分
"    糖對身體是有好處的，運動過後或飢餓時，適當地補充糖會讓我們迅速恢復體力。科學研究也發現，大腦細胞的能量來源主要來自葡萄糖，當血糖濃度降低時，大腦難以順利運轉，容易注意力不集中，學習或做事效果不佳。不過，哈佛醫學院等多個研究機構指出，高糖飲食會增加罹患乳癌及憂鬱症等疾病的風險；世界衛生組織也指出，高糖飲食是造成體重過重、第二型糖尿病、蛀牙、心臟病的元兇，並建議每日飲食中「添加糖」的攝取量不宜超過總熱量的10%。以每日熱量攝取量2000大卡為例，也就是50公克糖。我國國民健康署於民國103年至106年的「國民營養健康狀況變遷調查」中，有關國人飲用含糖飲料的結果顯示，國民中小學生在飲用比例上為各年齡之冠，其中男性又高於女性。
    基於國民營養及健康飲食原則，目前中小學校園禁止出現含糖飲料，以避免孩子在校園攝取過多糖份。但反對者認為，孩子回到家還是可能會喝含糖飲料，無法治本。
    對於「中、小學校園禁止含糖飲料」，你贊成或反對？請以「禁止含糖飲料進入中、小學之我見」為題，撰寫一篇文章，提出你的看法與論述。
文長至少600字。


","禁止含糖飲料進入中、小學之我見



我不贊成學校禁止含糖飲料。因為我覺得這樣做沒有用，而且對學生不好。



我認為飲料有很多種，有些飲料喝了對身體不會有壞處。像是運動飲料，喝了可以補充體力。還有牛奶和果汁，這些都是對身體有好處的飲料。所以不應該把所有含糖飲料都禁止。



我以前讀書的時候，學校有賣很多種飲料，我們都可以自己選要喝什麼。有的同學喜歡喝運動飲料，有的喜歡喝牛奶。我覺得這樣很好，因為大家可以選擇自己想喝的。



而且禁止了也沒有用，因為學生回家還是可以喝含糖飲料。與其禁止，不如教學生怎麼選擇比較健康的飲料。這樣才是真正對學生好的做法。



所以我覺得學校不應該禁止含糖飲料，應該要教學生正確的觀念，讓他們學會自己選擇健康的飲料。這樣比較有用。",2,1,1,2,1,7
