題目,作答,立意,結構,修辭,敘述,啟發,總分
"    看到山上那麼多參天大樹時，會勾起我的惻隱之心。在無法順暢呼吸的空間裡，樹木之間為了生存必須展開激烈的競爭。為了能多接受一些陽光，它們只能拼命向上生長。
但是，只為生存而競爭的森林卻漸次死亡，因為陽光無法到達地面，所以溫度不夠高，無法讓幼小的生命萌芽。小樹和花、草，以及與它們一起生活的小昆蟲沒有生存的空間。雖然表面上看起來非常完美，但這種森林其實與沒有希望的不孕之地無異。
根據我的經驗，密集栽種的樹苗體型壯大數十倍時，就需要開始砍樹，否則樹木會抱怨空間太窄，活不下去。要想確保樹木能充分接受陽光照射的空間，就必須做出犧牲。因此，幾年期間強行進行砍伐，樹木間距剛開始時是一公尺，現已擴大到七公尺。也就是說，即使是粗略估算，也可知七棵樹中有六棵為之消失。
森林要想成為孕育新生命的希望之地，就需要有縫隙。如果樹木壽命結束或因為意外災害而倒下，該位置就會產生空間，那麼，溫暖的陽光就會照射進來，被陽光照射的地面混雜著前一年秋天凋落的樹葉，於是積聚起能夠孕育新生命的養分。因此，樹木的縫隙，既是結束和開始共存的空間，也是由缺乏轉化為希望的空間。（改寫自禹鐘榮著、盧鴻金譯《樹木教我的人生課》）
    根據上文所述，為什麼森林需要縫隙？由此聯想，人生是否也需要縫隙？請以「縫隙的聯想」為題，寫一篇文章，結合生活經驗或見聞，書寫你的感思與體悟。
文長至少600字。


","生活中需要縫隙，就像森林一樣。我覺得現在的生活太忙了，每天都在工作，都沒有時間休息。我住在一個很大的城市，這裡的人都很忙，大家都在趕時間，好像沒有人會停下來休息。



我覺得自己就像一隻小螞蟻，在這個大城市裡面很難找到自己的位置。每天都要工作，但是感覺做不完，很累很辛苦。我想要找一個地方可以休息，但是這個城市太擠了，到處都是人，到處都是房子，根本找不到空間。



我在這個城市長大，但是總覺得自己不屬於這裡。別人好像都過得很好，但是我每天都很累。我一直在努力想要找到一個屬於自己的地方，就像要在牆縫裡找一個小洞一樣。



我覺得人生也需要縫隙，需要一些空間讓我們休息。但是在這個城市裡面，好像找不到這樣的地方。我每天都在努力，但是好像永遠都做不完事情。我希望能找到一個可以休息的地方，但是現在還沒找到。



所以我覺得，不管是森林還是人生，都需要一些空間，讓我們可以喘口氣。但是在這個城市裡面，這樣的空間越來越少了，大家都活得很辛苦。",2,1,1,2,1,7
