題目,作答,立意,結構,修辭,敘述,啟發,總分
"自從有了電腦、智慧型手機及網路搜尋引擎之後，資訊科技的發展改變了人類大腦處理資訊的方式。我們可能儲存了大量的資訊，卻來不及閱讀，也不再費力記憶周遭事物和相關知識，因為只要輕鬆點一下滑鼠、滑一下手機，資訊就傳到我們面前。
二十一世紀資訊量以驚人的速度暴增，有人認為網路資訊易於取得，會使記憶力與思考力衰退，不利於認知學習；也有人視網際網路為人類的外接大腦記憶體，意味著我們無須記憶大量知識，而可以專注在更重要、更有創造力的事物上。對於以上兩種不同的觀點，請提出你個人的看法。文長600字以上。
","現在的人都在用網路和手機，好像什麼都不用記了。我覺得這樣不太好，因為人應該要多記東西，不能都靠網路。



馬雲說過我們要會用網路，不能被網路控制。我同意他的說法，因為現在的人都太依賴網路了。像是很多人連簡單的數學都要用計算機，這樣對學習一點幫助都沒有。而且網路上的東西也不一定是對的，所以我們還是要靠自己的腦袋。



雖然網路可以幫我們找到很多資料，但是如果都不記下來，就會很快忘記。我覺得這樣對我們的大腦不好，因為大腦會變得很懶惰。而且如果哪天網路壞掉了，或是沒有手機可以用，那不就什麼都不會了嗎？



所以我認為，我們還是要多用腦袋想事情，不能什麼都靠網路。網路只是一個工具而已，最重要的還是要靠自己的大腦。這樣才不會被科技控制，也才能真的學到東西。",2,1,1,2,1,7
