題目,作答,立意,結構,修辭,敘述,啟發,總分
"    我覺得童年是一種氣味的記憶。
    我的童年，有許多果樹氣味的記憶。夏天暑熱的午後，廟埕後有一棵巨大的龍眼樹。我從小學翻牆出來，背著書包，爬上龍眼樹，躲在密密的枝葉裡。外面日光葉影搖晃，隱約聽見老師或母親尋來，在樹下叫著我的名字，但那呼喚的聲音，被蟬聲的高音淹沒了。我一動不動，找到一處適合蜷窩身體的枝椏，好像變成樹的一部分，而那時，龍眼樹密密的甜熟的氣味就包圍著我。我閉起眼睛，好像在假寐，也像在作夢，夢裡一串一串纍纍的龍眼，招來許多蜜蜂果蠅。我童年的夢，很甜很香，好像一整個夏天都窩在那棵樹上，包圍在濃郁的氣味裡做了一個醒不來的夢。（改寫自蔣勳《給青年藝術家的信》）
    生活中充斥各種氣味。氣味透過嗅覺傳遞，喚起人們的記憶和感受，一如文中龍眼樹甜熟的氣味喚起作者的童年記憶。請以「花草樹木的氣味記憶」為題，寫一篇文章，書寫你熟悉的花草樹木的氣味，及其所召喚的記憶和感受。

文長至少600字。

","花草樹木的氣味記憶



我覺得花草樹木的氣味很好聞。春天的時候，花開了，有很多香味。櫻花和菊花都很香，讓人很開心。夏天很熱，草地上的草有一種味道，我喜歡踩在草地上聞這個味道。樹也有味道，松樹和杉樹的味道很特別。



秋天的時候，樹葉變黃了，掉在地上。地上的樹葉有一種特別的味道，讓我想到小時候在樹下玩的時候。有些樹還會結果子，果子也有香味。冬天很冷，大部分的植物都沒有葉子了，但是有些樹還是綠的，像冬青樹，它們還是會有一點香味。



我覺得這些花草樹木的味道都很重要，因為可以讓我們想起以前的事情。每次聞到這些味道的時候，我都會覺得很舒服。這些味道讓我覺得大自然很美好。",1,1,1,1,1,5
