題目,作答,立意,結構,修辭,敘述,啟發,總分
"    我覺得童年是一種氣味的記憶。
    我的童年，有許多果樹氣味的記憶。夏天暑熱的午後，廟埕後有一棵巨大的龍眼樹。我從小學翻牆出來，背著書包，爬上龍眼樹，躲在密密的枝葉裡。外面日光葉影搖晃，隱約聽見老師或母親尋來，在樹下叫著我的名字，但那呼喚的聲音，被蟬聲的高音淹沒了。我一動不動，找到一處適合蜷窩身體的枝椏，好像變成樹的一部分，而那時，龍眼樹密密的甜熟的氣味就包圍著我。我閉起眼睛，好像在假寐，也像在作夢，夢裡一串一串纍纍的龍眼，招來許多蜜蜂果蠅。我童年的夢，很甜很香，好像一整個夏天都窩在那棵樹上，包圍在濃郁的氣味裡做了一個醒不來的夢。（改寫自蔣勳《給青年藝術家的信》）
    生活中充斥各種氣味。氣味透過嗅覺傳遞，喚起人們的記憶和感受，一如文中龍眼樹甜熟的氣味喚起作者的童年記憶。請以「花草樹木的氣味記憶」為題，寫一篇文章，書寫你熟悉的花草樹木的氣味，及其所召喚的記憶和感受。

文長至少600字。

","花草樹木的氣味記憶



我覺得花草樹木的氣味很特別，每次聞到都會想起很多事情。春天的時候，花開得很漂亮，有很多香味。我最喜歡櫻花的味道，因為聞起來很舒服。菊花也很香，讓我想起媽媽種的花。



夏天很熱的時候，草地上的味道很清新。我小時候常常和朋友在草地上玩，踩在草地上會有一種特別的味道。樹木也有香味，特別是松樹，聞起來像是在山上一樣。



到了秋天，樹葉會變黃掉下來。地上的落葉有一種特別的味道，有點像土的味道。這時候我就會想起以前在學校操場玩耍的時候，常常會聞到這種味道。



冬天雖然很冷，但是有些樹還是會有香味。像是冬青樹，即使在冷天也會有香味。這些樹很堅強，讓我覺得很佩服。



我覺得這些花草樹木的味道都很重要，因為每次聞到都會讓我想起以前的事情。雖然現在生活很忙，但是這些香味可以讓我放鬆一下。",2,2,1,2,1,8
