題目,作答,立意,結構,修辭,敘述,啟發,總分
"關於地球的記憶
被文字固禁在課本裡
我們的筆尖游走在山脈和海洋
翻譯每片花瓣的嬌嫩和露水的清新
所有的言語 答案
都靜放在我們的課本裡
等待我們翻起這一切的序幕（節錄自薛憶婷〈我們的課本〉）

    以上這首詩，從課本啟動天馬行空的遐想，瞥見知識豐富的樣貌。科學頑童費曼（Richard P. Feynman）曾說觀察轉動的餐盤，讓他得到很大的啟發，領略了興之所至的樂趣。物理課可讓我們發現萬物運行的迷人，生物課帶領我們進入細胞核遊歷，外語課讓我們聽見世界不同的文化。國文課堂上「採菊東籬下，悠然見南山」或「輕羅小扇撲流螢」，詩中情境也往往能讓人神遊於現實之外。過往的課程內容，是否曾經點燃你對知識的熱情？打開課本時，不知能否如〈我們的課本〉所述，揭開知識想像的序幕。
    若能從不同角度切入課本，進入知識的想像，或許可以讓課本帶領我們經歷驚奇的旅程。請以「當我打開課本」為題，寫一篇文章，敘述任一學科課本對你的意義，書寫你探索課本內容、知識的經驗與體會。
文長至少600字。


","當我打開課本



每個人在讀書的時候都會用到課本，我最喜歡的是數學和理化課本，因為這些科目很有趣。



數學課本裡面有很多題目要解，每個人解題的方法都不一樣。就像人生一樣，每個人走的路都不同，只要最後能到達目標就好。我覺得這樣很有意思，因為不用每個人都用一樣的方法。



理化課本雖然看起來很無聊，但是裡面其實有很多有趣的東西。比如說地球是怎麼形成的，還有一些看不見的力量，還有化學實驗。這些都是以前的科學家發現的，我們現在學習他們的發現，說不定以後我們也可以發現新的東西。



我覺得課本不一定要是真的書本，大自然也可以是一本課本。我們可以從生活中學到很多東西，不一定要死讀書。每個人都是不一樣的，不需要完全照著課本做，因為課本只是給我們一個參考而已。",2,1,1,2,1,7
