題目,作答,立意,結構,修辭,敘述,啟發,總分
"關於地球的記憶
被文字固禁在課本裡
我們的筆尖游走在山脈和海洋
翻譯每片花瓣的嬌嫩和露水的清新
所有的言語 答案
都靜放在我們的課本裡
等待我們翻起這一切的序幕（節錄自薛憶婷〈我們的課本〉）

    以上這首詩，從課本啟動天馬行空的遐想，瞥見知識豐富的樣貌。科學頑童費曼（Richard P. Feynman）曾說觀察轉動的餐盤，讓他得到很大的啟發，領略了興之所至的樂趣。物理課可讓我們發現萬物運行的迷人，生物課帶領我們進入細胞核遊歷，外語課讓我們聽見世界不同的文化。國文課堂上「採菊東籬下，悠然見南山」或「輕羅小扇撲流螢」，詩中情境也往往能讓人神遊於現實之外。過往的課程內容，是否曾經點燃你對知識的熱情？打開課本時，不知能否如〈我們的課本〉所述，揭開知識想像的序幕。
    若能從不同角度切入課本，進入知識的想像，或許可以讓課本帶領我們經歷驚奇的旅程。請以「當我打開課本」為題，寫一篇文章，敘述任一學科課本對你的意義，書寫你探索課本內容、知識的經驗與體會。
文長至少600字。


","當我打開課本



課本是每個學生都要用的東西。我最喜歡數學和理化課本，因為裡面有很多知識要學習。



我覺得數學課本很有趣，因為可以用不同方法解題。就像人生一樣，每個人走的路不一樣，但最後都能到達目的地。理化課本雖然很難，但是裡面有很多實驗和現象很神奇，讓我覺得很有趣。這些都是以前的科學家發現的，我們現在學習他們的成果。



我認為課本不只是書本而已，大自然也是一本課本。只要能讓我們學到東西的，都可以叫做課本。每個人都不一樣，不一定要照著課本學習，最重要的是要學到東西。",1,1,1,1,1,5
