題目,作答,立意,結構,修辭,敘述,啟發,總分
"二十一世紀資訊量以驚人的速度暴增，有人認為網路資訊易於取得，會使記憶力與思考力衰退，不利於認知學習；也有人視網際網路為人類的外接大腦記憶體，意味著我們毋須記憶大量知識，可以專注在更重要、更有創造力的事物上。對於以上兩種不同的觀點，你的看法為何？請以「網海浮沉之我思」為題，結合自己的相關經驗，探討創造力與思考力之間的關係。
文長至少600字。

","網海浮沉之我思



網路在現代生活中很重要，大家都在用網路。有人說網路不好，會讓人變笨，有人說網路很好，可以查很多東西。我覺得網路還是要用，因為現在的人都需要用網路。



以前要找資料要去圖書館，現在用網路就可以查到很多東西。雖然網路上的東西不一定是對的，但是可以查很多資料。我覺得這樣對學習很有幫助，可以知道很多新的事情。



在學校和工作的時候，很多人都會用網路。但是有些人會抄襲網路上的東西，這樣不好。這樣會讓人變得不會思考，只會抄別人的東西。而且抄襲是違法的，會有很多問題。



所以我覺得網路要好好用，不要抄襲。這樣才能讓我們進步，也可以讓下一代的人更會用網路。",1,1,1,1,1,5
