題目,作答,立意,結構,修辭,敘述,啟發,總分
"關於地球的記憶
被文字固禁在課本裡
我們的筆尖游走在山脈和海洋
翻譯每片花瓣的嬌嫩和露水的清新
所有的言語 答案
都靜放在我們的課本裡
等待我們翻起這一切的序幕（節錄自薛憶婷〈我們的課本〉）

    以上這首詩，從課本啟動天馬行空的遐想，瞥見知識豐富的樣貌。科學頑童費曼（Richard P. Feynman）曾說觀察轉動的餐盤，讓他得到很大的啟發，領略了興之所至的樂趣。物理課可讓我們發現萬物運行的迷人，生物課帶領我們進入細胞核遊歷，外語課讓我們聽見世界不同的文化。國文課堂上「採菊東籬下，悠然見南山」或「輕羅小扇撲流螢」，詩中情境也往往能讓人神遊於現實之外。過往的課程內容，是否曾經點燃你對知識的熱情？打開課本時，不知能否如〈我們的課本〉所述，揭開知識想像的序幕。
    若能從不同角度切入課本，進入知識的想像，或許可以讓課本帶領我們經歷驚奇的旅程。請以「當我打開課本」為題，寫一篇文章，敘述任一學科課本對你的意義，書寫你探索課本內容、知識的經驗與體會。
文長至少600字。


","當我打開課本



從小到大，我們每天都要看課本，每個科目都有不同的課本，這些課本教給我們很多東西。



我覺得歷史課本最有趣，因為裡面有很多故事。像是唐太宗的故事，還有老子和甘地的故事。這些故事都告訴我們一些道理。



唐太宗的故事告訴我們要當一個好的領導者。老子教我們要居安思危，就是要小心一點。甘地用和平的方式讓印度獨立，這告訴我們不要用暴力。



我覺得歷史課本很好，因為可以學到很多東西。每次打開歷史課本，我都可以看到很多故事，這些故事都教會我一些事情。",1,1,1,1,1,5
