題目,作答,立意,結構,修辭,敘述,啟發,總分
"    看到山上那麼多參天大樹時，會勾起我的惻隱之心。在無法順暢呼吸的空間裡，樹木之間為了生存必須展開激烈的競爭。為了能多接受一些陽光，它們只能拼命向上生長。
但是，只為生存而競爭的森林卻漸次死亡，因為陽光無法到達地面，所以溫度不夠高，無法讓幼小的生命萌芽。小樹和花、草，以及與它們一起生活的小昆蟲沒有生存的空間。雖然表面上看起來非常完美，但這種森林其實與沒有希望的不孕之地無異。
根據我的經驗，密集栽種的樹苗體型壯大數十倍時，就需要開始砍樹，否則樹木會抱怨空間太窄，活不下去。要想確保樹木能充分接受陽光照射的空間，就必須做出犧牲。因此，幾年期間強行進行砍伐，樹木間距剛開始時是一公尺，現已擴大到七公尺。也就是說，即使是粗略估算，也可知七棵樹中有六棵為之消失。
森林要想成為孕育新生命的希望之地，就需要有縫隙。如果樹木壽命結束或因為意外災害而倒下，該位置就會產生空間，那麼，溫暖的陽光就會照射進來，被陽光照射的地面混雜著前一年秋天凋落的樹葉，於是積聚起能夠孕育新生命的養分。因此，樹木的縫隙，既是結束和開始共存的空間，也是由缺乏轉化為希望的空間。（改寫自禹鐘榮著、盧鴻金譯《樹木教我的人生課》）
    根據上文所述，為什麼森林需要縫隙？由此聯想，人生是否也需要縫隙？請以「縫隙的聯想」為題，寫一篇文章，結合生活經驗或見聞，書寫你的感思與體悟。
文長至少600字。


","縫隙的聯想



大自然的智慧總是給予人類深刻的啟示。正如森林需要縫隙來孕育新生，人生何嘗不是如此？在這個步調急促的現代社會中，「縫隙」的重要性值得我們深思。



猶記得年少時期，我曾全心投入圍棋訓練。那時的我，懷著精進技藝的熱忱，從早到晚不懈練習，彷彿要將每分每秒都填滿。然而，緊湊的節奏漸漸消磨了我的熱情，身心俱疲的狀態讓我不得不停下腳步思考：究竟什麼才是持續精進的正確方式？



經過一段調整期，我領悟到：就像森林需要縫隙讓陽光滲透、讓新芽萌發，人也需要適時的空間來沉澱與生長。當我學會在練習之間留白，不僅圍棋技藝反而更上層樓，對棋藝的熱愛也得以持續綿長。這讓我深刻體會到，縫隙不是虛度光陰，而是為了更好的成長預留的必要空間。



放眼現代社會，許多人為了追求效率和成就，將生活塞得滿滿當當，彷彿稍有空隙就是一種浪費。然而，就像過度密集的森林會扼殺地表的生機，沒有喘息空間的生活終將令人窒息。適度的縫隙能讓我們沉澱思緒、調整方向，也能讓創意靈感在寧靜中萌發。



縫隙的價值不僅體現在個人生活中，在人際關係中也同樣重要。給予他人適當的空間，不過分干預，反而能讓關係更加健康；在工作中預留緩衝的時間，看似降低效率，實則能避免疲憊帶來的失誤，達到更好的成果。



森林教會我們，縫隙既是終結也是開始，是轉化希望的空間。在人生的旅程中，學會經營縫隙的智慧，方能讓生命綻放更燦爛的光彩。",5,4,4,4,4,21
