題目,作答,立意,結構,修辭,敘述,啟發,總分
"關於地球的記憶
被文字固禁在課本裡
我們的筆尖游走在山脈和海洋
翻譯每片花瓣的嬌嫩和露水的清新
所有的言語 答案
都靜放在我們的課本裡
等待我們翻起這一切的序幕（節錄自薛憶婷〈我們的課本〉）

    以上這首詩，從課本啟動天馬行空的遐想，瞥見知識豐富的樣貌。科學頑童費曼（Richard P. Feynman）曾說觀察轉動的餐盤，讓他得到很大的啟發，領略了興之所至的樂趣。物理課可讓我們發現萬物運行的迷人，生物課帶領我們進入細胞核遊歷，外語課讓我們聽見世界不同的文化。國文課堂上「採菊東籬下，悠然見南山」或「輕羅小扇撲流螢」，詩中情境也往往能讓人神遊於現實之外。過往的課程內容，是否曾經點燃你對知識的熱情？打開課本時，不知能否如〈我們的課本〉所述，揭開知識想像的序幕。
    若能從不同角度切入課本，進入知識的想像，或許可以讓課本帶領我們經歷驚奇的旅程。請以「當我打開課本」為題，寫一篇文章，敘述任一學科課本對你的意義，書寫你探索課本內容、知識的經驗與體會。
文長至少600字。


","當我打開課本



我最喜歡的是生物課本，因為裡面有很多有趣的東西。每次打開課本，就可以看到很多細胞和生物的圖片，讓我覺得很新奇。



細胞是很小的東西，但是在課本裡面畫得很大，可以看得很清楚。裡面有細胞核和其他的東西，雖然我記不太清楚它們的名字。動物和植物都是由細胞組成的，植物會做光合作用，動物就會到處跑。人類是最厲害的動物，因為我們有聰明的大腦。



生物課本和我們的生活有關係，因為我們每天都在用身體。我們的身體裡面有很多器官，它們都會一起工作。有些人長大後會去當醫生或是藥劑師，這些工作都要用到生物知識。不過現在的生物科技很厲害，可以改變基因，這樣可能會有危險。



看完生物課本後，我覺得學到了很多東西。雖然有些地方不太懂，但是我知道人類要好好保護地球上的生物，這樣才能讓地球變得更好。",2,1,1,2,1,7
