題目,作答,立意,結構,修辭,敘述,啟發,總分
"二十一世紀資訊量以驚人的速度暴增，有人認為網路資訊易於取得，會使記憶力與思考力衰退，不利於認知學習；也有人視網際網路為人類的外接大腦記憶體，意味著我們毋須記憶大量知識，可以專注在更重要、更有創造力的事物上。對於以上兩種不同的觀點，你的看法為何？請以「網海浮沉之我思」為題，結合自己的相關經驗，探討創造力與思考力之間的關係。
文長至少600字。

","網海浮沉之我思



現在的網路發展很快，大家都在用網路找資料。有些人說網路會讓我們變笨，因為都不用記東西；有些人說網路很好，可以讓我們的腦袋記更重要的事情。



我從小就常常用網路，覺得網路對我的幫助很大。以前在國小的時候，我就已經開始用網路查資料了。我爸媽有教我要小心網路上的假消息，所以我都會先確認資料是不是真的。



我現在都用手機記事情，像是功課要交什麼，或是要去哪裡。這樣我就不用自己記，手機會提醒我。我覺得這樣很方便，可以讓我想別的事情。網路真的對我很重要，每天都要用到。



不過有時候我也會擔心，因為太依賴網路可能不太好。但是現在的生活已經離不開網路了，所以我們要學會怎麼好好使用網路，不要被網路控制了我們的生活才對。",2,2,1,2,1,8
