題目,作答,立意,結構,修辭,敘述,啟發,總分
"二十一世紀資訊量以驚人的速度暴增，有人認為網路資訊易於取得，會使記憶力與思考力衰退，不利於認知學習；也有人視網際網路為人類的外接大腦記憶體，意味著我們毋須記憶大量知識，可以專注在更重要、更有創造力的事物上。對於以上兩種不同的觀點，你的看法為何？請以「網海浮沉之我思」為題，結合自己的相關經驗，探討創造力與思考力之間的關係。
文長至少600字。

","網路海浮沉之我思



現在的人每天都在用網路，我也是其中一個。我覺得網路有好有壞，要看我們怎麼用。



我最常用網路是在玩遊戲的時候。玩遊戲可以認識很多朋友，大家一起討論怎麼玩比較好。有時候還可以跟外國人一起玩，這樣就可以練習英文。我覺得這樣很好，因為可以學到很多東西。



我也會用手機查功課。網路上有很多人在講解題目，但是有時候會看到不一樣的答案，這時候就要想一想哪個是對的。我覺得要自己想清楚，不能只是看別人怎麼說。



網路上的東西不一定都是對的，所以我們要小心一點。如果只是一直看網路，不自己想，那就不好了。我覺得要用網路，但是也要自己動腦。這樣才能學到東西，不會被騙。



所以我認為網路是好東西，但是要會用才行。不能一直玩手機，要記得自己想一想。這樣才不會被網路害到，反而可以學到更多東西。",2,1,2,2,1,8
