題目,作答,立意,結構,修辭,敘述,啟發,總分
"關於地球的記憶
被文字固禁在課本裡
我們的筆尖游走在山脈和海洋
翻譯每片花瓣的嬌嫩和露水的清新
所有的言語 答案
都靜放在我們的課本裡
等待我們翻起這一切的序幕（節錄自薛憶婷〈我們的課本〉）

    以上這首詩，從課本啟動天馬行空的遐想，瞥見知識豐富的樣貌。科學頑童費曼（Richard P. Feynman）曾說觀察轉動的餐盤，讓他得到很大的啟發，領略了興之所至的樂趣。物理課可讓我們發現萬物運行的迷人，生物課帶領我們進入細胞核遊歷，外語課讓我們聽見世界不同的文化。國文課堂上「採菊東籬下，悠然見南山」或「輕羅小扇撲流螢」，詩中情境也往往能讓人神遊於現實之外。過往的課程內容，是否曾經點燃你對知識的熱情？打開課本時，不知能否如〈我們的課本〉所述，揭開知識想像的序幕。
    若能從不同角度切入課本，進入知識的想像，或許可以讓課本帶領我們經歷驚奇的旅程。請以「當我打開課本」為題，寫一篇文章，敘述任一學科課本對你的意義，書寫你探索課本內容、知識的經驗與體會。
文長至少600字。


","當我打開課本



當我打開歷史課本的時候，裡面有很多歷史事件。有台灣的歷史，也有中國的歷史，還有世界的歷史。這些歷史事件都很重要，讓我們知道以前發生了什麼事。



歷史課本裡面記載了很多有名的人物。像是鄭成功打敗了荷蘭人，所以大家叫他國姓爺。還有唐太宗打了一場很重要的戰爭，大家就叫他天可汗。法國的拿破崙也是一個很厲害的人物，他帶領軍隊打敗了很多國家。



歷史課本也告訴我們一些不好的事情。像是台灣的白色恐怖和二二八事件，讓很多人受苦。中國也有大躍進和文化大革命，這些都是很糟糕的政策。還有世界大戰，死了很多人，這些都是我們要記住的教訓。



我覺得讀歷史課本很有趣，可以知道很多以前的事情。雖然有時候很難記住這麼多內容，但是這些歷史可以讓我們學到很多東西。我們要記住這些歷史，不要重複以前的錯誤。",2,2,1,2,1,8
