題目,作答,立意,結構,修辭,敘述,啟發,總分
"林語堂說：「（我）所愛的不是晚秋，是初秋，那時暄氣初消，月正圓，蟹正肥，桂花皎潔，也未陷入懍烈蕭瑟氣態，這是最值得賞樂的。」楊牧則是在美麗的春天世界裡，萬物復甦，卻聽到「一片樹葉提早轉黃的聲音。」（〈夭〉）普魯斯特（Proust, M.）在《追憶逝水年華》中說：「一小時不僅僅是一個小時，它是一只充滿香氣、聲響、念頭和氛圍的花缽」，說明時間的認知與感官知覺及感受有關。請以「季節的感思」為題，寫一篇文章，描寫你對季節的感知經驗，並抒發心中的感受與領會。
文長至少600字。

","季節的感思



每年都有春夏秋冬四個季節，每個季節都有不同的特色。春天有花開，夏天很熱，秋天會掉葉子，冬天會下雪。我最喜歡的是秋天，因為秋天會讓我想很多事情。



秋天的時候風會變冷，蟬也不叫了，樹葉會變黃掉下來。這時候我就會想到以前的事情，想想自己過去一年做了什麼。我現在已經高中三年級了，想到國中的時候好像很久以前的事，時間過得真快。



秋天讓人覺得很憂愁，因為看到樹葉掉光光的樣子，會讓人感覺很孤單。不過秋天還是有好看的東西，像是菊花和楓葉，它們在冷天裡面還是很漂亮。每次看到這些，我就不會那麼難過了。



雖然時間一直在過去，我們沒有辦法讓它停下來，但是我們還是要努力往前走，不要讓自己後悔。秋天雖然冷冷的，但是也教會我要勇敢面對未來。",1,1,1,1,1,5
