題目,作答,立意,結構,修辭,敘述,啟發,總分
"    我覺得童年是一種氣味的記憶。
    我的童年，有許多果樹氣味的記憶。夏天暑熱的午後，廟埕後有一棵巨大的龍眼樹。我從小學翻牆出來，背著書包，爬上龍眼樹，躲在密密的枝葉裡。外面日光葉影搖晃，隱約聽見老師或母親尋來，在樹下叫著我的名字，但那呼喚的聲音，被蟬聲的高音淹沒了。我一動不動，找到一處適合蜷窩身體的枝椏，好像變成樹的一部分，而那時，龍眼樹密密的甜熟的氣味就包圍著我。我閉起眼睛，好像在假寐，也像在作夢，夢裡一串一串纍纍的龍眼，招來許多蜜蜂果蠅。我童年的夢，很甜很香，好像一整個夏天都窩在那棵樹上，包圍在濃郁的氣味裡做了一個醒不來的夢。（改寫自蔣勳《給青年藝術家的信》）
    生活中充斥各種氣味。氣味透過嗅覺傳遞，喚起人們的記憶和感受，一如文中龍眼樹甜熟的氣味喚起作者的童年記憶。請以「花草樹木的氣味記憶」為題，寫一篇文章，書寫你熟悉的花草樹木的氣味，及其所召喚的記憶和感受。

文長至少600字。

","花草樹木的氣味記憶



每當走在路上，我總會被路邊的花草樹木吸引。其中最讓我印象深刻的是玉蘭花的香氣。那是一種清淡的香味，常常在春天的時候飄散在街道上。



我記得小時候常看到有人在路邊賣玉蘭花，一串串米白色的花朵掛在攤子上。每次經過都會忍不住多看幾眼，因為它們不只好看，聞起來還有淡淡的香氣。



玉蘭花除了好看和香氣宜人之外，據說還有很多功效。有人說它可以清肝解毒，也可以用來治療感冒和流鼻水。不過我對這些不太了解，只知道每次聞到玉蘭花的香氣，心情就會變得很好。



可惜的是，玉蘭花的花期很短，沒多久就會凋謝。但這種短暫的美麗，反而讓人更加珍惜它存在的時刻。",1,1,1,1,1,5
