題目,作答,立意,結構,修辭,敘述,啟發,總分
"林語堂說：「（我）所愛的不是晚秋，是初秋，那時暄氣初消，月正圓，蟹正肥，桂花皎潔，也未陷入懍烈蕭瑟氣態，這是最值得賞樂的。」楊牧則是在美麗的春天世界裡，萬物復甦，卻聽到「一片樹葉提早轉黃的聲音。」（〈夭〉）普魯斯特（Proust, M.）在《追憶逝水年華》中說：「一小時不僅僅是一個小時，它是一只充滿香氣、聲響、念頭和氛圍的花缽」，說明時間的認知與感官知覺及感受有關。請以「季節的感思」為題，寫一篇文章，描寫你對季節的感知經驗，並抒發心中的感受與領會。
文長至少600字。

","季節的感思



每年都有春夏秋冬四個季節，每個季節都有不一樣的感覺。春天有花開，夏天很熱，秋天涼涼的，冬天很冷。每個人喜歡的季節都不一樣，有人喜歡夏天，有人喜歡冬天。



我最喜歡的季節是秋天，因為秋天的天氣不會太熱也不會太冷，風吹起來很舒服。夏天太熱了，一直流汗很不舒服，冬天又太冷了，會一直發抖。所以我覺得秋天最好。



秋天有中秋節，可以跟家人一起烤肉，很開心。走在路上都可以聞到烤肉的香味，市場也會賣很多中秋節要用的東西。跟家人一起烤肉的時候可以聊天，一起吃柚子，一起玩，感覺很好。



我很喜歡秋天，每年都很期待秋天的到來。因為秋天的天氣很舒服，又可以跟家人一起烤肉，所以我覺得秋天是最棒的季節。",2,1,1,2,1,7
