題目,作答,立意,結構,修辭,敘述,啟發,總分
"自從有了電腦、智慧型手機及網路搜尋引擎之後，資訊科技的發展改變了人類大腦處理資訊的方式。我們可能儲存了大量的資訊，卻來不及閱讀，也不再費力記憶周遭事物和相關知識，因為只要輕鬆點一下滑鼠、滑一下手機，資訊就傳到我們面前。
二十一世紀資訊量以驚人的速度暴增，有人認為網路資訊易於取得，會使記憶力與思考力衰退，不利於認知學習；也有人視網際網路為人類的外接大腦記憶體，意味著我們無須記憶大量知識，而可以專注在更重要、更有創造力的事物上。對於以上兩種不同的觀點，請提出你個人的看法。文長600字以上。
","現在的人都離不開網路，每天都在滑手機查資料。我覺得這樣不太好，因為人應該要多用腦想事情，不能都靠網路。



網路雖然可以讓我們找到很多東西，但是我覺得還是要自己記東西比較好。像我以前讀書的時候都會自己記筆記，成績就很好。現在的人都只會用手機，什麼都不記，上課也不認真聽，都在玩手機，這樣很浪費時間。



網路也不是說都是好的，因為網路上有很多假的資料。而且網路會讓人變笨，因為大家都不想要思考，看到什麼都直接相信。我認為人還是要自己動腦想，不能都靠網路。



很多人說網路很好用，可以讓我們不用記那麼多東西。但是我覺得這樣不行，因為如果都沒有記憶，人的大腦就會變成空的，什麼都不會。而且網路有時候會壞掉，如果那時候找不到資料怎麼辦？



所以我覺得大家應該要少用一點網路，多用腦袋想事情。網路只是一個工具，不能變成我們的大腦。我們要記住，人比網路還要厲害！",2,1,1,2,1,7
