題目,作答,立意,結構,修辭,敘述,啟發,總分
"關於地球的記憶
被文字固禁在課本裡
我們的筆尖游走在山脈和海洋
翻譯每片花瓣的嬌嫩和露水的清新
所有的言語 答案
都靜放在我們的課本裡
等待我們翻起這一切的序幕（節錄自薛憶婷〈我們的課本〉）

    以上這首詩，從課本啟動天馬行空的遐想，瞥見知識豐富的樣貌。科學頑童費曼（Richard P. Feynman）曾說觀察轉動的餐盤，讓他得到很大的啟發，領略了興之所至的樂趣。物理課可讓我們發現萬物運行的迷人，生物課帶領我們進入細胞核遊歷，外語課讓我們聽見世界不同的文化。國文課堂上「採菊東籬下，悠然見南山」或「輕羅小扇撲流螢」，詩中情境也往往能讓人神遊於現實之外。過往的課程內容，是否曾經點燃你對知識的熱情？打開課本時，不知能否如〈我們的課本〉所述，揭開知識想像的序幕。
    若能從不同角度切入課本，進入知識的想像，或許可以讓課本帶領我們經歷驚奇的旅程。請以「當我打開課本」為題，寫一篇文章，敘述任一學科課本對你的意義，書寫你探索課本內容、知識的經驗與體會。
文長至少600字。


","當我打開課本



每天上學都要帶著沉重的書包，裡面裝著各種科目的課本。我最喜歡的是國文課本，因為裡面有很多有趣的故事和詩詞。



記得有一次上課時，老師要我們讀一篇關於春天的課文。我打開課本，看到裡面寫著小草發芽、花朵開放的景象。雖然我坐在教室裡，但是透過文字的描寫，好像真的看到了美麗的春天景色。



不過有些課本內容很難懂，特別是數學和自然科學的部分。每次打開這些課本，看到密密麻麻的公式和圖表，就會覺得很頭痛。即使老師講解得很仔細，我還是常常聽不懂。



我覺得課本就像一本知識的書，裡面有很多東西要學習。雖然有時候會遇到不懂的地方，但是只要多看幾遍，或是請教老師和同學，總是可以慢慢理解的。



希望以後我可以更認真地讀書，把課本裡的知識都學起來，這樣才不會辜負老師的教導。",1,1,1,1,1,5
