題目,作答,立意,結構,修辭,敘述,啟發,總分
"二十一世紀資訊量以驚人的速度暴增，有人認為網路資訊易於取得，會使記憶力與思考力衰退，不利於認知學習；也有人視網際網路為人類的外接大腦記憶體，意味著我們毋須記憶大量知識，可以專注在更重要、更有創造力的事物上。對於以上兩種不同的觀點，你的看法為何？請以「網海浮沉之我思」為題，結合自己的相關經驗，探討創造力與思考力之間的關係。
文長至少600字。

","網海浮沉之我思



現在的人都會用網路，每天都在用手機和電腦。大家都把網路當成生活中很重要的一部分，不管是聊天還是玩遊戲都需要用到網路。



現在的資訊很多，每個人都有手機，想要找什麼資料都很方便。只要上網搜尋幾秒鐘，就可以看到很多文章和資料。不用特地跑到圖書館或是出國，在家裡就可以學到很多東西，對想學習的人來說很方便。



但是有些人說網路不好，會讓學生不想認真讀書。他們覺得網路讓人變懶惰，都不願意動腦思考。我覺得這些說法也有道理，因為現在的學生都喜歡直接查答案，不會自己想。



我自己也常常用網路，但是有時候會看到一些錯誤的資訊。所以我覺得用網路要小心，不能相信所有看到的東西。網路雖然方便，但是還是要靠自己的大腦去思考和判斷。",1,1,1,1,1,5
