題目,作答,立意,結構,修辭,敘述,啟發,總分
"    看到山上那麼多參天大樹時，會勾起我的惻隱之心。在無法順暢呼吸的空間裡，樹木之間為了生存必須展開激烈的競爭。為了能多接受一些陽光，它們只能拼命向上生長。
但是，只為生存而競爭的森林卻漸次死亡，因為陽光無法到達地面，所以溫度不夠高，無法讓幼小的生命萌芽。小樹和花、草，以及與它們一起生活的小昆蟲沒有生存的空間。雖然表面上看起來非常完美，但這種森林其實與沒有希望的不孕之地無異。
根據我的經驗，密集栽種的樹苗體型壯大數十倍時，就需要開始砍樹，否則樹木會抱怨空間太窄，活不下去。要想確保樹木能充分接受陽光照射的空間，就必須做出犧牲。因此，幾年期間強行進行砍伐，樹木間距剛開始時是一公尺，現已擴大到七公尺。也就是說，即使是粗略估算，也可知七棵樹中有六棵為之消失。
森林要想成為孕育新生命的希望之地，就需要有縫隙。如果樹木壽命結束或因為意外災害而倒下，該位置就會產生空間，那麼，溫暖的陽光就會照射進來，被陽光照射的地面混雜著前一年秋天凋落的樹葉，於是積聚起能夠孕育新生命的養分。因此，樹木的縫隙，既是結束和開始共存的空間，也是由缺乏轉化為希望的空間。（改寫自禹鐘榮著、盧鴻金譯《樹木教我的人生課》）
    根據上文所述，為什麼森林需要縫隙？由此聯想，人生是否也需要縫隙？請以「縫隙的聯想」為題，寫一篇文章，結合生活經驗或見聞，書寫你的感思與體悟。
文長至少600字。


","縫隙的聯想



現在的人每天都很忙，要做很多事情，好像沒有休息的時間。我覺得我們應該要學習森林裡的樹木，給自己一些空間。



森林裡的樹木很多，有大樹也有小草。大樹長得很高，但是陽光還是可以照到下面的小草，因為樹葉中間有縫隙。這樣每個植物都可以好好的生長，讓森林看起來很漂亮。



我們的生活也需要縫隙。工作很累的時候，可以聽音樂或是做自己喜歡的事情。這樣可以讓自己的心情變好，不會那麼累。就像森林裡的陽光一樣，可以讓我們的生活變得更好。



有些人很會安排時間，知道什麼時候要休息。但是有些人整天都在忙，都不知道要休息。我覺得只要開始注意這個問題，慢慢改變，生活就會變得更好。就像森林一樣，經過很久的時間才變得這麼美麗。



所以我們要記得給自己一些空間，不要一直忙碌。這樣才能讓自己的生活變得更好。",2,1,1,2,1,7
