題目,作答,立意,結構,修辭,敘述,啟發,總分
"二十一世紀資訊量以驚人的速度暴增，有人認為網路資訊易於取得，會使記憶力與思考力衰退，不利於認知學習；也有人視網際網路為人類的外接大腦記憶體，意味著我們毋須記憶大量知識，可以專注在更重要、更有創造力的事物上。對於以上兩種不同的觀點，你的看法為何？請以「網海浮沉之我思」為題，結合自己的相關經驗，探討創造力與思考力之間的關係。
文長至少600字。

","網海浮沉之我思



現在的網路真的很方便，大家都在用手機和電腦上網。以前要找資料要去圖書館，現在只要打幾個字就可以找到想要的東西，這樣很快又方便。



不過網路上的資料也不是都對的。有時候會看到假新聞，因為很多人喜歡亂寫東西，把自己的想法加進去，變成不太正確的資訊。這樣其他人看到就會被騙，所以我們要小心一點。



我覺得網路還是有好處的，因為可以讓我們學到很多東西。像是看YouTube的教學影片，或是找一些電子書來看，這樣就可以學到新知識。以前只能靠自己想，現在可以參考別人的想法，這樣比較好。



網路雖然方便，但是我們還是要記得要自己思考。不能什麼都相信網路上的東西，要學會分辨對錯。而且不能一直玩手機，要適當使用網路才是對的。



總之，網路帶給我們很多方便，讓我們可以很容易找到資料。但是我們要記得要謹慎使用，不要被假消息騙到，這樣才是聰明的網路使用者。",2,1,1,2,1,7
