題目,作答,立意,結構,修辭,敘述,啟發,總分
"    我覺得童年是一種氣味的記憶。
    我的童年，有許多果樹氣味的記憶。夏天暑熱的午後，廟埕後有一棵巨大的龍眼樹。我從小學翻牆出來，背著書包，爬上龍眼樹，躲在密密的枝葉裡。外面日光葉影搖晃，隱約聽見老師或母親尋來，在樹下叫著我的名字，但那呼喚的聲音，被蟬聲的高音淹沒了。我一動不動，找到一處適合蜷窩身體的枝椏，好像變成樹的一部分，而那時，龍眼樹密密的甜熟的氣味就包圍著我。我閉起眼睛，好像在假寐，也像在作夢，夢裡一串一串纍纍的龍眼，招來許多蜜蜂果蠅。我童年的夢，很甜很香，好像一整個夏天都窩在那棵樹上，包圍在濃郁的氣味裡做了一個醒不來的夢。（改寫自蔣勳《給青年藝術家的信》）
    生活中充斥各種氣味。氣味透過嗅覺傳遞，喚起人們的記憶和感受，一如文中龍眼樹甜熟的氣味喚起作者的童年記憶。請以「花草樹木的氣味記憶」為題，寫一篇文章，書寫你熟悉的花草樹木的氣味，及其所召喚的記憶和感受。

文長至少600字。

","花草樹木的氣味記憶



每次聞到玉蘭花的香味，我就會想起爺爺。以前我家後院有一棵玉蘭樹，開花的時候香味很濃。爺爺最喜歡在樹下喝茶下棋，常常叫我陪他玩。



我記得那時候，爺爺總是坐在老藤椅上，泡著高山茶。茶香和玉蘭花香混在一起，聞起來很舒服。我跟爺爺下棋的時候總是輸，因為他從來不讓我。我問他為什麼不讓我贏，他就說人生不會有人一直讓著你。



爺爺還常常跟我說一些人生的道理，像是說親情在利益面前不值錢。那時候我不懂他為什麼這樣說，覺得他好像很傷心的樣子。



後來爺爺過世了，親戚們為了遺產的事情吵得很難看。我才知道爺爺說的話是對的。現在每次聞到玉蘭花香，我就會想起爺爺和他教我的事情。雖然很難過，但這些記憶和氣味我永遠都不會忘記。",2,2,1,2,1,8
