題目,作答,立意,結構,修辭,敘述,啟發,總分
"    我覺得童年是一種氣味的記憶。
    我的童年，有許多果樹氣味的記憶。夏天暑熱的午後，廟埕後有一棵巨大的龍眼樹。我從小學翻牆出來，背著書包，爬上龍眼樹，躲在密密的枝葉裡。外面日光葉影搖晃，隱約聽見老師或母親尋來，在樹下叫著我的名字，但那呼喚的聲音，被蟬聲的高音淹沒了。我一動不動，找到一處適合蜷窩身體的枝椏，好像變成樹的一部分，而那時，龍眼樹密密的甜熟的氣味就包圍著我。我閉起眼睛，好像在假寐，也像在作夢，夢裡一串一串纍纍的龍眼，招來許多蜜蜂果蠅。我童年的夢，很甜很香，好像一整個夏天都窩在那棵樹上，包圍在濃郁的氣味裡做了一個醒不來的夢。（改寫自蔣勳《給青年藝術家的信》）
    生活中充斥各種氣味。氣味透過嗅覺傳遞，喚起人們的記憶和感受，一如文中龍眼樹甜熟的氣味喚起作者的童年記憶。請以「花草樹木的氣味記憶」為題，寫一篇文章，書寫你熟悉的花草樹木的氣味，及其所召喚的記憶和感受。

文長至少600字。

","花草樹木的氣味記憶



在生命的長河中，某些氣味總能喚醒沉睡的記憶，如同打開了時光的寶盒，讓過往的點滴重現眼前。對我而言，最珍貴的氣味記憶，來自那些與至親共度的採果時光，每一縷果香都蘊含著濃濃的親情。



仲夏將盡，孟秋未至的時節，園中的火龍果藤蔓正值豐收。祖母是公司園林的守護者，每到這個季節，我總愛跟著她穿梭在綠意盎然的園區中。火龍果藤上的尖刺雖然銳利，卻擋不住我們採摘的熱情。記得第一次誤闖果園時，一股清雅的果香撲面而來，那是火龍果花開時獨有的馨香，彷彿是大自然在夏末獻上的一曲優雅樂章。每當果實成熟，空氣中便瀰漫著甜美的芬芳，引來蝶舞蜂鳴，為這片園地增添了幾分生機。



而在初秋時分，另一種果香則牽引著我和外婆的回憶。在那些微風輕拂的午後，我們總會默契地帶著長剪和撈網，悄悄前往鄰家的木瓜園。外婆雖出身千金，卻因緣際會步入不如意的婚姻。但在她晚年的歲月裡，最快樂的時光莫過於和我一同重溫她年少時的趣事。每當木瓜落入網中，那清新的果香便在空氣中蕩漾，為我們的祖孫情誼譜寫出最動人的樂章。



隨著年歲漸長，我才明白這些香甜的記憶背後，藏著長輩們無聲的付出。那些火龍果是祖母辛勤工作的獎勵，每一顆都飽含她的汗水與驕傲；而外婆偷摘木瓜的遊戲，其實早已暗中與果農達成協議，只為給我一個天真快樂的童年。原來，那些果實之所以特別香甜，是因為摻雜了親情的芬芳。



如今，每當我漫步果園，嗅聞那熟悉的果香，總會想起祖母園丁服上的汗漬，和外婆眼角綻放的笑紋。這些氣味不僅是童年的印記，更是生命中最珍貴的情感見證，永遠縈繞在我的記憶深處，芬芳不散。",5,5,4,4,5,23
