題目,作答,立意,結構,修辭,敘述,啟發,總分
"林語堂說：「（我）所愛的不是晚秋，是初秋，那時暄氣初消，月正圓，蟹正肥，桂花皎潔，也未陷入懍烈蕭瑟氣態，這是最值得賞樂的。」楊牧則是在美麗的春天世界裡，萬物復甦，卻聽到「一片樹葉提早轉黃的聲音。」（〈夭〉）普魯斯特（Proust, M.）在《追憶逝水年華》中說：「一小時不僅僅是一個小時，它是一只充滿香氣、聲響、念頭和氛圍的花缽」，說明時間的認知與感官知覺及感受有關。請以「季節的感思」為題，寫一篇文章，描寫你對季節的感知經驗，並抒發心中的感受與領會。
文長至少600字。

","季節的感思



我覺得四季都有不同的感覺，每個季節都讓我有不同的想法。春天的時候，天氣開始變暖，可以看到很多花開，讓人心情很好。我最喜歡春天，因為不會太熱也不會太冷，很舒服。



夏天就很熱，每天都要開冷氣，但是可以去游泳和吃冰，所以也還不錯。夏天的時候天氣很好，可以去玩很多戶外活動，雖然會流很多汗，但是很開心。



秋天的時候，天氣開始變涼了，樹葉也開始變黃掉下來。我覺得秋天有點傷心，因為看到樹葉掉下來，感覺很孤單。但是秋天的天氣很舒服，可以去散步。



冬天很冷，我不太喜歡冬天，因為要穿很多衣服很麻煩。而且冬天天黑得很早，感覺一天過得很快。不過冬天可以吃火鍋，這是很開心的事。



我覺得每個季節都有好有壞，就像人生一樣，有開心的時候也有不開心的時候。我們要學會在不同的季節找到快樂，這樣生活才會過得好。",2,1,1,2,1,7
