題目,作答,立意,結構,修辭,敘述,啟發,總分
"    看到山上那麼多參天大樹時，會勾起我的惻隱之心。在無法順暢呼吸的空間裡，樹木之間為了生存必須展開激烈的競爭。為了能多接受一些陽光，它們只能拼命向上生長。
但是，只為生存而競爭的森林卻漸次死亡，因為陽光無法到達地面，所以溫度不夠高，無法讓幼小的生命萌芽。小樹和花、草，以及與它們一起生活的小昆蟲沒有生存的空間。雖然表面上看起來非常完美，但這種森林其實與沒有希望的不孕之地無異。
根據我的經驗，密集栽種的樹苗體型壯大數十倍時，就需要開始砍樹，否則樹木會抱怨空間太窄，活不下去。要想確保樹木能充分接受陽光照射的空間，就必須做出犧牲。因此，幾年期間強行進行砍伐，樹木間距剛開始時是一公尺，現已擴大到七公尺。也就是說，即使是粗略估算，也可知七棵樹中有六棵為之消失。
森林要想成為孕育新生命的希望之地，就需要有縫隙。如果樹木壽命結束或因為意外災害而倒下，該位置就會產生空間，那麼，溫暖的陽光就會照射進來，被陽光照射的地面混雜著前一年秋天凋落的樹葉，於是積聚起能夠孕育新生命的養分。因此，樹木的縫隙，既是結束和開始共存的空間，也是由缺乏轉化為希望的空間。（改寫自禹鐘榮著、盧鴻金譯《樹木教我的人生課》）
    根據上文所述，為什麼森林需要縫隙？由此聯想，人生是否也需要縫隙？請以「縫隙的聯想」為題，寫一篇文章，結合生活經驗或見聞，書寫你的感思與體悟。
文長至少600字。


","縫隙的聯想



森林裡面的樹木長得太密集的話，陽光照不到地面，小樹苗就長不大，昆蟲也沒有地方住，整個森林就會慢慢死掉。所以樹木之間要有空隙，這樣陽光才能照進來，讓生物可以好好生長。



人跟人之間也是這樣。如果跟別人太親近，自己的秘密就會被說出去。我以前跟同學很要好，什麼事情都會跟他們說。有一天下雨的時候，我發現全班同學都在討論我的私事，感覺很難過。那時候我才知道，原來不是每件事情都可以跟別人分享。



現在世界上的人越來越多，如果大家都太靠近，就會讓人感覺很不舒服。就像樹木一樣，人跟人之間也需要一些距離，這樣才能保護自己的隱私，不會被別人知道太多事情。所以我覺得人跟人之間要保持一些距離比較好。",1,1,1,1,1,5
