題目,作答,立意,結構,修辭,敘述,啟發,總分
"甲
生活中，人們習慣使用「標籤」將複雜的事物簡化、分類，再附上標記。然而，有時我們也將「標籤」使用在人的身上。哲學家叔本華說：「人們都從一個人所擁有的職位、從事的生意、隸屬的民族和家庭—亦即總體上從世俗常規所給予此人的角色和位置判斷他。所以，一個人就像商品一樣地被貼上標籤，並受到商品式的對待。至於根據其個人素質，這個人本身是個什麼樣的人，人們只是依自己的需要隨意地提及，亦即在大多數時候被擱置一邊，或者視而不見。」
人們或傳播媒體貼的標籤，有時會形成「刻板印象」，其中真假對錯值得深思。例如稱某個世代為「草莓族」，提到南美洲就想到「這些民族很會踢足球」。
乙
社會學家貝克指出：「人們一旦被貼上某種標籤，就會成為標籤所標定的人。」標籤對人的個性意識、自我認同有強烈的影響，因此當人被一種詞語或名稱貼上標籤時，他可能會往標籤所喻示的方向發展。許多企業因而賦予員工職稱正向的標籤，以放大標籤的力量。例如，蘋果（Apple）直營零售店中，為顧客的產品進行故障診斷的工程師，職稱是「Genius（天才）」，這個職稱間接鼓勵員工不斷了解最新技術知識，以提供顧客更好建議和技術支持。星巴克（Starbucks）店員則有「咖啡大師」、「咖啡大使」等名稱識別，象徵其所擁有的咖啡知識與對其專業服務的肯定。
你我也可以為自己貼上標籤，定義對自己的期待，並調整行為以符應標籤的內容，讓他人留下深刻印象，以擁有更多展現個人價值的機會。

    日常生活中不乏「貼標籤」或「被貼標籤」的實例，請以「貼標籤」為題，寫一篇文章，並融入上文「標籤」於人身上的正面與負面作用，並舉例闡述你對標籤現象的看法。
文長至少600字。


","貼標籤



在這個資訊爆炸的時代，「標籤」儼然成為人們簡化複雜社會關係的工具。然而，這把雙面刃究竟為人際互動帶來助力還是阻力？這個問題值得我們深入探討。



標籤的力量往往出乎意料。它就像一面魔鏡，既能照見人性光明的一面，也能映照出陰暗的角落。以我的觀察，標籤既可能是束縛，也可能成為激勵成長的動力。關鍵在於，我們如何看待及運用這些標籤。



在教育現場，標籤的正向力量特別明顯。我曾經觀察到一位原本缺乏自信的同學，因為老師賦予她「班長」的身分，逐漸蛻變成一位富有責任感和領導力的人。這個標籤不僅成為她的目標，更轉化為自我實現的動力。這讓我深刻體會到，恰當的標籤確實能激發人的潛能，引導積極的行為改變。



然而，標籤也可能成為緊箍咒。媒體常常為特定族群貼上「草莓族」、「啃老族」等標籤，這些籠統的歸類不僅忽視了個體的差異性，更可能形成負面的刻板印象。更糟的是，一旦這些標籤根深蒂固，當事者可能會不自覺地往這個方向發展，形成自我應驗的預言。



因此，面對標籤，我們需要培養更細緻的辨識能力。首先，要認知到標籤只是表象，而非本質；其次，要學會分辨標籤背後的動機與影響；最後，在使用標籤時，更要謹慎考量其可能帶來的後果。



標籤就像一把鑰匙，使用得當可以開啟成長的大門，使用不當則可能鎖死發展的可能。在這個標籤紛飛的時代，與其被動接受他人的定義，不如主動思考如何善用標籤的力量，讓它成為激勵自我提升的動力，而非限制個人發展的枷鎖。",4,4,4,4,4,20
