題目,作答,立意,結構,修辭,敘述,啟發,總分
"    記憶可以被編輯或刪除嗎？2004年美國電影《王牌冤家》（Eternal Sunshine of the Spotless Mind），敘述一對怨偶在一次激烈的爭吵後，先後踏入提供記憶刪除服務的「忘情診所」，主動要求洗去記憶。女主角成功地洗去兩人的戀愛記憶，男主角則在記憶清掃的過程中，因為看見舊日時光的美好，想保留一切甜蜜與悲傷的記憶，而開始和電腦清除系統搏鬥。2017年，臺灣導演陳玉勳將自己的短片〈海馬洗頭〉改為長片《健忘村》。〈海馬洗頭〉的創意發想，來自於「人的記憶都存在大腦的海馬迴裡」，電影中因此有「海馬洗頭店」，專職幫人洗去記憶。《健忘村》則有一件寶物「忘憂神器」，可以清除記憶。村長為了一己私利，引誘村人「忘憂」，刪除村人的部分記憶。
    電影裡的想像也許有一天會發生。2019年澳洲皇家墨爾本理工大學的研究團隊，利用「光遺傳學」技術影響海馬迴，開發類腦晶片，可模仿大腦儲存和刪除訊息的方式，能精準刪除老鼠腦中特定的記憶。這項科技將有望應用於心理創傷者、藥物成癮者的治療，清除其長時間的負面與病理性記憶。此外，也有政治哲學教授諾齊克提出「經驗機器」思想實驗：假設有一臺機器可以提供所有想要的幸福經驗，甚至可以定期修改，無論是領袖群倫、環遊世界……，使用者想要的「幸福人生」，都可以事先設定。面對這樣的機器，人類將如何抉擇？
假設「經驗機器」存在並且運作穩定，可以讓人享受虛擬的「幸福人生」，你認為將對人類產生什麼影響？權衡利弊，你會支持開放這樣的機器上市嗎？請以「編織記憶：幸福可以被設定！？」為題，運用文中相關資訊，並結合經驗與見聞，闡明自己的意見。
文長至少600字。

","記憶是不是可以改變呢？我覺得這個問題很難回答。像電影裡面那樣可以刪除記憶，聽起來很厲害，但是我覺得不太好。



我自己以前有一些不好的經驗，那時候我很喜歡畫畫，大家都說我畫得很好。後來我發現其實我沒有那麼厲害，因為有很多人比我畫得更好。那時候我很難過，但是我後來很努力學習，結果在比賽得到第一名。



如果可以改變記憶，讓人永遠都很開心，那不就不會進步了嗎？就像我如果一直覺得自己很厲害，就不會想要學習了。所以我覺得不好的記憶也是很重要的。



那個經驗機器雖然可以讓人很快樂，但是我覺得這樣不太好。因為這樣的快樂不是真的，而且可能會讓人變得很懶惰。不過如果是用來幫助生病的人，那可能還可以。



所以我覺得這種機器還是不要隨便用比較好，要有規定才行。不然的話，可能會發生很多問題。",2,1,1,2,1,7
