題目,作答,立意,結構,修辭,敘述,啟發,總分
"甲
(陶潛)為彭澤令。不以家累自隨，送一力給其子，書曰：「汝旦夕之費，自給為難。今遣此力，助汝薪水（打柴汲水）之勞。此亦人子也，可善遇之。」(《南史．隱逸．陶潛傳》)
乙
飯後，眾人各自有事離去，留下貞觀靜坐桌前獃想。她今日的這番感慨，實是前未曾有的。
阿啟伯摘瓜，乃她親眼所見。今早，她突發奇想，陪著外公去巡魚塭，回來時，祖孫二人，都在門口停住了，因為後門虛掩，阿啟伯拿著菜刀，正在棚下摘瓜，並未發覺他們，祖孫二個都閃到門背後。貞觀當時是真愣住了，在那種情況下，是前進呢？抑是後退？她不能很快作選擇。然而這種遲疑也只有幾秒鐘，她一下就被外公拉到門後，正是屏息靜氣時，老人家又帶了她拐出小巷口，走到前街來。
貞觀人到了大路上，心下才逐漸明白：外公躲那人的心，竟比那偷瓜的人所做的遮遮掩掩更甚！貞觀以為懂得了外公的心意：他怕阿啟伯當下撞見自己的那種難堪。事實上，他還有另一層深意，貪當然不好，而貧的本身沒有錯。外公不以阿啟伯為不是，是知道他家中十口，有菜就沒飯，有飯就沒菜。(改寫自蕭麗紅《千江有水千江月》)
陶潛或者外公對他人的善意，你可能也曾見聞或經歷過，請以「溫暖的心」為題，寫一篇文章，分享你的經驗及體會。
文長至少600字。

","溫暖的心



冬天來了，天氣變得很冷，大家都穿很多衣服。我要去台北，在路上看到很多遊民，他們都在乞討。我看到他們的時候都不知道要不要給錢，最後都沒有給，就這樣坐火車去台北了。



在火車上我一直在想遊民的事情，想說他們為什麼會變成這樣。到了台北車站，遊民更多了。我走到一個巷子，看到很多遊民在排隊，原來是一個阿婆在發熱食給他們吃。阿婆雖然很老了，但是還是很熱心的幫助別人。



晚上回到桃園的時候，我看到早上那個遊民還在那裡。這次我把身上的零錢都給他了，希望可以幫助他過冬天。我覺得我們應該要幫助需要幫助的人，這樣社會才會變得更好。



我們每個人都應該要學習阿婆那樣有愛心，不要只想著自己。雖然我們不能幫助所有人，但是能幫一個是一個。希望大家都可以多關心別人，讓這個世界變得更溫暖。",2,1,1,2,1,7
