題目,作答,立意,結構,修辭,敘述,啟發,總分
"甲
(陶潛)為彭澤令。不以家累自隨，送一力給其子，書曰：「汝旦夕之費，自給為難。今遣此力，助汝薪水（打柴汲水）之勞。此亦人子也，可善遇之。」(《南史．隱逸．陶潛傳》)
乙
飯後，眾人各自有事離去，留下貞觀靜坐桌前獃想。她今日的這番感慨，實是前未曾有的。
阿啟伯摘瓜，乃她親眼所見。今早，她突發奇想，陪著外公去巡魚塭，回來時，祖孫二人，都在門口停住了，因為後門虛掩，阿啟伯拿著菜刀，正在棚下摘瓜，並未發覺他們，祖孫二個都閃到門背後。貞觀當時是真愣住了，在那種情況下，是前進呢？抑是後退？她不能很快作選擇。然而這種遲疑也只有幾秒鐘，她一下就被外公拉到門後，正是屏息靜氣時，老人家又帶了她拐出小巷口，走到前街來。
貞觀人到了大路上，心下才逐漸明白：外公躲那人的心，竟比那偷瓜的人所做的遮遮掩掩更甚！貞觀以為懂得了外公的心意：他怕阿啟伯當下撞見自己的那種難堪。事實上，他還有另一層深意，貪當然不好，而貧的本身沒有錯。外公不以阿啟伯為不是，是知道他家中十口，有菜就沒飯，有飯就沒菜。(改寫自蕭麗紅《千江有水千江月》)
陶潛或者外公對他人的善意，你可能也曾見聞或經歷過，請以「溫暖的心」為題，寫一篇文章，分享你的經驗及體會。
文長至少600字。

","溫暖的心



我想跟大家分享一個我跑步的故事。那時候我在準備比賽，要減重十公斤，所以每天都要去跑步。



我穿著黑色的減重衣去跑步，每次都在附近的檳榔園跑。跑步的時候，遇到很多人都會跟我打招呼。有阿公阿婆在樹下乘涼，看到我就會說加油。開車的大哥也會讓我先過，還會按喇叭。有時候也會遇到其他跑步的人，他們都很厲害，跑得很快。



雖然我最後比賽輸了，但是我覺得很開心，因為認識了很多人。他們都對我很好，讓我感受到人情味。我覺得這樣的暑假過得很有意義，雖然比賽輸了，但是學到很多東西。



我覺得人與人之間的關心很重要，就算是不認識的人，一個簡單的加油也可以讓人很感動。這就是溫暖的心吧！希望以後我也可以像他們一樣，多關心別人。",2,1,1,2,1,7
