題目,作答,立意,結構,修辭,敘述,啟發,總分
"林語堂說：「（我）所愛的不是晚秋，是初秋，那時暄氣初消，月正圓，蟹正肥，桂花皎潔，也未陷入懍烈蕭瑟氣態，這是最值得賞樂的。」楊牧則是在美麗的春天世界裡，萬物復甦，卻聽到「一片樹葉提早轉黃的聲音。」（〈夭〉）普魯斯特（Proust, M.）在《追憶逝水年華》中說：「一小時不僅僅是一個小時，它是一只充滿香氣、聲響、念頭和氛圍的花缽」，說明時間的認知與感官知覺及感受有關。請以「季節的感思」為題，寫一篇文章，描寫你對季節的感知經驗，並抒發心中的感受與領會。
文長至少600字。

","季節的感思



一年有四個季節，每個季節都不一樣，讓人有不同的感覺。我最喜歡的是春天，因為春天很溫暖，花都開了，小動物也都醒來了。春天的太陽不會太熱，讓人覺得很舒服。



夏天很熱，每天都要吹冷氣，不然就是吃冰。我常常跟朋友去買冰，或是去游泳。夏天的白天很長，所以可以玩很久。



秋天的天氣很好，不會太熱也不會太冷。有時候會聞到桂花的香味，讓人覺得很開心。地上有很多落葉，走在上面很好玩。



冬天很冷，樹上的葉子都掉光了。冬天讓我想到要檢討自己今年做了什麼事情，因為快要過年了。冬天是一年的結束，所以要好好想想。



每個季節都有不同的感覺，讓我有不同的心情。我覺得每個季節都很特別，都有自己喜歡的地方。",2,1,1,2,1,7
