題目,作答,立意,結構,修辭,敘述,啟發,總分
"    糖對身體是有好處的，運動過後或飢餓時，適當地補充糖會讓我們迅速恢復體力。科學研究也發現，大腦細胞的能量來源主要來自葡萄糖，當血糖濃度降低時，大腦難以順利運轉，容易注意力不集中，學習或做事效果不佳。不過，哈佛醫學院等多個研究機構指出，高糖飲食會增加罹患乳癌及憂鬱症等疾病的風險；世界衛生組織也指出，高糖飲食是造成體重過重、第二型糖尿病、蛀牙、心臟病的元兇，並建議每日飲食中「添加糖」的攝取量不宜超過總熱量的10%。以每日熱量攝取量2000大卡為例，也就是50公克糖。我國國民健康署於民國103年至106年的「國民營養健康狀況變遷調查」中，有關國人飲用含糖飲料的結果顯示，國民中小學生在飲用比例上為各年齡之冠，其中男性又高於女性。
    基於國民營養及健康飲食原則，目前中小學校園禁止出現含糖飲料，以避免孩子在校園攝取過多糖份。但反對者認為，孩子回到家還是可能會喝含糖飲料，無法治本。
    對於「中、小學校園禁止含糖飲料」，你贊成或反對？請以「禁止含糖飲料進入中、小學之我見」為題，撰寫一篇文章，提出你的看法與論述。
文長至少600字。


","禁止含糖飲料進入中、小學之我見



我覺得中小學不要有含糖飲料很好，因為喝太多含糖飲料對身體不好。雖然有人說小朋友回家還是會喝，但是至少在學校可以管一下。



糖對身體有好處也有壞處。好處是可以讓人有精神，補充體力。壞處是會讓人生病，像是蛀牙、糖尿病等等。所以我覺得還是不要讓小朋友在學校喝到含糖飲料比較好。



現在很多小朋友都愛喝含糖飲料，男生比女生喝得多。這樣對健康不好，所以學校應該要禁止含糖飲料。雖然有人說這樣沒有用，但是我覺得總比都不管好。



總之，為了小朋友的健康，我支持學校禁止含糖飲料。這樣至少可以讓小朋友在學校的時候少喝一點含糖飲料。",1,1,1,1,1,5
