題目,作答,立意,結構,修辭,敘述,啟發,總分
"    糖對身體是有好處的，運動過後或飢餓時，適當地補充糖會讓我們迅速恢復體力。科學研究也發現，大腦細胞的能量來源主要來自葡萄糖，當血糖濃度降低時，大腦難以順利運轉，容易注意力不集中，學習或做事效果不佳。不過，哈佛醫學院等多個研究機構指出，高糖飲食會增加罹患乳癌及憂鬱症等疾病的風險；世界衛生組織也指出，高糖飲食是造成體重過重、第二型糖尿病、蛀牙、心臟病的元兇，並建議每日飲食中「添加糖」的攝取量不宜超過總熱量的10%。以每日熱量攝取量2000大卡為例，也就是50公克糖。我國國民健康署於民國103年至106年的「國民營養健康狀況變遷調查」中，有關國人飲用含糖飲料的結果顯示，國民中小學生在飲用比例上為各年齡之冠，其中男性又高於女性。
    基於國民營養及健康飲食原則，目前中小學校園禁止出現含糖飲料，以避免孩子在校園攝取過多糖份。但反對者認為，孩子回到家還是可能會喝含糖飲料，無法治本。
    對於「中、小學校園禁止含糖飲料」，你贊成或反對？請以「禁止含糖飲料進入中、小學之我見」為題，撰寫一篇文章，提出你的看法與論述。
文長至少600字。


","禁止含糖飲料進入中、小學之我見



我覺得中小學不應該讓學生喝含糖飲料，因為喝太多含糖飲料對身體不好。雖然有人說學生回家還是會喝，但是至少在學校可以管一下，這樣比較好。



我知道糖對身體有一些好處，像是運動後喝一點含糖飲料可以恢復體力，而且大腦也需要糖分才能運作。但是喝太多含糖飲料真的不好，會讓人生病，像是會得糖尿病、蛀牙，還有其他很多病。



現在很多小朋友都很愛喝含糖飲料，男生比女生喝得多。我覺得小朋友沒有自制力，如果學校賣含糖飲料，他們一定會買來喝。所以學校應該要禁止含糖飲料，這樣至少可以讓小朋友在學校的時候少喝一點。



雖然有人說這樣管不了根本的問題，但是我覺得至少可以讓小朋友在學校的時候不要喝到含糖飲料。這樣對他們的健康比較好，所以我支持學校禁止含糖飲料。",2,1,1,2,1,7
