題目,作答,立意,結構,修辭,敘述,啟發,總分
"    看到山上那麼多參天大樹時，會勾起我的惻隱之心。在無法順暢呼吸的空間裡，樹木之間為了生存必須展開激烈的競爭。為了能多接受一些陽光，它們只能拼命向上生長。
但是，只為生存而競爭的森林卻漸次死亡，因為陽光無法到達地面，所以溫度不夠高，無法讓幼小的生命萌芽。小樹和花、草，以及與它們一起生活的小昆蟲沒有生存的空間。雖然表面上看起來非常完美，但這種森林其實與沒有希望的不孕之地無異。
根據我的經驗，密集栽種的樹苗體型壯大數十倍時，就需要開始砍樹，否則樹木會抱怨空間太窄，活不下去。要想確保樹木能充分接受陽光照射的空間，就必須做出犧牲。因此，幾年期間強行進行砍伐，樹木間距剛開始時是一公尺，現已擴大到七公尺。也就是說，即使是粗略估算，也可知七棵樹中有六棵為之消失。
森林要想成為孕育新生命的希望之地，就需要有縫隙。如果樹木壽命結束或因為意外災害而倒下，該位置就會產生空間，那麼，溫暖的陽光就會照射進來，被陽光照射的地面混雜著前一年秋天凋落的樹葉，於是積聚起能夠孕育新生命的養分。因此，樹木的縫隙，既是結束和開始共存的空間，也是由缺乏轉化為希望的空間。（改寫自禹鐘榮著、盧鴻金譯《樹木教我的人生課》）
    根據上文所述，為什麼森林需要縫隙？由此聯想，人生是否也需要縫隙？請以「縫隙的聯想」為題，寫一篇文章，結合生活經驗或見聞，書寫你的感思與體悟。
文長至少600字。


","縫隙的聯想



我看到題目中說的森林裡的縫隙，讓我想到人生也需要縫隙。如果沒有縫隙，就像森林裡的大樹擋住陽光，小樹就長不大，這樣很不好。



我覺得人生也是這樣，如果沒有機會，就沒辦法成功。就像我們讀書的時候，如果前面的同學太高，我們就看不到黑板，這樣就學不好。所以老師都會讓我們換位子，這就是給我們一個縫隙。



我還想到，縫隙就是一個小小的空間，可以讓我們有機會。像是考試的時候，如果考不好，老師會給我們補考的機會，這也是一個縫隙。或是比賽的時候，如果輸了，還可以再參加下一次的比賽，這也是一個縫隙。



我覺得人生就是這樣，需要很多縫隙才能成功。就像森林裡的樹木一樣，大樹倒下了，小樹才能長大。但是小樹長大以後，也要記得給其他小樹機會，不能把所有的陽光都擋住。



所以我認為，縫隙很重要，因為它可以給我們機會。我們要好好把握這些機會，但也要記得給別人機會，這樣才是對的。",2,1,1,2,1,7
