題目,作答,立意,結構,修辭,敘述,啟發,總分
"林語堂說：「（我）所愛的不是晚秋，是初秋，那時暄氣初消，月正圓，蟹正肥，桂花皎潔，也未陷入懍烈蕭瑟氣態，這是最值得賞樂的。」楊牧則是在美麗的春天世界裡，萬物復甦，卻聽到「一片樹葉提早轉黃的聲音。」（〈夭〉）普魯斯特（Proust, M.）在《追憶逝水年華》中說：「一小時不僅僅是一個小時，它是一只充滿香氣、聲響、念頭和氛圍的花缽」，說明時間的認知與感官知覺及感受有關。請以「季節的感思」為題，寫一篇文章，描寫你對季節的感知經驗，並抒發心中的感受與領會。
文長至少600字。

","季節的感思



冬天是一年四季中最冷的季節。每年到了冬天，氣溫都會變得很低，讓人感到不舒服。我最不喜歡冬天，因為太冷了，常常會感冒。



不過冬天也有一些好玩的事情。冬至的時候，家人會一起吃湯圓。媽媽會煮很多湯圓給我們吃。吃了湯圓以後，身體就會暖和起來。聖誕節的時候，街上會有很多商店賣卡片和糖果，我會和同學交換禮物。



我爸爸開了一家火鍋店。冬天的時候生意很好，因為很多人喜歡吃火鍋。爸爸每天都很忙，要煮湯又要送餐。有時候我會去幫忙。爸爸說他想讓客人吃火鍋的時候感到溫暖。



雖然冬天很冷，但是如果大家互相關心，就會感覺比較溫暖。就像吃火鍋一樣，大家圍在一起，就不會覺得那麼冷了。所以冬天也不是那麼糟。",1,1,1,1,1,5
