題目,作答,立意,結構,修辭,敘述,啟發,總分
"二十一世紀資訊量以驚人的速度暴增，有人認為網路資訊易於取得，會使記憶力與思考力衰退，不利於認知學習；也有人視網際網路為人類的外接大腦記憶體，意味著我們毋須記憶大量知識，可以專注在更重要、更有創造力的事物上。對於以上兩種不同的觀點，你的看法為何？請以「網海浮沉之我思」為題，結合自己的相關經驗，探討創造力與思考力之間的關係。
文長至少600字。

","網海浮沉之我思



網路在現代生活中很重要，大家都在用網路。有人說網路會讓人變笨，記憶力變差，但也有人說網路可以幫我們記東西，讓我們做更重要的事。



我自己用網路的經驗是，做功課時會上網查資料。但是網路上的資料太多了，有時候不知道要看哪些才對。所以我覺得網路雖然方便，但還是要自己想一想才行。



網路可以幫助我們找到很多資料，但如果只是一直看網路，不自己思考，那就不好了。像是寫作業時，如果只是把網路上的東西抄下來，那就學不到東西。我們要自己想一想，才能寫出好的作業。



所以我覺得網路有好有壞，要看我們怎麼用。如果太依賴網路，可能會有問題。我們要學會正確使用網路才行。",1,1,1,1,1,5
