題目,作答,立意,結構,修辭,敘述,啟發,總分
"甲
(陶潛)為彭澤令。不以家累自隨，送一力給其子，書曰：「汝旦夕之費，自給為難。今遣此力，助汝薪水（打柴汲水）之勞。此亦人子也，可善遇之。」(《南史．隱逸．陶潛傳》)
乙
飯後，眾人各自有事離去，留下貞觀靜坐桌前獃想。她今日的這番感慨，實是前未曾有的。
阿啟伯摘瓜，乃她親眼所見。今早，她突發奇想，陪著外公去巡魚塭，回來時，祖孫二人，都在門口停住了，因為後門虛掩，阿啟伯拿著菜刀，正在棚下摘瓜，並未發覺他們，祖孫二個都閃到門背後。貞觀當時是真愣住了，在那種情況下，是前進呢？抑是後退？她不能很快作選擇。然而這種遲疑也只有幾秒鐘，她一下就被外公拉到門後，正是屏息靜氣時，老人家又帶了她拐出小巷口，走到前街來。
貞觀人到了大路上，心下才逐漸明白：外公躲那人的心，竟比那偷瓜的人所做的遮遮掩掩更甚！貞觀以為懂得了外公的心意：他怕阿啟伯當下撞見自己的那種難堪。事實上，他還有另一層深意，貪當然不好，而貧的本身沒有錯。外公不以阿啟伯為不是，是知道他家中十口，有菜就沒飯，有飯就沒菜。(改寫自蕭麗紅《千江有水千江月》)
陶潛或者外公對他人的善意，你可能也曾見聞或經歷過，請以「溫暖的心」為題，寫一篇文章，分享你的經驗及體會。
文長至少600字。

","溫暖的心



我覺得溫暖的心就是幫助別人。有時候幫助別人會被說是多管閒事，但我還是覺得幫助別人是對的。



我記得國中的時候，班上有一個同學很奇怪，大家都不喜歡他。他穿得很邋遢，成績也不好。有一天他跟班上的壞學生打架，大家都不知道要怎麼辦。



後來班導來了，她先罵那些壞學生，然後跟那個奇怪的同學說他很讓她失望。原來班導一直在放學後教那個同學怎麼跟人相處，但是那天他還是跟人打架了。



我覺得班導很有愛心，因為她願意幫助那個同學。雖然那個同學後來還是跟人打架，但是至少班導有試著幫助他。這就是溫暖的心吧。



我希望大家都可以幫助別人，這樣世界就會變得更好。因為每個人都需要別人的幫助，所以我們應該互相幫忙。這樣大家就可以變得更好。",1,1,1,1,1,5
