題目,作答,立意,結構,修辭,敘述,啟發,總分
"林語堂說：「（我）所愛的不是晚秋，是初秋，那時暄氣初消，月正圓，蟹正肥，桂花皎潔，也未陷入懍烈蕭瑟氣態，這是最值得賞樂的。」楊牧則是在美麗的春天世界裡，萬物復甦，卻聽到「一片樹葉提早轉黃的聲音。」（〈夭〉）普魯斯特（Proust, M.）在《追憶逝水年華》中說：「一小時不僅僅是一個小時，它是一只充滿香氣、聲響、念頭和氛圍的花缽」，說明時間的認知與感官知覺及感受有關。請以「季節的感思」為題，寫一篇文章，描寫你對季節的感知經驗，並抒發心中的感受與領會。
文長至少600字。

","季節的感思



秋天是我最喜歡的季節，因為不會太熱也不會太冷，天氣很舒服。



我覺得秋天的時候，樹葉會變黃變紅，看起來很漂亮。下雨的時候，空氣變得很清新，不會像夏天那樣悶熱。秋天有很多水果可以吃，像是蘋果和葡萄，農夫也在這時候收割稻子，大家都很開心。



秋天有中秋節，可以跟家人一起吃月餅看月亮。動物也很忙碌，有的鳥要飛到別的地方過冬，松鼠在找食物儲存起來。



我覺得秋天雖然不是一年的開始，但是是一個很好的季節。天氣不冷不熱，樹葉的顏色很漂亮，讓人感覺很舒服。",1,1,1,1,1,5
