題目,作答,立意,結構,修辭,敘述,啟發,總分
"林語堂說：「（我）所愛的不是晚秋，是初秋，那時暄氣初消，月正圓，蟹正肥，桂花皎潔，也未陷入懍烈蕭瑟氣態，這是最值得賞樂的。」楊牧則是在美麗的春天世界裡，萬物復甦，卻聽到「一片樹葉提早轉黃的聲音。」（〈夭〉）普魯斯特（Proust, M.）在《追憶逝水年華》中說：「一小時不僅僅是一個小時，它是一只充滿香氣、聲響、念頭和氛圍的花缽」，說明時間的認知與感官知覺及感受有關。請以「季節的感思」為題，寫一篇文章，描寫你對季節的感知經驗，並抒發心中的感受與領會。
文長至少600字。

","季節的感思



我最喜歡的季節是秋天，因為秋天不會太熱也不會太冷，比其他季節都舒服。春天很吵，夏天太熱，冬天又太冷，所以秋天最好。



秋天的時候，樹葉會變黃變紅，很漂亮。下雨的時候，天氣會變涼快，不會像夏天那樣熱。秋天的空氣很乾淨，可以看到很多農作物都長大了，像是稻子、蘋果和玉米，聞起來很香。



秋天還有中秋節，可以跟家人一起吃月餅看月亮。動物也很忙，有的鳥要飛走，有的松鼠在找食物。蝴蝶也在飛來飛去，大家都在忙自己的事。



我覺得秋天雖然不是第一個季節，但是是最好的季節。因為秋天有很多顏色，有黃色、橘色和紅色，看起來很漂亮。這些顏色讓人覺得很開心，也讓人對生活有希望。



所以我最喜歡秋天，因為秋天讓人感覺很舒服，也很漂亮。希望每年的秋天都可以這麼美好。",2,1,1,2,1,7
