題目,作答,立意,結構,修辭,敘述,啟發,總分
"關於地球的記憶
被文字固禁在課本裡
我們的筆尖游走在山脈和海洋
翻譯每片花瓣的嬌嫩和露水的清新
所有的言語 答案
都靜放在我們的課本裡
等待我們翻起這一切的序幕（節錄自薛憶婷〈我們的課本〉）

    以上這首詩，從課本啟動天馬行空的遐想，瞥見知識豐富的樣貌。科學頑童費曼（Richard P. Feynman）曾說觀察轉動的餐盤，讓他得到很大的啟發，領略了興之所至的樂趣。物理課可讓我們發現萬物運行的迷人，生物課帶領我們進入細胞核遊歷，外語課讓我們聽見世界不同的文化。國文課堂上「採菊東籬下，悠然見南山」或「輕羅小扇撲流螢」，詩中情境也往往能讓人神遊於現實之外。過往的課程內容，是否曾經點燃你對知識的熱情？打開課本時，不知能否如〈我們的課本〉所述，揭開知識想像的序幕。
    若能從不同角度切入課本，進入知識的想像，或許可以讓課本帶領我們經歷驚奇的旅程。請以「當我打開課本」為題，寫一篇文章，敘述任一學科課本對你的意義，書寫你探索課本內容、知識的經驗與體會。
文長至少600字。


","當我打開課本，總是會看到很多不同的東西。我最喜歡的是音樂課本，因為裡面有很多好聽的歌。



我記得第一次拿到音樂課本的時候，我很開心，因為可以學到新的歌。我會很快地翻課本，看看裡面有什麼歌，如果看到我會唱的歌，就會更開心。



音樂課本讓我可以放鬆，不像其他課本那麼無聊。我可以聽到很多不同的音樂，有些是外國的歌，有些是中國的歌。我覺得這樣很有趣，因為可以知道不同地方的音樂是什麼樣子。



每次上音樂課的時候，我都很期待。因為可以學到新的東西，也可以唱歌。我覺得音樂課本是最好玩的課本，希望以後還可以學到更多好聽的歌。",2,1,1,2,1,7
