題目,作答,立意,結構,修辭,敘述,啟發,總分
"    2007年臺灣的弘道老人福利基金會執行長林依瑩推出「不老騎士」計畫，帶17位平均81歲的爺爺奶奶，花費13天自行騎著摩托車環島1139公里。這群「不老騎士」中，有2位曾罹患癌症、4位需戴助聽器、5位患有高血壓，即使其中有人三進三出醫院，但還是完成了險峻路途的挑戰。這些騎士們曾是警察、軍人、牧師、老師或理髮師等，在不同人生經驗的交流中，豐富了彼此的視野。
    2012年在丹麥首都哥本哈根則有「樂齡卡打車」（Cycling Without Age）運動。哥本哈根一位中年上班族奧利（Ole Kassow）有感於安養機構的老人家行動不便，於是利用下班時間，用三輪車載老人家外出兜風。老人開心地要求回到他們充滿回憶的地方，有些多年不說話的老人，開始滔滔不絕地說著自己與地方的故事；失智症患者變得不再暴躁；盲人對志工訴說他們聞到花香、聽到鳥鳴，感覺微風吹拂過耳際。志工駕駛員因此聽到許多生命故事，更進一步認識自己的城市，也彷彿和老人形成了某種奧秘的聯繫。
    如果要帶長者進行樂齡之旅，一定有許多需要注意的事項。請以「樂齡出遊」為題，善用二文內的資訊，寫一篇文章，說明樂齡出遊的意義，並思考如何照顧到長者在生理與情感上的需求。
文長至少600字。

","樂齡出遊是一件很好的事情，可以讓老人家出去玩，不要整天待在家裡。像是不老騎士計畫就讓很多老人家可以騎摩托車環島，雖然他們有些人生病了，但還是很勇敢地完成了這個任務。



帶老人家出去玩要很小心，因為他們年紀大了，身體不好。我們要準備很多東西，像是藥品、水和一些零食。而且要記得帶手機，萬一有緊急狀況可以馬上打電話求救。



老人家出去玩可以認識新朋友，可以聊天說故事。像是在丹麥的那個計畫，就有很多老人家坐三輪車出去玩，他們可以聞到花香，聽到鳥叫，感覺很開心。有些老人家平常都不說話，出去玩的時候就會說很多話。



我覺得帶老人家出去玩要注意他們的感受，因為有些老人家可能會覺得孤單。我們要多跟他們說話，關心他們。而且要記得帶他們去他們想去的地方，讓他們可以回憶以前的事情。



總之，樂齡出遊可以讓老人家開心一點，不要整天悶在家裡。我們要好好照顧他們，讓他們玩得開心，平安回家。這樣對老人家的身體和心情都會比較好。",2,1,1,2,1,7
