題目,作答,立意,結構,修辭,敘述,啟發,總分
"甲
(陶潛)為彭澤令。不以家累自隨，送一力給其子，書曰：「汝旦夕之費，自給為難。今遣此力，助汝薪水（打柴汲水）之勞。此亦人子也，可善遇之。」(《南史．隱逸．陶潛傳》)
乙
飯後，眾人各自有事離去，留下貞觀靜坐桌前獃想。她今日的這番感慨，實是前未曾有的。
阿啟伯摘瓜，乃她親眼所見。今早，她突發奇想，陪著外公去巡魚塭，回來時，祖孫二人，都在門口停住了，因為後門虛掩，阿啟伯拿著菜刀，正在棚下摘瓜，並未發覺他們，祖孫二個都閃到門背後。貞觀當時是真愣住了，在那種情況下，是前進呢？抑是後退？她不能很快作選擇。然而這種遲疑也只有幾秒鐘，她一下就被外公拉到門後，正是屏息靜氣時，老人家又帶了她拐出小巷口，走到前街來。
貞觀人到了大路上，心下才逐漸明白：外公躲那人的心，竟比那偷瓜的人所做的遮遮掩掩更甚！貞觀以為懂得了外公的心意：他怕阿啟伯當下撞見自己的那種難堪。事實上，他還有另一層深意，貪當然不好，而貧的本身沒有錯。外公不以阿啟伯為不是，是知道他家中十口，有菜就沒飯，有飯就沒菜。(改寫自蕭麗紅《千江有水千江月》)
陶潛或者外公對他人的善意，你可能也曾見聞或經歷過，請以「溫暖的心」為題，寫一篇文章，分享你的經驗及體會。
文長至少600字。

","溫暖的心



在這個社會裡面，大家都說社會很險惡，人們都只會為了自己的利益，都不會去幫助別人。但是還是有一些人會幫助別人。



我小時候，阿公常常帶我去他的菜園玩。我們會在菜園裡面玩耍，玩累了就在遮蔽處休息。有一天，阿公發現他種的龍眼不見了很多，他就帶我回家，跟我爸說這件事。



第二天早上七點，阿公帶我去菜園。他叫我坐著不要出聲。後來有一個窮老人帶著孫子來摘龍眼。我想要去阻止他們，但是阿公不讓我去。阿公說他們是窮人，三餐都不一定吃得飽，所以不要去阻止他們。



這件事讓我知道，如果我們有能力，就應該要幫助別人。因為阿公說他以前也是很苦，所以他知道窮人的辛苦。",1,1,1,1,1,5
