題目,作答,立意,結構,修辭,敘述,啟發,總分
"    糖對身體是有好處的，運動過後或飢餓時，適當地補充糖會讓我們迅速恢復體力。科學研究也發現，大腦細胞的能量來源主要來自葡萄糖，當血糖濃度降低時，大腦難以順利運轉，容易注意力不集中，學習或做事效果不佳。不過，哈佛醫學院等多個研究機構指出，高糖飲食會增加罹患乳癌及憂鬱症等疾病的風險；世界衛生組織也指出，高糖飲食是造成體重過重、第二型糖尿病、蛀牙、心臟病的元兇，並建議每日飲食中「添加糖」的攝取量不宜超過總熱量的10%。以每日熱量攝取量2000大卡為例，也就是50公克糖。我國國民健康署於民國103年至106年的「國民營養健康狀況變遷調查」中，有關國人飲用含糖飲料的結果顯示，國民中小學生在飲用比例上為各年齡之冠，其中男性又高於女性。
    基於國民營養及健康飲食原則，目前中小學校園禁止出現含糖飲料，以避免孩子在校園攝取過多糖份。但反對者認為，孩子回到家還是可能會喝含糖飲料，無法治本。
    對於「中、小學校園禁止含糖飲料」，你贊成或反對？請以「禁止含糖飲料進入中、小學之我見」為題，撰寫一篇文章，提出你的看法與論述。
文長至少600字。


","禁止含糖飲料進入中、小學之我見



我覺得糖是很重要的東西，因為我們每天都會吃到糖。吃糖可以讓我們有精神，但是吃太多糖對身體不好，所以我們要小心。



現在很多中小學生都喜歡喝含糖飲料，所以學校不讓學生帶含糖飲料來學校。我覺得這樣做是對的，因為這樣可以讓學生少喝一點含糖飲料。



我認為學校應該要多辦一些活動來告訴學生喝含糖飲料不好，可以用海報或是請老師上課講。家長也要管一下小孩，不能只讓學校管。這樣小孩才會知道喝太多含糖飲料不好。



很多人都很喜歡喝含糖飲料，因為含糖飲料很好喝。不只是小朋友喜歡喝，大人也喜歡喝。雖然學校不讓帶含糖飲料，但是回家還是可以喝，這樣好像沒什麼用。不過我覺得還是要有規定比較好。



總之，我覺得學校和家長都要一起幫忙，這樣才能讓小朋友少喝一點含糖飲料。這樣對小朋友的健康比較好。",2,2,1,2,1,8
