題目,作答,立意,結構,修辭,敘述,啟發,總分
"甲
(陶潛)為彭澤令。不以家累自隨，送一力給其子，書曰：「汝旦夕之費，自給為難。今遣此力，助汝薪水（打柴汲水）之勞。此亦人子也，可善遇之。」(《南史．隱逸．陶潛傳》)
乙
飯後，眾人各自有事離去，留下貞觀靜坐桌前獃想。她今日的這番感慨，實是前未曾有的。
阿啟伯摘瓜，乃她親眼所見。今早，她突發奇想，陪著外公去巡魚塭，回來時，祖孫二人，都在門口停住了，因為後門虛掩，阿啟伯拿著菜刀，正在棚下摘瓜，並未發覺他們，祖孫二個都閃到門背後。貞觀當時是真愣住了，在那種情況下，是前進呢？抑是後退？她不能很快作選擇。然而這種遲疑也只有幾秒鐘，她一下就被外公拉到門後，正是屏息靜氣時，老人家又帶了她拐出小巷口，走到前街來。
貞觀人到了大路上，心下才逐漸明白：外公躲那人的心，竟比那偷瓜的人所做的遮遮掩掩更甚！貞觀以為懂得了外公的心意：他怕阿啟伯當下撞見自己的那種難堪。事實上，他還有另一層深意，貪當然不好，而貧的本身沒有錯。外公不以阿啟伯為不是，是知道他家中十口，有菜就沒飯，有飯就沒菜。(改寫自蕭麗紅《千江有水千江月》)
陶潛或者外公對他人的善意，你可能也曾見聞或經歷過，請以「溫暖的心」為題，寫一篇文章，分享你的經驗及體會。
文長至少600字。

","溫暖的心



我小時候不喜歡我外婆，因為她很髒，身上都是汗味，手也很粗糙。我那時候不懂為什麼她總是要買東西給鄰居。



外婆雖然很辛苦，但是她總是會買很多東西給我們。她每天都要去山上採竹筍，回來還要打掃家裡。她對我很好，常常買零食給我吃。



我最不懂的是外婆為什麼要對鄰居這麼好。她每次出去玩都要買東西送給鄰居，有時候買醬油，有時候買醃菜，過年還會送年糕給他們。



後來有一次外婆家的倉庫著火了，很多鄰居都來幫忙救火。那時候我才知道，原來外婆平常對鄰居好，是有原因的。鄰居也會在我們需要的時候幫助我們。



就像陶淵明對下人好一樣，對別人好是很重要的事情。雖然外婆沒有像陶淵明那樣有名，但是她的好心會讓很多人記住。我現在也學會要對別人好，這樣才能成為一個溫暖的人。",2,2,1,2,2,9
