題目,作答,立意,結構,修辭,敘述,啟發,總分
"林語堂說：「（我）所愛的不是晚秋，是初秋，那時暄氣初消，月正圓，蟹正肥，桂花皎潔，也未陷入懍烈蕭瑟氣態，這是最值得賞樂的。」楊牧則是在美麗的春天世界裡，萬物復甦，卻聽到「一片樹葉提早轉黃的聲音。」（〈夭〉）普魯斯特（Proust, M.）在《追憶逝水年華》中說：「一小時不僅僅是一個小時，它是一只充滿香氣、聲響、念頭和氛圍的花缽」，說明時間的認知與感官知覺及感受有關。請以「季節的感思」為題，寫一篇文章，描寫你對季節的感知經驗，並抒發心中的感受與領會。
文長至少600字。

","季節的感思



秋天到了，樹葉開始掉落，有的是乾枯的，有的是皺縮的，有的是生病的。有些葉子還是綠色的就掉下來了，這和我想像中不一樣。不過最後葉子都會掉光的。



很多人都說秋天很悲傷，覺得天氣變冷了很難過。古代的詩人也常常寫秋天的詩，說秋天讓人想到生命會結束。有人說秋天的楓葉比春天的花還要漂亮，也有人說秋天天氣涼爽很舒服。



我覺得葉子掉下來不一定是壞事。葉子掉到地上可以變成泥土，這樣就可以到處都是了。葉子在樹上的時候只能在一個地方，掉下來反而比較自由。



所以我們不用害怕事情結束。結束的時候，新的東西就會開始了。這是很自然的事情。



葉子掉下來雖然看起來很傷心，但是我們可以想得開心一點。等到春天的時候，樹上又會長出新的葉子，這樣大地又會充滿生機。",1,1,1,1,1,5
