題目,作答,立意,結構,修辭,敘述,啟發,總分
"    我覺得童年是一種氣味的記憶。
    我的童年，有許多果樹氣味的記憶。夏天暑熱的午後，廟埕後有一棵巨大的龍眼樹。我從小學翻牆出來，背著書包，爬上龍眼樹，躲在密密的枝葉裡。外面日光葉影搖晃，隱約聽見老師或母親尋來，在樹下叫著我的名字，但那呼喚的聲音，被蟬聲的高音淹沒了。我一動不動，找到一處適合蜷窩身體的枝椏，好像變成樹的一部分，而那時，龍眼樹密密的甜熟的氣味就包圍著我。我閉起眼睛，好像在假寐，也像在作夢，夢裡一串一串纍纍的龍眼，招來許多蜜蜂果蠅。我童年的夢，很甜很香，好像一整個夏天都窩在那棵樹上，包圍在濃郁的氣味裡做了一個醒不來的夢。（改寫自蔣勳《給青年藝術家的信》）
    生活中充斥各種氣味。氣味透過嗅覺傳遞，喚起人們的記憶和感受，一如文中龍眼樹甜熟的氣味喚起作者的童年記憶。請以「花草樹木的氣味記憶」為題，寫一篇文章，書寫你熟悉的花草樹木的氣味，及其所召喚的記憶和感受。

文長至少600字。

","花草樹木的氣味記憶



我小時候最喜歡聞桂花的味道。記得在學校裡第一次聞到桂花香的時候，我覺得很開心，因為那個味道真的很香很甜。



那時候天氣不會很熱，我和同學常常在桂花樹下玩。我們覺得桂花的味道很好聞，就想把它帶回家給家人聞。我們用紙盒裝了很多桂花，想說這樣就可以一直聞到香味了。



但是等我把桂花帶回家的時候，花都爛掉了，變成棕色的，一點都不香了。我那時候很難過，因為我想要分享給家人的香味都不見了。後來我才知道，好東西是不能一直保存的，要好好珍惜當下。



雖然我小時候看過很多花草樹木，但是只有桂花給我最深的印象。每次想到童年的事情，我就會想到桂花樹，想到它教會我要珍惜美好的事物。",2,1,1,2,1,7
