題目,作答,立意,結構,修辭,敘述,啟發,總分
"關於地球的記憶
被文字固禁在課本裡
我們的筆尖游走在山脈和海洋
翻譯每片花瓣的嬌嫩和露水的清新
所有的言語 答案
都靜放在我們的課本裡
等待我們翻起這一切的序幕（節錄自薛憶婷〈我們的課本〉）

    以上這首詩，從課本啟動天馬行空的遐想，瞥見知識豐富的樣貌。科學頑童費曼（Richard P. Feynman）曾說觀察轉動的餐盤，讓他得到很大的啟發，領略了興之所至的樂趣。物理課可讓我們發現萬物運行的迷人，生物課帶領我們進入細胞核遊歷，外語課讓我們聽見世界不同的文化。國文課堂上「採菊東籬下，悠然見南山」或「輕羅小扇撲流螢」，詩中情境也往往能讓人神遊於現實之外。過往的課程內容，是否曾經點燃你對知識的熱情？打開課本時，不知能否如〈我們的課本〉所述，揭開知識想像的序幕。
    若能從不同角度切入課本，進入知識的想像，或許可以讓課本帶領我們經歷驚奇的旅程。請以「當我打開課本」為題，寫一篇文章，敘述任一學科課本對你的意義，書寫你探索課本內容、知識的經驗與體會。
文長至少600字。


","當我打開課本



我每天都要打開課本讀書，因為這是學生的本分。課本裡面有很多知識，雖然有些地方看不太懂，但是老師說要認真讀書才會進步。



我現在讀電機科，課本裡面有很多電路圖和公式。剛開始看的時候都看不懂，因為太難了。後來慢慢看了很多遍，才稍微理解一點點。不過還是有很多地方不明白，因為電機的東西真的很複雜。



有一次我在課本裡看到變壓器的內容，那時候完全不知道它是什麼。老師上課講解了很久，我才知道它是用來改變電壓的。雖然現在還是不太懂它的原理，但至少知道它很重要。



我覺得讀書很辛苦，但是不讀書不行，因為要考試。每次考試前我都會翻課本，希望能記住一些重要的內容。雖然有時候會覺得很煩，但是為了將來找工作，還是要繼續讀下去。",1,1,1,1,1,5
