題目,作答,立意,結構,修辭,敘述,啟發,總分
"甲
(陶潛)為彭澤令。不以家累自隨，送一力給其子，書曰：「汝旦夕之費，自給為難。今遣此力，助汝薪水（打柴汲水）之勞。此亦人子也，可善遇之。」(《南史．隱逸．陶潛傳》)
乙
飯後，眾人各自有事離去，留下貞觀靜坐桌前獃想。她今日的這番感慨，實是前未曾有的。
阿啟伯摘瓜，乃她親眼所見。今早，她突發奇想，陪著外公去巡魚塭，回來時，祖孫二人，都在門口停住了，因為後門虛掩，阿啟伯拿著菜刀，正在棚下摘瓜，並未發覺他們，祖孫二個都閃到門背後。貞觀當時是真愣住了，在那種情況下，是前進呢？抑是後退？她不能很快作選擇。然而這種遲疑也只有幾秒鐘，她一下就被外公拉到門後，正是屏息靜氣時，老人家又帶了她拐出小巷口，走到前街來。
貞觀人到了大路上，心下才逐漸明白：外公躲那人的心，竟比那偷瓜的人所做的遮遮掩掩更甚！貞觀以為懂得了外公的心意：他怕阿啟伯當下撞見自己的那種難堪。事實上，他還有另一層深意，貪當然不好，而貧的本身沒有錯。外公不以阿啟伯為不是，是知道他家中十口，有菜就沒飯，有飯就沒菜。(改寫自蕭麗紅《千江有水千江月》)
陶潛或者外公對他人的善意，你可能也曾見聞或經歷過，請以「溫暖的心」為題，寫一篇文章，分享你的經驗及體會。
文長至少600字。

","溫暖的心



現在的人都在玩手機，走在路上都不看路，只會低頭滑手機。但是在鄉下就不會這樣，鄉下人都很熱情，這讓我想到一件事。



我國中畢業的時候，自己一個人回外公家。外公外婆很高興，一大早就煮很多菜給我吃。雖然不是什麼好菜，但是他們平常都很省錢，所以這樣已經很好了。吃完飯他們就一直問我很多問題，每次都問一樣的事情，但是我也不好說什麼，因為他們是關心我。



後來我想出去玩，就借外公的腳踏車出去騎。我在田邊騎車，看到稻田，吹著風很舒服。但是我騎著騎著就迷路了，想想真的很好笑，國中生竟然會迷路。我不敢問路，就一直在那邊繞來繞去，差點要哭了。後來有一個老伯伯騎三輪車經過，他不但請我去他家吃飯，還帶我回家。這就是鄉下人的溫暖。



所以我覺得鄉下人真的很好，不像城市裡的人都很冷漠。希望大家可以學習鄉下人的熱情，這樣世界會更好。",2,1,1,2,1,7
