題目,作答,立意,結構,修辭,敘述,啟發,總分
"甲
我們的感情是冰箱，打開來看，明亮可喜，關起門後是嗡嗡的黑暗。什麼都不會壞掉，埋在霜雪的角落。我們的感情是冰箱，有時很滿有時很空，一切都可以保存很久，冷冷的，可是很新鮮，看起來都像昨天。（柯裕棻〈冰箱〉）
乙
農曆年前我媽換了新冰箱。雖然舊的其實也還好，十數年如一日修長高冷玉面如銀，該凍肉時凍肉，該製冰時製冰，門沒關緊永遠忠實地響警告聲。燈泡甚至沒有壞過一次。只是我媽長期嫌它不得力，冷藏室裝一隻生雞一鍋燉肉就周轉不過來，胃口那樣地小，像一個節食的人，廚房裡最不需要的就是一個節食的人。我常常看見她蹲在那兒，腳邊圍滿生鮮，鬥盡心智排列組合，在最有限空間裡籌備出最大的寬容，冰箱門好像看牙醫的嘴開太久不斷嗶嗶叫，簡直像在哭了。感覺兩方都十分苦惱。
我認為運用如常的器物毋需特別汰換，也主張大家都不妨少吃一點。顯然我媽不作此想。她說：「總之我就是想要一臺大冰箱啦。」但如此一來，我反倒領悟了，這完全是某商品宣傳詞「豈止於大」（Bigger than bigger）的道理：一座夠大的新冰箱也豈止於冰箱，它是一種想像，一種意境，一種可能性，它富有召喚家庭生活最好願景的潛力。（改寫自黃麗群〈如果在冬天，一座新冰箱〉）
    冰箱可以很滿，可以很空，當你打開冰箱，通常想尋找什麼？又看見什麼？假如有一座屬於你的新冰箱，你會有怎樣的想像？冰藏什麼（虛實皆可）會符合你所期待的美好生活？請以「如果我有一座新冰箱」為題，撰文一篇，
文長至少600字。

","如果我有一座新冰箱



如果我有一座新冰箱，我一定會把它放在我房間裡面。因為我覺得冰箱不只是一個放東西的地方，它還可以放很多我喜歡的東西。我想要一個很大的冰箱，這樣就可以放很多東西了。



我會在冰箱裡面放很多好吃的東西，像是冰淇淋、巧克力、蛋糕還有果汁。這些都是我最喜歡吃的東西。我也會放一些水果，因為媽媽說要多吃水果才健康。我還要放一些零食，這樣晚上肚子餓的時候就可以吃。



我覺得冰箱很神奇，它可以讓食物保存很久。以前我常常買了東西忘記吃，結果都壞掉了，很浪費錢。如果有冰箱的話就不會這樣了。而且冰箱還可以做冰塊，夏天的時候喝冰水最舒服了。



我的冰箱不只是放食物而已，我還想要在冰箱門上貼一些照片和便條紙。這樣每次打開冰箱的時候，就可以看到開心的回憶。我也會在上面寫一些要記住的事情，這樣就不會忘記了。



我希望我的冰箱可以很整齊，不要像我家的冰箱那樣亂七八糟的。媽媽常常找不到東西，然後就會生氣。我會把東西分類放好，冷凍的放冷凍，冷藏的放冷藏，這樣比較好找。



我覺得冰箱就像一個小倉庫，可以放很多東西。它可以讓我的生活變得更方便，也可以讓我更開心。雖然現在我還沒有自己的冰箱，但是我相信以後一定會有的。到時候我就可以把我喜歡的東西都放進去，這樣想想就覺得很開心。",2,2,1,2,1,8
