題目,作答,立意,結構,修辭,敘述,啟發,總分
"二十一世紀資訊量以驚人的速度暴增，有人認為網路資訊易於取得，會使記憶力與思考力衰退，不利於認知學習；也有人視網際網路為人類的外接大腦記憶體，意味著我們毋須記憶大量知識，可以專注在更重要、更有創造力的事物上。對於以上兩種不同的觀點，你的看法為何？請以「網海浮沉之我思」為題，結合自己的相關經驗，探討創造力與思考力之間的關係。
文長至少600字。

","網海浮沉之我思



現在的網路很方便，大家都在用網路找資料。但是我覺得網路不是那麼好，因為會讓人變懶惰，不想記東西。



我自己有上網課的經驗，老師都用電腦教學，給我們很多網路資料。剛開始我覺得還不錯，可以看到很多資料，好像學到很多東西。但是後來發現，這些資料看過就忘記了，根本記不住。



而且用電腦上課很容易分心，常常一邊上課一邊玩手機，結果上課內容都沒有學好。雖然網路上有很多資料可以查，但是查完就忘記了，這樣對學習一點幫助都沒有。



有些人說網路可以讓我們更有創造力，不用記那麼多東西。但是我覺得如果什麼都不記，怎麼會有創造力？沒有知識的話，想再多也沒有用。



所以我認為網路雖然方便，但是不能太依賴它。我們還是要自己記東西，自己思考，這樣才能真的學到東西。",2,1,1,2,1,7
