題目,作答,立意,結構,修辭,敘述,啟發,總分
"二十一世紀資訊量以驚人的速度暴增，有人認為網路資訊易於取得，會使記憶力與思考力衰退，不利於認知學習；也有人視網際網路為人類的外接大腦記憶體，意味著我們毋須記憶大量知識，可以專注在更重要、更有創造力的事物上。對於以上兩種不同的觀點，你的看法為何？請以「網海浮沉之我思」為題，結合自己的相關經驗，探討創造力與思考力之間的關係。
文長至少600字。

","網海浮沉之我思



現在的網路很方便，大家都在用網路。網路可以讓我們找到很多資料，但是也有好處和壞處。



我以前因為新冠肺炎要在家上課。那時候老師都用電腦教我們，給我們很多網路資料。剛開始我覺得沒什麼不一樣，還是可以好好學習，而且還可以看到更多資料。



但是後來我發現用電腦上課有很多問題。我很容易忘記學到的東西，也很難專心。雖然有很多資料可以看，但是我都看完就忘記了，所以學習效果不好。



網路上的資料太多了，會讓人記憶力和思考力變差。有人說網路可以讓我們更有創造力，但是我覺得如果沒有思考力，創造力也沒有用。我們要先有知識，才能想出新的東西。



總之，網路很方便，但是要看我們怎麼用。如果用得不好，對學習會有壞處。",1,1,1,1,1,5
