題目,作答,立意,結構,修辭,敘述,啟發,總分
"    糖對身體是有好處的，運動過後或飢餓時，適當地補充糖會讓我們迅速恢復體力。科學研究也發現，大腦細胞的能量來源主要來自葡萄糖，當血糖濃度降低時，大腦難以順利運轉，容易注意力不集中，學習或做事效果不佳。不過，哈佛醫學院等多個研究機構指出，高糖飲食會增加罹患乳癌及憂鬱症等疾病的風險；世界衛生組織也指出，高糖飲食是造成體重過重、第二型糖尿病、蛀牙、心臟病的元兇，並建議每日飲食中「添加糖」的攝取量不宜超過總熱量的10%。以每日熱量攝取量2000大卡為例，也就是50公克糖。我國國民健康署於民國103年至106年的「國民營養健康狀況變遷調查」中，有關國人飲用含糖飲料的結果顯示，國民中小學生在飲用比例上為各年齡之冠，其中男性又高於女性。
    基於國民營養及健康飲食原則，目前中小學校園禁止出現含糖飲料，以避免孩子在校園攝取過多糖份。但反對者認為，孩子回到家還是可能會喝含糖飲料，無法治本。
    對於「中、小學校園禁止含糖飲料」，你贊成或反對？請以「禁止含糖飲料進入中、小學之我見」為題，撰寫一篇文章，提出你的看法與論述。
文長至少600字。


","禁止含糖飲料進入中、小學之我見



我覺得含糖飲料不應該被禁止進入中小學。因為糖分對人體是很重要的，如果學生運動後或是沒吃早餐，血糖太低可能會昏倒，這樣很危險。



而且有些學生早上趕著上學，沒時間吃早餐就來學校了。這時候如果能喝點含糖飲料，至少可以補充一點能量。因為大腦需要糖分才能運作，沒有糖分的話上課會沒精神，也會注意力不集中。



但是喝太多含糖飲料也不好，會得糖尿病和蛀牙。所以學生要適量飲用，不能喝太多。不過我還是覺得學校應該要賣含糖飲料，這樣學生需要的時候才有得喝。



總之，雖然含糖飲料有壞處，但是為了學生的安全，我反對禁止含糖飲料進入中小學。這樣才能確保學生在需要的時候可以補充糖分，不會因為血糖過低而發生危險。",1,1,1,1,1,5
