題目,作答,立意,結構,修辭,敘述,啟發,總分
"    我覺得童年是一種氣味的記憶。
    我的童年，有許多果樹氣味的記憶。夏天暑熱的午後，廟埕後有一棵巨大的龍眼樹。我從小學翻牆出來，背著書包，爬上龍眼樹，躲在密密的枝葉裡。外面日光葉影搖晃，隱約聽見老師或母親尋來，在樹下叫著我的名字，但那呼喚的聲音，被蟬聲的高音淹沒了。我一動不動，找到一處適合蜷窩身體的枝椏，好像變成樹的一部分，而那時，龍眼樹密密的甜熟的氣味就包圍著我。我閉起眼睛，好像在假寐，也像在作夢，夢裡一串一串纍纍的龍眼，招來許多蜜蜂果蠅。我童年的夢，很甜很香，好像一整個夏天都窩在那棵樹上，包圍在濃郁的氣味裡做了一個醒不來的夢。（改寫自蔣勳《給青年藝術家的信》）
    生活中充斥各種氣味。氣味透過嗅覺傳遞，喚起人們的記憶和感受，一如文中龍眼樹甜熟的氣味喚起作者的童年記憶。請以「花草樹木的氣味記憶」為題，寫一篇文章，書寫你熟悉的花草樹木的氣味，及其所召喚的記憶和感受。

文長至少600字。

","花草樹木的氣味記憶



我最喜歡的花香是玉蘭花的香味。記得有一次和爸爸坐車出去玩的時候，在路上遇到一個賣玉蘭花的老阿姨。那個阿姨看起來很辛苦，駝著背還要戴口罩，爸爸就買了一束玉蘭花放在車上。



從那天開始，我每次坐爸爸的車都可以聞到玉蘭花的香味。不管是上學、放學還是去補習班，車裡都有玉蘭花的味道。假日出去玩的時候也是一樣。我覺得玉蘭花的香味很特別，讓我想到很多和爸爸一起出去玩的回憶。



後來玉蘭花慢慢變乾了，香味也不見了。爸爸也變老了，沒有以前那麼有精神可以開很久的車帶我們出去玩。我覺得很可惜，因為以前和爸爸一起出去玩的時候真的很開心。



現在每次聞到玉蘭花的香味，我就會想起以前和爸爸一起出去玩的時候。我覺得要好好珍惜和家人在一起的時間，因為時間過得很快，有些事情錯過了就不會再回來了。",2,2,1,2,2,9
