題目,作答,立意,結構,修辭,敘述,啟發,總分
"林語堂說：「（我）所愛的不是晚秋，是初秋，那時暄氣初消，月正圓，蟹正肥，桂花皎潔，也未陷入懍烈蕭瑟氣態，這是最值得賞樂的。」楊牧則是在美麗的春天世界裡，萬物復甦，卻聽到「一片樹葉提早轉黃的聲音。」（〈夭〉）普魯斯特（Proust, M.）在《追憶逝水年華》中說：「一小時不僅僅是一個小時，它是一只充滿香氣、聲響、念頭和氛圍的花缽」，說明時間的認知與感官知覺及感受有關。請以「季節的感思」為題，寫一篇文章，描寫你對季節的感知經驗，並抒發心中的感受與領會。
文長至少600字。

","季節的感思



我住在南部，這裡沒有下雪，只有熱熱的太陽和偶爾的雨天。每天都過得差不多，日子一天一天過去，我也不太能感覺到季節的變化。



夏天的時候最熱，太陽一直掛在天上，照得人都快受不了。我每天忙著上課、做功課，日子過得很快，但是又覺得很慢。有時候下雨的時候，會讓我覺得舒服一點，不會那麼熱。



雨下個不停的時候，我就會想很多事情。想著自己的煩惱，想著未來要怎麼辦。雨水打在地上，好像在跟我說話一樣。雖然有很多煩惱，但是我還是希望太陽趕快出來，這樣心情會比較好。



現在又到了夏天，天氣還是一樣熱。我的心情沒有什麼變化，只是希望季節可以快點改變，帶來一些不一樣的感覺。但是日子還是這樣一天一天過去，我也不知道明天會怎麼樣。",1,1,1,1,1,5
