題目,作答,立意,結構,修辭,敘述,啟發,總分
"二十一世紀資訊量以驚人的速度暴增，有人認為網路資訊易於取得，會使記憶力與思考力衰退，不利於認知學習；也有人視網際網路為人類的外接大腦記憶體，意味著我們毋須記憶大量知識，可以專注在更重要、更有創造力的事物上。對於以上兩種不同的觀點，你的看法為何？請以「網海浮沉之我思」為題，結合自己的相關經驗，探討創造力與思考力之間的關係。
文長至少600字。

","網海浮沉之我思



現在的網路真的很方便，想要什麼資料都可以很快找到。但是我覺得這樣不太好，因為大家都變得很懶惰，什麼都不想記，什麼都不想思考。



我自己在高中的時候，也常常用網路查資料。因為要交很多報告，所以都會上網找資料。但是後來發現，我都沒有真的記住那些內容，只是複製貼上而已。而且網路上的資料也不知道是不是真的，我都沒有去查證。



不過網路也有好處，因為可以讓我們省很多時間。像我以前做美勞作業的時候，就會上網查怎麼做。這樣就不用自己去試很多次，可以把時間用在做作品上面。



我覺得網路雖然很方便，但是我們不能太依賴它。如果都靠網路的話，我們的腦袋就會變得很笨。所以我們要學會正確使用網路，不要讓它影響我們的思考能力。



網路就像是一把雙面刀，好處壞處都有，重要的是我們要懂得怎麼用。希望大家可以好好想一想，不要被網路控制了我們的生活。",2,1,2,2,1,8
