題目,作答,立意,結構,修辭,敘述,啟發,總分
"關於地球的記憶
被文字固禁在課本裡
我們的筆尖游走在山脈和海洋
翻譯每片花瓣的嬌嫩和露水的清新
所有的言語 答案
都靜放在我們的課本裡
等待我們翻起這一切的序幕（節錄自薛憶婷〈我們的課本〉）

    以上這首詩，從課本啟動天馬行空的遐想，瞥見知識豐富的樣貌。科學頑童費曼（Richard P. Feynman）曾說觀察轉動的餐盤，讓他得到很大的啟發，領略了興之所至的樂趣。物理課可讓我們發現萬物運行的迷人，生物課帶領我們進入細胞核遊歷，外語課讓我們聽見世界不同的文化。國文課堂上「採菊東籬下，悠然見南山」或「輕羅小扇撲流螢」，詩中情境也往往能讓人神遊於現實之外。過往的課程內容，是否曾經點燃你對知識的熱情？打開課本時，不知能否如〈我們的課本〉所述，揭開知識想像的序幕。
    若能從不同角度切入課本，進入知識的想像，或許可以讓課本帶領我們經歷驚奇的旅程。請以「當我打開課本」為題，寫一篇文章，敘述任一學科課本對你的意義，書寫你探索課本內容、知識的經驗與體會。
文長至少600字。


","當我打開課本



我最喜歡的是歷史課本，因為裡面有很多有趣的故事。每次打開課本，就可以看到很多以前發生的事情，像是戰爭啊、皇帝的故事啊，都很有趣。



歷史課本讓我知道以前的人過著什麼樣的生活。從很久以前的原始人，到現在的科技時代，人類真的進步了很多。我覺得很神奇，為什麼人類可以發明這麼多東西。像是大航海時代，人類坐著船去探險，發現了新的地方，這些故事都讓我覺得很厲害。



不過有時候看歷史課本也會覺得很難，因為要記很多年代和人名。而且有些內容很無聊，都是在講政治的事情。但是我還是會努力讀，因為老師說讀歷史可以讓我們學到很多東西。



希望以後可以學到更多有趣的歷史故事，這樣上課就不會那麼無聊了。",2,1,1,2,1,7
