題目,作答,立意,結構,修辭,敘述,啟發,總分
"    我覺得童年是一種氣味的記憶。
    我的童年，有許多果樹氣味的記憶。夏天暑熱的午後，廟埕後有一棵巨大的龍眼樹。我從小學翻牆出來，背著書包，爬上龍眼樹，躲在密密的枝葉裡。外面日光葉影搖晃，隱約聽見老師或母親尋來，在樹下叫著我的名字，但那呼喚的聲音，被蟬聲的高音淹沒了。我一動不動，找到一處適合蜷窩身體的枝椏，好像變成樹的一部分，而那時，龍眼樹密密的甜熟的氣味就包圍著我。我閉起眼睛，好像在假寐，也像在作夢，夢裡一串一串纍纍的龍眼，招來許多蜜蜂果蠅。我童年的夢，很甜很香，好像一整個夏天都窩在那棵樹上，包圍在濃郁的氣味裡做了一個醒不來的夢。（改寫自蔣勳《給青年藝術家的信》）
    生活中充斥各種氣味。氣味透過嗅覺傳遞，喚起人們的記憶和感受，一如文中龍眼樹甜熟的氣味喚起作者的童年記憶。請以「花草樹木的氣味記憶」為題，寫一篇文章，書寫你熟悉的花草樹木的氣味，及其所召喚的記憶和感受。

文長至少600字。

","花草樹木的氣味記憶



我小時候住在鄉下，每天都會聞到稻米的味道。稻米的味道不像其他植物那麼香，但是我很喜歡這個味道。



每年收割稻子的時候，稻香最濃。割稻機在田裡工作，我就站在旁邊看。我覺得很開心，但是等到休耕的時候就聞不到稻香了，我就會很難過。



我小時候常常和朋友一起去稻田玩。我們在田埂上跑來跑去，有時候會不小心踩壞稻子，被農夫罵。玩累了就坐在田邊，把腳放在水溝裡。風吹過來的時候，可以聞到稻子的味道。稻穗很重，會彎下來，看起來很可愛。



我覺得童年就是稻香的味道。現在長大了，已經很少聞到稻香了，但是我還是記得這個味道。",1,1,1,1,1,5
