題目,作答,立意,結構,修辭,敘述,啟發,總分
"甲
(陶潛)為彭澤令。不以家累自隨，送一力給其子，書曰：「汝旦夕之費，自給為難。今遣此力，助汝薪水（打柴汲水）之勞。此亦人子也，可善遇之。」(《南史．隱逸．陶潛傳》)
乙
飯後，眾人各自有事離去，留下貞觀靜坐桌前獃想。她今日的這番感慨，實是前未曾有的。
阿啟伯摘瓜，乃她親眼所見。今早，她突發奇想，陪著外公去巡魚塭，回來時，祖孫二人，都在門口停住了，因為後門虛掩，阿啟伯拿著菜刀，正在棚下摘瓜，並未發覺他們，祖孫二個都閃到門背後。貞觀當時是真愣住了，在那種情況下，是前進呢？抑是後退？她不能很快作選擇。然而這種遲疑也只有幾秒鐘，她一下就被外公拉到門後，正是屏息靜氣時，老人家又帶了她拐出小巷口，走到前街來。
貞觀人到了大路上，心下才逐漸明白：外公躲那人的心，竟比那偷瓜的人所做的遮遮掩掩更甚！貞觀以為懂得了外公的心意：他怕阿啟伯當下撞見自己的那種難堪。事實上，他還有另一層深意，貪當然不好，而貧的本身沒有錯。外公不以阿啟伯為不是，是知道他家中十口，有菜就沒飯，有飯就沒菜。(改寫自蕭麗紅《千江有水千江月》)
陶潛或者外公對他人的善意，你可能也曾見聞或經歷過，請以「溫暖的心」為題，寫一篇文章，分享你的經驗及體會。
文長至少600字。

","溫暖的心



我覺得溫暖的心就是幫助別人的心。每個人都需要別人的關心和幫助，但是現在的社會好像越來越冷漠了。以前的人看到別人有困難都會去幫忙，現在的人卻都不理別人。



我看過很多溫暖的例子，像是幫老爺爺奶奶過馬路，或是陪他們聊天。還有去幼兒園當志工，陪小朋友玩遊戲。這些都是很簡單的事情，但是可以讓別人感受到溫暖。



不過有些人不喜歡別人關心他，想要一個人靜一靜。這時候我們就要給他一些空間，不要一直煩他。這樣才不會造成不開心或是吵架。



現在的社會很多人都很忙，沒有時間關心別人。老人家和小孩子都很寂寞，需要別人陪伴。但是大家都說沒時間，或是怕被騙，所以都不願意幫助別人。我覺得這樣很不好，我們應該要多關心別人，讓社會變得更溫暖。",2,2,1,2,1,8
