題目,作答,立意,結構,修辭,敘述,啟發,總分
"甲
我們的感情是冰箱，打開來看，明亮可喜，關起門後是嗡嗡的黑暗。什麼都不會壞掉，埋在霜雪的角落。我們的感情是冰箱，有時很滿有時很空，一切都可以保存很久，冷冷的，可是很新鮮，看起來都像昨天。（柯裕棻〈冰箱〉）
乙
農曆年前我媽換了新冰箱。雖然舊的其實也還好，十數年如一日修長高冷玉面如銀，該凍肉時凍肉，該製冰時製冰，門沒關緊永遠忠實地響警告聲。燈泡甚至沒有壞過一次。只是我媽長期嫌它不得力，冷藏室裝一隻生雞一鍋燉肉就周轉不過來，胃口那樣地小，像一個節食的人，廚房裡最不需要的就是一個節食的人。我常常看見她蹲在那兒，腳邊圍滿生鮮，鬥盡心智排列組合，在最有限空間裡籌備出最大的寬容，冰箱門好像看牙醫的嘴開太久不斷嗶嗶叫，簡直像在哭了。感覺兩方都十分苦惱。
我認為運用如常的器物毋需特別汰換，也主張大家都不妨少吃一點。顯然我媽不作此想。她說：「總之我就是想要一臺大冰箱啦。」但如此一來，我反倒領悟了，這完全是某商品宣傳詞「豈止於大」（Bigger than bigger）的道理：一座夠大的新冰箱也豈止於冰箱，它是一種想像，一種意境，一種可能性，它富有召喚家庭生活最好願景的潛力。（改寫自黃麗群〈如果在冬天，一座新冰箱〉）
    冰箱可以很滿，可以很空，當你打開冰箱，通常想尋找什麼？又看見什麼？假如有一座屬於你的新冰箱，你會有怎樣的想像？冰藏什麼（虛實皆可）會符合你所期待的美好生活？請以「如果我有一座新冰箱」為題，撰文一篇，
文長至少600字。

","如果我有一座新冰箱



我家最近買了一台新冰箱，因為舊的冰箱壞掉了。新冰箱是黑色的，看起來很漂亮，而且很大，可以放很多東西。



這台冰箱分成冷藏室和冷凍室兩個部分。冷藏室可以放水果和蔬菜，冷凍室可以放肉類和冰淇淋。冰箱裡面有燈，晚上找東西的時候很方便。它也很省電，不會花太多錢。



我很喜歡這台新冰箱，因為它很安靜，不會發出很大的聲音。以前的冰箱很吵，現在好多了。有了新冰箱之後，我可以把食物放在裡面，不用擔心會壞掉。



我覺得新冰箱讓我的生活變得比較方便。我可以買比較多的食物回來，也可以請朋友來家裡玩。大家都說我家的新冰箱很好用。



我希望這台冰箱可以用很久，這樣我就可以一直把食物放在裡面，不用擔心會壞掉了。有了新冰箱真的很好，讓我的生活變得更好了。",1,1,1,1,1,5
