題目,作答,立意,結構,修辭,敘述,啟發,總分
"關於地球的記憶
被文字固禁在課本裡
我們的筆尖游走在山脈和海洋
翻譯每片花瓣的嬌嫩和露水的清新
所有的言語 答案
都靜放在我們的課本裡
等待我們翻起這一切的序幕（節錄自薛憶婷〈我們的課本〉）

    以上這首詩，從課本啟動天馬行空的遐想，瞥見知識豐富的樣貌。科學頑童費曼（Richard P. Feynman）曾說觀察轉動的餐盤，讓他得到很大的啟發，領略了興之所至的樂趣。物理課可讓我們發現萬物運行的迷人，生物課帶領我們進入細胞核遊歷，外語課讓我們聽見世界不同的文化。國文課堂上「採菊東籬下，悠然見南山」或「輕羅小扇撲流螢」，詩中情境也往往能讓人神遊於現實之外。過往的課程內容，是否曾經點燃你對知識的熱情？打開課本時，不知能否如〈我們的課本〉所述，揭開知識想像的序幕。
    若能從不同角度切入課本，進入知識的想像，或許可以讓課本帶領我們經歷驚奇的旅程。請以「當我打開課本」為題，寫一篇文章，敘述任一學科課本對你的意義，書寫你探索課本內容、知識的經驗與體會。
文長至少600字。


","當我打開課本



我覺得微積分課本很難，裡面有很多看不懂的符號和公式。剛開始學的時候，我都不知道這些東西要幹嘛用的，只能一直背公式，然後照著老師教的方法做題目。



極限這個東西最難懂了，我每次看到極限符號就頭痛。雖然老師說極限很重要，可以幫我們了解很多事情的變化，但是我還是不太明白。我只知道要把數字代進去算，算出來的答案要跟老師說的一樣。



後來學到導數，就是要算斜率和變化的速度。我知道開車的時候速度會變快變慢，這就跟導數有關係。不過我還是不太會算，每次考試都要花很多時間想。



積分更難了，老師說可以用來算面積，但是那些符號和公式實在太複雜了。我只能照著課本的例題做，有時候還是會算錯。



雖然微積分很難，但是我知道這是很重要的科目。希望以後可以慢慢學會，不要每次考試都考不好。現在我打開課本的時候，還是會覺得很緊張，因為不知道要怎麼解題目。",2,2,1,2,1,8
