題目,作答,立意,結構,修辭,敘述,啟發,總分
"二十一世紀資訊量以驚人的速度暴增，有人認為網路資訊易於取得，會使記憶力與思考力衰退，不利於認知學習；也有人視網際網路為人類的外接大腦記憶體，意味著我們毋須記憶大量知識，可以專注在更重要、更有創造力的事物上。對於以上兩種不同的觀點，你的看法為何？請以「網海浮沉之我思」為題，結合自己的相關經驗，探討創造力與思考力之間的關係。
文長至少600字。

","網海浮沉之我思



現在的網路發展很快，每個人都在用網路。我覺得網路雖然方便，但是也有不好的地方。因為網路讓我們變得很懶惰，什麼都不想記，什麼都要查。



我自己也常常用網路，像是做報告的時候都會上網查資料。網路上的資料很多，可以讓我們找到想要的東西。但是我覺得這樣不太好，因為我們都不用自己的腦袋想。以前的人都要自己想辦法，現在的人都只會用網路。



牛頓說過要站在巨人的肩膀上看世界。我覺得這句話很有道理，因為我們可以學習別人的經驗。但是現在的人都太依賴網路了，什麼都要查，這樣對我們的記憶力不好。



所以我認為網路雖然方便，但是我們還是要多用自己的腦袋想事情。不能什麼都靠網路，這樣對我們的思考能力不好。我們要學會平衡使用網路，這樣才是對的。",2,1,2,1,1,7
