題目,作答,立意,結構,修辭,敘述,啟發,總分
"二十一世紀資訊量以驚人的速度暴增，有人認為網路資訊易於取得，會使記憶力與思考力衰退，不利於認知學習；也有人視網際網路為人類的外接大腦記憶體，意味著我們毋須記憶大量知識，可以專注在更重要、更有創造力的事物上。對於以上兩種不同的觀點，你的看法為何？請以「網海浮沉之我思」為題，結合自己的相關經驗，探討創造力與思考力之間的關係。
文長至少600字。

","網海浮沉之我思



網路在現代生活中很重要，每天都有很多資訊出現。有人說網路不好，會讓人變笨，有人說網路很好，可以幫助我們記東西。我覺得網路還是有用的。



我每天都會用網路，可以查很多東西，像是功課啊、看影片啊都可以。網路上什麼都有，想找什麼都找得到。我覺得這樣很方便，不用自己想太多。



但是網路也有不好的地方，因為太方便了，所以很多人都直接抄答案，都不會自己想。這樣子用久了可能會忘記怎麼思考，變得都只會查網路。



我自己也常常這樣，有問題就直接查網路。雖然可以很快找到答案，但是好像真的比較少自己動腦想了。這樣不太好，應該要多想一下。



總之網路是好是壞，要看我們怎麼用。用得好可以幫助我們，用不好可能會讓我們變笨。希望大家可以好好使用網路。",1,1,1,1,1,5
