題目,作答,立意,結構,修辭,敘述,啟發,總分
"二十一世紀資訊量以驚人的速度暴增，有人認為網路資訊易於取得，會使記憶力與思考力衰退，不利於認知學習；也有人視網際網路為人類的外接大腦記憶體，意味著我們毋須記憶大量知識，可以專注在更重要、更有創造力的事物上。對於以上兩種不同的觀點，你的看法為何？請以「網海浮沉之我思」為題，結合自己的相關經驗，探討創造力與思考力之間的關係。
文長至少600字。

","網海浮沉之我思



現在的網路真的很方便，大家都在用網路找資料。有人說網路會讓人變笨，也有人說網路很好用，可以讓我們不用記那麼多東西。我覺得網路是好的，因為可以讓我們做更多事情。



我自己很常用網路，像是查資料、看影片都很方便。網路上有很多東西可以參考，像是做報告的時候可以找到很多範例。我覺得這樣可以讓我們做出更好的東西，因為可以看別人怎麼做。



但是網路也有不好的地方，因為很多人都直接抄答案，不會自己想。這樣子久了以後，可能真的會變笨，因為都不用動腦。而且網路上的東西也不一定對，有時候會看到錯誤的資料。



我覺得網路雖然方便，但是還是要自己會思考才行。不能什麼都靠網路，要不然以後可能會變成機器人一樣，都不會想事情。所以我們要好好使用網路，不要被網路控制了我們的大腦。",2,1,2,2,1,8
