題目,作答,立意,結構,修辭,敘述,啟發,總分
"    看到山上那麼多參天大樹時，會勾起我的惻隱之心。在無法順暢呼吸的空間裡，樹木之間為了生存必須展開激烈的競爭。為了能多接受一些陽光，它們只能拼命向上生長。
但是，只為生存而競爭的森林卻漸次死亡，因為陽光無法到達地面，所以溫度不夠高，無法讓幼小的生命萌芽。小樹和花、草，以及與它們一起生活的小昆蟲沒有生存的空間。雖然表面上看起來非常完美，但這種森林其實與沒有希望的不孕之地無異。
根據我的經驗，密集栽種的樹苗體型壯大數十倍時，就需要開始砍樹，否則樹木會抱怨空間太窄，活不下去。要想確保樹木能充分接受陽光照射的空間，就必須做出犧牲。因此，幾年期間強行進行砍伐，樹木間距剛開始時是一公尺，現已擴大到七公尺。也就是說，即使是粗略估算，也可知七棵樹中有六棵為之消失。
森林要想成為孕育新生命的希望之地，就需要有縫隙。如果樹木壽命結束或因為意外災害而倒下，該位置就會產生空間，那麼，溫暖的陽光就會照射進來，被陽光照射的地面混雜著前一年秋天凋落的樹葉，於是積聚起能夠孕育新生命的養分。因此，樹木的縫隙，既是結束和開始共存的空間，也是由缺乏轉化為希望的空間。（改寫自禹鐘榮著、盧鴻金譯《樹木教我的人生課》）
    根據上文所述，為什麼森林需要縫隙？由此聯想，人生是否也需要縫隙？請以「縫隙的聯想」為題，寫一篇文章，結合生活經驗或見聞，書寫你的感思與體悟。
文長至少600字。


","縫隙的聯想



漫步在蒼鬱的森林中，我常為眼前的景象所震懾：參天的巨木直插雲霄，枝葉交織成一片綠色的穹頂。然而，當我佇足細觀，卻發現在這看似生機盎然的表象下，地面竟是一片死寂。這份矛盾的景象，總讓我不禁思索生命與空間的關係。



大自然的智慧往往超乎人類的想像。當一棵古木轟然倒下，看似是生命的終結，實則開啟了新生的契機。在這道縫隙中，陽光得以穿透重重枝葉，灑落在久未見光的土地上。漸漸地，幼苗破土而出，野花綻放，昆蟲振翅，一個嶄新的生態系統在這片天光下悄然成形。這便是大自然的奧妙：生命需要適當的空間才能綻放光彩。



這樣的啟示讓我聯想到現代人的處境。在這個競爭激烈的社會中，我們就像那些拼命向上生長的樹木，為了追逐成功的陽光，不斷地擠壓自己的生存空間。工作、學業、人際關係像是層層疊疊的枝葉，遮蔽了我們喘息的空間。許多人終日奔波，被壓力和期待層層包裹，漸漸失去了生命的色彩與活力。



然而，就如同森林需要縫隙來維持生態平衡，人生也需要適時的空白與停頓。這些縫隙，或許是一個短暫的假期，或許是一段獨處的時光，又或許是放下手機專注於當下的片刻。在這些縫隙中，我們得以讓心靈透透氣，讓思緒沉澱，讓創意萌發。



我的一位摯友曾是工作狂，直到一場突如其來的病痛迫使他放慢腳步。在被迫休養的日子裡，他重拾兒時熱愛的繪畫，意外發現這段「被迫的縫隙」竟成為他人生的轉捩點。現在的他，在工作之餘會刻意留白，讓生活節奏更具韻律，反而在各方面都有更好的表現。



縫隙不是虛無，而是孕育新生的搖籃。就像森林中的空地讓幼苗有機會向陽生長，人生中的停頓與空白同樣珍貴。在這個永不停歇的時代，懂得為自己創造縫隙，或許才是維持生命永續的智慧。",5,5,4,4,5,23
