題目,作答,立意,結構,修辭,敘述,啟發,總分
"    我覺得童年是一種氣味的記憶。
    我的童年，有許多果樹氣味的記憶。夏天暑熱的午後，廟埕後有一棵巨大的龍眼樹。我從小學翻牆出來，背著書包，爬上龍眼樹，躲在密密的枝葉裡。外面日光葉影搖晃，隱約聽見老師或母親尋來，在樹下叫著我的名字，但那呼喚的聲音，被蟬聲的高音淹沒了。我一動不動，找到一處適合蜷窩身體的枝椏，好像變成樹的一部分，而那時，龍眼樹密密的甜熟的氣味就包圍著我。我閉起眼睛，好像在假寐，也像在作夢，夢裡一串一串纍纍的龍眼，招來許多蜜蜂果蠅。我童年的夢，很甜很香，好像一整個夏天都窩在那棵樹上，包圍在濃郁的氣味裡做了一個醒不來的夢。（改寫自蔣勳《給青年藝術家的信》）
    生活中充斥各種氣味。氣味透過嗅覺傳遞，喚起人們的記憶和感受，一如文中龍眼樹甜熟的氣味喚起作者的童年記憶。請以「花草樹木的氣味記憶」為題，寫一篇文章，書寫你熟悉的花草樹木的氣味，及其所召喚的記憶和感受。

文長至少600字。

","花草樹木的氣味記憶



每當春風拂過藥草園，那獨特的中藥香總能喚醒我深藏心底的思念。記憶中的奶奶，是一位懂得用草木療癒人心的智者。她的愛，摻雜在每一味藥材的氣息裡，縈繞不去。



奶奶的藥園是我童年最深刻的記憶場景。在那裡，她種植了當歸、枸杞、菊花等各式藥材。每到採收時節，她總是小心翼翼地採摘，彷彿在對待珍寶。我還記得，當歸特有的溫潤香氣，混合著泥土的芬芳；枸杞葉片間透出的清新氣息，還有菊花綻放時的淡雅芳香。這些氣味交織在一起，構築成我童年最真實的味覺圖景。



青春期的我，對奶奶的良苦用心總是難以理解。每當聽見她呼喚我去喝藥，我就像受驚的小鳥，總想躲得遠遠的。廚房裡，十幾種藥材在砂鍋中慢慢熬煮，散發出濃郁的藥香。那氣味穿透整個屋子，也穿透了我的抗拒心理。奶奶總是耐心地告訴我：「人生如藥，苦盡甘來。能耐得住苦，才能成就大器。」現在想來，這何嘗不是她用草木智慧傳授給我的人生哲理？



如今的我，每次經過中藥房，那熟悉的藥材香氣總能勾起對奶奶的思念。曾經覺得難以下嚥的苦味，竟成了最珍貴的回憶。後來才知道，那些藥材都是奶奶親手栽種或上山採集的。她用最純粹的心意，為我準備最好的藥材，釀造最珍貴的愛。



歲月流轉，奶奶的身影已然遠去，但她留下的這份草木氣息卻永遠留存在我的記憶裡。現在，每當我聞到相似的藥香，都能感受到奶奶的愛依然溫暖如初。那些充滿智慧的話語，那些蘊含深情的叮嚀，都化作了最動人的氣味記憶，永遠縈繞在我心間。",5,4,5,4,5,23
