題目,作答,立意,結構,修辭,敘述,啟發,總分
"    我覺得童年是一種氣味的記憶。
    我的童年，有許多果樹氣味的記憶。夏天暑熱的午後，廟埕後有一棵巨大的龍眼樹。我從小學翻牆出來，背著書包，爬上龍眼樹，躲在密密的枝葉裡。外面日光葉影搖晃，隱約聽見老師或母親尋來，在樹下叫著我的名字，但那呼喚的聲音，被蟬聲的高音淹沒了。我一動不動，找到一處適合蜷窩身體的枝椏，好像變成樹的一部分，而那時，龍眼樹密密的甜熟的氣味就包圍著我。我閉起眼睛，好像在假寐，也像在作夢，夢裡一串一串纍纍的龍眼，招來許多蜜蜂果蠅。我童年的夢，很甜很香，好像一整個夏天都窩在那棵樹上，包圍在濃郁的氣味裡做了一個醒不來的夢。（改寫自蔣勳《給青年藝術家的信》）
    生活中充斥各種氣味。氣味透過嗅覺傳遞，喚起人們的記憶和感受，一如文中龍眼樹甜熟的氣味喚起作者的童年記憶。請以「花草樹木的氣味記憶」為題，寫一篇文章，書寫你熟悉的花草樹木的氣味，及其所召喚的記憶和感受。

文長至少600字。

","花草樹木的氣味記憶



我小時候住在鄉下，常常聞到青草的味道。這種味道不是香的也不是臭的，就是一種特別的氣味。在工廠旁邊也能聞到這種味道。



我小時候每天放學都要跟著祖父上山，那時候覺得很無聊，因為不能看電視，只能在山上玩。我那時候不喜歡青草的味道，因為聞到這個味道就代表要去山上做事。



後來我去城市讀高中，發現城市裡的人都很冷漠，大家都在看手機。我因為課業壓力很大，所以常常生氣。有一天我迷路了，走到一個很多雜草的地方，聞到青草味道讓我想起小時候，心情就變好了。



青草的味道雖然不像花香那麼明顯，但是可以讓人變得平靜。這個味道讓我想起了童年的回憶，也讓我在城市生活中找到了一點安慰。",1,1,1,1,1,5
