題目,作答,立意,結構,修辭,敘述,啟發,總分
"二十一世紀資訊量以驚人的速度暴增，有人認為網路資訊易於取得，會使記憶力與思考力衰退，不利於認知學習；也有人視網際網路為人類的外接大腦記憶體，意味著我們毋須記憶大量知識，可以專注在更重要、更有創造力的事物上。對於以上兩種不同的觀點，你的看法為何？請以「網海浮沉之我思」為題，結合自己的相關經驗，探討創造力與思考力之間的關係。
文長至少600字。

","網海浮沉之我思



現在的生活離不開網路，從以前的3G到現在的5G，還有AI的發展，這些科技一直在進步。我覺得網路帶給我們很多改變，有好的也有不好的。



網路讓我們的生活變得很方便，不用再看報紙找資料，只要用手機或電腦就可以查到很多東西。我們可以很容易找到想要的資訊，學習也變得比較輕鬆。但是網路也有不好的地方，就是會有安全的問題。



在網路上要小心，因為很容易被偷個人資料。現在資訊傳得很快，好的壞的假的都有，雖然很容易得到這些資訊，但是別人也很容易得到我們的資料。如果有壞人拿到我們的資料，就會很麻煩。



我覺得我們要學會思考，不能看到什麼都相信。要想一想這些資訊是不是真的，是不是安全的。這樣才不會被騙，也不會把假消息傳給別人。我們要保護自己的資料安全，這樣才能安心使用網路。



所以網路雖然方便，但是我們還是要小心使用。要記得思考，不要什麼都相信，這樣才能安全地使用網路。",2,2,1,2,1,8
