題目,作答,立意,結構,修辭,敘述,啟發,總分
"甲
(陶潛)為彭澤令。不以家累自隨，送一力給其子，書曰：「汝旦夕之費，自給為難。今遣此力，助汝薪水（打柴汲水）之勞。此亦人子也，可善遇之。」(《南史．隱逸．陶潛傳》)
乙
飯後，眾人各自有事離去，留下貞觀靜坐桌前獃想。她今日的這番感慨，實是前未曾有的。
阿啟伯摘瓜，乃她親眼所見。今早，她突發奇想，陪著外公去巡魚塭，回來時，祖孫二人，都在門口停住了，因為後門虛掩，阿啟伯拿著菜刀，正在棚下摘瓜，並未發覺他們，祖孫二個都閃到門背後。貞觀當時是真愣住了，在那種情況下，是前進呢？抑是後退？她不能很快作選擇。然而這種遲疑也只有幾秒鐘，她一下就被外公拉到門後，正是屏息靜氣時，老人家又帶了她拐出小巷口，走到前街來。
貞觀人到了大路上，心下才逐漸明白：外公躲那人的心，竟比那偷瓜的人所做的遮遮掩掩更甚！貞觀以為懂得了外公的心意：他怕阿啟伯當下撞見自己的那種難堪。事實上，他還有另一層深意，貪當然不好，而貧的本身沒有錯。外公不以阿啟伯為不是，是知道他家中十口，有菜就沒飯，有飯就沒菜。(改寫自蕭麗紅《千江有水千江月》)
陶潛或者外公對他人的善意，你可能也曾見聞或經歷過，請以「溫暖的心」為題，寫一篇文章，分享你的經驗及體會。
文長至少600字。

","溫暖的心



從小到大，老師和父母都教我們要當個好人，要對別人好。每天跟人打招呼說早安，說再見，這些都是我們學到的禮貌。我覺得這些都是為了讓大家可以好好相處。



我以前在高中的時候有一段不太好的時間，那時候心情很不好，每天都很難過。還好我遇到一個很好的老師，就是我的班導師。她對我很好，我有什麼事情都可以跟她說。這讓我想到題目裡面說的陶潛和外公，他們也是這樣對別人好。



我覺得每個人都會遇到困難，所以我們應該要幫助別人。雖然我們不一定能完全了解別人的困難，但是我們可以對他們好一點。這樣做不只可以幫助別人，自己也會很開心。看到別人因為我們的幫助而笑，這種感覺很好。



每個人家裡都有自己的困難，我們不需要知道全部的原因，只要記得要對別人好就可以了。以後我也要繼續保持這樣的心情，幫助需要幫助的人。",1,1,1,1,1,5
