題目,作答,立意,結構,修辭,敘述,啟發,總分
"林語堂說：「（我）所愛的不是晚秋，是初秋，那時暄氣初消，月正圓，蟹正肥，桂花皎潔，也未陷入懍烈蕭瑟氣態，這是最值得賞樂的。」楊牧則是在美麗的春天世界裡，萬物復甦，卻聽到「一片樹葉提早轉黃的聲音。」（〈夭〉）普魯斯特（Proust, M.）在《追憶逝水年華》中說：「一小時不僅僅是一個小時，它是一只充滿香氣、聲響、念頭和氛圍的花缽」，說明時間的認知與感官知覺及感受有關。請以「季節的感思」為題，寫一篇文章，描寫你對季節的感知經驗，並抒發心中的感受與領會。
文長至少600字。

","季節的感思



冬天來了，天氣變冷了。我小時候很喜歡冬天，因為覺得冬天會下雪，可是台灣沒有下雪，所以我很失望。



我以前不喜歡冬天，因為冬天沒有下雪。我小時候想當英雄，想在雪地裡救人，但是這只是小孩子的想法而已。後來我長大了，才知道雖然沒有雪，但是人們的愛心可以幫助別人。



冬天很冷，常常會有災難發生。但是有很多人會去幫助別人，有的人捐錢，有的人捐東西。這些幫助可以減少傷亡，也可以預防災害再發生。這就是人間最美的事情。



現在的我已經不是小時候那個想當英雄的小孩了。我有了愛心，這就是最重要的力量。我會努力幫助別人，這樣就可以當一個英雄了。",1,1,1,1,1,5
