題目,作答,立意,結構,修辭,敘述,啟發,總分
"    我覺得童年是一種氣味的記憶。
    我的童年，有許多果樹氣味的記憶。夏天暑熱的午後，廟埕後有一棵巨大的龍眼樹。我從小學翻牆出來，背著書包，爬上龍眼樹，躲在密密的枝葉裡。外面日光葉影搖晃，隱約聽見老師或母親尋來，在樹下叫著我的名字，但那呼喚的聲音，被蟬聲的高音淹沒了。我一動不動，找到一處適合蜷窩身體的枝椏，好像變成樹的一部分，而那時，龍眼樹密密的甜熟的氣味就包圍著我。我閉起眼睛，好像在假寐，也像在作夢，夢裡一串一串纍纍的龍眼，招來許多蜜蜂果蠅。我童年的夢，很甜很香，好像一整個夏天都窩在那棵樹上，包圍在濃郁的氣味裡做了一個醒不來的夢。（改寫自蔣勳《給青年藝術家的信》）
    生活中充斥各種氣味。氣味透過嗅覺傳遞，喚起人們的記憶和感受，一如文中龍眼樹甜熟的氣味喚起作者的童年記憶。請以「花草樹木的氣味記憶」為題，寫一篇文章，書寫你熟悉的花草樹木的氣味，及其所召喚的記憶和感受。

文長至少600字。

","花草樹木的氣味記憶



我小時候最喜歡的就是奶奶家的桂花香。每次放假去奶奶家，都可以聞到很香的桂花味道，因為奶奶在陽台種了很多桂花。



我每天都睡到中午才起床，風吹進來的時候都會有桂花香，讓我很開心。奶奶都會準備很多好吃的東西給我吃，然後跟我說今天要做什麼。我覺得那時候真的很幸福。



我最喜歡跟奶奶一起照顧桂花。奶奶會教我怎麼澆水，還有怎麼讓花長得好。我覺得澆花的時候很舒服，因為可以聞到桂花香，也可以忘記讀書的壓力。



現在我長大了，比較少回奶奶家。有時候晚上讀書讀得很累的時候，好像可以聞到桂花香，但是我家沒有種桂花。我想是因為我很想念奶奶，也很想念小時候那些快樂的時光。",2,1,1,2,1,7
