題目,作答,立意,結構,修辭,敘述,啟發,總分
"林語堂說：「（我）所愛的不是晚秋，是初秋，那時暄氣初消，月正圓，蟹正肥，桂花皎潔，也未陷入懍烈蕭瑟氣態，這是最值得賞樂的。」楊牧則是在美麗的春天世界裡，萬物復甦，卻聽到「一片樹葉提早轉黃的聲音。」（〈夭〉）普魯斯特（Proust, M.）在《追憶逝水年華》中說：「一小時不僅僅是一個小時，它是一只充滿香氣、聲響、念頭和氛圍的花缽」，說明時間的認知與感官知覺及感受有關。請以「季節的感思」為題，寫一篇文章，描寫你對季節的感知經驗，並抒發心中的感受與領會。
文長至少600字。

","季節的感思



四季一年四次的變化，每個季節都有不同的特色。冬天很冷，春天很暖，夏天很熱，秋天很涼。



我最不喜歡冬天，因為天氣太冷了。小時候我很愛跟別人比較，想要贏過別人。但是上了高中以後，發現很多同學都比我厲害，我就很難過。我一直想要考高分，但是考不好就會很傷心。



冬天的時候，外面都沒有花，只有梅花會開。有一天晚上我睡不著，就看到院子裡有一朵梅花開了。梅花很漂亮，紅紅白白的。我看了以後就想到，每個人都不一樣，不用跟別人比較。就像梅花不會跟其他花一起開一樣。



所以我學到了，不要一直想要贏過別人。每個人都有自己的特色，像花開的時間不一樣。我們應該要找到自己想要的東西，不要管別人怎麼想。這樣才能過得開心。",1,1,1,1,1,5
