題目,作答,立意,結構,修辭,敘述,啟發,總分
"林語堂說：「（我）所愛的不是晚秋，是初秋，那時暄氣初消，月正圓，蟹正肥，桂花皎潔，也未陷入懍烈蕭瑟氣態，這是最值得賞樂的。」楊牧則是在美麗的春天世界裡，萬物復甦，卻聽到「一片樹葉提早轉黃的聲音。」（〈夭〉）普魯斯特（Proust, M.）在《追憶逝水年華》中說：「一小時不僅僅是一個小時，它是一只充滿香氣、聲響、念頭和氛圍的花缽」，說明時間的認知與感官知覺及感受有關。請以「季節的感思」為題，寫一篇文章，描寫你對季節的感知經驗，並抒發心中的感受與領會。
文長至少600字。

","季節的感思



每年的四季都會輪流來臨，春天、夏天、秋天、冬天，每個季節都有不同的感覺。我最喜歡的是冬天，因為冬天可以看到很特別的景色。



我小時候很愛跟別人比較，常常想要贏過別人，做什麼事情都要拼命去做，就是想要得到別人的稱讚。但是上了高中以後，我發現有很多比我厲害的同學，我想要超越他們，可是做不到，所以常常很難過。



冬天的時候，外面很冷清，晚上更冷。有時候會聽到風吹過的聲音，還有一些小鳥叫的聲音。有一天晚上我睡不著，就看到院子裡有一朵梅花開了。那朵梅花很漂亮，紅紅白白的，在月光下很好看。梅花不像其他的花要在春天開，它選擇在冬天開，這樣反而更特別。



我從梅花學到，每個人都是不一樣的，不需要跟別人比較。就像花開的時間不一樣，每個人也有自己的特色。我們應該要找到自己真正想要的東西，不要一直看別人怎麼做。



所以我現在知道了，不要一直追著別人跑，要做自己就好。每個人都有自己的時間，不要著急，慢慢來也可以。",2,1,1,2,2,8
