題目,作答,立意,結構,修辭,敘述,啟發,總分
"甲
我們的感情是冰箱，打開來看，明亮可喜，關起門後是嗡嗡的黑暗。什麼都不會壞掉，埋在霜雪的角落。我們的感情是冰箱，有時很滿有時很空，一切都可以保存很久，冷冷的，可是很新鮮，看起來都像昨天。（柯裕棻〈冰箱〉）
乙
農曆年前我媽換了新冰箱。雖然舊的其實也還好，十數年如一日修長高冷玉面如銀，該凍肉時凍肉，該製冰時製冰，門沒關緊永遠忠實地響警告聲。燈泡甚至沒有壞過一次。只是我媽長期嫌它不得力，冷藏室裝一隻生雞一鍋燉肉就周轉不過來，胃口那樣地小，像一個節食的人，廚房裡最不需要的就是一個節食的人。我常常看見她蹲在那兒，腳邊圍滿生鮮，鬥盡心智排列組合，在最有限空間裡籌備出最大的寬容，冰箱門好像看牙醫的嘴開太久不斷嗶嗶叫，簡直像在哭了。感覺兩方都十分苦惱。
我認為運用如常的器物毋需特別汰換，也主張大家都不妨少吃一點。顯然我媽不作此想。她說：「總之我就是想要一臺大冰箱啦。」但如此一來，我反倒領悟了，這完全是某商品宣傳詞「豈止於大」（Bigger than bigger）的道理：一座夠大的新冰箱也豈止於冰箱，它是一種想像，一種意境，一種可能性，它富有召喚家庭生活最好願景的潛力。（改寫自黃麗群〈如果在冬天，一座新冰箱〉）
    冰箱可以很滿，可以很空，當你打開冰箱，通常想尋找什麼？又看見什麼？假如有一座屬於你的新冰箱，你會有怎樣的想像？冰藏什麼（虛實皆可）會符合你所期待的美好生活？請以「如果我有一座新冰箱」為題，撰文一篇，
文長至少600字。

","如果我有一座新冰箱



冰箱是家裡很重要的東西。每個家庭都需要一台冰箱來放食物。我家的冰箱已經用了很多年了，裡面可以放很多東西。



我每天都會打開冰箱找東西吃。冰箱裡面有很多食物，有水果、蔬菜、肉類等等。媽媽常常會把剩菜放進冰箱，等到下一餐再拿出來加熱。夏天的時候，冰箱可以讓食物不會壞掉，還可以做冰塊讓飲料變涼。



不過冰箱也有不好的地方。有時候忘記關冰箱門，它就會一直發出聲音。還有如果放太多東西，找起來很麻煩。有些食物放太久也會壞掉，發出臭味。



我希望以後可以有一台新冰箱。新冰箱要夠大，這樣就可以放很多東西。最好可以自動提醒我食物快過期了，這樣就不會浪費食物。



總之，冰箱對我們來說很重要。雖然現在的冰箱已經很好用了，但是我還是希望可以有一台更好的新冰箱。",1,1,1,1,1,5
