題目,作答,立意,結構,修辭,敘述,啟發,總分
"    我覺得童年是一種氣味的記憶。
    我的童年，有許多果樹氣味的記憶。夏天暑熱的午後，廟埕後有一棵巨大的龍眼樹。我從小學翻牆出來，背著書包，爬上龍眼樹，躲在密密的枝葉裡。外面日光葉影搖晃，隱約聽見老師或母親尋來，在樹下叫著我的名字，但那呼喚的聲音，被蟬聲的高音淹沒了。我一動不動，找到一處適合蜷窩身體的枝椏，好像變成樹的一部分，而那時，龍眼樹密密的甜熟的氣味就包圍著我。我閉起眼睛，好像在假寐，也像在作夢，夢裡一串一串纍纍的龍眼，招來許多蜜蜂果蠅。我童年的夢，很甜很香，好像一整個夏天都窩在那棵樹上，包圍在濃郁的氣味裡做了一個醒不來的夢。（改寫自蔣勳《給青年藝術家的信》）
    生活中充斥各種氣味。氣味透過嗅覺傳遞，喚起人們的記憶和感受，一如文中龍眼樹甜熟的氣味喚起作者的童年記憶。請以「花草樹木的氣味記憶」為題，寫一篇文章，書寫你熟悉的花草樹木的氣味，及其所召喚的記憶和感受。

文長至少600字。

","花草樹木的氣味記憶



夏天很熱，我最喜歡聞到芒果的香味。因為這種味道讓我想起小學的時候。



我小學的時候，下課時間很吵，大家都在玩。但是我不喜歡跑來跑去，因為天氣太熱了。我都坐在操場旁邊的芒果樹下。芒果樹很大，有很多芒果。沒熟的時候有一種清新的味道，等到熟了就會變得很香甜。我喜歡坐在樹下聞這個味道，感覺比較不會那麼熱。



後來我畢業了，有一天回去學校想看看那棵芒果樹。結果發現芒果樹被砍掉了，只剩下樹墩。我覺得很難過，因為再也聞不到芒果的香味了。現在學校也沒有種新的芒果樹。



所以每次想到芒果的味道，我就會想起以前的事情。這就是我的氣味記憶。",1,1,1,1,1,5
