題目,作答,立意,結構,修辭,敘述,啟發,總分
"甲
我們的感情是冰箱，打開來看，明亮可喜，關起門後是嗡嗡的黑暗。什麼都不會壞掉，埋在霜雪的角落。我們的感情是冰箱，有時很滿有時很空，一切都可以保存很久，冷冷的，可是很新鮮，看起來都像昨天。（柯裕棻〈冰箱〉）
乙
農曆年前我媽換了新冰箱。雖然舊的其實也還好，十數年如一日修長高冷玉面如銀，該凍肉時凍肉，該製冰時製冰，門沒關緊永遠忠實地響警告聲。燈泡甚至沒有壞過一次。只是我媽長期嫌它不得力，冷藏室裝一隻生雞一鍋燉肉就周轉不過來，胃口那樣地小，像一個節食的人，廚房裡最不需要的就是一個節食的人。我常常看見她蹲在那兒，腳邊圍滿生鮮，鬥盡心智排列組合，在最有限空間裡籌備出最大的寬容，冰箱門好像看牙醫的嘴開太久不斷嗶嗶叫，簡直像在哭了。感覺兩方都十分苦惱。
我認為運用如常的器物毋需特別汰換，也主張大家都不妨少吃一點。顯然我媽不作此想。她說：「總之我就是想要一臺大冰箱啦。」但如此一來，我反倒領悟了，這完全是某商品宣傳詞「豈止於大」（Bigger than bigger）的道理：一座夠大的新冰箱也豈止於冰箱，它是一種想像，一種意境，一種可能性，它富有召喚家庭生活最好願景的潛力。（改寫自黃麗群〈如果在冬天，一座新冰箱〉）
    冰箱可以很滿，可以很空，當你打開冰箱，通常想尋找什麼？又看見什麼？假如有一座屬於你的新冰箱，你會有怎樣的想像？冰藏什麼（虛實皆可）會符合你所期待的美好生活？請以「如果我有一座新冰箱」為題，撰文一篇，
文長至少600字。

","如果我有一座新冰箱



今天天氣很熱，我躺在沙發上睡覺。醒來的時候肚子餓了，就去打開冰箱找東西吃。我家的冰箱很舊了，上面都是灰塵。



打開冰箱的時候，看到裡面有一盒巧克力，是以前同學送我的。看到巧克力就想到以前在學校的時候，大家都穿著制服，女生穿白色上衣和紅色裙子。畢業的時候，大家互相送巧克力，說再見。



我還記得學校外面有櫻花樹，開花的時候很漂亮。有時候還可以看到鳥在天上飛，蟲子在樹上叫。這些回憶都很美好，但是現在想起來有點模糊了。



如果我有一座新冰箱，我想把這些回憶都放進去。這樣以後想起來的時候，就不會忘記了。就像冰箱可以把食物保存很久一樣，我希望回憶也可以一直保存下去。



我把巧克力放回冰箱，關上門。雖然冰箱很舊了，但是可以幫我保存這些回憶，我覺得很好。希望以後可以常常打開冰箱，看看這些回憶。",2,2,1,2,1,8
