題目,作答,立意,結構,修辭,敘述,啟發,總分
"二十一世紀資訊量以驚人的速度暴增，有人認為網路資訊易於取得，會使記憶力與思考力衰退，不利於認知學習；也有人視網際網路為人類的外接大腦記憶體，意味著我們毋須記憶大量知識，可以專注在更重要、更有創造力的事物上。對於以上兩種不同的觀點，你的看法為何？請以「網海浮沉之我思」為題，結合自己的相關經驗，探討創造力與思考力之間的關係。
文長至少600字。

","網海浮沉之我思



現在的科技發展很快，大家都在用手機和電腦，這些東西雖然方便，但是我覺得不是很好。因為人們都不想要動腦思考，什麼都靠科技。



以前我們要找資料都要去圖書館，要用紙筆寫字記筆記。現在的人都用電腦打字，用手機查資料。雖然這樣比較快，但是我覺得寫字很重要，因為可以讓我們記得比較清楚。用電腦打字雖然方便，但是感覺不一樣，而且容易忘記。



還有現在的人做作品都是用電腦軟體，都用網路上下載的素材。這樣不好，因為大家做出來的東西都差不多。以前的人做作品都是自己想的，所以比較有特色。現在的人都用一樣的軟體，一樣的素材，所以作品都沒有自己的想法。



我覺得科技雖然方便，但是不能完全依賴它。我們還是要多用腦袋想事情，要自己動手做事情。這樣才能讓我們的想法和作品比較有特色。如果都靠科技，那我們就會變得很懶惰，什麼都不會了。



所以我認為，科技應該只是輔助工具，不能取代我們的思考和創作能力。我們要記住，人的想法和創意才是最重要的。",2,2,1,2,1,8
