題目,作答,立意,結構,修辭,敘述,啟發,總分
"甲
我們的感情是冰箱，打開來看，明亮可喜，關起門後是嗡嗡的黑暗。什麼都不會壞掉，埋在霜雪的角落。我們的感情是冰箱，有時很滿有時很空，一切都可以保存很久，冷冷的，可是很新鮮，看起來都像昨天。（柯裕棻〈冰箱〉）
乙
農曆年前我媽換了新冰箱。雖然舊的其實也還好，十數年如一日修長高冷玉面如銀，該凍肉時凍肉，該製冰時製冰，門沒關緊永遠忠實地響警告聲。燈泡甚至沒有壞過一次。只是我媽長期嫌它不得力，冷藏室裝一隻生雞一鍋燉肉就周轉不過來，胃口那樣地小，像一個節食的人，廚房裡最不需要的就是一個節食的人。我常常看見她蹲在那兒，腳邊圍滿生鮮，鬥盡心智排列組合，在最有限空間裡籌備出最大的寬容，冰箱門好像看牙醫的嘴開太久不斷嗶嗶叫，簡直像在哭了。感覺兩方都十分苦惱。
我認為運用如常的器物毋需特別汰換，也主張大家都不妨少吃一點。顯然我媽不作此想。她說：「總之我就是想要一臺大冰箱啦。」但如此一來，我反倒領悟了，這完全是某商品宣傳詞「豈止於大」（Bigger than bigger）的道理：一座夠大的新冰箱也豈止於冰箱，它是一種想像，一種意境，一種可能性，它富有召喚家庭生活最好願景的潛力。（改寫自黃麗群〈如果在冬天，一座新冰箱〉）
    冰箱可以很滿，可以很空，當你打開冰箱，通常想尋找什麼？又看見什麼？假如有一座屬於你的新冰箱，你會有怎樣的想像？冰藏什麼（虛實皆可）會符合你所期待的美好生活？請以「如果我有一座新冰箱」為題，撰文一篇，
文長至少600字。

","如果我有一座新冰箱



在生命的長河中，每個人都需要一座專屬的情感冰箱，用以存放那些來不及消化的情緒、尚未完全理解的經歷。當我凝視著這座想像中的新冰箱，彷彿看見了自己成長的縮影。



記得兒時的夏日，陽光在臉上跳躍，凝結的水珠不是來自冰涼可樂，而是第一次因童言無忌而被責罵後的淚水。那是我放進冰箱的第一件「收藏品」—被凍結的真誠。從那時起，我學會了如何將直覺的話語暫時封存，等待適當的時機再將它們取出。



隨著年歲增長，我的情感冰箱逐漸堆積了更多內容：天真被霜覆蓋，熱情被寒氣凝結，衝動與理想被整齊地分類存放。冰箱的容量似乎在不知不覺間不斷擴大，而門把上積累的灰塵，見證了那些很少被重新審視的情感。



學測前夕，這座冰箱面臨了最嚴峻的考驗。來自各方的期待與壓力如潮水般湧入：「要是大學沒考好，未來就毀了。」這樣的話語不斷灌入耳中。為了專注於課業，我選擇將所有情緒冷凍保存。然而，敞開的冰箱門不斷流失能量，讓我成為一具行走的情感真空。



當學測成績不如預期時，積壓的情緒如同解凍的冰川，化作滔天巨浪。自責、愧疚、迷惘，所有被壓抑的感受一次爆發，幾乎將我淹沒。所幸母親的智慧之言如同救生圈：「情緒不會消失，只會以不同方式重現。」她教會我，情感不該被永久冷凍，而應該像潮汐一般，有其自然的流動節奏。



現在的我明白了，新冰箱的意義不在於它的容量，而在於如何善用它。情緒的暫存不是為了永久封存，而是為了在適當的時候能夠從容面對。這座冰箱教會我生命中必要的取捨藝術：知道何時該保存，何時該釋放；明白什麼需要冷靜處理，什麼該即刻面對。



期待每個人都能擁有並善用自己的情感冰箱，讓它成為生命歷程中的良伴，而不是情感的墳場。因為真正的成長，不在於把一切都冰封起來，而在於學會在適當的時機，優雅地解凍每一份珍貴的情感。",5,5,4,4,5,23
