題目,作答,立意,結構,修辭,敘述,啟發,總分
"    我覺得童年是一種氣味的記憶。
    我的童年，有許多果樹氣味的記憶。夏天暑熱的午後，廟埕後有一棵巨大的龍眼樹。我從小學翻牆出來，背著書包，爬上龍眼樹，躲在密密的枝葉裡。外面日光葉影搖晃，隱約聽見老師或母親尋來，在樹下叫著我的名字，但那呼喚的聲音，被蟬聲的高音淹沒了。我一動不動，找到一處適合蜷窩身體的枝椏，好像變成樹的一部分，而那時，龍眼樹密密的甜熟的氣味就包圍著我。我閉起眼睛，好像在假寐，也像在作夢，夢裡一串一串纍纍的龍眼，招來許多蜜蜂果蠅。我童年的夢，很甜很香，好像一整個夏天都窩在那棵樹上，包圍在濃郁的氣味裡做了一個醒不來的夢。（改寫自蔣勳《給青年藝術家的信》）
    生活中充斥各種氣味。氣味透過嗅覺傳遞，喚起人們的記憶和感受，一如文中龍眼樹甜熟的氣味喚起作者的童年記憶。請以「花草樹木的氣味記憶」為題，寫一篇文章，書寫你熟悉的花草樹木的氣味，及其所召喚的記憶和感受。

文長至少600字。

","我住在台北，每天都聞到很多不同的氣味。有汽車排氣管的臭味，也有一些花草的香味。不過最讓我印象深刻的是在我高中的時候聞到的氣味。



我記得那時候剛上高一，每天下午都會聞到一些特別的味道。有時候是松樹的味道，有時候是柑橘的味道，還有時候會聞到檜木的香味。這些味道都是從學校頂樓飄下來的，因為那裡有人在養蜜蜂。



有一天下午天氣很好，我就想去看看頂樓到底是什麼樣子。我走上樓梯，看到一扇銀色的防火門。我推了一下門，發現沒有鎖，但是很重。我先喊了一聲問有沒有人，但是沒有人回答，只聽到蜜蜂的嗡嗡聲。



我用力把門推開，看到了很漂亮的景色。陽光照進來，很多蜜蜂在飛，還有紫色和白色的羅勒花在開。這個地方讓我覺得很特別，好像發現了一個秘密花園一樣。



這些氣味讓我一直記得那時候的感覺，每次想到都覺得很開心。雖然現在已經畢業了，但是那些香味還是會讓我想起高中的美好時光。",2,2,1,2,1,8
