題目,作答,立意,結構,修辭,敘述,啟發,總分
"關於地球的記憶
被文字固禁在課本裡
我們的筆尖游走在山脈和海洋
翻譯每片花瓣的嬌嫩和露水的清新
所有的言語 答案
都靜放在我們的課本裡
等待我們翻起這一切的序幕（節錄自薛憶婷〈我們的課本〉）

    以上這首詩，從課本啟動天馬行空的遐想，瞥見知識豐富的樣貌。科學頑童費曼（Richard P. Feynman）曾說觀察轉動的餐盤，讓他得到很大的啟發，領略了興之所至的樂趣。物理課可讓我們發現萬物運行的迷人，生物課帶領我們進入細胞核遊歷，外語課讓我們聽見世界不同的文化。國文課堂上「採菊東籬下，悠然見南山」或「輕羅小扇撲流螢」，詩中情境也往往能讓人神遊於現實之外。過往的課程內容，是否曾經點燃你對知識的熱情？打開課本時，不知能否如〈我們的課本〉所述，揭開知識想像的序幕。
    若能從不同角度切入課本，進入知識的想像，或許可以讓課本帶領我們經歷驚奇的旅程。請以「當我打開課本」為題，寫一篇文章，敘述任一學科課本對你的意義，書寫你探索課本內容、知識的經驗與體會。
文長至少600字。


","當我打開課本



我最喜歡的是國文課本。每次打開課本時，都會看到很多文言文。雖然有時候看不太懂，但是老師都會幫我們解釋。



我記得有一課說「你看著像稿子，我看倒像綠豆糕」，這句話讓我覺得很有趣。因為每個人看東西的想法都不一樣，所以我覺得讀文言文也是這樣。



我讀文言文的時候，常常會想像自己在詩人寫詩的地方。雖然不知道詩人在想什麼，但是我會試著去感受。有時候我的想法和課本的解釋不一樣，但是我覺得這樣也沒關係。



我覺得國文很特別，因為它可以用不同的方式說同一件事。雖然我不太會寫作文，但是我還是很喜歡上國文課。",1,1,1,1,1,5
