題目,作答,立意,結構,修辭,敘述,啟發,總分
"甲
(陶潛)為彭澤令。不以家累自隨，送一力給其子，書曰：「汝旦夕之費，自給為難。今遣此力，助汝薪水（打柴汲水）之勞。此亦人子也，可善遇之。」(《南史．隱逸．陶潛傳》)
乙
飯後，眾人各自有事離去，留下貞觀靜坐桌前獃想。她今日的這番感慨，實是前未曾有的。
阿啟伯摘瓜，乃她親眼所見。今早，她突發奇想，陪著外公去巡魚塭，回來時，祖孫二人，都在門口停住了，因為後門虛掩，阿啟伯拿著菜刀，正在棚下摘瓜，並未發覺他們，祖孫二個都閃到門背後。貞觀當時是真愣住了，在那種情況下，是前進呢？抑是後退？她不能很快作選擇。然而這種遲疑也只有幾秒鐘，她一下就被外公拉到門後，正是屏息靜氣時，老人家又帶了她拐出小巷口，走到前街來。
貞觀人到了大路上，心下才逐漸明白：外公躲那人的心，竟比那偷瓜的人所做的遮遮掩掩更甚！貞觀以為懂得了外公的心意：他怕阿啟伯當下撞見自己的那種難堪。事實上，他還有另一層深意，貪當然不好，而貧的本身沒有錯。外公不以阿啟伯為不是，是知道他家中十口，有菜就沒飯，有飯就沒菜。(改寫自蕭麗紅《千江有水千江月》)
陶潛或者外公對他人的善意，你可能也曾見聞或經歷過，請以「溫暖的心」為題，寫一篇文章，分享你的經驗及體會。
文長至少600字。

","溫暖的心



人和人之間的互動很重要，如果大家都能互相關心，這個世界就會變得更好。社會新聞也不會有那麼多壞事發生。



我以前心情不好的時候很多，有時候是因為功課，有時候是因為朋友。但是後來遇到一個人，讓我的心情變好了。



我在國中的時候，常常放學後去超商坐著等媽媽下班。有一個超商店員叫阿凱，看起來像不良少年，但是他對我很好。他會問我讀哪個學校，為什麼常常來這裡。



有一次他跟我說他的故事，他爸爸吸毒，媽媽不見了，所以他要自己工作賺錢。我聽了很難過，只能跟他說辛苦了。後來我也跟他說我的煩惱。他說如果我不開心可以跟他說，他願意聽我說話。



這件事讓我知道，有人願意關心你的時候，心情就會變好。雖然生活中有不開心的事，但是有人願意聽你說話，就會覺得溫暖。",1,1,1,1,1,5
