題目,作答,立意,結構,修辭,敘述,啟發,總分
"    我覺得童年是一種氣味的記憶。
    我的童年，有許多果樹氣味的記憶。夏天暑熱的午後，廟埕後有一棵巨大的龍眼樹。我從小學翻牆出來，背著書包，爬上龍眼樹，躲在密密的枝葉裡。外面日光葉影搖晃，隱約聽見老師或母親尋來，在樹下叫著我的名字，但那呼喚的聲音，被蟬聲的高音淹沒了。我一動不動，找到一處適合蜷窩身體的枝椏，好像變成樹的一部分，而那時，龍眼樹密密的甜熟的氣味就包圍著我。我閉起眼睛，好像在假寐，也像在作夢，夢裡一串一串纍纍的龍眼，招來許多蜜蜂果蠅。我童年的夢，很甜很香，好像一整個夏天都窩在那棵樹上，包圍在濃郁的氣味裡做了一個醒不來的夢。（改寫自蔣勳《給青年藝術家的信》）
    生活中充斥各種氣味。氣味透過嗅覺傳遞，喚起人們的記憶和感受，一如文中龍眼樹甜熟的氣味喚起作者的童年記憶。請以「花草樹木的氣味記憶」為題，寫一篇文章，書寫你熟悉的花草樹木的氣味，及其所召喚的記憶和感受。

文長至少600字。

","花草樹木的氣味記憶



我的鼻子不太靈敏，因為有鼻炎的關係，所以很多香味都聞不到。不過我還記得一些氣味，像是下雨後的泥土味道。



我很喜歡下雨天，因為空氣很清新。下雨的時候聽雨聲也很舒服。雨停了以後，空氣中會有泥土和草的味道，這種味道不會太香也不會臭，就是很自然的感覺。這種味道到現在都沒有變，我還是很喜歡下雨天。



我有時候會想，如果以後我的鼻子完全聞不到味道了，那這種雨後的泥土味可能就只能存在我的記憶裡了。不過我現在還是可以聞到一些味道，所以還是要珍惜現在能聞到的氣味。",1,1,1,1,1,5
