題目,作答,立意,結構,修辭,敘述,啟發,總分
"    我覺得童年是一種氣味的記憶。
    我的童年，有許多果樹氣味的記憶。夏天暑熱的午後，廟埕後有一棵巨大的龍眼樹。我從小學翻牆出來，背著書包，爬上龍眼樹，躲在密密的枝葉裡。外面日光葉影搖晃，隱約聽見老師或母親尋來，在樹下叫著我的名字，但那呼喚的聲音，被蟬聲的高音淹沒了。我一動不動，找到一處適合蜷窩身體的枝椏，好像變成樹的一部分，而那時，龍眼樹密密的甜熟的氣味就包圍著我。我閉起眼睛，好像在假寐，也像在作夢，夢裡一串一串纍纍的龍眼，招來許多蜜蜂果蠅。我童年的夢，很甜很香，好像一整個夏天都窩在那棵樹上，包圍在濃郁的氣味裡做了一個醒不來的夢。（改寫自蔣勳《給青年藝術家的信》）
    生活中充斥各種氣味。氣味透過嗅覺傳遞，喚起人們的記憶和感受，一如文中龍眼樹甜熟的氣味喚起作者的童年記憶。請以「花草樹木的氣味記憶」為題，寫一篇文章，書寫你熟悉的花草樹木的氣味，及其所召喚的記憶和感受。

文長至少600字。

","花草樹木的氣味記憶



我覺得氣味對人來說很重要，因為可以讓我們想起很多事情。我的鼻子不太好，所以聞不到很多香味，但是我還記得下雨後的味道。



我從小就很喜歡下雨天，因為雨後的空氣很舒服。下完雨後，空氣裡會有泥土和草的味道，這種味道不會太香也不會臭，就是很特別的感覺。每次下雨的時候，我都會聞到這種味道，讓我覺得很開心。



我現在長大了，但是我還是很喜歡下雨天。雖然我的鼻子不太好，但是我希望以後還可以聞到這種味道。因為這是我很重要的回憶，如果以後聞不到了，我會很難過。



我覺得每個人都應該要記住自己喜歡的味道，因為這些味道可能會讓我們想起很多開心的事情。雖然我沒有辦法聞到花香，但是雨後的味道對我來說就很特別了。",2,1,1,2,1,7
