題目,作答,立意,結構,修辭,敘述,啟發,總分
"    我覺得童年是一種氣味的記憶。
    我的童年，有許多果樹氣味的記憶。夏天暑熱的午後，廟埕後有一棵巨大的龍眼樹。我從小學翻牆出來，背著書包，爬上龍眼樹，躲在密密的枝葉裡。外面日光葉影搖晃，隱約聽見老師或母親尋來，在樹下叫著我的名字，但那呼喚的聲音，被蟬聲的高音淹沒了。我一動不動，找到一處適合蜷窩身體的枝椏，好像變成樹的一部分，而那時，龍眼樹密密的甜熟的氣味就包圍著我。我閉起眼睛，好像在假寐，也像在作夢，夢裡一串一串纍纍的龍眼，招來許多蜜蜂果蠅。我童年的夢，很甜很香，好像一整個夏天都窩在那棵樹上，包圍在濃郁的氣味裡做了一個醒不來的夢。（改寫自蔣勳《給青年藝術家的信》）
    生活中充斥各種氣味。氣味透過嗅覺傳遞，喚起人們的記憶和感受，一如文中龍眼樹甜熟的氣味喚起作者的童年記憶。請以「花草樹木的氣味記憶」為題，寫一篇文章，書寫你熟悉的花草樹木的氣味，及其所召喚的記憶和感受。

文長至少600字。

","花草樹木的氣味記憶



氣味是時光的魔法師，能在瞬間喚醒沉睡的記憶。每個人的生命中，都有那麼一些特別的香氣，牽引著我們回到過往。對我而言，最深刻的，莫過於雨後大地的氣息。



我天生患有慢性鼻炎，許多細微的香氣都與我無緣。玫瑰的芬芳、桂花的馥郁，在我的感知中都如隔著一層薄紗，朦朧而遙遠。然而，越是如此，那些能突破我感官限制的氣味，就越發顯得珍貴而深刻。



雨後的泥土氣息就是這樣的存在。每當雨停歇的時刻，泥土釋放出的清新氣息總能穿透我遲鈍的嗅覺，直達心靈深處。這氣味中揉合了濕潤的土壤、青草的鮮活，以及空氣被洗滌後的清冽。它不似花香般濃烈，卻有著最純粹的生命力量。



記得小時候，每逢下雨，我總愛趴在窗邊，看著雨滴打在綠葉上，濺起晶瑩的水花。雨聲是大自然最動人的交響曲，而雨後的氣息則是這樂章最完美的終章。那時的我，還不懂得欣賞花香，卻已經愛上了這份來自大地的芬芳。



歲月流轉，我的鼻炎時好時壞，但對雨後氣息的感知卻始終如一。這或許是上天的巧妙安排，讓我在感官的缺憾中，反而更深刻地體會到某些氣味的珍貴。就像人生中總有得有失，我雖然錯過了許多花香，卻在雨後的泥土氣息中，尋得了最真摯的生命感動。



如今，每當細雨初霽，我依然會不自覺地深呼吸，讓那股潮濕的清新充盈肺腑。這氣味是我與自然最親密的對話，也是我最珍貴的氣味記憶。或許未來某天，我的嗅覺會更加衰退，但我相信，這份雨後的氣息會永遠留存在我的記憶深處，成為生命中最美好的印記。",5,4,5,4,5,23
