題目,作答,立意,結構,修辭,敘述,啟發,總分
"甲
我們的感情是冰箱，打開來看，明亮可喜，關起門後是嗡嗡的黑暗。什麼都不會壞掉，埋在霜雪的角落。我們的感情是冰箱，有時很滿有時很空，一切都可以保存很久，冷冷的，可是很新鮮，看起來都像昨天。（柯裕棻〈冰箱〉）
乙
農曆年前我媽換了新冰箱。雖然舊的其實也還好，十數年如一日修長高冷玉面如銀，該凍肉時凍肉，該製冰時製冰，門沒關緊永遠忠實地響警告聲。燈泡甚至沒有壞過一次。只是我媽長期嫌它不得力，冷藏室裝一隻生雞一鍋燉肉就周轉不過來，胃口那樣地小，像一個節食的人，廚房裡最不需要的就是一個節食的人。我常常看見她蹲在那兒，腳邊圍滿生鮮，鬥盡心智排列組合，在最有限空間裡籌備出最大的寬容，冰箱門好像看牙醫的嘴開太久不斷嗶嗶叫，簡直像在哭了。感覺兩方都十分苦惱。
我認為運用如常的器物毋需特別汰換，也主張大家都不妨少吃一點。顯然我媽不作此想。她說：「總之我就是想要一臺大冰箱啦。」但如此一來，我反倒領悟了，這完全是某商品宣傳詞「豈止於大」（Bigger than bigger）的道理：一座夠大的新冰箱也豈止於冰箱，它是一種想像，一種意境，一種可能性，它富有召喚家庭生活最好願景的潛力。（改寫自黃麗群〈如果在冬天，一座新冰箱〉）
    冰箱可以很滿，可以很空，當你打開冰箱，通常想尋找什麼？又看見什麼？假如有一座屬於你的新冰箱，你會有怎樣的想像？冰藏什麼（虛實皆可）會符合你所期待的美好生活？請以「如果我有一座新冰箱」為題，撰文一篇，
文長至少600字。

","如果我有一座新冰箱



冰箱是每個家庭都會有的電器，我家的冰箱已經用了很多年了。每次打開冰箱，裡面都塞得滿滿的，有時候連放個東西都很困難。



我覺得如果有一座新冰箱的話，我會想要放一些自己喜歡的東西。比如說夏天的時候可以放一些冰涼的飲料和冰棒，這樣很消暑。還可以放一些點心，等到想吃的時候就可以拿出來吃。媽媽做的醬菜也可以放在冰箱裡，這樣煮麵的時候就可以直接拿來配。



我現在在外面打工，常常回家的時候家人都睡了。不過媽媽都會幫我把飯菜放在冰箱裡，我回來的時候熱一下就可以吃了。有時候冰箱門上還會貼著家人給我的紙條，告訴我一些事情。我也會在紙條上回他們的話。



我覺得冰箱不只是一個放東西的地方，它也是我和家人溝通的工具。雖然現在大家都用手機傳訊息，但是我覺得冰箱門上的紙條比較有感覺，因為這樣比較有家的味道。",2,2,1,2,1,8
