題目,作答,立意,結構,修辭,敘述,啟發,總分
"關於地球的記憶
被文字固禁在課本裡
我們的筆尖游走在山脈和海洋
翻譯每片花瓣的嬌嫩和露水的清新
所有的言語 答案
都靜放在我們的課本裡
等待我們翻起這一切的序幕（節錄自薛憶婷〈我們的課本〉）

    以上這首詩，從課本啟動天馬行空的遐想，瞥見知識豐富的樣貌。科學頑童費曼（Richard P. Feynman）曾說觀察轉動的餐盤，讓他得到很大的啟發，領略了興之所至的樂趣。物理課可讓我們發現萬物運行的迷人，生物課帶領我們進入細胞核遊歷，外語課讓我們聽見世界不同的文化。國文課堂上「採菊東籬下，悠然見南山」或「輕羅小扇撲流螢」，詩中情境也往往能讓人神遊於現實之外。過往的課程內容，是否曾經點燃你對知識的熱情？打開課本時，不知能否如〈我們的課本〉所述，揭開知識想像的序幕。
    若能從不同角度切入課本，進入知識的想像，或許可以讓課本帶領我們經歷驚奇的旅程。請以「當我打開課本」為題，寫一篇文章，敘述任一學科課本對你的意義，書寫你探索課本內容、知識的經驗與體會。
文長至少600字。


","當我打開課本



我最喜歡歷史課本，每次拿到新課本都很開心。課本封面都有不同的圖案，我最喜歡看大戰的內容。因為大戰的內容比較新，有很多圖片可以看，比中國歷史和台灣歷史有趣多了。



歷史課本跟國文英文不一樣，不會有很多字，都是用圖片來說故事。我喜歡這樣，因為看圖片比較容易懂。課本也沒有說哪個是對的哪個是錯的，所以我可以自己想。二戰的諾曼地登陸的圖片最好看，有飛機、士兵，看起來很緊張。



我喜歡看歷史課本，因為文字很簡單，容易記住重點。看歷史課本就像坐時光機一樣，可以看到以前發生的事情。我覺得這樣很有趣，所以我很喜歡歷史課本。",1,1,1,1,1,5
