題目,作答,立意,結構,修辭,敘述,啟發,總分
"    糖對身體是有好處的，運動過後或飢餓時，適當地補充糖會讓我們迅速恢復體力。科學研究也發現，大腦細胞的能量來源主要來自葡萄糖，當血糖濃度降低時，大腦難以順利運轉，容易注意力不集中，學習或做事效果不佳。不過，哈佛醫學院等多個研究機構指出，高糖飲食會增加罹患乳癌及憂鬱症等疾病的風險；世界衛生組織也指出，高糖飲食是造成體重過重、第二型糖尿病、蛀牙、心臟病的元兇，並建議每日飲食中「添加糖」的攝取量不宜超過總熱量的10%。以每日熱量攝取量2000大卡為例，也就是50公克糖。我國國民健康署於民國103年至106年的「國民營養健康狀況變遷調查」中，有關國人飲用含糖飲料的結果顯示，國民中小學生在飲用比例上為各年齡之冠，其中男性又高於女性。
    基於國民營養及健康飲食原則，目前中小學校園禁止出現含糖飲料，以避免孩子在校園攝取過多糖份。但反對者認為，孩子回到家還是可能會喝含糖飲料，無法治本。
    對於「中、小學校園禁止含糖飲料」，你贊成或反對？請以「禁止含糖飲料進入中、小學之我見」為題，撰寫一篇文章，提出你的看法與論述。
文長至少600字。


","禁止含糖飲料進入中、小學之我見



在這個講究健康飲食的時代，含糖飲料的管制議題引發了廣泛討論。作為一個親身經歷過含糖飲料誘惑的過來人，我堅定支持在中、小學校園中禁止含糖飲料，因為這不僅關乎學童當下的健康，更攸關未來整個世代的健康福祉。



首先，從醫學角度來看，過度攝取糖分確實會帶來嚴重的健康隱憂。世界衛生組織的研究明確指出，高糖飲食與肥胖、糖尿病、心臟病等慢性病有密切關聯。這些疾病一旦形成，往往需要終身治療，不僅影響生活品質，更可能透過基因遺傳影響下一代。因此，在校園中禁止含糖飲料，就是為學童的健康未雨綢繆。



以我的家庭經驗為例，父母皆罹患糖尿病，這讓我深刻體會到糖分管制的重要性。回想求學時期，國小階段在嚴格的管理下，很少接觸含糖飲料；但到了國中，因為求學環境改變，加上青春期的叛逆心理，常常無法抵擋含糖飲料的誘惑。所幸學校實施含糖飲料管制政策，在某種程度上約束了我的飲用習慣，這份防範意識至今仍使我受益良多。



反對校園禁糖政策者認為，學生離開校園後仍可自由取得含糖飲料，管制形同虛設。然而，我認為這種觀點過於消極。學校作為教育場所，不僅要傳授知識，更應培養學生正確的飲食觀念。透過校園禁糖政策，配合健康教育課程，能讓學生了解糖分過量的危害，進而建立健康的飲食習慣。即使無法完全杜絕學生接觸含糖飲料，但至少能在其主要活動場所－學校裡，創造一個健康的飲食環境。



預防勝於治療，在學生尚未完全理解高糖飲食危害之前，透過制度性的規範來保護他們的健康，是教育單位不可推卸的責任。期待透過這樣的政策推行，能培養下一代更健康的飲食習慣，為國民健康奠定更穩固的基礎。",4,4,4,4,4,20
