題目,作答,立意,結構,修辭,敘述,啟發,總分
"    我覺得童年是一種氣味的記憶。
    我的童年，有許多果樹氣味的記憶。夏天暑熱的午後，廟埕後有一棵巨大的龍眼樹。我從小學翻牆出來，背著書包，爬上龍眼樹，躲在密密的枝葉裡。外面日光葉影搖晃，隱約聽見老師或母親尋來，在樹下叫著我的名字，但那呼喚的聲音，被蟬聲的高音淹沒了。我一動不動，找到一處適合蜷窩身體的枝椏，好像變成樹的一部分，而那時，龍眼樹密密的甜熟的氣味就包圍著我。我閉起眼睛，好像在假寐，也像在作夢，夢裡一串一串纍纍的龍眼，招來許多蜜蜂果蠅。我童年的夢，很甜很香，好像一整個夏天都窩在那棵樹上，包圍在濃郁的氣味裡做了一個醒不來的夢。（改寫自蔣勳《給青年藝術家的信》）
    生活中充斥各種氣味。氣味透過嗅覺傳遞，喚起人們的記憶和感受，一如文中龍眼樹甜熟的氣味喚起作者的童年記憶。請以「花草樹木的氣味記憶」為題，寫一篇文章，書寫你熟悉的花草樹木的氣味，及其所召喚的記憶和感受。

文長至少600字。

","花草樹木的氣味記憶



我小時候常去阿公家玩，那裡有一棵樟樹。每次下課我都會跟同學去阿公家後院踢足球，玩累了就坐在樹下休息。樹上有一種香香的味道，後來阿公告訴我那是樟樹的味道。



現在我長大了，比較少回阿公家。但是有時候在路上聞到樟樹的味道，就會想起以前和同學在那裡玩的時候。那時候我們都很開心，沒有煩惱。



最近回阿公家，樟樹的味道還是一樣，但是感覺不太一樣了。因為以前一起玩的同學都不在了，只能靠著聞樹的味道來回想以前的事情。



每個人的童年都不一樣，但是都可以用味道來回憶。對我來說，樟樹的味道就是我童年最特別的記憶。",1,1,1,1,1,5
