題目,作答,立意,結構,修辭,敘述,啟發,總分
"    我覺得童年是一種氣味的記憶。
    我的童年，有許多果樹氣味的記憶。夏天暑熱的午後，廟埕後有一棵巨大的龍眼樹。我從小學翻牆出來，背著書包，爬上龍眼樹，躲在密密的枝葉裡。外面日光葉影搖晃，隱約聽見老師或母親尋來，在樹下叫著我的名字，但那呼喚的聲音，被蟬聲的高音淹沒了。我一動不動，找到一處適合蜷窩身體的枝椏，好像變成樹的一部分，而那時，龍眼樹密密的甜熟的氣味就包圍著我。我閉起眼睛，好像在假寐，也像在作夢，夢裡一串一串纍纍的龍眼，招來許多蜜蜂果蠅。我童年的夢，很甜很香，好像一整個夏天都窩在那棵樹上，包圍在濃郁的氣味裡做了一個醒不來的夢。（改寫自蔣勳《給青年藝術家的信》）
    生活中充斥各種氣味。氣味透過嗅覺傳遞，喚起人們的記憶和感受，一如文中龍眼樹甜熟的氣味喚起作者的童年記憶。請以「花草樹木的氣味記憶」為題，寫一篇文章，書寫你熟悉的花草樹木的氣味，及其所召喚的記憶和感受。

文長至少600字。

","花草樹木的氣味記憶



我要說說玉蘭花的事情。玉蘭花在台灣很常見，在菜市場和路邊都可以看到。我小時候常常看到玉蘭花，聞到它的香味。



以前沒什麼功課要做的時候，媽媽會帶我和妹妹去外婆家。我們在那邊看電視、玩玩具，有時候也會玩躲貓貓。外婆常常會買玉蘭花回來放在神明廳，所以整個房子都有花香。



現在長大了，功課變多了，比較少去外婆家。但是每次看到玉蘭花，就會想起以前在外婆家玩的事情。那時候春天很熱鬧，夏天很熱，秋天有點冷，冬天更冷。



雖然有些事情已經記不太清楚了，但是只要聞到玉蘭花的香味，就會想起小時候快樂的時光。那是我最開心的時候。",1,1,1,1,1,5
