題目,作答,立意,結構,修辭,敘述,啟發,總分
"    2007年臺灣的弘道老人福利基金會執行長林依瑩推出「不老騎士」計畫，帶17位平均81歲的爺爺奶奶，花費13天自行騎著摩托車環島1139公里。這群「不老騎士」中，有2位曾罹患癌症、4位需戴助聽器、5位患有高血壓，即使其中有人三進三出醫院，但還是完成了險峻路途的挑戰。這些騎士們曾是警察、軍人、牧師、老師或理髮師等，在不同人生經驗的交流中，豐富了彼此的視野。
    2012年在丹麥首都哥本哈根則有「樂齡卡打車」（Cycling Without Age）運動。哥本哈根一位中年上班族奧利（Ole Kassow）有感於安養機構的老人家行動不便，於是利用下班時間，用三輪車載老人家外出兜風。老人開心地要求回到他們充滿回憶的地方，有些多年不說話的老人，開始滔滔不絕地說著自己與地方的故事；失智症患者變得不再暴躁；盲人對志工訴說他們聞到花香、聽到鳥鳴，感覺微風吹拂過耳際。志工駕駛員因此聽到許多生命故事，更進一步認識自己的城市，也彷彿和老人形成了某種奧秘的聯繫。
    如果要帶長者進行樂齡之旅，一定有許多需要注意的事項。請以「樂齡出遊」為題，善用二文內的資訊，寫一篇文章，說明樂齡出遊的意義，並思考如何照顧到長者在生理與情感上的需求。
文長至少600字。

","樂齡出遊



老人家出去玩是一件很好的事情。像是題目裡面說的不老騎士和樂齡卡打車，都讓老人家很開心。我覺得帶老人家出去玩很有意義，因為可以讓他們不會一直待在家裡很無聊。



老人家年紀大了，所以帶他們出去玩要很小心。像是要注意他們的身體狀況，不能走太快或是走太久。有些老人家有高血壓或是其他病，所以更要注意。而且天氣太熱或太冷的時候也不適合出門，這些都要先想好。



老人家其實有很多故事可以說，只是平常沒有機會講。帶他們出去玩的時候，他們會想到以前的事情，就會開始說很多故事。這樣我們也可以學到很多東西，因為他們比我們有經驗。



我覺得陪老人家出去玩很重要，因為可以讓他們開心。有些老人家平常都不太說話，但是出去玩的時候就會變得比較活潑。而且老人家也可以認識新朋友，不會覺得寂寞。



所以我們應該要多帶老人家出去玩，這樣對大家都有好處。不過要記得要注意安全，不要讓老人家太累。這樣才能讓老人家玩得開心，我們也可以學到很多東西。",2,2,1,2,2,9
