題目,作答,立意,結構,修辭,敘述,啟發,總分
"    我覺得童年是一種氣味的記憶。
    我的童年，有許多果樹氣味的記憶。夏天暑熱的午後，廟埕後有一棵巨大的龍眼樹。我從小學翻牆出來，背著書包，爬上龍眼樹，躲在密密的枝葉裡。外面日光葉影搖晃，隱約聽見老師或母親尋來，在樹下叫著我的名字，但那呼喚的聲音，被蟬聲的高音淹沒了。我一動不動，找到一處適合蜷窩身體的枝椏，好像變成樹的一部分，而那時，龍眼樹密密的甜熟的氣味就包圍著我。我閉起眼睛，好像在假寐，也像在作夢，夢裡一串一串纍纍的龍眼，招來許多蜜蜂果蠅。我童年的夢，很甜很香，好像一整個夏天都窩在那棵樹上，包圍在濃郁的氣味裡做了一個醒不來的夢。（改寫自蔣勳《給青年藝術家的信》）
    生活中充斥各種氣味。氣味透過嗅覺傳遞，喚起人們的記憶和感受，一如文中龍眼樹甜熟的氣味喚起作者的童年記憶。請以「花草樹木的氣味記憶」為題，寫一篇文章，書寫你熟悉的花草樹木的氣味，及其所召喚的記憶和感受。

文長至少600字。

","花草樹木的氣味記憶



我記得小時候家附近有一片稻田，每當夏天來臨時，我都會和朋友們在那裡玩耍。稻田裡總是飄散著青草的香味，讓我覺得很舒服。



那時候我們幾個小朋友常常在稻田裡跑來跑去，完全不怕太陽很大。我們會在稻草堆裡躲貓貓，玩得很開心。每次玩到太陽下山，聽到家人叫我們回家吃飯才會依依不捨地離開。



現在長大了，那片稻田已經不見了，變成了一棟棟的房子。但是每當我聞到青草的味道，就會想起以前和朋友在稻田玩耍的時光。那些美好的回憶讓我很懷念，可是再也回不去了。



生活在城市裡的我，已經很少能聞到稻田的香味。我覺得很可惜，因為那是我童年最美好的記憶。希望以後還能有機會再聞到這樣的氣味，讓我可以回想起從前快樂的時光。",1,1,1,1,1,5
