題目,作答,立意,結構,修辭,敘述,啟發,總分
"二十一世紀資訊量以驚人的速度暴增，有人認為網路資訊易於取得，會使記憶力與思考力衰退，不利於認知學習；也有人視網際網路為人類的外接大腦記憶體，意味著我們毋須記憶大量知識，可以專注在更重要、更有創造力的事物上。對於以上兩種不同的觀點，你的看法為何？請以「網海浮沉之我思」為題，結合自己的相關經驗，探討創造力與思考力之間的關係。
文長至少600字。

","網海浮沉之我思



現在的網路發展很快，大家都在用網路找資料。有人說網路會讓人變笨，因為都不用記東西；有人說網路很好，可以讓我們不用記那麼多東西。我覺得網路是好的，因為可以幫助我們找到很多資料。



我是讀物理系的學生，物理有很多公式要記，如果沒有網路的話要花很多時間去翻書找資料。用網路的話很快就可以找到想要的公式，還可以看到別人怎麼解題。而且網路上還有很多影片可以看，比課本更容易懂。



做報告的時候也是一樣，網路可以找到很多資料。以前要去圖書館找書很麻煩，現在用網路找資料很方便。而且網路上的資料比較新，可以學到很多新的東西。



我覺得網路不會讓人變笨，重要的是要會用網路。如果只是一直玩手機，當然會變笨。但是如果好好用網路找資料學習，反而可以學到更多東西。所以我認為網路是好的工具，可以幫助我們學習。",2,2,1,2,1,8
