題目,作答,立意,結構,修辭,敘述,啟發,總分
"甲
我們的感情是冰箱，打開來看，明亮可喜，關起門後是嗡嗡的黑暗。什麼都不會壞掉，埋在霜雪的角落。我們的感情是冰箱，有時很滿有時很空，一切都可以保存很久，冷冷的，可是很新鮮，看起來都像昨天。（柯裕棻〈冰箱〉）
乙
農曆年前我媽換了新冰箱。雖然舊的其實也還好，十數年如一日修長高冷玉面如銀，該凍肉時凍肉，該製冰時製冰，門沒關緊永遠忠實地響警告聲。燈泡甚至沒有壞過一次。只是我媽長期嫌它不得力，冷藏室裝一隻生雞一鍋燉肉就周轉不過來，胃口那樣地小，像一個節食的人，廚房裡最不需要的就是一個節食的人。我常常看見她蹲在那兒，腳邊圍滿生鮮，鬥盡心智排列組合，在最有限空間裡籌備出最大的寬容，冰箱門好像看牙醫的嘴開太久不斷嗶嗶叫，簡直像在哭了。感覺兩方都十分苦惱。
我認為運用如常的器物毋需特別汰換，也主張大家都不妨少吃一點。顯然我媽不作此想。她說：「總之我就是想要一臺大冰箱啦。」但如此一來，我反倒領悟了，這完全是某商品宣傳詞「豈止於大」（Bigger than bigger）的道理：一座夠大的新冰箱也豈止於冰箱，它是一種想像，一種意境，一種可能性，它富有召喚家庭生活最好願景的潛力。（改寫自黃麗群〈如果在冬天，一座新冰箱〉）
    冰箱可以很滿，可以很空，當你打開冰箱，通常想尋找什麼？又看見什麼？假如有一座屬於你的新冰箱，你會有怎樣的想像？冰藏什麼（虛實皆可）會符合你所期待的美好生活？請以「如果我有一座新冰箱」為題，撰文一篇，
文長至少600字。

","如果我有一座新冰箱



時光如流水，在歲月的長河中悄然流逝。家中那台老舊的冰箱，外表布滿歲月的痕跡，卻依然忠實地守護著生活的點滴。每當深夜，打開冰箱門的瞬間，刺骨的寒意與明亮的燈光交織，映照出一個關於記憶與想像的溫柔世界。



如果我有一座新冰箱，我想將它變成時光的保險箱，珍藏那些與阿公相處的珍貴回憶。在記憶深處，有一片金黃的稻海，隨風起伏，綿延至天際。年幼的我，牽著阿公佈滿繭痕的大手，在田埂間蹣跚而行。春日裡，泥土的芬芳混合著新綠的氣息，我看著阿公彎腰插秧的身影，那是最動人的農家詩篇。夏夜裡，成群的白鷺鷥如雪花般灑落田間，為黃昏增添一抹純淨的色彩。



秋收時節，阿公載著我乘坐鐵牛，在稻浪中穿梭。引擎的轟鳴聲，伴著我們的歡笑，在金黃的稻海中譜寫屬於我們的冒險故事。那時的歡樂是如此純粹，那份溫暖是如此真實。這些回憶，我多麼希望能永遠保存在時光的冰箱裡，永不融化，永不褪色。



然而，生命的軌跡總是難以預料。當我邁入大學校園，阿公卻悄然離開人世，化作天上的星辰守護著我。如果我有一座新冰箱，我願將它變成連結今昔的橋樑，儲存所有與阿公相處的點點滴滴。在寂寞的夜晚，打開冰箱門時，不只能看見食物的新鮮，更能感受記憶的溫度。



這座想像中的新冰箱，不只是一個保存食物的容器，更是承載著愛與懷念的時光寶盒。它提醒著我，有些情感雖然無法實體保存，卻能在心中永遠保持鮮活。就像阿公教會我的農家智慧，以及那份永不褪色的親情，都將在記憶的冰箱中，永遠保持最初的溫度。",5,5,4,4,5,23
