題目,作答,立意,結構,修辭,敘述,啟發,總分
"甲
(陶潛)為彭澤令。不以家累自隨，送一力給其子，書曰：「汝旦夕之費，自給為難。今遣此力，助汝薪水（打柴汲水）之勞。此亦人子也，可善遇之。」(《南史．隱逸．陶潛傳》)
乙
飯後，眾人各自有事離去，留下貞觀靜坐桌前獃想。她今日的這番感慨，實是前未曾有的。
阿啟伯摘瓜，乃她親眼所見。今早，她突發奇想，陪著外公去巡魚塭，回來時，祖孫二人，都在門口停住了，因為後門虛掩，阿啟伯拿著菜刀，正在棚下摘瓜，並未發覺他們，祖孫二個都閃到門背後。貞觀當時是真愣住了，在那種情況下，是前進呢？抑是後退？她不能很快作選擇。然而這種遲疑也只有幾秒鐘，她一下就被外公拉到門後，正是屏息靜氣時，老人家又帶了她拐出小巷口，走到前街來。
貞觀人到了大路上，心下才逐漸明白：外公躲那人的心，竟比那偷瓜的人所做的遮遮掩掩更甚！貞觀以為懂得了外公的心意：他怕阿啟伯當下撞見自己的那種難堪。事實上，他還有另一層深意，貪當然不好，而貧的本身沒有錯。外公不以阿啟伯為不是，是知道他家中十口，有菜就沒飯，有飯就沒菜。(改寫自蕭麗紅《千江有水千江月》)
陶潛或者外公對他人的善意，你可能也曾見聞或經歷過，請以「溫暖的心」為題，寫一篇文章，分享你的經驗及體會。
文長至少600字。

","溫暖的心



我想分享一個關於溫暖的故事，是關於一個網路主播小何的事情。我每天都會看他的直播，因為他講話很有趣，讓人很開心。



小何以前是一個很窮的人，住在北京的小房間裡面。那時候他過得很辛苦，但是有很多人幫助他。後來他當了主播，賺到了錢，就開始幫助別人。他會幫助其他主播賺錢，也會幫助一些賣得便宜又好用的東西的品牌。



最讓我感動的是，他每個月都會拿錢出來幫助沒辦法讀書的人。他說不管是不是他的粉絲都可以來找他幫忙，因為他覺得讀書很重要。他說他雖然幫不了很多人，但是能幫一點是一點。



我覺得小何真的是一個很好的人，他讓我知道世界上還是有很多溫暖的事情。希望以後我也可以像他一樣，幫助需要幫助的人。",2,1,1,2,2,8
