題目,作答,立意,結構,修辭,敘述,啟發,總分
"二十一世紀資訊量以驚人的速度暴增，有人認為網路資訊易於取得，會使記憶力與思考力衰退，不利於認知學習；也有人視網際網路為人類的外接大腦記憶體，意味著我們毋須記憶大量知識，可以專注在更重要、更有創造力的事物上。對於以上兩種不同的觀點，你的看法為何？請以「網海浮沉之我思」為題，結合自己的相關經驗，探討創造力與思考力之間的關係。
文長至少600字。

","網海浮沉之我思



網路資訊很容易得到，我覺得這樣會讓人的記憶力和思考力變差。



現在的人都離不開網路，網路確實讓我們生活變得很方便，可以快速找到想要的資料，也可以在家裡跟世界連結。但是因為太方便了，很多人都不想動腦，連要吃什麼、要做什麼工作都要上網問別人。網路上的人很熱心，隨時都會回答你的問題，這樣久了，大家就變成網路的奴隸。



我以前也是這樣，因為功課很多壓力很大，就一直上網。一開始只是查筆記，後來變成玩遊戲玩七個小時都不休息，不到一個禮拜就完全沉迷了。直到有一天學校辦了一場演講，是在講網路成癮的問題，講師說網路會讓人變得很依賴它。



我覺得網路雖然方便，但是不能太依賴它，要學會自己思考，不然腦袋會變得很笨。現在的人應該要想辦法控制自己使用網路的時間，這樣才不會被網路控制了生活。",1,1,1,1,1,5
