題目,作答,立意,結構,修辭,敘述,啟發,總分
"    看到山上那麼多參天大樹時，會勾起我的惻隱之心。在無法順暢呼吸的空間裡，樹木之間為了生存必須展開激烈的競爭。為了能多接受一些陽光，它們只能拼命向上生長。
但是，只為生存而競爭的森林卻漸次死亡，因為陽光無法到達地面，所以溫度不夠高，無法讓幼小的生命萌芽。小樹和花、草，以及與它們一起生活的小昆蟲沒有生存的空間。雖然表面上看起來非常完美，但這種森林其實與沒有希望的不孕之地無異。
根據我的經驗，密集栽種的樹苗體型壯大數十倍時，就需要開始砍樹，否則樹木會抱怨空間太窄，活不下去。要想確保樹木能充分接受陽光照射的空間，就必須做出犧牲。因此，幾年期間強行進行砍伐，樹木間距剛開始時是一公尺，現已擴大到七公尺。也就是說，即使是粗略估算，也可知七棵樹中有六棵為之消失。
森林要想成為孕育新生命的希望之地，就需要有縫隙。如果樹木壽命結束或因為意外災害而倒下，該位置就會產生空間，那麼，溫暖的陽光就會照射進來，被陽光照射的地面混雜著前一年秋天凋落的樹葉，於是積聚起能夠孕育新生命的養分。因此，樹木的縫隙，既是結束和開始共存的空間，也是由缺乏轉化為希望的空間。（改寫自禹鐘榮著、盧鴻金譯《樹木教我的人生課》）
    根據上文所述，為什麼森林需要縫隙？由此聯想，人生是否也需要縫隙？請以「縫隙的聯想」為題，寫一篇文章，結合生活經驗或見聞，書寫你的感思與體悟。
文長至少600字。


","縫隙的聯想



森林需要縫隙，因為這樣才能讓小樹苗長大。如果沒有縫隙，大樹會把所有的陽光和養分都搶走，小樹就長不大了。這樣對森林不好，所以要有縫隙讓小樹有機會生長。



我的生活中也有縫隙。小時候我有一個玩具箱，裡面有很多玩具和球。我最喜歡的是在夜市打彈珠得到的機器人，還有和哥哥一起踢的足球。這些都是我很珍惜的回憶。



但是上了國中以後，我的生活就變了。我的桌上堆滿了參考書和考卷，每天都要讀書考試。老師和家長都說讀書最重要，我只能把玩具都收起來。我的心情變得很不好，覺得很難過。



現在想起來，我很想念以前玩玩具的時候。那時候的生活比較快樂，不像現在這麼辛苦。我希望生活中能有一些縫隙，讓我可以休息和玩耍。",1,1,1,1,1,5
