題目,作答,立意,結構,修辭,敘述,啟發,總分
"    看到山上那麼多參天大樹時，會勾起我的惻隱之心。在無法順暢呼吸的空間裡，樹木之間為了生存必須展開激烈的競爭。為了能多接受一些陽光，它們只能拼命向上生長。
但是，只為生存而競爭的森林卻漸次死亡，因為陽光無法到達地面，所以溫度不夠高，無法讓幼小的生命萌芽。小樹和花、草，以及與它們一起生活的小昆蟲沒有生存的空間。雖然表面上看起來非常完美，但這種森林其實與沒有希望的不孕之地無異。
根據我的經驗，密集栽種的樹苗體型壯大數十倍時，就需要開始砍樹，否則樹木會抱怨空間太窄，活不下去。要想確保樹木能充分接受陽光照射的空間，就必須做出犧牲。因此，幾年期間強行進行砍伐，樹木間距剛開始時是一公尺，現已擴大到七公尺。也就是說，即使是粗略估算，也可知七棵樹中有六棵為之消失。
森林要想成為孕育新生命的希望之地，就需要有縫隙。如果樹木壽命結束或因為意外災害而倒下，該位置就會產生空間，那麼，溫暖的陽光就會照射進來，被陽光照射的地面混雜著前一年秋天凋落的樹葉，於是積聚起能夠孕育新生命的養分。因此，樹木的縫隙，既是結束和開始共存的空間，也是由缺乏轉化為希望的空間。（改寫自禹鐘榮著、盧鴻金譯《樹木教我的人生課》）
    根據上文所述，為什麼森林需要縫隙？由此聯想，人生是否也需要縫隙？請以「縫隙的聯想」為題，寫一篇文章，結合生活經驗或見聞，書寫你的感思與體悟。
文長至少600字。


","縫隙的聯想



縫隙是一個很重要的東西，在生活中到處都可以看到縫隙。像是樹木之間的縫隙，人與人之間的縫隙，還有很多很多的縫隙。



我覺得縫隙有好的也有壞的。好的縫隙就是可以讓我們休息，不要太累。像是讀書的時候要休息一下，不然會很累。壞的縫隙就是跟朋友吵架，然後就不理對方，這樣感情就會有縫隙。



我記得高三的時候，大家都在準備學測，很多同學都很緊張。有的人會給自己一些休息時間，這樣讀書才會有精神。但是有些人一直讀書不休息，結果後來成績反而變差，有的人還想不開。



所以我覺得做什麼事情都要給自己一些空間，不要把自己逼得太緊。就像森林裡的樹木一樣，需要一些縫隙才能長得好。我們的生活也是這樣，要有一些縫隙才能過得好。



我希望大家都可以記住這一點，給自己一些空間，這樣生活才會過得快樂。縫隙雖然看起來是空的，但是其實很重要，可以讓我們的生活變得更好。",2,1,1,2,1,7
