題目,作答,立意,結構,修辭,敘述,啟發,總分
"    看到山上那麼多參天大樹時，會勾起我的惻隱之心。在無法順暢呼吸的空間裡，樹木之間為了生存必須展開激烈的競爭。為了能多接受一些陽光，它們只能拼命向上生長。
但是，只為生存而競爭的森林卻漸次死亡，因為陽光無法到達地面，所以溫度不夠高，無法讓幼小的生命萌芽。小樹和花、草，以及與它們一起生活的小昆蟲沒有生存的空間。雖然表面上看起來非常完美，但這種森林其實與沒有希望的不孕之地無異。
根據我的經驗，密集栽種的樹苗體型壯大數十倍時，就需要開始砍樹，否則樹木會抱怨空間太窄，活不下去。要想確保樹木能充分接受陽光照射的空間，就必須做出犧牲。因此，幾年期間強行進行砍伐，樹木間距剛開始時是一公尺，現已擴大到七公尺。也就是說，即使是粗略估算，也可知七棵樹中有六棵為之消失。
森林要想成為孕育新生命的希望之地，就需要有縫隙。如果樹木壽命結束或因為意外災害而倒下，該位置就會產生空間，那麼，溫暖的陽光就會照射進來，被陽光照射的地面混雜著前一年秋天凋落的樹葉，於是積聚起能夠孕育新生命的養分。因此，樹木的縫隙，既是結束和開始共存的空間，也是由缺乏轉化為希望的空間。（改寫自禹鐘榮著、盧鴻金譯《樹木教我的人生課》）
    根據上文所述，為什麼森林需要縫隙？由此聯想，人生是否也需要縫隙？請以「縫隙的聯想」為題，寫一篇文章，結合生活經驗或見聞，書寫你的感思與體悟。
文長至少600字。


","縫隙的聯想



生活中，每個人都需要休息的時間。就像森林裡的樹木需要空隙一樣，人也需要喘息的機會。



我覺得現在的人壓力都很大，很多人都會去看心理醫生。我去書店的時候，看到很多心理輔導的書，就知道大家都過得不太好。有些人甚至因為壓力太大而想不開。



我自己也有壓力，每天都要上課讀書，假日只能躺在床上休息。但是我知道要找到方法放鬆自己，不然會走不下去。就像森林裡的樹木一樣，如果太擠在一起，就會長不好。所以我們要學會給自己空間。



我覺得每個人都要找到自己的方式來放鬆。有的人喜歡看書，有的人喜歡運動，有的人喜歡聽音樂。只要能讓自己開心，就是好方法。



希望每個人都能找到屬於自己的縫隙，讓生活變得更好。",1,1,1,1,1,5
