題目,作答,立意,結構,修辭,敘述,啟發,總分
"甲
生活中，人們習慣使用「標籤」將複雜的事物簡化、分類，再附上標記。然而，有時我們也將「標籤」使用在人的身上。哲學家叔本華說：「人們都從一個人所擁有的職位、從事的生意、隸屬的民族和家庭—亦即總體上從世俗常規所給予此人的角色和位置判斷他。所以，一個人就像商品一樣地被貼上標籤，並受到商品式的對待。至於根據其個人素質，這個人本身是個什麼樣的人，人們只是依自己的需要隨意地提及，亦即在大多數時候被擱置一邊，或者視而不見。」
人們或傳播媒體貼的標籤，有時會形成「刻板印象」，其中真假對錯值得深思。例如稱某個世代為「草莓族」，提到南美洲就想到「這些民族很會踢足球」。
乙
社會學家貝克指出：「人們一旦被貼上某種標籤，就會成為標籤所標定的人。」標籤對人的個性意識、自我認同有強烈的影響，因此當人被一種詞語或名稱貼上標籤時，他可能會往標籤所喻示的方向發展。許多企業因而賦予員工職稱正向的標籤，以放大標籤的力量。例如，蘋果（Apple）直營零售店中，為顧客的產品進行故障診斷的工程師，職稱是「Genius（天才）」，這個職稱間接鼓勵員工不斷了解最新技術知識，以提供顧客更好建議和技術支持。星巴克（Starbucks）店員則有「咖啡大師」、「咖啡大使」等名稱識別，象徵其所擁有的咖啡知識與對其專業服務的肯定。
你我也可以為自己貼上標籤，定義對自己的期待，並調整行為以符應標籤的內容，讓他人留下深刻印象，以擁有更多展現個人價值的機會。

    日常生活中不乏「貼標籤」或「被貼標籤」的實例，請以「貼標籤」為題，寫一篇文章，並融入上文「標籤」於人身上的正面與負面作用，並舉例闡述你對標籤現象的看法。
文長至少600字。


","貼標籤



在這個快速分類的時代，人們習慣用簡單的標籤來定義複雜的個體。從街頭呼嘯而過的飆車族被稱為「猴子」，到宅在家中沉浸動漫世界的青年被冠上「宅宅」之名，標籤彷彿成為了現代社會理解他人的速食文化。然而，這種快速貼標的現象，究竟為我們的人際互動帶來了什麼樣的影響？



回顧自身經歷，我深刻體會到標籤的雙面性。因為對烹飪的熱愛，朋友們親暱地稱我為「大廚」。這個標籤像是一枚閃亮的徽章，不僅肯定了我的興趣，更激勵我在廚藝的道路上精進。每當穿上圍裙，這個標籤就化作一股無形的力量，推動我鑽研更多料理技巧，嘗試更多創新菜色。然而，另一個「睡神」的標籤卻像是一道無形的枷鎖，讓我在朋友圈中的形象蒙上了懶散的色彩。即使有正當理由未能及時回覆訊息，在這個標籤的影響下，朋友們總是先入為主地認定我又在睡覺。



標籤的力量，正如同一把精準的雕刻刀，能夠塑造人的行為與自我認知。正向的標籤，如同蘋果公司將技術人員稱為「天才」，能夠激發個人潛能，促使人不斷向上；反之，負面的標籤則可能成為自我實現的預言，讓人不自覺地朝著既定印象發展。這種現象印證了社會學家貝克的觀點：標籤不僅是一種稱謂，更是一種潛移默化的行為指引。



因此，在為他人或自己貼標籤時，我們應該謹慎思考其可能帶來的影響。正向的標籤應該被善用，作為激勵進步的動力；而對於負面標籤，我們則需要有意識地避免其限制效應，不讓簡單的分類侷限了人的發展可能。畢竟，每個人都是獨特而複雜的個體，不應被單一標籤所定義。



在這個標籤紛飛的時代，或許我們更應該學會在貼標籤之前，先放慢腳步，用心觀察與理解每個人的獨特之處。唯有如此，才能讓標籤成為溝通的橋樑，而非隔閡的高牆。",5,5,4,4,5,23
