題目,作答,立意,結構,修辭,敘述,啟發,總分
"甲
(陶潛)為彭澤令。不以家累自隨，送一力給其子，書曰：「汝旦夕之費，自給為難。今遣此力，助汝薪水（打柴汲水）之勞。此亦人子也，可善遇之。」(《南史．隱逸．陶潛傳》)
乙
飯後，眾人各自有事離去，留下貞觀靜坐桌前獃想。她今日的這番感慨，實是前未曾有的。
阿啟伯摘瓜，乃她親眼所見。今早，她突發奇想，陪著外公去巡魚塭，回來時，祖孫二人，都在門口停住了，因為後門虛掩，阿啟伯拿著菜刀，正在棚下摘瓜，並未發覺他們，祖孫二個都閃到門背後。貞觀當時是真愣住了，在那種情況下，是前進呢？抑是後退？她不能很快作選擇。然而這種遲疑也只有幾秒鐘，她一下就被外公拉到門後，正是屏息靜氣時，老人家又帶了她拐出小巷口，走到前街來。
貞觀人到了大路上，心下才逐漸明白：外公躲那人的心，竟比那偷瓜的人所做的遮遮掩掩更甚！貞觀以為懂得了外公的心意：他怕阿啟伯當下撞見自己的那種難堪。事實上，他還有另一層深意，貪當然不好，而貧的本身沒有錯。外公不以阿啟伯為不是，是知道他家中十口，有菜就沒飯，有飯就沒菜。(改寫自蕭麗紅《千江有水千江月》)
陶潛或者外公對他人的善意，你可能也曾見聞或經歷過，請以「溫暖的心」為題，寫一篇文章，分享你的經驗及體會。
文長至少600字。

","溫暖的心



人性本善，這是亙古不變的真理。即使在紛擾的世間，每個人心中都蘊藏著一份最純粹的溫暖，等待被觸動、被喚醒。我曾親身經歷過這樣一個溫暖人心的故事，讓我深刻體會到，人與人之間的善意，往往能在最平凡的時刻綻放出最動人的光芒。



在我的小學時光裡，有一位摯友是由祖父母撫養長大的。在那個大多數同學都是由父母照顧的環境中，她的家庭狀況顯得格外特別。雖然家境並不寬裕，僅能維持基本的生活所需，但她的祖父母總是盡其所能地栽培她。然而，這對年邁的長者常因無法給予孫女更優渥的生活而自責，甚至因此不敢參與學校活動，深怕影響孫女的人際關係。



在小學生涯的最後一年，我的摯友報名了校運會的個人跑步競賽。我知道，她最大的心願就是能在比賽時看見台下有著祖父母支持的身影。於是，我和幾位同學決定採取行動，趁著她不在家時拜訪她的祖父母。我們真誠地表達了希望他們能出席比賽的想法，分享著他們孫女平日在學校的點點滴滴，也訴說著她多麼期待能在人生重要時刻有他們的陪伴。



當校慶這天到來，看見祖父母如約出現在觀眾席上時，我永遠無法忘記摯友臉上那驚喜與感動交織的表情。這份意外的驚喜不僅溫暖了她的心，更激發出她內在的潛能。她告訴我，當看見祖父母在場邊為她加油時，她彷彿有了無窮的力量，這股力量最終助她奪得了金牌。賽後，她的祖父母握著我的手，眼中泛著淚光地道謝，那一刻，我深深體會到，原來幸福可以如此簡單而純粹。



這個經歷讓我明白，人間處處有溫情，即使是微小的善意之舉，都可能在他人的生命中留下永恆的美好印記。正如陶潛對兒子的叮嚀，或是小說中外公對鄰居的體諒，這些平凡中的善意，都在訴說著人性最動人的光輝。在這個世界上，我們每個人都可以成為傳遞溫暖的使者，用一個小小的舉動，點亮他人生命中的希望之光。",4,4,4,4,4,20
