題目,作答,立意,結構,修辭,敘述,啟發,總分
"關於地球的記憶
被文字固禁在課本裡
我們的筆尖游走在山脈和海洋
翻譯每片花瓣的嬌嫩和露水的清新
所有的言語 答案
都靜放在我們的課本裡
等待我們翻起這一切的序幕（節錄自薛憶婷〈我們的課本〉）

    以上這首詩，從課本啟動天馬行空的遐想，瞥見知識豐富的樣貌。科學頑童費曼（Richard P. Feynman）曾說觀察轉動的餐盤，讓他得到很大的啟發，領略了興之所至的樂趣。物理課可讓我們發現萬物運行的迷人，生物課帶領我們進入細胞核遊歷，外語課讓我們聽見世界不同的文化。國文課堂上「採菊東籬下，悠然見南山」或「輕羅小扇撲流螢」，詩中情境也往往能讓人神遊於現實之外。過往的課程內容，是否曾經點燃你對知識的熱情？打開課本時，不知能否如〈我們的課本〉所述，揭開知識想像的序幕。
    若能從不同角度切入課本，進入知識的想像，或許可以讓課本帶領我們經歷驚奇的旅程。請以「當我打開課本」為題，寫一篇文章，敘述任一學科課本對你的意義，書寫你探索課本內容、知識的經驗與體會。
文長至少600字。


","當我打開課本



我打開課本時，就像打開一扇門一樣。我最喜歡的是地理課本，因為可以看到很多地方。



地理課本裡有很多山和海，還有不同的國家。我每天早上都會喝牛奶，有一次喝了紐西蘭的牛奶，就讓我想到紐西蘭這個地方。我想像自己在紐西蘭的草地上，看著天空，想著那裡的人們每天都在做什麼。我也想去看看那裡的冰山，因為在台灣看不到這些東西。



看了地理課本，我知道了很多不同的地方。我覺得這讓我更了解世界，也更喜歡自己的國家。因為有些我們平常看得到的東西，在別的地方是看不到的。",1,1,1,1,1,5
