題目,作答,立意,結構,修辭,敘述,啟發,總分
"    我覺得童年是一種氣味的記憶。
    我的童年，有許多果樹氣味的記憶。夏天暑熱的午後，廟埕後有一棵巨大的龍眼樹。我從小學翻牆出來，背著書包，爬上龍眼樹，躲在密密的枝葉裡。外面日光葉影搖晃，隱約聽見老師或母親尋來，在樹下叫著我的名字，但那呼喚的聲音，被蟬聲的高音淹沒了。我一動不動，找到一處適合蜷窩身體的枝椏，好像變成樹的一部分，而那時，龍眼樹密密的甜熟的氣味就包圍著我。我閉起眼睛，好像在假寐，也像在作夢，夢裡一串一串纍纍的龍眼，招來許多蜜蜂果蠅。我童年的夢，很甜很香，好像一整個夏天都窩在那棵樹上，包圍在濃郁的氣味裡做了一個醒不來的夢。（改寫自蔣勳《給青年藝術家的信》）
    生活中充斥各種氣味。氣味透過嗅覺傳遞，喚起人們的記憶和感受，一如文中龍眼樹甜熟的氣味喚起作者的童年記憶。請以「花草樹木的氣味記憶」為題，寫一篇文章，書寫你熟悉的花草樹木的氣味，及其所召喚的記憶和感受。

文長至少600字。

","花草樹木的氣味記憶



我想說說檸檬桉樹的氣味，因為這是我小時候的回憶。檸檬桉樹有一種特別的香味，聞起來像檸檬和木頭混在一起的味道，很好聞。



我記得小時候常常在一棵檸檬桉樹下玩耍。那時候天氣很好，陽光照在樹葉上，地上有很多落葉。這些落葉都有檸檬桉的香味，我很喜歡躺在樹下聞這個味道。有時候躺著躺著就睡著了，因為很舒服。



現在長大了，每天都很忙，要想很多事情。腦袋裡裝了太多東西，所以以前的回憶都慢慢忘記了。但是有時候還是會想起檸檬桉樹的味道，讓我覺得很懷念。",2,1,2,1,1,7
