題目,作答,立意,結構,修辭,敘述,啟發,總分
"關於地球的記憶
被文字固禁在課本裡
我們的筆尖游走在山脈和海洋
翻譯每片花瓣的嬌嫩和露水的清新
所有的言語 答案
都靜放在我們的課本裡
等待我們翻起這一切的序幕（節錄自薛憶婷〈我們的課本〉）

    以上這首詩，從課本啟動天馬行空的遐想，瞥見知識豐富的樣貌。科學頑童費曼（Richard P. Feynman）曾說觀察轉動的餐盤，讓他得到很大的啟發，領略了興之所至的樂趣。物理課可讓我們發現萬物運行的迷人，生物課帶領我們進入細胞核遊歷，外語課讓我們聽見世界不同的文化。國文課堂上「採菊東籬下，悠然見南山」或「輕羅小扇撲流螢」，詩中情境也往往能讓人神遊於現實之外。過往的課程內容，是否曾經點燃你對知識的熱情？打開課本時，不知能否如〈我們的課本〉所述，揭開知識想像的序幕。
    若能從不同角度切入課本，進入知識的想像，或許可以讓課本帶領我們經歷驚奇的旅程。請以「當我打開課本」為題，寫一篇文章，敘述任一學科課本對你的意義，書寫你探索課本內容、知識的經驗與體會。
文長至少600字。


","當我打開課本



打開課本時，我看到了很多文字。在課本裡，我讀到了一個人的故事，他是個很有想法的人。他寫的文字讓我知道了他的想法，他是個很有正義感的人。



這個人生活的時候，有很多人都在說自己的想法。雖然有人不喜歡他，但他還是堅持自己的想法。他不怕別人說他，因為他覺得自己做的事情是對的。他一直都在做他覺得對的事情。



他說要愛所有的人，不管認不認識。他到處跑，想要讓大家不要打仗。他問為什麼要這樣做，他自己的答案就是要去做好事。就算日子不好過，他還是想要做好事，一直都這樣想。



這個人就像一盞燈一樣，給大家指路。他皮膚黑黑的，眼睛很亮，背著東西到處跑。現在雖然過了很久，但我讀到他的故事還是很感動。我在他的故事裡學到了要堅持。



這個人就是墨子，是我最喜歡的一個課本裡的人物。",1,1,1,1,1,5
