題目,作答,立意,結構,修辭,敘述,啟發,總分
"甲
(陶潛)為彭澤令。不以家累自隨，送一力給其子，書曰：「汝旦夕之費，自給為難。今遣此力，助汝薪水（打柴汲水）之勞。此亦人子也，可善遇之。」(《南史．隱逸．陶潛傳》)
乙
飯後，眾人各自有事離去，留下貞觀靜坐桌前獃想。她今日的這番感慨，實是前未曾有的。
阿啟伯摘瓜，乃她親眼所見。今早，她突發奇想，陪著外公去巡魚塭，回來時，祖孫二人，都在門口停住了，因為後門虛掩，阿啟伯拿著菜刀，正在棚下摘瓜，並未發覺他們，祖孫二個都閃到門背後。貞觀當時是真愣住了，在那種情況下，是前進呢？抑是後退？她不能很快作選擇。然而這種遲疑也只有幾秒鐘，她一下就被外公拉到門後，正是屏息靜氣時，老人家又帶了她拐出小巷口，走到前街來。
貞觀人到了大路上，心下才逐漸明白：外公躲那人的心，竟比那偷瓜的人所做的遮遮掩掩更甚！貞觀以為懂得了外公的心意：他怕阿啟伯當下撞見自己的那種難堪。事實上，他還有另一層深意，貪當然不好，而貧的本身沒有錯。外公不以阿啟伯為不是，是知道他家中十口，有菜就沒飯，有飯就沒菜。(改寫自蕭麗紅《千江有水千江月》)
陶潛或者外公對他人的善意，你可能也曾見聞或經歷過，請以「溫暖的心」為題，寫一篇文章，分享你的經驗及體會。
文長至少600字。

","溫暖的心



每個人都說要幫助別人，因為這樣可以讓自己很快樂。我在一個下雨天的時候，在公車站遇到一件事情，讓我覺得人心是很溫暖的。



那天放學的時候，我要去朋友家。因為朋友家有點遠，所以我要坐公車去。那天下很大的雨，打雷打得很大聲。我在公車站等車的時候，看到一個戴帽子的老伯伯從公車上下來。他下車以後就一直看公車的路線圖，然後嘆氣。



我雖然在玩手機，但是我聽到他在說話。他說他老了，坐錯車，而且把雨傘忘在車上了，很煩惱。他要上車的時候，我就把我的雨傘給他，跟他說不要感冒。因為他已經上車了，所以他也不能拒絕。我看著公車開走，覺得很開心。



我沒有雨傘，但是我還是很高興地去朋友家。等我下車的時候，雨就變小了，還出太陽。



這件事讓我知道幫助別人是很自然的事情。如果看到別人有困難卻不幫忙，心裡會不舒服。因為每個人心裡都有溫暖，都想幫助別人。",2,1,1,2,1,7
