題目,作答,立意,結構,修辭,敘述,啟發,總分
"    我覺得童年是一種氣味的記憶。
    我的童年，有許多果樹氣味的記憶。夏天暑熱的午後，廟埕後有一棵巨大的龍眼樹。我從小學翻牆出來，背著書包，爬上龍眼樹，躲在密密的枝葉裡。外面日光葉影搖晃，隱約聽見老師或母親尋來，在樹下叫著我的名字，但那呼喚的聲音，被蟬聲的高音淹沒了。我一動不動，找到一處適合蜷窩身體的枝椏，好像變成樹的一部分，而那時，龍眼樹密密的甜熟的氣味就包圍著我。我閉起眼睛，好像在假寐，也像在作夢，夢裡一串一串纍纍的龍眼，招來許多蜜蜂果蠅。我童年的夢，很甜很香，好像一整個夏天都窩在那棵樹上，包圍在濃郁的氣味裡做了一個醒不來的夢。（改寫自蔣勳《給青年藝術家的信》）
    生活中充斥各種氣味。氣味透過嗅覺傳遞，喚起人們的記憶和感受，一如文中龍眼樹甜熟的氣味喚起作者的童年記憶。請以「花草樹木的氣味記憶」為題，寫一篇文章，書寫你熟悉的花草樹木的氣味，及其所召喚的記憶和感受。

文長至少600字。

","花草樹木的氣味記憶



我小時候常常聞到很多不同的味道，有花香、草香和樹木的香氣。這些味道讓我想起以前的事情。



我姑姑很喜歡種花，她家裡到處都是花和植物。因為我以前上學的地方離姑姑家很近，所以常常去她家。我喜歡坐在她家的陽台，風吹來的時候會有花香。現在我上大學了，也跟姑姑住在一起，有時候會跟她去逛花市，那裡有很多花和樹的香味。



我小時候是阿公阿嬤帶大的。阿公有空的時候會騎摩托車帶我和哥哥去河濱公園看羊，那裡有很多草，我記得草的味道。



每次聞到這些味道的時候，我就會想起以前的事情，覺得很開心。",1,1,1,1,1,5
