題目,作答,立意,結構,修辭,敘述,啟發,總分
"關於地球的記憶
被文字固禁在課本裡
我們的筆尖游走在山脈和海洋
翻譯每片花瓣的嬌嫩和露水的清新
所有的言語 答案
都靜放在我們的課本裡
等待我們翻起這一切的序幕（節錄自薛憶婷〈我們的課本〉）

    以上這首詩，從課本啟動天馬行空的遐想，瞥見知識豐富的樣貌。科學頑童費曼（Richard P. Feynman）曾說觀察轉動的餐盤，讓他得到很大的啟發，領略了興之所至的樂趣。物理課可讓我們發現萬物運行的迷人，生物課帶領我們進入細胞核遊歷，外語課讓我們聽見世界不同的文化。國文課堂上「採菊東籬下，悠然見南山」或「輕羅小扇撲流螢」，詩中情境也往往能讓人神遊於現實之外。過往的課程內容，是否曾經點燃你對知識的熱情？打開課本時，不知能否如〈我們的課本〉所述，揭開知識想像的序幕。
    若能從不同角度切入課本，進入知識的想像，或許可以讓課本帶領我們經歷驚奇的旅程。請以「當我打開課本」為題，寫一篇文章，敘述任一學科課本對你的意義，書寫你探索課本內容、知識的經驗與體會。
文長至少600字。


","當我打開課本



我在高中時第一次讀到「師說」這篇文章。因為被分配到要講解這篇文章，所以對它印象特別深刻。現在上大學了，我還記得「惑而不從師，其為惑也，終不解矣」這句話。



國中時我們要準備會考，大家都想考好。雖然我最有信心的是國文，但成績並不理想。不過我並不難過，因為國中的國文老師教得很好，而且解文言文的題目也很有趣。但是我不敢問老師問題，這個壞習慣一直到高中都沒改掉。



「師說」裡面講到李蟠這個人，他很有學問但還是願意向別人學習。我想我應該要學習他的精神，所以後來我開始敢問老師問題了。



我覺得國文不只是一門要考試的科目。它給了我很多知識，也教會我思考。「師說」這篇文章讓我明白，我們應該要不斷學習。人生只有一次，如果不努力學習就太可惜了。課本不只是一本書，它可以幫助我們更了解自己。",1,1,1,1,1,5
