題目,作答,立意,結構,修辭,敘述,啟發,總分
"    看到山上那麼多參天大樹時，會勾起我的惻隱之心。在無法順暢呼吸的空間裡，樹木之間為了生存必須展開激烈的競爭。為了能多接受一些陽光，它們只能拼命向上生長。
但是，只為生存而競爭的森林卻漸次死亡，因為陽光無法到達地面，所以溫度不夠高，無法讓幼小的生命萌芽。小樹和花、草，以及與它們一起生活的小昆蟲沒有生存的空間。雖然表面上看起來非常完美，但這種森林其實與沒有希望的不孕之地無異。
根據我的經驗，密集栽種的樹苗體型壯大數十倍時，就需要開始砍樹，否則樹木會抱怨空間太窄，活不下去。要想確保樹木能充分接受陽光照射的空間，就必須做出犧牲。因此，幾年期間強行進行砍伐，樹木間距剛開始時是一公尺，現已擴大到七公尺。也就是說，即使是粗略估算，也可知七棵樹中有六棵為之消失。
森林要想成為孕育新生命的希望之地，就需要有縫隙。如果樹木壽命結束或因為意外災害而倒下，該位置就會產生空間，那麼，溫暖的陽光就會照射進來，被陽光照射的地面混雜著前一年秋天凋落的樹葉，於是積聚起能夠孕育新生命的養分。因此，樹木的縫隙，既是結束和開始共存的空間，也是由缺乏轉化為希望的空間。（改寫自禹鐘榮著、盧鴻金譯《樹木教我的人生課》）
    根據上文所述，為什麼森林需要縫隙？由此聯想，人生是否也需要縫隙？請以「縫隙的聯想」為題，寫一篇文章，結合生活經驗或見聞，書寫你的感思與體悟。
文長至少600字。


","縫隙的聯想



森林需要縫隙才能讓陽光照進來，讓小樹苗長大。人生也是這樣，需要有休息的時間。



我是一個高三學生，每天都有很多功課要做，考試也很多。我覺得很累，因為要一直讀書，沒有時間玩，也沒有時間跟家人朋友聊天。我只想要考到好成績，所以一直拼命讀書。



但是壓力太大了，我覺得自己快要受不了。就像掉進海裡一樣，想要游上來卻游不動。我覺得很難過，也很害怕。



有一天，我實在太累了，就出去散步。我走到公園坐在椅子上，看著天空和樹葉，感覺比較輕鬆。這就是我找到的縫隙，讓我可以休息一下。



所以我知道了，讀書的時候也要休息，不能一直讀。就像森林裡的樹一樣，需要空間才能長大。",1,1,1,1,1,5
