題目,作答,立意,結構,修辭,敘述,啟發,總分
"    看到山上那麼多參天大樹時，會勾起我的惻隱之心。在無法順暢呼吸的空間裡，樹木之間為了生存必須展開激烈的競爭。為了能多接受一些陽光，它們只能拼命向上生長。
但是，只為生存而競爭的森林卻漸次死亡，因為陽光無法到達地面，所以溫度不夠高，無法讓幼小的生命萌芽。小樹和花、草，以及與它們一起生活的小昆蟲沒有生存的空間。雖然表面上看起來非常完美，但這種森林其實與沒有希望的不孕之地無異。
根據我的經驗，密集栽種的樹苗體型壯大數十倍時，就需要開始砍樹，否則樹木會抱怨空間太窄，活不下去。要想確保樹木能充分接受陽光照射的空間，就必須做出犧牲。因此，幾年期間強行進行砍伐，樹木間距剛開始時是一公尺，現已擴大到七公尺。也就是說，即使是粗略估算，也可知七棵樹中有六棵為之消失。
森林要想成為孕育新生命的希望之地，就需要有縫隙。如果樹木壽命結束或因為意外災害而倒下，該位置就會產生空間，那麼，溫暖的陽光就會照射進來，被陽光照射的地面混雜著前一年秋天凋落的樹葉，於是積聚起能夠孕育新生命的養分。因此，樹木的縫隙，既是結束和開始共存的空間，也是由缺乏轉化為希望的空間。（改寫自禹鐘榮著、盧鴻金譯《樹木教我的人生課》）
    根據上文所述，為什麼森林需要縫隙？由此聯想，人生是否也需要縫隙？請以「縫隙的聯想」為題，寫一篇文章，結合生活經驗或見聞，書寫你的感思與體悟。
文長至少600字。


","縫隙的聯想



大自然的智慧總是令人驚嘆。在森林中，縫隙不僅是空間的留白，更是生命延續的關鍵。當參天大樹間出現縫隙，陽光得以灑落，為地表帶來溫暖與希望，讓新生命有機會萌芽、成長。這片刻的留白，竟成就了生生不息的生命循環。



回首自己的成長歷程，我深深體會到人生也需要這樣的縫隙。猶記得求學時期，我抱持著探索的熱情，在各種活動中尋找屬於自己的一片天。從音樂到美術，從籃球到羽球，每一次的嘗試都像是在密不透風的生命之林中，開闢一道讓陽光灑落的縫隙。最終，我在羽球運動中找到了自己的舞台，這項運動不僅磨練了我的技巧，更培養了我堅毅的意志。



然而，就如同森林中總有比自己更高大的樹木，運動場上也永遠存在著更強勁的對手。有時即便付出了畢生的努力，仍可能無法超越某些目標。但這並不可怕，因為生命的意義不在於一味地追求超越，而在於在適合自己的位置上，綻放最燦爛的光芒。



如今，我漸漸領悟到：人生的縫隙不僅是讓自己成長的空間，更是為他人創造機會的契機。當我在某個領域有所成就時，我願意效法森林中的大樹，主動讓出一些空間，讓後進者也能沐浴希望的陽光。這種良性循環，正是維持生態平衡、促進社會進步的重要力量。



縫隙，看似是一種缺憾，實則是一種智慧。它提醒我們：生命不該是密不透風的，應該留有讓新事物、新思維得以滲入的空間。唯有如此，我們才能在人生的旅途上，既成就自己，也幫助他人；既仰望星空，也腳踏實地。",5,5,4,4,5,23
