題目,作答,立意,結構,修辭,敘述,啟發,總分
"甲
生活中，人們習慣使用「標籤」將複雜的事物簡化、分類，再附上標記。然而，有時我們也將「標籤」使用在人的身上。哲學家叔本華說：「人們都從一個人所擁有的職位、從事的生意、隸屬的民族和家庭—亦即總體上從世俗常規所給予此人的角色和位置判斷他。所以，一個人就像商品一樣地被貼上標籤，並受到商品式的對待。至於根據其個人素質，這個人本身是個什麼樣的人，人們只是依自己的需要隨意地提及，亦即在大多數時候被擱置一邊，或者視而不見。」
人們或傳播媒體貼的標籤，有時會形成「刻板印象」，其中真假對錯值得深思。例如稱某個世代為「草莓族」，提到南美洲就想到「這些民族很會踢足球」。
乙
社會學家貝克指出：「人們一旦被貼上某種標籤，就會成為標籤所標定的人。」標籤對人的個性意識、自我認同有強烈的影響，因此當人被一種詞語或名稱貼上標籤時，他可能會往標籤所喻示的方向發展。許多企業因而賦予員工職稱正向的標籤，以放大標籤的力量。例如，蘋果（Apple）直營零售店中，為顧客的產品進行故障診斷的工程師，職稱是「Genius（天才）」，這個職稱間接鼓勵員工不斷了解最新技術知識，以提供顧客更好建議和技術支持。星巴克（Starbucks）店員則有「咖啡大師」、「咖啡大使」等名稱識別，象徵其所擁有的咖啡知識與對其專業服務的肯定。
你我也可以為自己貼上標籤，定義對自己的期待，並調整行為以符應標籤的內容，讓他人留下深刻印象，以擁有更多展現個人價值的機會。

    日常生活中不乏「貼標籤」或「被貼標籤」的實例，請以「貼標籤」為題，寫一篇文章，並融入上文「標籤」於人身上的正面與負面作用，並舉例闡述你對標籤現象的看法。
文長至少600字。


","貼標籤



現在的人很喜歡給別人貼標籤，有時候這些標籤會讓人很困擾。像是有人說女生開車都很差，或是說男生一定要很勇敢。我覺得這樣不太好，因為每個人都不一樣。



我以前常常看到別人被貼標籤。比如說有人會說讀書好的人一定很宅，運動好的人一定功課差。但是這些都不一定是對的，因為每個人都有自己的特點。像我就認識一個同學，他功課很好，運動也很棒。



我自己也被貼過標籤。有一次我考試考得不好，老師就說我是個不認真的學生。但是我其實有在努力，只是那次沒發揮好而已。這種被貼標籤的感覺真的很不舒服。



我覺得我們不應該隨便給別人貼標籤，因為這樣會傷害別人的感受。每個人都是不一樣的，不能用一個標籤就把人分類。而且有時候這些標籤會讓人很難過，甚至影響到他們的生活。



所以我希望大家可以停止給別人貼標籤，讓每個人都可以做自己。這樣的話，世界會變得更好。",2,1,1,2,1,7
