題目,作答,立意,結構,修辭,敘述,啟發,總分
"    看到山上那麼多參天大樹時，會勾起我的惻隱之心。在無法順暢呼吸的空間裡，樹木之間為了生存必須展開激烈的競爭。為了能多接受一些陽光，它們只能拼命向上生長。
但是，只為生存而競爭的森林卻漸次死亡，因為陽光無法到達地面，所以溫度不夠高，無法讓幼小的生命萌芽。小樹和花、草，以及與它們一起生活的小昆蟲沒有生存的空間。雖然表面上看起來非常完美，但這種森林其實與沒有希望的不孕之地無異。
根據我的經驗，密集栽種的樹苗體型壯大數十倍時，就需要開始砍樹，否則樹木會抱怨空間太窄，活不下去。要想確保樹木能充分接受陽光照射的空間，就必須做出犧牲。因此，幾年期間強行進行砍伐，樹木間距剛開始時是一公尺，現已擴大到七公尺。也就是說，即使是粗略估算，也可知七棵樹中有六棵為之消失。
森林要想成為孕育新生命的希望之地，就需要有縫隙。如果樹木壽命結束或因為意外災害而倒下，該位置就會產生空間，那麼，溫暖的陽光就會照射進來，被陽光照射的地面混雜著前一年秋天凋落的樹葉，於是積聚起能夠孕育新生命的養分。因此，樹木的縫隙，既是結束和開始共存的空間，也是由缺乏轉化為希望的空間。（改寫自禹鐘榮著、盧鴻金譯《樹木教我的人生課》）
    根據上文所述，為什麼森林需要縫隙？由此聯想，人生是否也需要縫隙？請以「縫隙的聯想」為題，寫一篇文章，結合生活經驗或見聞，書寫你的感思與體悟。
文長至少600字。


","縫隙的聯想



我去過森林，看到很多樹木。有的樹很高大，有的樹很矮小。大樹的葉子會遮住陽光，讓小樹長不大。



我覺得人也需要縫隙。因為每個人都不一樣，有不同的興趣和朋友。如果沒有縫隙的話，人會很累。就像森林裡的小樹一樣，會被大樹遮住陽光，長不大。



我覺得人和人之間要有空間，不能太擠在一起。比如說，我和朋友在一起的時候，也需要一些自己的時間。這樣才不會覺得很煩。有時候和家人在一起也是這樣，需要一點自己的空間。



縫隙是很重要的。就像森林裡的樹木一樣，需要一些空間才能長大。人也是這樣，需要一些空間才能過得好。如果沒有縫隙，大家都會很不舒服。



所以我認為縫隙是必要的。不管是在森林裡還是在生活中，都需要有一些空間。這樣才能讓每個人都過得開心，不會覺得很擠。",2,1,1,2,1,7
