題目,作答,立意,結構,修辭,敘述,啟發,總分
"    我覺得童年是一種氣味的記憶。
    我的童年，有許多果樹氣味的記憶。夏天暑熱的午後，廟埕後有一棵巨大的龍眼樹。我從小學翻牆出來，背著書包，爬上龍眼樹，躲在密密的枝葉裡。外面日光葉影搖晃，隱約聽見老師或母親尋來，在樹下叫著我的名字，但那呼喚的聲音，被蟬聲的高音淹沒了。我一動不動，找到一處適合蜷窩身體的枝椏，好像變成樹的一部分，而那時，龍眼樹密密的甜熟的氣味就包圍著我。我閉起眼睛，好像在假寐，也像在作夢，夢裡一串一串纍纍的龍眼，招來許多蜜蜂果蠅。我童年的夢，很甜很香，好像一整個夏天都窩在那棵樹上，包圍在濃郁的氣味裡做了一個醒不來的夢。（改寫自蔣勳《給青年藝術家的信》）
    生活中充斥各種氣味。氣味透過嗅覺傳遞，喚起人們的記憶和感受，一如文中龍眼樹甜熟的氣味喚起作者的童年記憶。請以「花草樹木的氣味記憶」為題，寫一篇文章，書寫你熟悉的花草樹木的氣味，及其所召喚的記憶和感受。

文長至少600字。

","花草樹木的氣味記憶



我要說說我小時候聞過的花香。我記得在我讀國小的時候，學校有一片空地，那裡種了很多玫瑰花。每次下課的時候，我和同學都會跑到那裡玩鬼抓人。



那個地方雖然看起來很普通，但是對我們來說很重要，因為我們每天都在那裡玩。玫瑰花的香味很好聞，讓我們玩得更開心。有一次我和同學玩的時候不小心撞在一起，我差點暈倒，但是聞到玫瑰花香就覺得很安心。



玫瑰花代表害羞和熱情，我覺得這跟我們小時候很像。我們剛認識的時候都很害羞，但是後來就變成好朋友了。現在我長大了，但是每次聞到玫瑰花香，還是會想起以前和同學一起玩的時候。



雖然人會長大，但是花香的味道永遠不會變。我最近又回到學校，看到那些玫瑰花還在那裡開著。聞到花香的時候，我就想起以前的事情，覺得很懷念。這就是我的花草樹木氣味記憶。",2,1,1,2,1,7
