題目,作答,立意,結構,修辭,敘述,啟發,總分
"甲
(陶潛)為彭澤令。不以家累自隨，送一力給其子，書曰：「汝旦夕之費，自給為難。今遣此力，助汝薪水（打柴汲水）之勞。此亦人子也，可善遇之。」(《南史．隱逸．陶潛傳》)
乙
飯後，眾人各自有事離去，留下貞觀靜坐桌前獃想。她今日的這番感慨，實是前未曾有的。
阿啟伯摘瓜，乃她親眼所見。今早，她突發奇想，陪著外公去巡魚塭，回來時，祖孫二人，都在門口停住了，因為後門虛掩，阿啟伯拿著菜刀，正在棚下摘瓜，並未發覺他們，祖孫二個都閃到門背後。貞觀當時是真愣住了，在那種情況下，是前進呢？抑是後退？她不能很快作選擇。然而這種遲疑也只有幾秒鐘，她一下就被外公拉到門後，正是屏息靜氣時，老人家又帶了她拐出小巷口，走到前街來。
貞觀人到了大路上，心下才逐漸明白：外公躲那人的心，竟比那偷瓜的人所做的遮遮掩掩更甚！貞觀以為懂得了外公的心意：他怕阿啟伯當下撞見自己的那種難堪。事實上，他還有另一層深意，貪當然不好，而貧的本身沒有錯。外公不以阿啟伯為不是，是知道他家中十口，有菜就沒飯，有飯就沒菜。(改寫自蕭麗紅《千江有水千江月》)
陶潛或者外公對他人的善意，你可能也曾見聞或經歷過，請以「溫暖的心」為題，寫一篇文章，分享你的經驗及體會。
文長至少600字。

","溫暖的心



我覺得人要對別人好，這樣生活才會有意義。我要講一個我國中時候的故事，是關於一個很可憐的同學的事。



我有一個同學，他爸媽很早就過世了，所以他都很安靜，不太跟人說話。上課的時候他都一個人坐在角落，不敢跟別人玩。放學的時候他也不會馬上回家，都一個人坐在位子上看窗外，等到天黑才回家。



我看他這樣很可憐，就常常去找他玩。我們一起分組討論功課，放學後也會一起去學校旁邊的小山坡玩。我們在那邊跑來跑去，玩累了就躺在草地上看天空，那時候覺得很開心。



但是後來暑假結束開學的時候，老師告訴我他自殺了。老師說他在遺書裡寫到，雖然沒有爸媽讓他很難過，但是因為有我陪他，他才覺得生活有希望。可是最後他還是選擇了離開這個世界，讓我覺得很傷心。



我希望大家都可以對別人好一點，因為這樣可以讓別人感受到溫暖。雖然有時候我們幫不了別人太多，但是至少可以讓他們知道這個世界上還有人關心他們。",2,1,1,2,1,7
