題目,作答,立意,結構,修辭,敘述,啟發,總分
"關於地球的記憶
被文字固禁在課本裡
我們的筆尖游走在山脈和海洋
翻譯每片花瓣的嬌嫩和露水的清新
所有的言語 答案
都靜放在我們的課本裡
等待我們翻起這一切的序幕（節錄自薛憶婷〈我們的課本〉）

    以上這首詩，從課本啟動天馬行空的遐想，瞥見知識豐富的樣貌。科學頑童費曼（Richard P. Feynman）曾說觀察轉動的餐盤，讓他得到很大的啟發，領略了興之所至的樂趣。物理課可讓我們發現萬物運行的迷人，生物課帶領我們進入細胞核遊歷，外語課讓我們聽見世界不同的文化。國文課堂上「採菊東籬下，悠然見南山」或「輕羅小扇撲流螢」，詩中情境也往往能讓人神遊於現實之外。過往的課程內容，是否曾經點燃你對知識的熱情？打開課本時，不知能否如〈我們的課本〉所述，揭開知識想像的序幕。
    若能從不同角度切入課本，進入知識的想像，或許可以讓課本帶領我們經歷驚奇的旅程。請以「當我打開課本」為題，寫一篇文章，敘述任一學科課本對你的意義，書寫你探索課本內容、知識的經驗與體會。
文長至少600字。


","當我打開課本



英文課本是我求學過程中印象深刻的一本書。每次翻開課本，看到那些英文單字和句子，總是有不同的感受。有時候覺得英文很難，要背很多單字讓人煩惱；有時候又覺得簡單，因為只要記住幾個單字就能表達想法。



雖然學習英文常常讓人感到無聊，特別是要背誦大量單字的時候，但想到以後出國旅遊或工作時能用英文和外國人溝通，就覺得學習英文還是有意義的。畢竟英文是世界通用的語言，掌握好英文對未來發展很重要。



打開英文課本時，我常常在想：這些知識雖然現在學起來辛苦，但總有一天會派上用場。或許這就是學習的意義吧。",1,1,1,1,1,5
