題目,作答,立意,結構,修辭,敘述,啟發,總分
"    我覺得童年是一種氣味的記憶。
    我的童年，有許多果樹氣味的記憶。夏天暑熱的午後，廟埕後有一棵巨大的龍眼樹。我從小學翻牆出來，背著書包，爬上龍眼樹，躲在密密的枝葉裡。外面日光葉影搖晃，隱約聽見老師或母親尋來，在樹下叫著我的名字，但那呼喚的聲音，被蟬聲的高音淹沒了。我一動不動，找到一處適合蜷窩身體的枝椏，好像變成樹的一部分，而那時，龍眼樹密密的甜熟的氣味就包圍著我。我閉起眼睛，好像在假寐，也像在作夢，夢裡一串一串纍纍的龍眼，招來許多蜜蜂果蠅。我童年的夢，很甜很香，好像一整個夏天都窩在那棵樹上，包圍在濃郁的氣味裡做了一個醒不來的夢。（改寫自蔣勳《給青年藝術家的信》）
    生活中充斥各種氣味。氣味透過嗅覺傳遞，喚起人們的記憶和感受，一如文中龍眼樹甜熟的氣味喚起作者的童年記憶。請以「花草樹木的氣味記憶」為題，寫一篇文章，書寫你熟悉的花草樹木的氣味，及其所召喚的記憶和感受。

文長至少600字。

","花草樹木的氣味記憶



我最喜歡夏天下雨後的青草味道。每次聞到這個味道就會想起小時候的事情。



我小時候很愛玩，放學後都不會待在家裡。如果下雨的話，我就會很不開心，只能坐在家門口等雨停。雨快停的時候，我就會穿上雨衣雨鞋跑出去玩。



我和朋友們都會去一個地方玩。我們會先點名，然後就開始玩遊戲。我們會踩水坑、抓魚，還有玩老鷹抓小雞。那時候空氣很清新，有青草的味道，玩得很開心。



玩到天黑的時候，爸爸媽媽就會來叫我們回家吃飯。我們就會說再見，約好明天再一起玩。



但是現在長大了，大家都不再一起玩了。雖然這樣，但是每次聞到下雨後的青草味，我還是會想起以前玩耍的時候。",1,1,1,1,1,5
