題目,作答,立意,結構,修辭,敘述,啟發,總分
"關於地球的記憶
被文字固禁在課本裡
我們的筆尖游走在山脈和海洋
翻譯每片花瓣的嬌嫩和露水的清新
所有的言語 答案
都靜放在我們的課本裡
等待我們翻起這一切的序幕（節錄自薛憶婷〈我們的課本〉）

    以上這首詩，從課本啟動天馬行空的遐想，瞥見知識豐富的樣貌。科學頑童費曼（Richard P. Feynman）曾說觀察轉動的餐盤，讓他得到很大的啟發，領略了興之所至的樂趣。物理課可讓我們發現萬物運行的迷人，生物課帶領我們進入細胞核遊歷，外語課讓我們聽見世界不同的文化。國文課堂上「採菊東籬下，悠然見南山」或「輕羅小扇撲流螢」，詩中情境也往往能讓人神遊於現實之外。過往的課程內容，是否曾經點燃你對知識的熱情？打開課本時，不知能否如〈我們的課本〉所述，揭開知識想像的序幕。
    若能從不同角度切入課本，進入知識的想像，或許可以讓課本帶領我們經歷驚奇的旅程。請以「當我打開課本」為題，寫一篇文章，敘述任一學科課本對你的意義，書寫你探索課本內容、知識的經驗與體會。
文長至少600字。


","當我打開課本



我最喜歡的是物理課本，因為裡面有很多公式和理論。這些都是以前的科學家研究出來的，他們都很厲害，還得到諾貝爾獎。我覺得他們很認真，花了很多時間做研究。



我們現在還在研究宇宙，因為宇宙很大很神秘。以前的人就開始研究宇宙了，他們想要知道天氣和時間。後來人類去了月球，就知道了更多關於宇宙的事情。



宇宙裡面有很多我們不知道的事情，我們要繼續研究才能知道更多。雖然要花很多時間，但是只要我們一直努力，就可以學到更多東西。



課本裡的知識都是很重要的，是以前的人留給我們的。我們現在的生活都需要這些知識，像是手機和電腦都是用知識發明的。我們要好好學習這些知識，這樣才能讓未來變得更好。



所以我覺得課本很重要，我們要認真讀書，這樣才能學到更多東西。希望以後我也可以發明新的東西，讓世界變得更好。",2,1,1,2,1,7
