題目,作答,立意,結構,修辭,敘述,啟發,總分
"關於地球的記憶
被文字固禁在課本裡
我們的筆尖游走在山脈和海洋
翻譯每片花瓣的嬌嫩和露水的清新
所有的言語 答案
都靜放在我們的課本裡
等待我們翻起這一切的序幕（節錄自薛憶婷〈我們的課本〉）

    以上這首詩，從課本啟動天馬行空的遐想，瞥見知識豐富的樣貌。科學頑童費曼（Richard P. Feynman）曾說觀察轉動的餐盤，讓他得到很大的啟發，領略了興之所至的樂趣。物理課可讓我們發現萬物運行的迷人，生物課帶領我們進入細胞核遊歷，外語課讓我們聽見世界不同的文化。國文課堂上「採菊東籬下，悠然見南山」或「輕羅小扇撲流螢」，詩中情境也往往能讓人神遊於現實之外。過往的課程內容，是否曾經點燃你對知識的熱情？打開課本時，不知能否如〈我們的課本〉所述，揭開知識想像的序幕。
    若能從不同角度切入課本，進入知識的想像，或許可以讓課本帶領我們經歷驚奇的旅程。請以「當我打開課本」為題，寫一篇文章，敘述任一學科課本對你的意義，書寫你探索課本內容、知識的經驗與體會。
文長至少600字。


","當我打開課本



我每天都要打開課本讀書，因為要考試。每次上課時，老師走進教室，我就要打開課本，跟著老師念課文。



我最喜歡的是歷史課本，因為裡面有很多故事。以前讀歷史只是為了考試，但是考完學測後，我開始覺得歷史課本很有趣。



歷史課本裡面有很多人物和故事，像是韓信、蘇軾這些人。我可以看到他們做了什麼事情。以前讀課本都覺得很無聊，現在覺得比較有意思了。這些故事讓我知道了很多以前的事情。



讀歷史可以學到很多東西，可以知道以前的人做錯了什麼，這樣我們就不會再犯同樣的錯誤。課本裡的知識很重要，可以幫助我們。



所以我覺得課本很重要，因為它可以告訴我們很多事情。我們要好好讀書，這樣才能學到東西。現在的和平生活是因為以前的人努力才有的，所以我們要感謝他們。",1,1,1,1,1,5
