題目,作答,立意,結構,修辭,敘述,啟發,總分
"關於地球的記憶
被文字固禁在課本裡
我們的筆尖游走在山脈和海洋
翻譯每片花瓣的嬌嫩和露水的清新
所有的言語 答案
都靜放在我們的課本裡
等待我們翻起這一切的序幕（節錄自薛憶婷〈我們的課本〉）

    以上這首詩，從課本啟動天馬行空的遐想，瞥見知識豐富的樣貌。科學頑童費曼（Richard P. Feynman）曾說觀察轉動的餐盤，讓他得到很大的啟發，領略了興之所至的樂趣。物理課可讓我們發現萬物運行的迷人，生物課帶領我們進入細胞核遊歷，外語課讓我們聽見世界不同的文化。國文課堂上「採菊東籬下，悠然見南山」或「輕羅小扇撲流螢」，詩中情境也往往能讓人神遊於現實之外。過往的課程內容，是否曾經點燃你對知識的熱情？打開課本時，不知能否如〈我們的課本〉所述，揭開知識想像的序幕。
    若能從不同角度切入課本，進入知識的想像，或許可以讓課本帶領我們經歷驚奇的旅程。請以「當我打開課本」為題，寫一篇文章，敘述任一學科課本對你的意義，書寫你探索課本內容、知識的經驗與體會。
文長至少600字。


","當我打開課本



我覺得課本是一個很有趣的東西。以前我最喜歡國文課本，因為可以跟朋友一起玩課文裡的句子，把它們拼在一起變成好笑的話，這樣可以讓我們很開心。



雖然老師都說不可以在課本上亂畫，但是我還是喜歡在課本上畫畫。我會把課文裡的人物畫成卡通人物，像是把曹操畫成巨人，把諸葛亮畫成搖滾歌手。我覺得這樣可以讓我更喜歡讀書，因為課本變得比較有趣了。



現在的學校都在用電腦和平板上課，我覺得這樣不太好。因為用紙本課本比較好，可以摸到書本的感覺，也可以在上面寫寫畫畫。如果以後都沒有紙本課本了，那就不能像以前那樣學習了。



我覺得課本對我來說很重要，因為它讓我認識了很多文字，也讓我可以發揮想像力。雖然現在的課本都變成電子的了，但是我還是比較喜歡紙本的課本，因為那是我從小到大的回憶。",2,2,1,2,1,8
