題目,作答,立意,結構,修辭,敘述,啟發,總分
"    我覺得童年是一種氣味的記憶。
    我的童年，有許多果樹氣味的記憶。夏天暑熱的午後，廟埕後有一棵巨大的龍眼樹。我從小學翻牆出來，背著書包，爬上龍眼樹，躲在密密的枝葉裡。外面日光葉影搖晃，隱約聽見老師或母親尋來，在樹下叫著我的名字，但那呼喚的聲音，被蟬聲的高音淹沒了。我一動不動，找到一處適合蜷窩身體的枝椏，好像變成樹的一部分，而那時，龍眼樹密密的甜熟的氣味就包圍著我。我閉起眼睛，好像在假寐，也像在作夢，夢裡一串一串纍纍的龍眼，招來許多蜜蜂果蠅。我童年的夢，很甜很香，好像一整個夏天都窩在那棵樹上，包圍在濃郁的氣味裡做了一個醒不來的夢。（改寫自蔣勳《給青年藝術家的信》）
    生活中充斥各種氣味。氣味透過嗅覺傳遞，喚起人們的記憶和感受，一如文中龍眼樹甜熟的氣味喚起作者的童年記憶。請以「花草樹木的氣味記憶」為題，寫一篇文章，書寫你熟悉的花草樹木的氣味，及其所召喚的記憶和感受。

文長至少600字。

","花草樹木的氣味記憶



我最喜歡草地的味道。每次學校修剪草皮的時候，都會有一種特別的味道。這種味道讓我想起小時候在學校的時光。



那時候學校的操場上有很多草，每年都要修剪好幾次。修剪完的草會堆成小山，在太陽底下發出香味。我和同學們最喜歡在下課的時候跑去玩草堆。我們會躺在草堆上看天空，聞著草的味道。草的味道有時候香香的，有時候甜甜的，還有時候會有點嗆鼻子。



後來上了國中和高中，操場都變成水泥地了，再也聞不到草的味道。但是每次聞到草香的時候，我還是會想起小時候玩草堆的時候。



現在我上大學了，學校操場又有草地。等到修剪草皮的時候，我想找朋友一起去玩，讓他們也感受一下草地的味道。",1,1,1,1,1,5
