題目,作答,立意,結構,修辭,敘述,啟發,總分
"    看到山上那麼多參天大樹時，會勾起我的惻隱之心。在無法順暢呼吸的空間裡，樹木之間為了生存必須展開激烈的競爭。為了能多接受一些陽光，它們只能拼命向上生長。
但是，只為生存而競爭的森林卻漸次死亡，因為陽光無法到達地面，所以溫度不夠高，無法讓幼小的生命萌芽。小樹和花、草，以及與它們一起生活的小昆蟲沒有生存的空間。雖然表面上看起來非常完美，但這種森林其實與沒有希望的不孕之地無異。
根據我的經驗，密集栽種的樹苗體型壯大數十倍時，就需要開始砍樹，否則樹木會抱怨空間太窄，活不下去。要想確保樹木能充分接受陽光照射的空間，就必須做出犧牲。因此，幾年期間強行進行砍伐，樹木間距剛開始時是一公尺，現已擴大到七公尺。也就是說，即使是粗略估算，也可知七棵樹中有六棵為之消失。
森林要想成為孕育新生命的希望之地，就需要有縫隙。如果樹木壽命結束或因為意外災害而倒下，該位置就會產生空間，那麼，溫暖的陽光就會照射進來，被陽光照射的地面混雜著前一年秋天凋落的樹葉，於是積聚起能夠孕育新生命的養分。因此，樹木的縫隙，既是結束和開始共存的空間，也是由缺乏轉化為希望的空間。（改寫自禹鐘榮著、盧鴻金譯《樹木教我的人生課》）
    根據上文所述，為什麼森林需要縫隙？由此聯想，人生是否也需要縫隙？請以「縫隙的聯想」為題，寫一篇文章，結合生活經驗或見聞，書寫你的感思與體悟。
文長至少600字。


","縫隙的聯想



我覺得人和人之間的關係很難處理，就像森林裡的樹木一樣，有時候會有很多問題。我上大學以後交了新朋友，但是感覺和他們之間總是有一道看不見的牆，好像怎麼樣都走不進彼此的心裡。



我以前在高中當體育班的隊長，那時候想要和大家處得很好，希望大家可以像一家人一樣。可是後來發現只有我自己這樣想，別人都不這麼想。這讓我很難過，所以我就想說每個人都不一樣，想法也不一樣，如果不退一步的話，關係就會越來越差。



還有一次是和教練的事情。因為我是隊長，要幫教練和隊員溝通。教練想和我們當朋友，但是因為他是老師我們是學生，所以關係就變得很奇怪。而且教練要顧成績，壓力很大，就會對我們很嚴格，這樣關係就更不好了。



我從小就很在意人際關係，但是現在才知道，如果要和別人處得好，大家都要退一步才行。就像森林裡的樹木一樣，需要一些空間才能長得好。",2,1,1,2,1,7
