題目,作答,立意,結構,修辭,敘述,啟發,總分
"二十一世紀資訊量以驚人的速度暴增，有人認為網路資訊易於取得，會使記憶力與思考力衰退，不利於認知學習；也有人視網際網路為人類的外接大腦記憶體，意味著我們毋須記憶大量知識，可以專注在更重要、更有創造力的事物上。對於以上兩種不同的觀點，你的看法為何？請以「網海浮沉之我思」為題，結合自己的相關經驗，探討創造力與思考力之間的關係。
文長至少600字。

","網海浮沉之我思



現在的網路很方便，大家都在用網路找資料。有人說網路會讓我們變笨，因為什麼都不用記，也不用想。但是也有人說網路很好用，可以幫我們記東西。



我覺得網路雖然方便，但是也有壞處。因為網路太方便了，所以我們都不會想東西。像是我在寫功課的時候，都直接上網找答案，也不會自己想一想答案是什麼。這樣子久了，我就變得很懶惰，什麼都要靠網路。



我的物理老師說過，要自己想答案才會記得住。但是現在的人都不愛想，因為網路上都有答案。我覺得這樣不太好，因為自己想出來的東西才會記得比較久。



所以我覺得網路雖然方便，但是不能太依賴它。我們還是要自己想東西，這樣才能學到東西。如果什麼都靠網路，那我們就不會進步了。",1,1,1,1,1,5
