題目,作答,立意,結構,修辭,敘述,啟發,總分
"    糖對身體是有好處的，運動過後或飢餓時，適當地補充糖會讓我們迅速恢復體力。科學研究也發現，大腦細胞的能量來源主要來自葡萄糖，當血糖濃度降低時，大腦難以順利運轉，容易注意力不集中，學習或做事效果不佳。不過，哈佛醫學院等多個研究機構指出，高糖飲食會增加罹患乳癌及憂鬱症等疾病的風險；世界衛生組織也指出，高糖飲食是造成體重過重、第二型糖尿病、蛀牙、心臟病的元兇，並建議每日飲食中「添加糖」的攝取量不宜超過總熱量的10%。以每日熱量攝取量2000大卡為例，也就是50公克糖。我國國民健康署於民國103年至106年的「國民營養健康狀況變遷調查」中，有關國人飲用含糖飲料的結果顯示，國民中小學生在飲用比例上為各年齡之冠，其中男性又高於女性。
    基於國民營養及健康飲食原則，目前中小學校園禁止出現含糖飲料，以避免孩子在校園攝取過多糖份。但反對者認為，孩子回到家還是可能會喝含糖飲料，無法治本。
    對於「中、小學校園禁止含糖飲料」，你贊成或反對？請以「禁止含糖飲料進入中、小學之我見」為題，撰寫一篇文章，提出你的看法與論述。
文長至少600字。


","禁止含糖飲料進入中小學之我見



我覺得學校不應該禁止含糖飲料進入校園。因為糖是可以補充能量的，而且有時候學生會需要喝一點含糖飲料。像是有些同學會沒有吃早餐，或是運動完之後很累，這時候喝一點含糖飲料可以讓他們有精神。



雖然喝太多含糖飲料對身體不好，會讓人生病，但是我覺得學生應該要學會自己控制。如果學校完全禁止含糖飲料，學生回家還是會喝，這樣沒有用。而且有些學生不喜歡喝白開水，如果學校只有白開水，他們可能會整天都不喝水。



我認為學校應該要教學生正確的飲食習慣，而不是直接禁止含糖飲料。因為學生需要學會自己判斷什麼時候可以喝，喝多少才對。如果學校只會禁止，學生就不會學到這些東西。



所以我不贊成學校禁止含糖飲料，應該要讓學生自己決定要不要喝。但是學校要教導學生喝太多含糖飲料的壞處，這樣才能讓學生學會照顧自己的健康。",2,1,1,2,1,7
