題目,作答,立意,結構,修辭,敘述,啟發,總分
"    看到山上那麼多參天大樹時，會勾起我的惻隱之心。在無法順暢呼吸的空間裡，樹木之間為了生存必須展開激烈的競爭。為了能多接受一些陽光，它們只能拼命向上生長。
但是，只為生存而競爭的森林卻漸次死亡，因為陽光無法到達地面，所以溫度不夠高，無法讓幼小的生命萌芽。小樹和花、草，以及與它們一起生活的小昆蟲沒有生存的空間。雖然表面上看起來非常完美，但這種森林其實與沒有希望的不孕之地無異。
根據我的經驗，密集栽種的樹苗體型壯大數十倍時，就需要開始砍樹，否則樹木會抱怨空間太窄，活不下去。要想確保樹木能充分接受陽光照射的空間，就必須做出犧牲。因此，幾年期間強行進行砍伐，樹木間距剛開始時是一公尺，現已擴大到七公尺。也就是說，即使是粗略估算，也可知七棵樹中有六棵為之消失。
森林要想成為孕育新生命的希望之地，就需要有縫隙。如果樹木壽命結束或因為意外災害而倒下，該位置就會產生空間，那麼，溫暖的陽光就會照射進來，被陽光照射的地面混雜著前一年秋天凋落的樹葉，於是積聚起能夠孕育新生命的養分。因此，樹木的縫隙，既是結束和開始共存的空間，也是由缺乏轉化為希望的空間。（改寫自禹鐘榮著、盧鴻金譯《樹木教我的人生課》）
    根據上文所述，為什麼森林需要縫隙？由此聯想，人生是否也需要縫隙？請以「縫隙的聯想」為題，寫一篇文章，結合生活經驗或見聞，書寫你的感思與體悟。
文長至少600字。


","縫隙的聯想



生活中，我們常常會覺得很累，因為要做的事情太多了。就像森林裡的樹木一樣，大家都在擠來擠去，想要爭一點空間和陽光。



我的外公外婆就是這樣，他們每天工作很辛苦，就是為了要給我們好的生活。因為我媽媽行動不方便，所以他們更要努力賺錢。但是他們工作太累了，身體都壞掉了。外公現在走路不方便，外婆得了憂鬱症，都不出門了。



我覺得人生也需要空隙，不能一直拼命工作。就像森林裡的樹木，如果太擠在一起，反而會死掉。我們應該要給自己休息的時間，不要把自己逼得太緊。



我現在知道了，做事情要慢慢來，先把重要的事情做好，其他的事情可以等一等。這樣才不會像外公外婆一樣，為了給我們好生活，結果把自己的身體搞壞了。



所以我想說的是，人生需要有空隙，要給自己喘息的機會。不要一直想要做很多事，這樣反而會把自己搞得很累。",2,1,1,2,1,7
