題目,作答,立意,結構,修辭,敘述,啟發,總分
"甲
生活中，人們習慣使用「標籤」將複雜的事物簡化、分類，再附上標記。然而，有時我們也將「標籤」使用在人的身上。哲學家叔本華說：「人們都從一個人所擁有的職位、從事的生意、隸屬的民族和家庭—亦即總體上從世俗常規所給予此人的角色和位置判斷他。所以，一個人就像商品一樣地被貼上標籤，並受到商品式的對待。至於根據其個人素質，這個人本身是個什麼樣的人，人們只是依自己的需要隨意地提及，亦即在大多數時候被擱置一邊，或者視而不見。」
人們或傳播媒體貼的標籤，有時會形成「刻板印象」，其中真假對錯值得深思。例如稱某個世代為「草莓族」，提到南美洲就想到「這些民族很會踢足球」。
乙
社會學家貝克指出：「人們一旦被貼上某種標籤，就會成為標籤所標定的人。」標籤對人的個性意識、自我認同有強烈的影響，因此當人被一種詞語或名稱貼上標籤時，他可能會往標籤所喻示的方向發展。許多企業因而賦予員工職稱正向的標籤，以放大標籤的力量。例如，蘋果（Apple）直營零售店中，為顧客的產品進行故障診斷的工程師，職稱是「Genius（天才）」，這個職稱間接鼓勵員工不斷了解最新技術知識，以提供顧客更好建議和技術支持。星巴克（Starbucks）店員則有「咖啡大師」、「咖啡大使」等名稱識別，象徵其所擁有的咖啡知識與對其專業服務的肯定。
你我也可以為自己貼上標籤，定義對自己的期待，並調整行為以符應標籤的內容，讓他人留下深刻印象，以擁有更多展現個人價值的機會。

    日常生活中不乏「貼標籤」或「被貼標籤」的實例，請以「貼標籤」為題，寫一篇文章，並融入上文「標籤」於人身上的正面與負面作用，並舉例闡述你對標籤現象的看法。
文長至少600字。


","貼標籤



在這個講求效率的現代社會中，「標籤」早已超越了其最初標示物品的功能，悄然延伸至人際互動的領域。當我們細究這種「貼標籤」的社會現象時，不難發現它如同一把雙面刃，既能激發個人潛能，也可能成為束縛成長的無形枷鎖。



回顧歷史，標籤最初只是為了便於分類和識別物品，但隨著社會的演進，人們開始將這種簡化的歸類方式應用於人際關係中。就如同叔本華所言，人們習慣性地用職業、身份等外在標籤來定義他人，而忽視了每個人獨特的個性與價值。這種過度簡化的思維方式，往往導致我們陷入刻板印象的迷思，甚至造成社會偏見的滋生。



然而，標籤並非全然負面。以企業管理為例，許多具有前瞻性的公司善用正向標籤來激勵員工。像蘋果公司將技術支援人員稱為「天才」，不僅提升了員工的自我認同感，更激發了他們追求專業成長的動力。這種積極的標籤效應，確實能夠引導個人向著更理想的方向發展。



在教育領域中，我親身經歷過標籤的雙重作用。當老師稱讚我是「認真負責的學生」時，這個正向標籤確實激勵我更加努力；相反地，若某位同學被貼上「調皮搗蛋」的標籤，往往會陷入負面循環，影響其自我認知與發展。



面對標籤文化的盛行，我們應該培養更深層的思考能力。首先，要警惕過度簡化他人的傾向，學會透過真誠的交流來認識每個人的獨特之處。其次，在運用標籤時，應該謹慎考量其可能帶來的影響，善用正向標籤的激勵效果，同時避免負面標籤可能造成的傷害。



最重要的是，我們要學會突破標籤的框架。每個人都是獨特的個體，擁有無限的可能性。與其被動地接受他人的定義，不如主動為自己創造正向的標籤，並以實際行動證明自己的價值。唯有如此，才能在這個充滿標籤的世界中，保持自我，綻放光彩。",5,5,4,4,5,23
