題目,作答,立意,結構,修辭,敘述,啟發,總分
"關於地球的記憶
被文字固禁在課本裡
我們的筆尖游走在山脈和海洋
翻譯每片花瓣的嬌嫩和露水的清新
所有的言語 答案
都靜放在我們的課本裡
等待我們翻起這一切的序幕（節錄自薛憶婷〈我們的課本〉）

    以上這首詩，從課本啟動天馬行空的遐想，瞥見知識豐富的樣貌。科學頑童費曼（Richard P. Feynman）曾說觀察轉動的餐盤，讓他得到很大的啟發，領略了興之所至的樂趣。物理課可讓我們發現萬物運行的迷人，生物課帶領我們進入細胞核遊歷，外語課讓我們聽見世界不同的文化。國文課堂上「採菊東籬下，悠然見南山」或「輕羅小扇撲流螢」，詩中情境也往往能讓人神遊於現實之外。過往的課程內容，是否曾經點燃你對知識的熱情？打開課本時，不知能否如〈我們的課本〉所述，揭開知識想像的序幕。
    若能從不同角度切入課本，進入知識的想像，或許可以讓課本帶領我們經歷驚奇的旅程。請以「當我打開課本」為題，寫一篇文章，敘述任一學科課本對你的意義，書寫你探索課本內容、知識的經驗與體會。
文長至少600字。


","當我打開課本



我覺得課本是一個很有趣的東西，尤其是地球科學的課本。以前我都不喜歡讀書，覺得很無聊，但是後來發現地球科學課本裡面講的東西還蠻有趣的。



我記得國中的時候第一次看地球科學課本，裡面講了很多關於宇宙的事情。雖然宇宙很遠很大，但是透過課本，我可以知道宇宙是什麼樣子。課本上有很多圖片，讓我可以看到星星和行星，感覺好像真的在看宇宙一樣。



我覺得地球科學課本教了我很多東西，不只是知識而已。雖然有時候內容有點難懂，但是只要仔細看，還是可以學到一些東西的。我現在知道了宇宙有多大，地球是怎麼形成的，這些都是從課本上學到的。



以前我都覺得讀課本很無聊，但是現在我覺得還好。因為只要用不同的方式去看課本，就會發現其實課本沒有那麼無聊。雖然有時候還是會覺得有點無趣，但是至少我學到了一些東西。",2,1,1,2,1,7
