題目,作答,立意,結構,修辭,敘述,啟發,總分
"關於地球的記憶
被文字固禁在課本裡
我們的筆尖游走在山脈和海洋
翻譯每片花瓣的嬌嫩和露水的清新
所有的言語 答案
都靜放在我們的課本裡
等待我們翻起這一切的序幕（節錄自薛憶婷〈我們的課本〉）

    以上這首詩，從課本啟動天馬行空的遐想，瞥見知識豐富的樣貌。科學頑童費曼（Richard P. Feynman）曾說觀察轉動的餐盤，讓他得到很大的啟發，領略了興之所至的樂趣。物理課可讓我們發現萬物運行的迷人，生物課帶領我們進入細胞核遊歷，外語課讓我們聽見世界不同的文化。國文課堂上「採菊東籬下，悠然見南山」或「輕羅小扇撲流螢」，詩中情境也往往能讓人神遊於現實之外。過往的課程內容，是否曾經點燃你對知識的熱情？打開課本時，不知能否如〈我們的課本〉所述，揭開知識想像的序幕。
    若能從不同角度切入課本，進入知識的想像，或許可以讓課本帶領我們經歷驚奇的旅程。請以「當我打開課本」為題，寫一篇文章，敘述任一學科課本對你的意義，書寫你探索課本內容、知識的經驗與體會。
文長至少600字。


","當我打開課本



每次打開課本，我都覺得很無聊，因為裡面都是很多難懂的字和知識。不過，我知道課本是很重要的東西，所以還是要認真讀。



我記得剛開始讀課本的時候，很多東西都看不懂。數學的公式很難記，國文的修辭也很複雜。但是慢慢地，我開始能夠理解一些內容了。每次會做題目或是能讀懂課文的時候，我都會很開心。



課本裡面有很多不同的知識，像是歷史、科學這些。歷史課本告訴我們以前的人怎麼生活，科學課本讓我們知道很多自然現象。雖然有時候很難記，但是這些知識都是有用的。



在上課的時候，同學們會一起討論課本的內容。有時候老師問問題，我們就會想辦法回答。雖然不是每次都答對，但是和同學一起學習還蠻有趣的。



總之，課本雖然有時候很難懂，但是它可以教我們很多東西。希望以後我可以更認真地讀課本，學到更多知識。",2,2,1,2,1,8
