題目,作答,立意,結構,修辭,敘述,啟發,總分
"    看到山上那麼多參天大樹時，會勾起我的惻隱之心。在無法順暢呼吸的空間裡，樹木之間為了生存必須展開激烈的競爭。為了能多接受一些陽光，它們只能拼命向上生長。
但是，只為生存而競爭的森林卻漸次死亡，因為陽光無法到達地面，所以溫度不夠高，無法讓幼小的生命萌芽。小樹和花、草，以及與它們一起生活的小昆蟲沒有生存的空間。雖然表面上看起來非常完美，但這種森林其實與沒有希望的不孕之地無異。
根據我的經驗，密集栽種的樹苗體型壯大數十倍時，就需要開始砍樹，否則樹木會抱怨空間太窄，活不下去。要想確保樹木能充分接受陽光照射的空間，就必須做出犧牲。因此，幾年期間強行進行砍伐，樹木間距剛開始時是一公尺，現已擴大到七公尺。也就是說，即使是粗略估算，也可知七棵樹中有六棵為之消失。
森林要想成為孕育新生命的希望之地，就需要有縫隙。如果樹木壽命結束或因為意外災害而倒下，該位置就會產生空間，那麼，溫暖的陽光就會照射進來，被陽光照射的地面混雜著前一年秋天凋落的樹葉，於是積聚起能夠孕育新生命的養分。因此，樹木的縫隙，既是結束和開始共存的空間，也是由缺乏轉化為希望的空間。（改寫自禹鐘榮著、盧鴻金譯《樹木教我的人生課》）
    根據上文所述，為什麼森林需要縫隙？由此聯想，人生是否也需要縫隙？請以「縫隙的聯想」為題，寫一篇文章，結合生活經驗或見聞，書寫你的感思與體悟。
文長至少600字。


","縫隙的聯想



我覺得人生需要縫隙，就像森林一樣。因為如果沒有縫隙，人會活得很辛苦。



我自己就有這樣的經驗，以前我每天都在讀書和打工，壓力很大，常常覺得很累。那時候我真的很痛苦，不知道該怎麼辦。我的朋友看到我這樣子，就來關心我，跟我聊天。這樣子我就覺得好一點了。



朋友的關心就像是一個縫隙，讓我可以喘口氣。我發現生活不是只有讀書和工作，還有很多其他的事情可以做。像是跟家人聊天、聽音樂，或是做自己喜歡的事情，這些都可以讓我放鬆一下。



所以我想說，每個人都要給自己一些空間，不要把自己逼得太緊。有時候休息一下也是很重要的。就像森林需要縫隙一樣，人也需要一些喘息的機會。這樣子才能活得比較開心。



我希望大家都可以找到屬於自己的縫隙，讓自己的生活變得更好。不要一直把自己關在牆裡面，要學會放鬆，這樣子才能過得快樂。",2,1,1,2,1,7
