題目,作答,立意,結構,修辭,敘述,啟發,總分
"甲
(陶潛)為彭澤令。不以家累自隨，送一力給其子，書曰：「汝旦夕之費，自給為難。今遣此力，助汝薪水（打柴汲水）之勞。此亦人子也，可善遇之。」(《南史．隱逸．陶潛傳》)
乙
飯後，眾人各自有事離去，留下貞觀靜坐桌前獃想。她今日的這番感慨，實是前未曾有的。
阿啟伯摘瓜，乃她親眼所見。今早，她突發奇想，陪著外公去巡魚塭，回來時，祖孫二人，都在門口停住了，因為後門虛掩，阿啟伯拿著菜刀，正在棚下摘瓜，並未發覺他們，祖孫二個都閃到門背後。貞觀當時是真愣住了，在那種情況下，是前進呢？抑是後退？她不能很快作選擇。然而這種遲疑也只有幾秒鐘，她一下就被外公拉到門後，正是屏息靜氣時，老人家又帶了她拐出小巷口，走到前街來。
貞觀人到了大路上，心下才逐漸明白：外公躲那人的心，竟比那偷瓜的人所做的遮遮掩掩更甚！貞觀以為懂得了外公的心意：他怕阿啟伯當下撞見自己的那種難堪。事實上，他還有另一層深意，貪當然不好，而貧的本身沒有錯。外公不以阿啟伯為不是，是知道他家中十口，有菜就沒飯，有飯就沒菜。(改寫自蕭麗紅《千江有水千江月》)
陶潛或者外公對他人的善意，你可能也曾見聞或經歷過，請以「溫暖的心」為題，寫一篇文章，分享你的經驗及體會。
文長至少600字。

","溫暖的心



我要說說溫暖的心。溫暖的心就是對別人好，幫助別人。我覺得這樣做很重要，因為可以讓世界變得更好。



有一次我在公車站看到一個老人跌倒了。他的東西掉了一地，很多人都沒有去幫他。後來有一個女生去幫他撿東西，還問他有沒有受傷。我看了覺得很感動，因為這個女生人很好。



我覺得對別人好不需要做很大的事情。有時候說一句好話，或是幫別人一個小忙就可以了。這樣做會讓別人很開心，也會讓自己很開心。



所以我們要常常幫助別人。因為幫助別人是一件好事情，可以讓這個世界變得更好。我希望大家都可以有一顆溫暖的心，這樣生活就會更美好了。",1,1,1,1,1,5
