題目,作答,立意,結構,修辭,敘述,啟發,總分
"二十一世紀資訊量以驚人的速度暴增，有人認為網路資訊易於取得，會使記憶力與思考力衰退，不利於認知學習；也有人視網際網路為人類的外接大腦記憶體，意味著我們毋須記憶大量知識，可以專注在更重要、更有創造力的事物上。對於以上兩種不同的觀點，你的看法為何？請以「網海浮沉之我思」為題，結合自己的相關經驗，探討創造力與思考力之間的關係。
文長至少600字。

","網海浮沉之我思



現在的科技發展真的很快，大家都在用手機和電腦。以前的人們都會互相聊天玩耍，過年過節時特別熱鬧。但是現在不一樣了，因為有了手機，大家都低頭滑手機，很少跟別人說話。



我覺得現在的資訊發達有好有壞。好處是我們要找資料很方便，像是寫作業的時候不會的題目可以上網查。但是壞處也很多，比如說網路上有很多詐騙，如果不小心就會被騙。



我自己平常不太喜歡用手機和電腦，因為用久了會頭痛。我比較喜歡看書，雖然偶爾也會玩一下遊戲。我覺得那些可以一直看手機的人真的很厲害，我做不到。



現在的生活已經離不開科技了，不像以前那麼簡單。我看過一個影片說，如果科技發展太快，可能會帶來不好的結果。但是現在的人都需要用到網路和電子產品，除非是很老的老人家。



所以我認為，在這個資訊發達的時代，我們要學會好好使用科技，不要被科技控制了生活，這樣對大家才是最好的。",2,2,1,2,1,8
