題目,作答,立意,結構,修辭,敘述,啟發,總分
"二十一世紀資訊量以驚人的速度暴增，有人認為網路資訊易於取得，會使記憶力與思考力衰退，不利於認知學習；也有人視網際網路為人類的外接大腦記憶體，意味著我們毋須記憶大量知識，可以專注在更重要、更有創造力的事物上。對於以上兩種不同的觀點，你的看法為何？請以「網海浮沉之我思」為題，結合自己的相關經驗，探討創造力與思考力之間的關係。
文長至少600字。

","網海浮沉之我思



現在的科技很發達，大家都在用手機和電腦。以前的人沒有這些東西，生活比較簡單，大家都會互相聊天玩耍。過年過節的時候，親戚朋友都會來家裡團聚，氣氛很熱鬧。



但是現在不一樣了，因為有了手機，大家都在玩手機，比較少互相交談。我覺得這樣不太好，因為人與人之間變得很冷漠。不過科技發達也有好處，像是寫作業的時候不會的題目可以上網查，很方便。



但是網路上也有壞人，他們會用一些騙人的方法騙別人的錢和個人資料。所以我們要小心使用網路，不要隨便點擊不認識的連結。



我自己不太會用手機和電腦，平常比較喜歡看書。因為看太久手機會讓眼睛很累，精神也不好。但是現在的生活已經離不開科技了，我們要學會好好使用它，這樣對大家才有好處。",1,1,1,1,1,5
