題目,作答,立意,結構,修辭,敘述,啟發,總分
"甲
(陶潛)為彭澤令。不以家累自隨，送一力給其子，書曰：「汝旦夕之費，自給為難。今遣此力，助汝薪水（打柴汲水）之勞。此亦人子也，可善遇之。」(《南史．隱逸．陶潛傳》)
乙
飯後，眾人各自有事離去，留下貞觀靜坐桌前獃想。她今日的這番感慨，實是前未曾有的。
阿啟伯摘瓜，乃她親眼所見。今早，她突發奇想，陪著外公去巡魚塭，回來時，祖孫二人，都在門口停住了，因為後門虛掩，阿啟伯拿著菜刀，正在棚下摘瓜，並未發覺他們，祖孫二個都閃到門背後。貞觀當時是真愣住了，在那種情況下，是前進呢？抑是後退？她不能很快作選擇。然而這種遲疑也只有幾秒鐘，她一下就被外公拉到門後，正是屏息靜氣時，老人家又帶了她拐出小巷口，走到前街來。
貞觀人到了大路上，心下才逐漸明白：外公躲那人的心，竟比那偷瓜的人所做的遮遮掩掩更甚！貞觀以為懂得了外公的心意：他怕阿啟伯當下撞見自己的那種難堪。事實上，他還有另一層深意，貪當然不好，而貧的本身沒有錯。外公不以阿啟伯為不是，是知道他家中十口，有菜就沒飯，有飯就沒菜。(改寫自蕭麗紅《千江有水千江月》)
陶潛或者外公對他人的善意，你可能也曾見聞或經歷過，請以「溫暖的心」為題，寫一篇文章，分享你的經驗及體會。
文長至少600字。

","溫暖的心



生活中常常會遇到困難，我以前都不想麻煩別人幫忙，就算別人想幫我，我也會拒絕。因為這樣，後來大家都不太願意幫我了，我自己也很煩惱。



有一次和朋友出去玩，我的鞋子不舒服，走路很痛。我的朋友看到了，就去便利商店幫我買藥。這件事讓我很感動，讓我知道接受別人的幫助也是可以的。



從那以後，我開始注意到別人對我的好。以前我都不敢麻煩別人，怕給別人添麻煩。但是我發現，什麼事都自己來反而會讓別人擔心。所以我現在會接受別人的幫助，也會去幫助別人。



小時候我最記得的是聖誕節。我相信有聖誕老公公，還會掛襪子等禮物。每次都真的會收到禮物，長大後才知道是爸媽偷偷準備的。這些回憶讓我覺得很溫暖。",1,1,1,1,1,5
