題目,作答,立意,結構,修辭,敘述,啟發,總分
"甲
生活中，人們習慣使用「標籤」將複雜的事物簡化、分類，再附上標記。然而，有時我們也將「標籤」使用在人的身上。哲學家叔本華說：「人們都從一個人所擁有的職位、從事的生意、隸屬的民族和家庭—亦即總體上從世俗常規所給予此人的角色和位置判斷他。所以，一個人就像商品一樣地被貼上標籤，並受到商品式的對待。至於根據其個人素質，這個人本身是個什麼樣的人，人們只是依自己的需要隨意地提及，亦即在大多數時候被擱置一邊，或者視而不見。」
人們或傳播媒體貼的標籤，有時會形成「刻板印象」，其中真假對錯值得深思。例如稱某個世代為「草莓族」，提到南美洲就想到「這些民族很會踢足球」。
乙
社會學家貝克指出：「人們一旦被貼上某種標籤，就會成為標籤所標定的人。」標籤對人的個性意識、自我認同有強烈的影響，因此當人被一種詞語或名稱貼上標籤時，他可能會往標籤所喻示的方向發展。許多企業因而賦予員工職稱正向的標籤，以放大標籤的力量。例如，蘋果（Apple）直營零售店中，為顧客的產品進行故障診斷的工程師，職稱是「Genius（天才）」，這個職稱間接鼓勵員工不斷了解最新技術知識，以提供顧客更好建議和技術支持。星巴克（Starbucks）店員則有「咖啡大師」、「咖啡大使」等名稱識別，象徵其所擁有的咖啡知識與對其專業服務的肯定。
你我也可以為自己貼上標籤，定義對自己的期待，並調整行為以符應標籤的內容，讓他人留下深刻印象，以擁有更多展現個人價值的機會。

    日常生活中不乏「貼標籤」或「被貼標籤」的實例，請以「貼標籤」為題，寫一篇文章，並融入上文「標籤」於人身上的正面與負面作用，並舉例闡述你對標籤現象的看法。
文長至少600字。


","貼標籤



現代社會中，標籤無所不在。商品上的標籤讓我們知道價格，人身上的標籤則讓別人快速認識一個人。比如說「啃老族」指的是依賴父母生活的年輕人，「月光族」是指每個月都把薪水花光的人。



這些標籤有時候會讓人感到不舒服。因為每個人都是獨特的個體，不能用簡單的詞語就概括一個人的全部。就像有些人說年輕人都是「草莓族」，但其實很多年輕人都很努力工作。



標籤也可能會影響一個人的行為。如果別人總是說你很懶惰，你可能真的會變得不愛做事。不過有些標籤也有好處，比如老師稱讚學生是「品學兼優」，學生就會更加用功讀書。



所以我覺得貼標籤這件事要謹慎使用，不能隨便給別人貼標籤，以免傷害到別人。我們應該多了解一個人，而不是用簡單的標籤來判斷他。",1,1,1,1,1,5
