題目,作答,立意,結構,修辭,敘述,啟發,總分
"林語堂說：「（我）所愛的不是晚秋，是初秋，那時暄氣初消，月正圓，蟹正肥，桂花皎潔，也未陷入懍烈蕭瑟氣態，這是最值得賞樂的。」楊牧則是在美麗的春天世界裡，萬物復甦，卻聽到「一片樹葉提早轉黃的聲音。」（〈夭〉）普魯斯特（Proust, M.）在《追憶逝水年華》中說：「一小時不僅僅是一個小時，它是一只充滿香氣、聲響、念頭和氛圍的花缽」，說明時間的認知與感官知覺及感受有關。請以「季節的感思」為題，寫一篇文章，描寫你對季節的感知經驗，並抒發心中的感受與領會。
文長至少600字。

","季節的感思



我最喜歡的季節是夏天和冬天，因為這兩個季節給我很多感覺。夏天很熱，但是有很多好玩的事情。我喜歡聽蟬叫的聲音，也喜歡看天空下雨。下雨的時候，我會坐在椅子上看雨，感覺很舒服。



秋天的時候，風會吹落很多樹葉。我喜歡在晚上散步，看著天上的月亮。月亮很亮，好像在跟我說話一樣。秋天的風有點冷，讓我知道冬天快要來了。



冬天很冷，我要穿很多衣服。但是我還是喜歡冬天，因為可以穿很多漂亮的衣服。我喜歡在冬天的晚上出去走路，雖然很冷，但是感覺很特別。冬天讓我想很多事情，雖然沒有下雪，但是我覺得冬天很美。



我覺得每個季節都有不同的感覺，都讓我有不同的心情。夏天讓我開心，秋天讓我安靜，冬天讓我想很多事情。這就是我對季節的感覺。",2,1,1,2,1,7
