題目,作答,立意,結構,修辭,敘述,啟發,總分
"關於地球的記憶
被文字固禁在課本裡
我們的筆尖游走在山脈和海洋
翻譯每片花瓣的嬌嫩和露水的清新
所有的言語 答案
都靜放在我們的課本裡
等待我們翻起這一切的序幕（節錄自薛憶婷〈我們的課本〉）

    以上這首詩，從課本啟動天馬行空的遐想，瞥見知識豐富的樣貌。科學頑童費曼（Richard P. Feynman）曾說觀察轉動的餐盤，讓他得到很大的啟發，領略了興之所至的樂趣。物理課可讓我們發現萬物運行的迷人，生物課帶領我們進入細胞核遊歷，外語課讓我們聽見世界不同的文化。國文課堂上「採菊東籬下，悠然見南山」或「輕羅小扇撲流螢」，詩中情境也往往能讓人神遊於現實之外。過往的課程內容，是否曾經點燃你對知識的熱情？打開課本時，不知能否如〈我們的課本〉所述，揭開知識想像的序幕。
    若能從不同角度切入課本，進入知識的想像，或許可以讓課本帶領我們經歷驚奇的旅程。請以「當我打開課本」為題，寫一篇文章，敘述任一學科課本對你的意義，書寫你探索課本內容、知識的經驗與體會。
文長至少600字。


","當我打開課本



我從小就不喜歡上國文課，覺得那些課文都很無聊，跟我的生活沒有關係。每次上課都覺得很煩，因為要讀一些不實際的東西。



有一次上國文課的時候，我看著課本發呆，突然看到課文寫的一些古代的事情。那些人穿著古裝，小孩子在玩耍，大人在田裡工作。雖然他們很辛苦，但是看起來都很開心。



我看著教室的天花板，想到外面的天空。現在的城市到處都是高樓大廈，跟課本寫的以前的生活很不一樣。我們現在生活在水泥叢林裡，好像忘記了以前的生活是什麼樣子。



看完課文以後，我覺得課本還是有一點用處的。雖然寫的都是假的事情，但是可以讓我們知道以前的事情，了解一些不同的生活方式。",1,1,1,1,1,5
