題目,作答,立意,結構,修辭,敘述,啟發,總分
"關於地球的記憶
被文字固禁在課本裡
我們的筆尖游走在山脈和海洋
翻譯每片花瓣的嬌嫩和露水的清新
所有的言語 答案
都靜放在我們的課本裡
等待我們翻起這一切的序幕（節錄自薛憶婷〈我們的課本〉）

    以上這首詩，從課本啟動天馬行空的遐想，瞥見知識豐富的樣貌。科學頑童費曼（Richard P. Feynman）曾說觀察轉動的餐盤，讓他得到很大的啟發，領略了興之所至的樂趣。物理課可讓我們發現萬物運行的迷人，生物課帶領我們進入細胞核遊歷，外語課讓我們聽見世界不同的文化。國文課堂上「採菊東籬下，悠然見南山」或「輕羅小扇撲流螢」，詩中情境也往往能讓人神遊於現實之外。過往的課程內容，是否曾經點燃你對知識的熱情？打開課本時，不知能否如〈我們的課本〉所述，揭開知識想像的序幕。
    若能從不同角度切入課本，進入知識的想像，或許可以讓課本帶領我們經歷驚奇的旅程。請以「當我打開課本」為題，寫一篇文章，敘述任一學科課本對你的意義，書寫你探索課本內容、知識的經驗與體會。
文長至少600字。


","當我打開課本



我覺得生物課本很有趣，裡面有很多科學家的發現。以前的人認為髒衣服會生出老鼠，但後來科學家發現這是錯的。



現在的課本知識都是前人研究出來的結果。我們現在學的東西，都是他們辛苦找出來的答案。不過科學一直在進步，所以課本內容也會改變。



我最喜歡看課本裡講解生命的部分。雖然有些內容很難懂，但是可以讓我知道生物的奧秘。我覺得這些知識對保護地球很重要，因為我們要和自然好好相處。



每次看課本的時候，我都會想到科學家們的努力。這些知識讓我對生命有更多了解，也讓我知道要愛護環境。希望以後可以學到更多有趣的知識。",1,1,1,1,1,5
