題目,作答,立意,結構,修辭,敘述,啟發,總分
"    看到山上那麼多參天大樹時，會勾起我的惻隱之心。在無法順暢呼吸的空間裡，樹木之間為了生存必須展開激烈的競爭。為了能多接受一些陽光，它們只能拼命向上生長。
但是，只為生存而競爭的森林卻漸次死亡，因為陽光無法到達地面，所以溫度不夠高，無法讓幼小的生命萌芽。小樹和花、草，以及與它們一起生活的小昆蟲沒有生存的空間。雖然表面上看起來非常完美，但這種森林其實與沒有希望的不孕之地無異。
根據我的經驗，密集栽種的樹苗體型壯大數十倍時，就需要開始砍樹，否則樹木會抱怨空間太窄，活不下去。要想確保樹木能充分接受陽光照射的空間，就必須做出犧牲。因此，幾年期間強行進行砍伐，樹木間距剛開始時是一公尺，現已擴大到七公尺。也就是說，即使是粗略估算，也可知七棵樹中有六棵為之消失。
森林要想成為孕育新生命的希望之地，就需要有縫隙。如果樹木壽命結束或因為意外災害而倒下，該位置就會產生空間，那麼，溫暖的陽光就會照射進來，被陽光照射的地面混雜著前一年秋天凋落的樹葉，於是積聚起能夠孕育新生命的養分。因此，樹木的縫隙，既是結束和開始共存的空間，也是由缺乏轉化為希望的空間。（改寫自禹鐘榮著、盧鴻金譯《樹木教我的人生課》）
    根據上文所述，為什麼森林需要縫隙？由此聯想，人生是否也需要縫隙？請以「縫隙的聯想」為題，寫一篇文章，結合生活經驗或見聞，書寫你的感思與體悟。
文長至少600字。


","縫隙的聯想



樹林太密的話，就不會有新的生命長出來，人生也是這樣，如果沒有休息的時間，我們會很累，做事情也會做不好。



我在準備考試的時候，每天都在讀書，覺得一定要這樣才能考上好大學。但是後來我發現這樣不對，因為我越來越不想讀書，看到書本就煩。我才知道人是需要休息的，不能一直讀書。



考完試以後，我就開始玩遊戲，每天都在玩，什麼事都不做。玩了一個月，我都沒有學到新東西。有一天我起床的時候，拉開窗簾覺得太亮，又把它拉回去一點，這時候我才知道，休息不能太多也不能太少，要剛剛好。



所以人生就像樹林一樣，需要有空隙才能長出新的東西。樹林的空隙可以讓新的樹長出來，人生的空隙可以讓我們休息，然後再繼續往前走。",2,1,1,2,1,7
