題目,作答,立意,結構,修辭,敘述,啟發,總分
"甲
我們的感情是冰箱，打開來看，明亮可喜，關起門後是嗡嗡的黑暗。什麼都不會壞掉，埋在霜雪的角落。我們的感情是冰箱，有時很滿有時很空，一切都可以保存很久，冷冷的，可是很新鮮，看起來都像昨天。（柯裕棻〈冰箱〉）
乙
農曆年前我媽換了新冰箱。雖然舊的其實也還好，十數年如一日修長高冷玉面如銀，該凍肉時凍肉，該製冰時製冰，門沒關緊永遠忠實地響警告聲。燈泡甚至沒有壞過一次。只是我媽長期嫌它不得力，冷藏室裝一隻生雞一鍋燉肉就周轉不過來，胃口那樣地小，像一個節食的人，廚房裡最不需要的就是一個節食的人。我常常看見她蹲在那兒，腳邊圍滿生鮮，鬥盡心智排列組合，在最有限空間裡籌備出最大的寬容，冰箱門好像看牙醫的嘴開太久不斷嗶嗶叫，簡直像在哭了。感覺兩方都十分苦惱。
我認為運用如常的器物毋需特別汰換，也主張大家都不妨少吃一點。顯然我媽不作此想。她說：「總之我就是想要一臺大冰箱啦。」但如此一來，我反倒領悟了，這完全是某商品宣傳詞「豈止於大」（Bigger than bigger）的道理：一座夠大的新冰箱也豈止於冰箱，它是一種想像，一種意境，一種可能性，它富有召喚家庭生活最好願景的潛力。（改寫自黃麗群〈如果在冬天，一座新冰箱〉）
    冰箱可以很滿，可以很空，當你打開冰箱，通常想尋找什麼？又看見什麼？假如有一座屬於你的新冰箱，你會有怎樣的想像？冰藏什麼（虛實皆可）會符合你所期待的美好生活？請以「如果我有一座新冰箱」為題，撰文一篇，
文長至少600字。

","如果我有一座新冰箱



每個人都需要一個冰箱。如果我有一座新冰箱，我會把很多東西放進去。首先我會放一些食物，像是水果、蔬菜還有肉類。這些食物都要放在冰箱裡面才不會壞掉。



我也想在冰箱裡面放一些飲料。可樂和果汁都要冰冰的喝才好喝。夏天的時候特別需要冰涼的飲料，所以冰箱一定要有這些東西。還有冰淇淋也要放在冷凍庫裡，不然會融化掉。



除了食物和飲料以外，我還想把一些回憶放進冰箱。雖然回憶不能真的放進去，但是我覺得冰箱就像一個保存回憶的地方。每次打開冰箱的時候，看到裡面的東西就會想到一些事情。



我媽媽常常煮很多菜，然後把剩下的放進冰箱。隔天再拿出來加熱就可以吃了。這樣很方便，也不會浪費食物。但是有時候會忘記冰箱裡面放了什麼東西，等到想起來的時候可能已經壞掉了。



如果我有一座新冰箱，我會把它整理得很乾淨。這樣比較容易找東西，也不會有壞掉的食物。我覺得一個乾淨的冰箱代表一個整齊的生活，這就是我想要的美好生活。",1,1,1,1,1,5
