題目,作答,立意,結構,修辭,敘述,啟發,總分
"    看到山上那麼多參天大樹時，會勾起我的惻隱之心。在無法順暢呼吸的空間裡，樹木之間為了生存必須展開激烈的競爭。為了能多接受一些陽光，它們只能拼命向上生長。
但是，只為生存而競爭的森林卻漸次死亡，因為陽光無法到達地面，所以溫度不夠高，無法讓幼小的生命萌芽。小樹和花、草，以及與它們一起生活的小昆蟲沒有生存的空間。雖然表面上看起來非常完美，但這種森林其實與沒有希望的不孕之地無異。
根據我的經驗，密集栽種的樹苗體型壯大數十倍時，就需要開始砍樹，否則樹木會抱怨空間太窄，活不下去。要想確保樹木能充分接受陽光照射的空間，就必須做出犧牲。因此，幾年期間強行進行砍伐，樹木間距剛開始時是一公尺，現已擴大到七公尺。也就是說，即使是粗略估算，也可知七棵樹中有六棵為之消失。
森林要想成為孕育新生命的希望之地，就需要有縫隙。如果樹木壽命結束或因為意外災害而倒下，該位置就會產生空間，那麼，溫暖的陽光就會照射進來，被陽光照射的地面混雜著前一年秋天凋落的樹葉，於是積聚起能夠孕育新生命的養分。因此，樹木的縫隙，既是結束和開始共存的空間，也是由缺乏轉化為希望的空間。（改寫自禹鐘榮著、盧鴻金譯《樹木教我的人生課》）
    根據上文所述，為什麼森林需要縫隙？由此聯想，人生是否也需要縫隙？請以「縫隙的聯想」為題，寫一篇文章，結合生活經驗或見聞，書寫你的感思與體悟。
文長至少600字。


","縫隙的聯想



生活中到處都有縫隙，像是人和人之間、物和物之間都會有空隙。我覺得縫隙是一定要有的東西。



縫隙就像空間一樣，在我們的生活中很重要。它可能在圖書館的角落，也可能在我們的生活中。有些小動物需要縫隙才能活下去。我以前總是想要自己很完美，看電視劇裡的人物就想要變得跟他們一樣。那時候我還小，不懂得人不可能完美。人都會犯錯，有缺點是很正常的事情。



有一次我很喜歡的偶像出事了，很多人都在罵他。我那時候很難過，希望這件事情沒有發生。後來他說失敗了沒關係，可以重新開始。他說不要想變成別人，做自己喜歡的事情才重要。聽到這些話，我覺得好多了。



我喜歡一首歌說「這時代每個人都有風險，不如做自己比較好」。我覺得人生要怎麼過，應該自己決定。我希望大家可以給自己一些空間，不要把自己逼得太緊。",1,1,1,1,1,5
