題目,作答,立意,結構,修辭,敘述,啟發,總分
"二十一世紀資訊量以驚人的速度暴增，有人認為網路資訊易於取得，會使記憶力與思考力衰退，不利於認知學習；也有人視網際網路為人類的外接大腦記憶體，意味著我們毋須記憶大量知識，可以專注在更重要、更有創造力的事物上。對於以上兩種不同的觀點，你的看法為何？請以「網海浮沉之我思」為題，結合自己的相關經驗，探討創造力與思考力之間的關係。
文長至少600字。

","網海浮沉之我思



現在的網路很方便，可以讓我們很快找到想要的資料。有些人說網路會讓我們變笨，但我不這麼認為。



我覺得網路很好用，可以幫我們找到很多東西。比如說要找食譜的時候，網路上有很多食譜可以看，我們可以選擇最適合的來用。這樣也是一種思考的方式。



我常常用網路來查一些東西，像是路邊的花草是什麼，或是一些科學知識。我也會看一些教學影片，學習做菜。所以我覺得網路不會讓我們變笨，反而可以幫助我們學習新東西。



不過網路上的資料也不是都可以相信的，有時候會有假的資料。所以我們要小心使用網路，不要被騙了。



總之，我覺得網路是好東西，只要我們好好使用，就不會有問題。",1,1,1,1,1,5
