題目,作答,立意,結構,修辭,敘述,啟發,總分
"關於地球的記憶
被文字固禁在課本裡
我們的筆尖游走在山脈和海洋
翻譯每片花瓣的嬌嫩和露水的清新
所有的言語 答案
都靜放在我們的課本裡
等待我們翻起這一切的序幕（節錄自薛憶婷〈我們的課本〉）

    以上這首詩，從課本啟動天馬行空的遐想，瞥見知識豐富的樣貌。科學頑童費曼（Richard P. Feynman）曾說觀察轉動的餐盤，讓他得到很大的啟發，領略了興之所至的樂趣。物理課可讓我們發現萬物運行的迷人，生物課帶領我們進入細胞核遊歷，外語課讓我們聽見世界不同的文化。國文課堂上「採菊東籬下，悠然見南山」或「輕羅小扇撲流螢」，詩中情境也往往能讓人神遊於現實之外。過往的課程內容，是否曾經點燃你對知識的熱情？打開課本時，不知能否如〈我們的課本〉所述，揭開知識想像的序幕。
    若能從不同角度切入課本，進入知識的想像，或許可以讓課本帶領我們經歷驚奇的旅程。請以「當我打開課本」為題，寫一篇文章，敘述任一學科課本對你的意義，書寫你探索課本內容、知識的經驗與體會。
文長至少600字。


","當我打開課本



我覺得歷史課本很有意思，因為可以讓我們學到很多以前的事情。我們可以從歷史裡面學到很多東西，知道以前的人是怎麼生活的，也可以避免重複他們的錯誤。



我記得國三的時候，我都不認真讀書，每天只想要玩。看到同學都在努力準備會考，我還是不當一回事。等到考試快到了，我才發現自己什麼都不會，但是已經來不及了。結果考得很差，沒有考上想要的學校，讓我很後悔。



現在我已經高三了，馬上要考學測。想到國三的時候考得不好，我就告訴自己不能再犯同樣的錯誤。我的家人也常常提醒我，說雖然過去的事情已經過去了，但是要記住教訓，不要再犯同樣的錯誤。



所以我現在比較認真在讀書了，希望這次學測可以考得好一點。我覺得歷史真的教會我們很多事情，讓我們可以從錯誤中學習，不要重複別人的錯誤。",2,1,1,2,1,7
