題目,作答,立意,結構,修辭,敘述,啟發,總分
"二十一世紀資訊量以驚人的速度暴增，有人認為網路資訊易於取得，會使記憶力與思考力衰退，不利於認知學習；也有人視網際網路為人類的外接大腦記憶體，意味著我們毋須記憶大量知識，可以專注在更重要、更有創造力的事物上。對於以上兩種不同的觀點，你的看法為何？請以「網海浮沉之我思」為題，結合自己的相關經驗，探討創造力與思考力之間的關係。
文長至少600字。

","網海浮沉之我思



現在的網路很方便，可以找到很多資訊。有些人說這樣會讓我們變笨，因為不用記東西，也不用想東西。但是有些人說這樣很好，可以讓我們做別的事情。



我覺得網路可以幫助我們學習。在網路上找資料的時候，我們要看資料是不是對的。這樣也是一種學習。不能只是看到什麼就相信什麼。



我以前上課的時候，要做影片配樂。那時候就用網路找了很多音樂和影片。這些東西在網路上很容易找到。所以網路對我們做作業很有幫助。



我想說網路可以給我們很多東西。如果沒有網路，我們要自己想很多東西會很難。但是我們也不能太相信網路。要自己想一想，看看網路上的東西是不是對的。這樣才是對的。",1,1,1,1,1,5
