題目,作答,立意,結構,修辭,敘述,啟發,總分
"林語堂說：「（我）所愛的不是晚秋，是初秋，那時暄氣初消，月正圓，蟹正肥，桂花皎潔，也未陷入懍烈蕭瑟氣態，這是最值得賞樂的。」楊牧則是在美麗的春天世界裡，萬物復甦，卻聽到「一片樹葉提早轉黃的聲音。」（〈夭〉）普魯斯特（Proust, M.）在《追憶逝水年華》中說：「一小時不僅僅是一個小時，它是一只充滿香氣、聲響、念頭和氛圍的花缽」，說明時間的認知與感官知覺及感受有關。請以「季節的感思」為題，寫一篇文章，描寫你對季節的感知經驗，並抒發心中的感受與領會。
文長至少600字。

","季節的感思



夏天是我最喜歡的季節。每天早上起床，看到窗外的景色都很漂亮。太陽照進來的光線讓房間很亮，感覺很舒服。



我住的地方後面有一座山，常常可以看到白雲飄過來。雲朵慢慢地移動，有時候遮住了太陽，讓天空變暗。中午過後，天空就會變得很黑，好像要下雨的樣子。打雷的聲音很大，有時候會嚇到我。



夏天的時候，外面很熱，但是我喜歡待在家裡吹電風扇。風扇轉動的聲音讓我覺得很安靜。我可以看著窗外發呆，看著雲朵變來變去，這樣的感覺很好。



放暑假的時候，我最喜歡一個人待在家裡。不用去上課，可以做自己想做的事情。外面有蝴蝶在飛，也有蟲子在叫，這些都讓我覺得夏天很特別。



我覺得夏天是最好的季節，因為可以放假，也可以看到很多漂亮的景色。即使下雨天，我也知道太陽一定會再出來。這就是我對夏天的感覺。",1,1,1,1,1,5
