題目,作答,立意,結構,修辭,敘述,啟發,總分
"    我覺得童年是一種氣味的記憶。
    我的童年，有許多果樹氣味的記憶。夏天暑熱的午後，廟埕後有一棵巨大的龍眼樹。我從小學翻牆出來，背著書包，爬上龍眼樹，躲在密密的枝葉裡。外面日光葉影搖晃，隱約聽見老師或母親尋來，在樹下叫著我的名字，但那呼喚的聲音，被蟬聲的高音淹沒了。我一動不動，找到一處適合蜷窩身體的枝椏，好像變成樹的一部分，而那時，龍眼樹密密的甜熟的氣味就包圍著我。我閉起眼睛，好像在假寐，也像在作夢，夢裡一串一串纍纍的龍眼，招來許多蜜蜂果蠅。我童年的夢，很甜很香，好像一整個夏天都窩在那棵樹上，包圍在濃郁的氣味裡做了一個醒不來的夢。（改寫自蔣勳《給青年藝術家的信》）
    生活中充斥各種氣味。氣味透過嗅覺傳遞，喚起人們的記憶和感受，一如文中龍眼樹甜熟的氣味喚起作者的童年記憶。請以「花草樹木的氣味記憶」為題，寫一篇文章，書寫你熟悉的花草樹木的氣味，及其所召喚的記憶和感受。

文長至少600字。

","花草樹木的氣味記憶



我家在鄉下，不像城市那樣吵鬧。我家是三合院，圍牆邊種了很多樹和花。



我最喜歡的是雞蛋花，它長得像雞蛋一樣白色外面黃色裡面。它有香香的味道，聞起來很舒服。



我爺爺很老了，他住在鄉下種花。我小時候常常跟爺爺一起看花。爺爺告訴我雞蛋花代表希望，要我記得生活不好的時候也要有希望。



我現在在城市讀書，有時候在路上聞到像雞蛋花的味道，就會想起老家和爺爺。我很想家，也很想爺爺，不知道他現在好不好。每次聞到這個味道就會哭。這個香味讓我想起小時候。",1,1,1,1,1,5
