題目,作答,立意,結構,修辭,敘述,啟發,總分
"甲
我們的感情是冰箱，打開來看，明亮可喜，關起門後是嗡嗡的黑暗。什麼都不會壞掉，埋在霜雪的角落。我們的感情是冰箱，有時很滿有時很空，一切都可以保存很久，冷冷的，可是很新鮮，看起來都像昨天。（柯裕棻〈冰箱〉）
乙
農曆年前我媽換了新冰箱。雖然舊的其實也還好，十數年如一日修長高冷玉面如銀，該凍肉時凍肉，該製冰時製冰，門沒關緊永遠忠實地響警告聲。燈泡甚至沒有壞過一次。只是我媽長期嫌它不得力，冷藏室裝一隻生雞一鍋燉肉就周轉不過來，胃口那樣地小，像一個節食的人，廚房裡最不需要的就是一個節食的人。我常常看見她蹲在那兒，腳邊圍滿生鮮，鬥盡心智排列組合，在最有限空間裡籌備出最大的寬容，冰箱門好像看牙醫的嘴開太久不斷嗶嗶叫，簡直像在哭了。感覺兩方都十分苦惱。
我認為運用如常的器物毋需特別汰換，也主張大家都不妨少吃一點。顯然我媽不作此想。她說：「總之我就是想要一臺大冰箱啦。」但如此一來，我反倒領悟了，這完全是某商品宣傳詞「豈止於大」（Bigger than bigger）的道理：一座夠大的新冰箱也豈止於冰箱，它是一種想像，一種意境，一種可能性，它富有召喚家庭生活最好願景的潛力。（改寫自黃麗群〈如果在冬天，一座新冰箱〉）
    冰箱可以很滿，可以很空，當你打開冰箱，通常想尋找什麼？又看見什麼？假如有一座屬於你的新冰箱，你會有怎樣的想像？冰藏什麼（虛實皆可）會符合你所期待的美好生活？請以「如果我有一座新冰箱」為題，撰文一篇，
文長至少600字。

","如果我有一座新冰箱



冰箱是每個家裡都要有的東西，可以讓食物不會壞掉，也可以讓我們的生活比較方便。我覺得冰箱真的很重要，因為沒有冰箱的話，食物很快就會壞掉。



如果我有一座新冰箱，我就可以買很多食物回家，不用每天跑去超市買東西。而且我可以把食物放在冰箱裡面，想吃的時候就拿出來吃，這樣很方便。我也可以自己煮東西吃，因為食材都可以放在冰箱裡面，不會壞掉。



現在的冰箱都很厲害，可以省電，也可以放很多東西。有的冰箱還可以自己製冰塊，夏天的時候就可以喝冰水，很舒服。我覺得這些功能都很好，讓我們的生活更方便了。



所以我希望可以有一座新冰箱，這樣我就可以過得更好，也可以吃到更多好吃的東西。冰箱真的是很重要的東西，每個家裡都應該要有一台。",2,1,1,2,1,7
