題目,作答,立意,結構,修辭,敘述,啟發,總分
"二十一世紀資訊量以驚人的速度暴增，有人認為網路資訊易於取得，會使記憶力與思考力衰退，不利於認知學習；也有人視網際網路為人類的外接大腦記憶體，意味著我們毋須記憶大量知識，可以專注在更重要、更有創造力的事物上。對於以上兩種不同的觀點，你的看法為何？請以「網海浮沉之我思」為題，結合自己的相關經驗，探討創造力與思考力之間的關係。
文長至少600字。

","網海浮沉之我思



現在的人每天都在用網路，我覺得這樣不太好。因為大家都一直滑手機，都不想動腦思考。像我自己也常常一滑手機就是好幾個小時，什麼事情都沒做。



網路雖然可以讓我們找到很多資料，但是我覺得這樣不太好。因為網路上的資料太多了，有時候會看到錯誤的資訊。而且現在的人都用社交軟體聊天，都不會面對面說話了，這樣很容易誤會對方的意思。



網路也有好處，像是可以查資料、買東西很方便，還可以跟國外的朋友聊天。但是我覺得網路還是有很多壞處，因為大家都太依賴網路了。像是我的朋友都一直玩手機，都不想讀書，這樣對學習很不好。



我認為網路就像是一把刀，用得好就會對我們有幫助，用得不好就會傷害我們。所以我們要學會正確使用網路，不要一直玩手機，要多想一想怎麼樣才能好好利用網路。",2,1,1,2,1,7
