題目,作答,立意,結構,修辭,敘述,啟發,總分
"二十一世紀資訊量以驚人的速度暴增，有人認為網路資訊易於取得，會使記憶力與思考力衰退，不利於認知學習；也有人視網際網路為人類的外接大腦記憶體，意味著我們毋須記憶大量知識，可以專注在更重要、更有創造力的事物上。對於以上兩種不同的觀點，你的看法為何？請以「網海浮沉之我思」為題，結合自己的相關經驗，探討創造力與思考力之間的關係。
文長至少600字。

","網海浮沉之我思



現在的網路越來越發達，大家都在用網路。網路雖然很方便，但是也會讓我們變笨。



我覺得網路雖然可以讓我們做很多事情，但是也會讓很多人失業。因為現在很多工作都被電腦取代了，這樣很多人就沒有工作，生活會很困難。所以我認為思考比較重要，不能只會用網路。



我自己也常常用手機記事情，結果現在記憶力變得很差，常常忘記事情。以前我都會自己記住事情，現在都要靠手機，這樣不太好。我覺得我們應該要多動腦，不要什麼都靠網路。



網路雖然可以讓生活方便，但是會讓人變懶惰。很多人現在都不會思考，遇到問題就直接上網查。這樣對我們的思考能力不好，而且會讓貧富差距變大。



所以我覺得我們應該要少用一點網路，多用腦袋想事情。這樣對我們比較好，也可以讓我們的思考能力變好。",2,1,1,2,1,7
