題目,作答,立意,結構,修辭,敘述,啟發,總分
"    我覺得童年是一種氣味的記憶。
    我的童年，有許多果樹氣味的記憶。夏天暑熱的午後，廟埕後有一棵巨大的龍眼樹。我從小學翻牆出來，背著書包，爬上龍眼樹，躲在密密的枝葉裡。外面日光葉影搖晃，隱約聽見老師或母親尋來，在樹下叫著我的名字，但那呼喚的聲音，被蟬聲的高音淹沒了。我一動不動，找到一處適合蜷窩身體的枝椏，好像變成樹的一部分，而那時，龍眼樹密密的甜熟的氣味就包圍著我。我閉起眼睛，好像在假寐，也像在作夢，夢裡一串一串纍纍的龍眼，招來許多蜜蜂果蠅。我童年的夢，很甜很香，好像一整個夏天都窩在那棵樹上，包圍在濃郁的氣味裡做了一個醒不來的夢。（改寫自蔣勳《給青年藝術家的信》）
    生活中充斥各種氣味。氣味透過嗅覺傳遞，喚起人們的記憶和感受，一如文中龍眼樹甜熟的氣味喚起作者的童年記憶。請以「花草樹木的氣味記憶」為題，寫一篇文章，書寫你熟悉的花草樹木的氣味，及其所召喚的記憶和感受。

文長至少600字。

","花草樹木的氣味記憶



我小時候常常和爺爺去公園玩。公園裡有很多植物，每種植物都有不同的味道。



我最喜歡薰衣草的味道。每次走到薰衣草旁邊都會聞到香香的味道。爺爺說薰衣草的香味可以讓人心情變好。所以我心情不好的時候就會想起薰衣草的味道。



公園裡還有一棵大橡樹。秋天的時候樹葉會變黃掉下來，空氣中有木頭的味道。我喜歡摸橡樹的樹皮，感覺很粗糙。



爺爺教我認識不同的植物。我們會坐在草地上，爺爺會拿樹葉給我聞。我覺得很有趣，學到了很多植物的知識。



現在爺爺已經不在了，但是每次我聞到花香或樹木的味道，就會想起和爺爺一起去公園的日子。這些味道讓我想起和爺爺在一起的時光。",1,1,1,1,1,5
