題目,作答,立意,結構,修辭,敘述,啟發,總分
"甲
我們的感情是冰箱，打開來看，明亮可喜，關起門後是嗡嗡的黑暗。什麼都不會壞掉，埋在霜雪的角落。我們的感情是冰箱，有時很滿有時很空，一切都可以保存很久，冷冷的，可是很新鮮，看起來都像昨天。（柯裕棻〈冰箱〉）
乙
農曆年前我媽換了新冰箱。雖然舊的其實也還好，十數年如一日修長高冷玉面如銀，該凍肉時凍肉，該製冰時製冰，門沒關緊永遠忠實地響警告聲。燈泡甚至沒有壞過一次。只是我媽長期嫌它不得力，冷藏室裝一隻生雞一鍋燉肉就周轉不過來，胃口那樣地小，像一個節食的人，廚房裡最不需要的就是一個節食的人。我常常看見她蹲在那兒，腳邊圍滿生鮮，鬥盡心智排列組合，在最有限空間裡籌備出最大的寬容，冰箱門好像看牙醫的嘴開太久不斷嗶嗶叫，簡直像在哭了。感覺兩方都十分苦惱。
我認為運用如常的器物毋需特別汰換，也主張大家都不妨少吃一點。顯然我媽不作此想。她說：「總之我就是想要一臺大冰箱啦。」但如此一來，我反倒領悟了，這完全是某商品宣傳詞「豈止於大」（Bigger than bigger）的道理：一座夠大的新冰箱也豈止於冰箱，它是一種想像，一種意境，一種可能性，它富有召喚家庭生活最好願景的潛力。（改寫自黃麗群〈如果在冬天，一座新冰箱〉）
    冰箱可以很滿，可以很空，當你打開冰箱，通常想尋找什麼？又看見什麼？假如有一座屬於你的新冰箱，你會有怎樣的想像？冰藏什麼（虛實皆可）會符合你所期待的美好生活？請以「如果我有一座新冰箱」為題，撰文一篇，
文長至少600字。

","如果我有一座新冰箱



我是一個高三學生，每天都在讀書，生活很無聊。有一天，我和媽媽吵架，因為我不想去補習。那天早上我很生氣就直接離開家，沒想到這是最後一次見到媽媽。



後來爸爸打電話告訴我，媽媽出車禍死掉了。我當時很難過，不知道要怎麼辦。我很後悔和媽媽吵架，但是已經來不及了。



如果我有一個新冰箱，我想把媽媽的愛放在裡面。這樣我想媽媽的時候就可以打開冰箱看看。以前媽媽都會聽我說學校的事情，現在她不在了，我很想她。



我希望可以回到那一天，好好跟媽媽說對不起，但是這是不可能的事。從那天開始，我就知道要好好對待家人，不要等到失去才後悔。



媽媽雖然走了，但是她的愛還在。我每次想到媽媽的時候都會很傷心，希望她在天堂過得好。",2,1,1,2,1,7
