題目,作答,立意,結構,修辭,敘述,啟發,總分
"關於地球的記憶
被文字固禁在課本裡
我們的筆尖游走在山脈和海洋
翻譯每片花瓣的嬌嫩和露水的清新
所有的言語 答案
都靜放在我們的課本裡
等待我們翻起這一切的序幕（節錄自薛憶婷〈我們的課本〉）

    以上這首詩，從課本啟動天馬行空的遐想，瞥見知識豐富的樣貌。科學頑童費曼（Richard P. Feynman）曾說觀察轉動的餐盤，讓他得到很大的啟發，領略了興之所至的樂趣。物理課可讓我們發現萬物運行的迷人，生物課帶領我們進入細胞核遊歷，外語課讓我們聽見世界不同的文化。國文課堂上「採菊東籬下，悠然見南山」或「輕羅小扇撲流螢」，詩中情境也往往能讓人神遊於現實之外。過往的課程內容，是否曾經點燃你對知識的熱情？打開課本時，不知能否如〈我們的課本〉所述，揭開知識想像的序幕。
    若能從不同角度切入課本，進入知識的想像，或許可以讓課本帶領我們經歷驚奇的旅程。請以「當我打開課本」為題，寫一篇文章，敘述任一學科課本對你的意義，書寫你探索課本內容、知識的經驗與體會。
文長至少600字。


","當我打開課本



我覺得課本是很重要的東西，因為它可以讓我們學到很多知識。每天上課都要用課本，所以課本對我們來說很重要。



我記得我最喜歡的是資訊課本，因為它教我們寫程式。以前我都覺得寫程式很無聊，因為要看很多看不懂的英文和數字，我一點都不想學。但是有一天，我翻開課本的時候，發現裡面有教我們做遊戲。



我看到課本裡面說可以用程式做遊戲，就覺得很有趣。課本把程式變成像積木一樣，可以一塊一塊疊起來。雖然一開始不會，但是看著課本慢慢教，我就學會了。後來我就很喜歡寫程式，到現在還在學。



我覺得課本很重要，因為它可以教我們很多東西。如果課本寫得好，我們就會想要學習。就像老師一樣，課本也可以教我們很多知識。所以我們要好好看課本，這樣才能學到東西。",2,1,1,2,1,7
