題目,作答,立意,結構,修辭,敘述,啟發,總分
"二十一世紀資訊量以驚人的速度暴增，有人認為網路資訊易於取得，會使記憶力與思考力衰退，不利於認知學習；也有人視網際網路為人類的外接大腦記憶體，意味著我們毋須記憶大量知識，可以專注在更重要、更有創造力的事物上。對於以上兩種不同的觀點，你的看法為何？請以「網海浮沉之我思」為題，結合自己的相關經驗，探討創造力與思考力之間的關係。
文長至少600字。

","網海浮沉之我思



現在的科技越來越進步，大家都在用手機和電腦，我覺得這樣不太好，因為會讓人變笨。以前沒有這麼多科技的時候，我們出國要做很多準備，要去買書，要學習當地的語言，這樣比較好。



我記得小時候和爸爸媽媽一起去書局買旅遊書的時候，看到書上的照片就很開心。那時候要出國玩，都要先做功課，要看很多書，要學習當地的語言，這樣才能玩得開心。等到真的去到那個地方的時候，就會覺得很感動，因為終於看到書上的景點了。



但是現在不一樣了，現在的人都用手機查資料，不用再買書了。而且現在出國到處都有中文標示，也不用學習當地的語言。所以現在出國都沒有以前那麼開心了，也沒有以前那麼特別。



我覺得科技雖然讓我們的生活變得方便，但是也讓我們失去了很多東西。像是現在的人都不會記東西，因為都可以用手機查。這樣對我們的記憶力不好，也會讓我們變得很懶惰。



所以我希望大家可以少用一點手機，多看一點書，這樣對我們比較好。科技不應該讓我們變笨，而是要讓我們變得更聰明才對。",2,1,1,2,1,7
