題目,作答,立意,結構,修辭,敘述,啟發,總分
"    我覺得童年是一種氣味的記憶。
    我的童年，有許多果樹氣味的記憶。夏天暑熱的午後，廟埕後有一棵巨大的龍眼樹。我從小學翻牆出來，背著書包，爬上龍眼樹，躲在密密的枝葉裡。外面日光葉影搖晃，隱約聽見老師或母親尋來，在樹下叫著我的名字，但那呼喚的聲音，被蟬聲的高音淹沒了。我一動不動，找到一處適合蜷窩身體的枝椏，好像變成樹的一部分，而那時，龍眼樹密密的甜熟的氣味就包圍著我。我閉起眼睛，好像在假寐，也像在作夢，夢裡一串一串纍纍的龍眼，招來許多蜜蜂果蠅。我童年的夢，很甜很香，好像一整個夏天都窩在那棵樹上，包圍在濃郁的氣味裡做了一個醒不來的夢。（改寫自蔣勳《給青年藝術家的信》）
    生活中充斥各種氣味。氣味透過嗅覺傳遞，喚起人們的記憶和感受，一如文中龍眼樹甜熟的氣味喚起作者的童年記憶。請以「花草樹木的氣味記憶」為題，寫一篇文章，書寫你熟悉的花草樹木的氣味，及其所召喚的記憶和感受。

文長至少600字。

","花草樹木的氣味記憶



我覺得花草樹木的氣味很特別，因為每次聞到都會想起以前的事情。我小時候家裡有很多花草，都是媽媽種的。



我記得媽媽很喜歡種花，後院種了很多不同的植物。有一次我問媽媽為什麼要自己種花，路邊不是也有很多花嗎？媽媽說她喜歡花，所以願意花時間照顧。她說自己種的花跟別人的不一樣，因為有感情在裡面。



在家裡那麼多花草中，我最記得雞蛋花的味道。以前媽媽在澆水的時候，我都會在旁邊看。媽媽會一邊澆水一邊教我怎麼照顧花，她說雞蛋花要多曬太陽才會長得好，但是不能澆太多水，不然花會爛掉。現在每次聞到雞蛋花的香味，我就會想起小時候和媽媽一起在院子裡的情景。這些回憶讓我覺得很溫暖。",2,2,1,2,1,8
