題目,作答,立意,結構,修辭,敘述,啟發,總分
"甲
我們的感情是冰箱，打開來看，明亮可喜，關起門後是嗡嗡的黑暗。什麼都不會壞掉，埋在霜雪的角落。我們的感情是冰箱，有時很滿有時很空，一切都可以保存很久，冷冷的，可是很新鮮，看起來都像昨天。（柯裕棻〈冰箱〉）
乙
農曆年前我媽換了新冰箱。雖然舊的其實也還好，十數年如一日修長高冷玉面如銀，該凍肉時凍肉，該製冰時製冰，門沒關緊永遠忠實地響警告聲。燈泡甚至沒有壞過一次。只是我媽長期嫌它不得力，冷藏室裝一隻生雞一鍋燉肉就周轉不過來，胃口那樣地小，像一個節食的人，廚房裡最不需要的就是一個節食的人。我常常看見她蹲在那兒，腳邊圍滿生鮮，鬥盡心智排列組合，在最有限空間裡籌備出最大的寬容，冰箱門好像看牙醫的嘴開太久不斷嗶嗶叫，簡直像在哭了。感覺兩方都十分苦惱。
我認為運用如常的器物毋需特別汰換，也主張大家都不妨少吃一點。顯然我媽不作此想。她說：「總之我就是想要一臺大冰箱啦。」但如此一來，我反倒領悟了，這完全是某商品宣傳詞「豈止於大」（Bigger than bigger）的道理：一座夠大的新冰箱也豈止於冰箱，它是一種想像，一種意境，一種可能性，它富有召喚家庭生活最好願景的潛力。（改寫自黃麗群〈如果在冬天，一座新冰箱〉）
    冰箱可以很滿，可以很空，當你打開冰箱，通常想尋找什麼？又看見什麼？假如有一座屬於你的新冰箱，你會有怎樣的想像？冰藏什麼（虛實皆可）會符合你所期待的美好生活？請以「如果我有一座新冰箱」為題，撰文一篇，
文長至少600字。

","如果我有一座新冰箱



每個人的生命中，總有些珍貴的時刻想要永恆保存。當我站在家中這座老舊的冰箱前，望著它斑駁的表面，不禁想像：如果我有一座新冰箱，我會在裡面存放些什麼？



這座想像中的冰箱，不只是一個單純的電器用品，而是一個承載記憶的時光寶盒。它的容量很大，足以容納我所有想珍藏的回憶；它的性能很好，能將每一個珍貴時刻都完整保存；它的溫度恆定，讓時光凝結在最美好的瞬間。



打開冰箱的下層冷藏室，裡面擺放的是近兩年的生活片段。這些回憶還新鮮溫熱，像是剛從生活超市採購回來的食材，還帶著些許溫度。但不知為何，這些近期的回憶顯得稀疏而平淡，就像是一個吝嗇的收藏家，很少為記憶的倉庫增添新品。或許是因為畢業後的生活太過忙碌，又或許是成長的代價，讓我們漸漸失去了感動的能力。



而在上層的冷凍庫中，則珍藏著我最珍貴的高中歲月。這些回憶被細心包裝，整齊地排列在層架上，時不時會在夜深人靜時散發出淡淡的光芒。有那些和同學在教室裡談天說地的午後時光，有備戰考試時互相打氣的溫暖瞬間，還有社團活動中揮灑青春的歡樂時刻。這些回憶雖然被凍結，卻從未失去鮮活的生命力。



每當想念時，我就小心翼翼地取出一段回憶，讓它慢慢解凍。奇妙的是，那些曾經以為會隨時間褪色的情感，在解凍後卻依然鮮明如初。昔日的歡笑聲、淚水、擁抱，都完整地保存在記憶的晶體中，散發著溫暖的光芒。



這座理想中的新冰箱，它的門不再沉重，因為回憶本就不該是負擔。它是一個溫柔的容器，讓我們能夠在繁忙的生活中，隨時打開門，尋找那些滋養心靈的美好時刻。或許生命中總有太多無法預期的變化，但至少在這座時光冰箱裡，我們永遠能找到那些最純粹的感動，那些值得永恆珍藏的生命印記。",4,4,4,4,4,20
