題目,作答,立意,結構,修辭,敘述,啟發,總分
"甲
(陶潛)為彭澤令。不以家累自隨，送一力給其子，書曰：「汝旦夕之費，自給為難。今遣此力，助汝薪水（打柴汲水）之勞。此亦人子也，可善遇之。」(《南史．隱逸．陶潛傳》)
乙
飯後，眾人各自有事離去，留下貞觀靜坐桌前獃想。她今日的這番感慨，實是前未曾有的。
阿啟伯摘瓜，乃她親眼所見。今早，她突發奇想，陪著外公去巡魚塭，回來時，祖孫二人，都在門口停住了，因為後門虛掩，阿啟伯拿著菜刀，正在棚下摘瓜，並未發覺他們，祖孫二個都閃到門背後。貞觀當時是真愣住了，在那種情況下，是前進呢？抑是後退？她不能很快作選擇。然而這種遲疑也只有幾秒鐘，她一下就被外公拉到門後，正是屏息靜氣時，老人家又帶了她拐出小巷口，走到前街來。
貞觀人到了大路上，心下才逐漸明白：外公躲那人的心，竟比那偷瓜的人所做的遮遮掩掩更甚！貞觀以為懂得了外公的心意：他怕阿啟伯當下撞見自己的那種難堪。事實上，他還有另一層深意，貪當然不好，而貧的本身沒有錯。外公不以阿啟伯為不是，是知道他家中十口，有菜就沒飯，有飯就沒菜。(改寫自蕭麗紅《千江有水千江月》)
陶潛或者外公對他人的善意，你可能也曾見聞或經歷過，請以「溫暖的心」為題，寫一篇文章，分享你的經驗及體會。
文長至少600字。

","溫暖的心



我想跟大家分享一個關於我爸爸的故事。我爸爸開了一家麵店，每天都有很多人來吃麵。我常常坐在旁邊聽客人聊天，他們會講很多事情，像是誰家發生什麼事，或是誰家有什麼問題。



有一天，我聽到一個很大的消息。原來住在附近的張大爺因為玩股票賠光了錢。張大爺以前是我們這裡最有錢的人，大家都很尊敬他。我爸爸聽到這個消息的時候也很驚訝。



後來，張大爺來我們的麵店。那時候我們正要收攤了，但是爸爸看到張大爺就又重新開爐煮麵。爸爸說以前張大爺幫過他，現在該他幫張大爺了。張大爺說他現在連吃飯的錢都沒有，爸爸就讓他免費吃麵。



我覺得爸爸真的很善良，願意幫助有困難的人。他說人生一定會有困難的時候，如果有人需要幫助，我們應該要伸出援手。我希望以後我也可以像爸爸一樣，幫助需要幫助的人。",2,2,1,2,2,9
