題目,作答,立意,結構,修辭,敘述,啟發,總分
"    記憶可以被編輯或刪除嗎？2004年美國電影《王牌冤家》（Eternal Sunshine of the Spotless Mind），敘述一對怨偶在一次激烈的爭吵後，先後踏入提供記憶刪除服務的「忘情診所」，主動要求洗去記憶。女主角成功地洗去兩人的戀愛記憶，男主角則在記憶清掃的過程中，因為看見舊日時光的美好，想保留一切甜蜜與悲傷的記憶，而開始和電腦清除系統搏鬥。2017年，臺灣導演陳玉勳將自己的短片〈海馬洗頭〉改為長片《健忘村》。〈海馬洗頭〉的創意發想，來自於「人的記憶都存在大腦的海馬迴裡」，電影中因此有「海馬洗頭店」，專職幫人洗去記憶。《健忘村》則有一件寶物「忘憂神器」，可以清除記憶。村長為了一己私利，引誘村人「忘憂」，刪除村人的部分記憶。
    電影裡的想像也許有一天會發生。2019年澳洲皇家墨爾本理工大學的研究團隊，利用「光遺傳學」技術影響海馬迴，開發類腦晶片，可模仿大腦儲存和刪除訊息的方式，能精準刪除老鼠腦中特定的記憶。這項科技將有望應用於心理創傷者、藥物成癮者的治療，清除其長時間的負面與病理性記憶。此外，也有政治哲學教授諾齊克提出「經驗機器」思想實驗：假設有一臺機器可以提供所有想要的幸福經驗，甚至可以定期修改，無論是領袖群倫、環遊世界……，使用者想要的「幸福人生」，都可以事先設定。面對這樣的機器，人類將如何抉擇？
假設「經驗機器」存在並且運作穩定，可以讓人享受虛擬的「幸福人生」，你認為將對人類產生什麼影響？權衡利弊，你會支持開放這樣的機器上市嗎？請以「編織記憶：幸福可以被設定！？」為題，運用文中相關資訊，並結合經驗與見聞，闡明自己的意見。
文長至少600字。

","編織記憶：幸福可以被設定！？



現在科技很發達，有人說可以用機器來設定幸福的記憶，我覺得這樣不太好。因為如果每個人都用機器來得到幸福，那生活就沒有意義了。



經驗機器雖然可以讓人很快樂，但是這種快樂是假的。用了這種機器，人就會整天躺在那裡，不想工作也不想讀書。而且大家都不會想要跟家人朋友相處，因為機器就可以給他們快樂了。這樣對社會不好，因為沒有人工作，經濟就會變差。



題目裡面還說到可以用光遺傳學來刪除不好的記憶。我覺得這個比較好，因為可以幫助一些有心理問題的人。如果可以把不開心的記憶刪掉，人就會比較有信心。但是我覺得還是要小心使用，不能濫用。



我認為這些科技要謹慎使用，不能讓大家都依賴機器。人還是要靠自己的努力來得到真正的幸福，這樣才有意義。如果都用機器來得到快樂，那人生就沒有價值了。



所以我覺得經驗機器不應該讓大家使用，但是可以用光遺傳學來幫助有需要的病人。科技應該要用在對的地方，不能讓它變成害人的東西。",2,2,1,2,2,9
