題目,作答,立意,結構,修辭,敘述,啟發,總分
"關於地球的記憶
被文字固禁在課本裡
我們的筆尖游走在山脈和海洋
翻譯每片花瓣的嬌嫩和露水的清新
所有的言語 答案
都靜放在我們的課本裡
等待我們翻起這一切的序幕（節錄自薛憶婷〈我們的課本〉）

    以上這首詩，從課本啟動天馬行空的遐想，瞥見知識豐富的樣貌。科學頑童費曼（Richard P. Feynman）曾說觀察轉動的餐盤，讓他得到很大的啟發，領略了興之所至的樂趣。物理課可讓我們發現萬物運行的迷人，生物課帶領我們進入細胞核遊歷，外語課讓我們聽見世界不同的文化。國文課堂上「採菊東籬下，悠然見南山」或「輕羅小扇撲流螢」，詩中情境也往往能讓人神遊於現實之外。過往的課程內容，是否曾經點燃你對知識的熱情？打開課本時，不知能否如〈我們的課本〉所述，揭開知識想像的序幕。
    若能從不同角度切入課本，進入知識的想像，或許可以讓課本帶領我們經歷驚奇的旅程。請以「當我打開課本」為題，寫一篇文章，敘述任一學科課本對你的意義，書寫你探索課本內容、知識的經驗與體會。
文長至少600字。


","當我打開課本



我們從小到大都會看過很多課本，像是英文、國文、數學、自然等等。每個課本都有不同的內容，有些內容會讓我們覺得很有趣。我最喜歡的是國小自然課本裡面講的虹吸現象，因為這個現象後來幫助我解決了一個問題。



虹吸現象就是把水從高的地方流到低的地方。要做這個實驗，要準備兩個裝水的容器，一個放高一點，一個放低一點。然後用一條水管連接兩個容器，水管裡面要先裝滿水。這樣水就會從高的容器流到低的容器。雖然這個現象平常不太會看到，但是有時候還是會用得到。



有一次我家停電了，沒有水可以用，我就想到了這個虹吸現象。我們趕快去買了一條水管，把剩下的水都裝在水桶裡。然後有人爬到水塔上面，把水管放進去，另一邊放在水桶裡，這樣就可以讓水流下來了。



我覺得課本裡面教的東西，如果可以用在生活上就很好。像虹吸現象這樣的知識，對我來說就很有用，因為它真的幫我解決了問題。",2,1,1,2,1,7
