題目,作答,立意,結構,修辭,敘述,啟發,總分
"關於地球的記憶
被文字固禁在課本裡
我們的筆尖游走在山脈和海洋
翻譯每片花瓣的嬌嫩和露水的清新
所有的言語 答案
都靜放在我們的課本裡
等待我們翻起這一切的序幕（節錄自薛憶婷〈我們的課本〉）

    以上這首詩，從課本啟動天馬行空的遐想，瞥見知識豐富的樣貌。科學頑童費曼（Richard P. Feynman）曾說觀察轉動的餐盤，讓他得到很大的啟發，領略了興之所至的樂趣。物理課可讓我們發現萬物運行的迷人，生物課帶領我們進入細胞核遊歷，外語課讓我們聽見世界不同的文化。國文課堂上「採菊東籬下，悠然見南山」或「輕羅小扇撲流螢」，詩中情境也往往能讓人神遊於現實之外。過往的課程內容，是否曾經點燃你對知識的熱情？打開課本時，不知能否如〈我們的課本〉所述，揭開知識想像的序幕。
    若能從不同角度切入課本，進入知識的想像，或許可以讓課本帶領我們經歷驚奇的旅程。請以「當我打開課本」為題，寫一篇文章，敘述任一學科課本對你的意義，書寫你探索課本內容、知識的經驗與體會。
文長至少600字。


","當我打開課本，看到裡面有很多字和圖片。我最喜歡生物課本，因為可以看到很多動物和植物的圖片，覺得很有趣。



生物課本讓我知道植物是怎麼長大的，也知道昆蟲有什麼特徵。我在家裡種過一些小花，看著它慢慢長大，就像課本裡說的一樣。我覺得這樣學習比較容易記住。



不過課本有時候字太多了，看起來很無聊。雖然老師說要認真讀，但是我常常看不懂，只能看看圖片。我知道課本很重要，可是真的不太喜歡讀課本。



我覺得如果課本可以有更多圖片，或者內容可以寫得簡單一點就好了。這樣我們就比較容易學習，也不會覺得那麼困難。現在的課本都太難了，很多同學都不愛看。



希望以後的課本可以變得更有趣一點，這樣我們就會更喜歡學習了。雖然現在不太喜歡讀課本，但是我還是會努力學習，因為這是學生應該做的事情。",2,2,1,2,1,8
