題目,作答,立意,結構,修辭,敘述,啟發,總分
"    糖對身體是有好處的，運動過後或飢餓時，適當地補充糖會讓我們迅速恢復體力。科學研究也發現，大腦細胞的能量來源主要來自葡萄糖，當血糖濃度降低時，大腦難以順利運轉，容易注意力不集中，學習或做事效果不佳。不過，哈佛醫學院等多個研究機構指出，高糖飲食會增加罹患乳癌及憂鬱症等疾病的風險；世界衛生組織也指出，高糖飲食是造成體重過重、第二型糖尿病、蛀牙、心臟病的元兇，並建議每日飲食中「添加糖」的攝取量不宜超過總熱量的10%。以每日熱量攝取量2000大卡為例，也就是50公克糖。我國國民健康署於民國103年至106年的「國民營養健康狀況變遷調查」中，有關國人飲用含糖飲料的結果顯示，國民中小學生在飲用比例上為各年齡之冠，其中男性又高於女性。
    基於國民營養及健康飲食原則，目前中小學校園禁止出現含糖飲料，以避免孩子在校園攝取過多糖份。但反對者認為，孩子回到家還是可能會喝含糖飲料，無法治本。
    對於「中、小學校園禁止含糖飲料」，你贊成或反對？請以「禁止含糖飲料進入中、小學之我見」為題，撰寫一篇文章，提出你的看法與論述。
文長至少600字。


","禁止含糖飲料進入中、小學之我見



我不贊成學校禁止含糖飲料。因為糖是人體需要的，可以讓我們有精神，讓大腦運作得更好。雖然醫生說喝太多含糖飲料不好，會得很多病，但是我覺得學校不應該管這麼多。



我覺得學校沒有權力管學生喝什麼。每個人都有選擇要喝什麼的自由，而且家長才應該要教小孩喝什麼比較好。學校管太多反而不好，因為學生還是會想辦法喝到含糖飲料。



而且就算學校禁止了，學生放學後還是可以去買飲料喝。學校附近很多飲料店，想喝的話隨時都可以去買。這樣的規定根本沒有用，還不如不要規定。如果要管的話，是不是連學校附近的店家都要管？這樣好像管太多了。



我自己家裡有人得糖尿病，所以我現在比較少喝含糖飲料，都喝白開水。但是這是我自己的選擇，不是因為別人規定我。所以我覺得學校應該要教學生正確的觀念，而不是用規定來限制學生。",2,2,1,2,1,8
