題目,作答,立意,結構,修辭,敘述,啟發,總分
"林語堂說：「（我）所愛的不是晚秋，是初秋，那時暄氣初消，月正圓，蟹正肥，桂花皎潔，也未陷入懍烈蕭瑟氣態，這是最值得賞樂的。」楊牧則是在美麗的春天世界裡，萬物復甦，卻聽到「一片樹葉提早轉黃的聲音。」（〈夭〉）普魯斯特（Proust, M.）在《追憶逝水年華》中說：「一小時不僅僅是一個小時，它是一只充滿香氣、聲響、念頭和氛圍的花缽」，說明時間的認知與感官知覺及感受有關。請以「季節的感思」為題，寫一篇文章，描寫你對季節的感知經驗，並抒發心中的感受與領會。
文長至少600字。

","季節的感思



我覺得每個季節都有不同的感覺。春天來的時候，花開了，樹也長出新葉子。走在路上看到這些景色，感覺還不錯。



夏天很熱，太陽很大，常常會流很多汗。但是夏天也有好處，像是可以吃冰，衣服也容易晾乾。不過颱風來的時候很麻煩，會把東西都吹壞。



秋天應該要涼爽，可是現在的秋天都很熱，跟夏天差不多。以前秋天要穿外套，現在都不用了，感覺很奇怪。



我最喜歡冬天，因為可以蓋被子睡覺很舒服。我喜歡玩滑板，冬天玩滑板比較不會流汗，心情也比較好。雖然冬天跌倒會比較痛，但是我還是喜歡冬天多一點。



每個季節都有好有壞，有人喜歡冬天，有人喜歡夏天。我希望天氣可以一直很冷，這樣就可以一直玩滑板了。",1,1,1,1,1,5
