題目,作答,立意,結構,修辭,敘述,啟發,總分
"    糖對身體是有好處的，運動過後或飢餓時，適當地補充糖會讓我們迅速恢復體力。科學研究也發現，大腦細胞的能量來源主要來自葡萄糖，當血糖濃度降低時，大腦難以順利運轉，容易注意力不集中，學習或做事效果不佳。不過，哈佛醫學院等多個研究機構指出，高糖飲食會增加罹患乳癌及憂鬱症等疾病的風險；世界衛生組織也指出，高糖飲食是造成體重過重、第二型糖尿病、蛀牙、心臟病的元兇，並建議每日飲食中「添加糖」的攝取量不宜超過總熱量的10%。以每日熱量攝取量2000大卡為例，也就是50公克糖。我國國民健康署於民國103年至106年的「國民營養健康狀況變遷調查」中，有關國人飲用含糖飲料的結果顯示，國民中小學生在飲用比例上為各年齡之冠，其中男性又高於女性。
    基於國民營養及健康飲食原則，目前中小學校園禁止出現含糖飲料，以避免孩子在校園攝取過多糖份。但反對者認為，孩子回到家還是可能會喝含糖飲料，無法治本。
    對於「中、小學校園禁止含糖飲料」，你贊成或反對？請以「禁止含糖飲料進入中、小學之我見」為題，撰寫一篇文章，提出你的看法與論述。
文長至少600字。


","禁止含糖飲料在中、小學之我見



我覺得中小學禁止含糖飲料不好。因為手搖飲在台灣很多人都喜歡喝，而且糖也是中國飲食文化很重要的東西。所以學校禁止含糖飲料沒有用。



糖對人體很重要，運動後需要補充能量，大腦也需要糖分才能運作。中小學生正在長大，又常常運動，如果不能喝含糖飲料補充體力，對身體不好。下課時間玩得很累，回到教室沒有糖分補充，上課就會沒精神。



雖然有研究說糖對身體不好，每天喝太多含糖飲料會生病。但是我覺得與其禁止學生喝，不如教他們怎麼控制喝的量比較好。因為學生回家還是可以喝，所以禁止也沒有用。



總之，我不贊成學校禁止含糖飲料，因為這樣解決不了問題。應該要教學生正確的飲食習慣才對。",1,1,1,1,1,5
