題目,作答,立意,結構,修辭,敘述,啟發,總分
"甲
(陶潛)為彭澤令。不以家累自隨，送一力給其子，書曰：「汝旦夕之費，自給為難。今遣此力，助汝薪水（打柴汲水）之勞。此亦人子也，可善遇之。」(《南史．隱逸．陶潛傳》)
乙
飯後，眾人各自有事離去，留下貞觀靜坐桌前獃想。她今日的這番感慨，實是前未曾有的。
阿啟伯摘瓜，乃她親眼所見。今早，她突發奇想，陪著外公去巡魚塭，回來時，祖孫二人，都在門口停住了，因為後門虛掩，阿啟伯拿著菜刀，正在棚下摘瓜，並未發覺他們，祖孫二個都閃到門背後。貞觀當時是真愣住了，在那種情況下，是前進呢？抑是後退？她不能很快作選擇。然而這種遲疑也只有幾秒鐘，她一下就被外公拉到門後，正是屏息靜氣時，老人家又帶了她拐出小巷口，走到前街來。
貞觀人到了大路上，心下才逐漸明白：外公躲那人的心，竟比那偷瓜的人所做的遮遮掩掩更甚！貞觀以為懂得了外公的心意：他怕阿啟伯當下撞見自己的那種難堪。事實上，他還有另一層深意，貪當然不好，而貧的本身沒有錯。外公不以阿啟伯為不是，是知道他家中十口，有菜就沒飯，有飯就沒菜。(改寫自蕭麗紅《千江有水千江月》)
陶潛或者外公對他人的善意，你可能也曾見聞或經歷過，請以「溫暖的心」為題，寫一篇文章，分享你的經驗及體會。
文長至少600字。

","溫暖的心



我覺得這個世界上有很多不同的人，有好人也有壞人。有錢人不一定會幫助別人，反而是窮人比較會幫助人。我覺得這樣很溫暖。



我在網路上看過一個影片，是一個小女孩在路上很餓，有錢人都不理她，只有窮人會給她食物。這讓我覺得很感動，因為窮人雖然自己也沒有錢，但是還是願意幫助別人。有錢人可能是怕被騙，所以不敢幫忙。



我自己也有一個溫暖的經驗。有一次我和朋友慶生，買了一個很大的蛋糕，吃不完。我們就想說不要浪費，就拿去火車站地下街給遊民吃。遊民拿到蛋糕都很有禮貌地說謝謝。有一個遊民還說要把蛋糕給另一個比較餓的人，讓我覺得很感動。



這件事讓我知道幫助別人很快樂。不需要做很大的事情，只要一點點小事就可以讓別人感到溫暖。希望大家都可以多幫助別人，讓世界變得更好。",2,1,2,2,1,8
