題目,作答,立意,結構,修辭,敘述,啟發,總分
"    記憶可以被編輯或刪除嗎？2004年美國電影《王牌冤家》（Eternal Sunshine of the Spotless Mind），敘述一對怨偶在一次激烈的爭吵後，先後踏入提供記憶刪除服務的「忘情診所」，主動要求洗去記憶。女主角成功地洗去兩人的戀愛記憶，男主角則在記憶清掃的過程中，因為看見舊日時光的美好，想保留一切甜蜜與悲傷的記憶，而開始和電腦清除系統搏鬥。2017年，臺灣導演陳玉勳將自己的短片〈海馬洗頭〉改為長片《健忘村》。〈海馬洗頭〉的創意發想，來自於「人的記憶都存在大腦的海馬迴裡」，電影中因此有「海馬洗頭店」，專職幫人洗去記憶。《健忘村》則有一件寶物「忘憂神器」，可以清除記憶。村長為了一己私利，引誘村人「忘憂」，刪除村人的部分記憶。
    電影裡的想像也許有一天會發生。2019年澳洲皇家墨爾本理工大學的研究團隊，利用「光遺傳學」技術影響海馬迴，開發類腦晶片，可模仿大腦儲存和刪除訊息的方式，能精準刪除老鼠腦中特定的記憶。這項科技將有望應用於心理創傷者、藥物成癮者的治療，清除其長時間的負面與病理性記憶。此外，也有政治哲學教授諾齊克提出「經驗機器」思想實驗：假設有一臺機器可以提供所有想要的幸福經驗，甚至可以定期修改，無論是領袖群倫、環遊世界……，使用者想要的「幸福人生」，都可以事先設定。面對這樣的機器，人類將如何抉擇？
假設「經驗機器」存在並且運作穩定，可以讓人享受虛擬的「幸福人生」，你認為將對人類產生什麼影響？權衡利弊，你會支持開放這樣的機器上市嗎？請以「編織記憶：幸福可以被設定！？」為題，運用文中相關資訊，並結合經驗與見聞，闡明自己的意見。
文長至少600字。

","編織記憶：幸福可以被設定！？



記憶是很重要的東西，如果有經驗機器可以改變記憶，我覺得這樣不太好。因為這樣人就會變得很懶惰，什麼事情都不想做了。



我看過很多人玩手機遊戲，整天都在玩，不想面對現實生活。我有一個同學就是這樣，他整天都在玩遊戲，不愛洗澡也不想上學。他爸爸很辛苦，要工作還要照顧他。後來他的同學都不喜歡他，因為他身上有怪味道，最後他都不來上學了。



如果有經驗機器，大家一定都會想要用它來改變自己的記憶，讓自己變得很厲害或是很快樂。但是這些都是假的，不是真的。而且人如果都不用面對困難，就會變得很軟弱。我覺得人應該要面對現實，不要想要用機器來騙自己。



所以我不贊成讓這種機器出現在市場上。因為這樣會讓人變得很懶惰，什麼事情都不想做。人應該要靠自己的努力來得到幸福，不要想要用機器來改變記憶。這樣才是對的。",2,1,1,2,1,7
