題目,作答,立意,結構,修辭,敘述,啟發,總分
"    我覺得童年是一種氣味的記憶。
    我的童年，有許多果樹氣味的記憶。夏天暑熱的午後，廟埕後有一棵巨大的龍眼樹。我從小學翻牆出來，背著書包，爬上龍眼樹，躲在密密的枝葉裡。外面日光葉影搖晃，隱約聽見老師或母親尋來，在樹下叫著我的名字，但那呼喚的聲音，被蟬聲的高音淹沒了。我一動不動，找到一處適合蜷窩身體的枝椏，好像變成樹的一部分，而那時，龍眼樹密密的甜熟的氣味就包圍著我。我閉起眼睛，好像在假寐，也像在作夢，夢裡一串一串纍纍的龍眼，招來許多蜜蜂果蠅。我童年的夢，很甜很香，好像一整個夏天都窩在那棵樹上，包圍在濃郁的氣味裡做了一個醒不來的夢。（改寫自蔣勳《給青年藝術家的信》）
    生活中充斥各種氣味。氣味透過嗅覺傳遞，喚起人們的記憶和感受，一如文中龍眼樹甜熟的氣味喚起作者的童年記憶。請以「花草樹木的氣味記憶」為題，寫一篇文章，書寫你熟悉的花草樹木的氣味，及其所召喚的記憶和感受。

文長至少600字。

","花草樹木的氣味記憶



我小時候最喜歡吃仙丹花的花蜜。每次看到路邊有仙丹花，就會很開心的跑過去。



我記得國小的時候，有一次看到同學在花叢那邊，我就走過去看。他們在吃一種紅色的小花，就是仙丹花。只要把花蕊拔出來，就可以吃到甜甜的花蜜。我們都很喜歡吃，覺得很好玩。



後來老師發現花叢的花都被我們吃掉了，就生氣的罵我們，說不可以再吃花蜜。我們都很害怕，所以就不敢再去吃了。現在想想真的很好笑，我們竟然把那麼多花都吃掉了。



長大以後，雖然沒有人管我們了，但是我也不會想要再去吃花蜜。可能是因為長大了，對這些事情沒有興趣了吧。



每次看到路邊的仙丹花，就會想到以前和同學一起吃花蜜的時候。雖然我們都長大了，但是那些回憶還在那裡。",1,1,1,1,1,5
