題目,作答,立意,結構,修辭,敘述,啟發,總分
"林語堂說：「（我）所愛的不是晚秋，是初秋，那時暄氣初消，月正圓，蟹正肥，桂花皎潔，也未陷入懍烈蕭瑟氣態，這是最值得賞樂的。」楊牧則是在美麗的春天世界裡，萬物復甦，卻聽到「一片樹葉提早轉黃的聲音。」（〈夭〉）普魯斯特（Proust, M.）在《追憶逝水年華》中說：「一小時不僅僅是一個小時，它是一只充滿香氣、聲響、念頭和氛圍的花缽」，說明時間的認知與感官知覺及感受有關。請以「季節的感思」為題，寫一篇文章，描寫你對季節的感知經驗，並抒發心中的感受與領會。
文長至少600字。

","季節的感思



我覺得季節變化很有趣。春天有點冷但是有花開，夏天很熱但是有蟬叫，秋天涼涼的有落葉，冬天很冷會下雪。但是現在的季節跟以前不一樣了。



以前春天的時候大家都穿外套去看花，現在因為地球暖化，春天好像不見了。夏天以前大家都去游泳玩水，現在河水髒髒的，大家都在家開冷氣。



秋天以前可以穿長袖吹風看落葉，現在天氣變來變去的，也沒什麼落葉可以看。冬天以前要穿大衣去買年貨拜年，現在都用網路買東西，用手機聯絡，感覺不太一樣。



我覺得科技進步雖然方便，但是好像失去了一些以前的感覺。現在四季都差不多，讓人有點難過。",1,1,1,1,1,5
