題目,作答,立意,結構,修辭,敘述,啟發,總分
"甲
我們的感情是冰箱，打開來看，明亮可喜，關起門後是嗡嗡的黑暗。什麼都不會壞掉，埋在霜雪的角落。我們的感情是冰箱，有時很滿有時很空，一切都可以保存很久，冷冷的，可是很新鮮，看起來都像昨天。（柯裕棻〈冰箱〉）
乙
農曆年前我媽換了新冰箱。雖然舊的其實也還好，十數年如一日修長高冷玉面如銀，該凍肉時凍肉，該製冰時製冰，門沒關緊永遠忠實地響警告聲。燈泡甚至沒有壞過一次。只是我媽長期嫌它不得力，冷藏室裝一隻生雞一鍋燉肉就周轉不過來，胃口那樣地小，像一個節食的人，廚房裡最不需要的就是一個節食的人。我常常看見她蹲在那兒，腳邊圍滿生鮮，鬥盡心智排列組合，在最有限空間裡籌備出最大的寬容，冰箱門好像看牙醫的嘴開太久不斷嗶嗶叫，簡直像在哭了。感覺兩方都十分苦惱。
我認為運用如常的器物毋需特別汰換，也主張大家都不妨少吃一點。顯然我媽不作此想。她說：「總之我就是想要一臺大冰箱啦。」但如此一來，我反倒領悟了，這完全是某商品宣傳詞「豈止於大」（Bigger than bigger）的道理：一座夠大的新冰箱也豈止於冰箱，它是一種想像，一種意境，一種可能性，它富有召喚家庭生活最好願景的潛力。（改寫自黃麗群〈如果在冬天，一座新冰箱〉）
    冰箱可以很滿，可以很空，當你打開冰箱，通常想尋找什麼？又看見什麼？假如有一座屬於你的新冰箱，你會有怎樣的想像？冰藏什麼（虛實皆可）會符合你所期待的美好生活？請以「如果我有一座新冰箱」為題，撰文一篇，
文長至少600字。

","如果我有一座新冰箱



深夜的書桌前，刺眼的檯燈照著厚重的原文書，這是我踏入大學後最熟悉的景象。每當我強撐著疲憊的雙眼，在知識的汪洋中載浮載沉時，總會不經意想起：如果有一座能夠冰藏記憶的冰箱，該有多好。



打開這座想像中的冰箱，最上層，我要存放童年時期那些絢爛的夢想。那時的我，不諳世事，一心嚮往成為一名藝術家。記得那雙眼睛總是在捕捉生活中的美好，雙手不停揮灑著色彩，試圖將所見所感轉化為畫作，與人分享內心的感動。那時的世界是如此純粹而繽紛，每一天都像是新調的顏料，鮮豔而充滿可能。



中層，我要放進蛻變的過程。就像冰箱裡的食材會隨時間產生變化，我也在求學路上逐漸改變。看著同學們一個個放下童年夢想，追逐著分數與現實，我也不得不順應這股洪流，成為一名「典型的台灣學生」。曾經自由揮灑的畫紙，被制式的考卷取代；絢麗的色彩，褪成了單調的對錯。



但在這座冰箱的最下層，我要珍藏一個重要的領悟：過去的夢想不該被現實完全凍結。就像冰箱不只是保存食物的容器，更是孕育生活滋味的場所，我們的記憶與夢想也不該只是被封存的過去。它們應該適時地被取出，為現在的生活注入新的養分。



這座想像中的冰箱，不只是保存過往的容器，更像是一面鏡子，映照出生命中不同階段的自己。當我打開冰箱門，看見的不只是被保存的回憶，更看見了重新擁抱夢想的可能。或許，我們不必完全放棄童年的純真，而是學會在現實與理想之間取得平衡，讓生活既能保有務實的冷靜，也能保留夢想的溫度。



現在的我明白，真正的智慧不在於選擇放棄或堅持，而在於學會調和。就像一座完美的冰箱，既要維持適當的溫度，也要懂得適時除霜，讓保存的事物既新鮮又不失其原味。期待有朝一日，當我再次翻開那些塵封的畫作時，能以更成熟的眼光，讓童年的色彩與現在的智慧交融，譜寫出屬於自己的生命詩篇。",4,4,4,4,5,21
