題目,作答,立意,結構,修辭,敘述,啟發,總分
"甲
我們的感情是冰箱，打開來看，明亮可喜，關起門後是嗡嗡的黑暗。什麼都不會壞掉，埋在霜雪的角落。我們的感情是冰箱，有時很滿有時很空，一切都可以保存很久，冷冷的，可是很新鮮，看起來都像昨天。（柯裕棻〈冰箱〉）
乙
農曆年前我媽換了新冰箱。雖然舊的其實也還好，十數年如一日修長高冷玉面如銀，該凍肉時凍肉，該製冰時製冰，門沒關緊永遠忠實地響警告聲。燈泡甚至沒有壞過一次。只是我媽長期嫌它不得力，冷藏室裝一隻生雞一鍋燉肉就周轉不過來，胃口那樣地小，像一個節食的人，廚房裡最不需要的就是一個節食的人。我常常看見她蹲在那兒，腳邊圍滿生鮮，鬥盡心智排列組合，在最有限空間裡籌備出最大的寬容，冰箱門好像看牙醫的嘴開太久不斷嗶嗶叫，簡直像在哭了。感覺兩方都十分苦惱。
我認為運用如常的器物毋需特別汰換，也主張大家都不妨少吃一點。顯然我媽不作此想。她說：「總之我就是想要一臺大冰箱啦。」但如此一來，我反倒領悟了，這完全是某商品宣傳詞「豈止於大」（Bigger than bigger）的道理：一座夠大的新冰箱也豈止於冰箱，它是一種想像，一種意境，一種可能性，它富有召喚家庭生活最好願景的潛力。（改寫自黃麗群〈如果在冬天，一座新冰箱〉）
    冰箱可以很滿，可以很空，當你打開冰箱，通常想尋找什麼？又看見什麼？假如有一座屬於你的新冰箱，你會有怎樣的想像？冰藏什麼（虛實皆可）會符合你所期待的美好生活？請以「如果我有一座新冰箱」為題，撰文一篇，
文長至少600字。

","如果我有一座新冰箱



我現在是大學生，每天都要讀很多書，常常覺得很累。我希望有一個冰箱可以把我的回憶都放進去，這樣就不會忘記以前快樂的事情。



我小時候很喜歡畫畫，想要當一個畫家。那時候覺得畫畫很開心，可以畫很多漂亮的東西。我希望可以把這些美麗的東西畫給別人看，讓大家也可以感受到我看到的美。



但是後來上了國中和高中，同學們都開始很認真讀書，不再想以前的夢想。我也變得跟他們一樣，每天只想要考試考好一點。現在的生活變得很無聊，只有讀書和考試，一點都不快樂。



如果我有一個新冰箱，我想把小時候的回憶都放進去。這樣我就不會忘記以前快樂的時候，也許生活就不會這麼無趣了。我覺得現在的我變得很不好，只會跟著別人做事情，不像小時候有自己的想法。



我希望可以找回以前的自己，讓生活變得更有趣一點。",2,1,1,2,1,7
