題目,作答,立意,結構,修辭,敘述,啟發,總分
"關於地球的記憶
被文字固禁在課本裡
我們的筆尖游走在山脈和海洋
翻譯每片花瓣的嬌嫩和露水的清新
所有的言語 答案
都靜放在我們的課本裡
等待我們翻起這一切的序幕（節錄自薛憶婷〈我們的課本〉）

    以上這首詩，從課本啟動天馬行空的遐想，瞥見知識豐富的樣貌。科學頑童費曼（Richard P. Feynman）曾說觀察轉動的餐盤，讓他得到很大的啟發，領略了興之所至的樂趣。物理課可讓我們發現萬物運行的迷人，生物課帶領我們進入細胞核遊歷，外語課讓我們聽見世界不同的文化。國文課堂上「採菊東籬下，悠然見南山」或「輕羅小扇撲流螢」，詩中情境也往往能讓人神遊於現實之外。過往的課程內容，是否曾經點燃你對知識的熱情？打開課本時，不知能否如〈我們的課本〉所述，揭開知識想像的序幕。
    若能從不同角度切入課本，進入知識的想像，或許可以讓課本帶領我們經歷驚奇的旅程。請以「當我打開課本」為題，寫一篇文章，敘述任一學科課本對你的意義，書寫你探索課本內容、知識的經驗與體會。
文長至少600字。


","當我打開課本



每次打開歷史課本時，我都覺得很無聊。但是老師說要學習歷史，所以我還是要看。課本上有很多圖片和文字，讓我看了就想睡覺。



我看到課本上寫著以前的事情，有賣東西的小販，有穿著奇怪衣服的人，還有在朝廷工作的官員。我也看到一些戰爭的事情，人們都很可憐，沒有地方住。這些內容對我來說都很遙遠。



歷史課本告訴我們以前發生的事情，但是我不太懂為什麼要學這些。老師說要從歷史中學習，可是我覺得現在的生活跟以前差很多，沒什麼關係。雖然課本上寫了很多事情，但是我記不住那麼多。



我覺得歷史課本就像一本故事書，裡面的內容雖然很多，但是跟我的生活沒有關係。我只要記住考試要考的內容就好了。",1,1,1,1,1,5
