題目,作答,立意,結構,修辭,敘述,啟發,總分
"    看到山上那麼多參天大樹時，會勾起我的惻隱之心。在無法順暢呼吸的空間裡，樹木之間為了生存必須展開激烈的競爭。為了能多接受一些陽光，它們只能拼命向上生長。
但是，只為生存而競爭的森林卻漸次死亡，因為陽光無法到達地面，所以溫度不夠高，無法讓幼小的生命萌芽。小樹和花、草，以及與它們一起生活的小昆蟲沒有生存的空間。雖然表面上看起來非常完美，但這種森林其實與沒有希望的不孕之地無異。
根據我的經驗，密集栽種的樹苗體型壯大數十倍時，就需要開始砍樹，否則樹木會抱怨空間太窄，活不下去。要想確保樹木能充分接受陽光照射的空間，就必須做出犧牲。因此，幾年期間強行進行砍伐，樹木間距剛開始時是一公尺，現已擴大到七公尺。也就是說，即使是粗略估算，也可知七棵樹中有六棵為之消失。
森林要想成為孕育新生命的希望之地，就需要有縫隙。如果樹木壽命結束或因為意外災害而倒下，該位置就會產生空間，那麼，溫暖的陽光就會照射進來，被陽光照射的地面混雜著前一年秋天凋落的樹葉，於是積聚起能夠孕育新生命的養分。因此，樹木的縫隙，既是結束和開始共存的空間，也是由缺乏轉化為希望的空間。（改寫自禹鐘榮著、盧鴻金譯《樹木教我的人生課》）
    根據上文所述，為什麼森林需要縫隙？由此聯想，人生是否也需要縫隙？請以「縫隙的聯想」為題，寫一篇文章，結合生活經驗或見聞，書寫你的感思與體悟。
文長至少600字。


","縫隙的聯想



我覺得縫隙是一個很重要的東西，因為它可以讓我們休息。就像森林裡的樹木一樣，如果太擠的話，小樹就長不大，所以需要有空隙讓陽光照進來。



我們讀書的時候也是這樣，老師常常叫我們一直讀書，但是我覺得應該要給我們一些休息的時間。因為如果一直讀書的話，腦袋會很累，什麼都記不住。就像樹木一樣，如果太擠的話，就會死掉。



我以前的老師就說過，每個人都不一樣，所以不能用同樣的方法教每個人。有些人喜歡運動，有些人喜歡畫畫，我們應該要給每個人一些空間，讓他們做自己喜歡的事情。



我希望老師和家長可以給我們更多的時間休息，不要一直逼我們讀書。這樣我們才能學得更好，也能找到自己真正喜歡的事情。雖然改變很難，但是我相信只要大家一起努力，一定可以做到的。



所以我覺得縫隙很重要，因為它可以讓我們休息，也可以讓我們變得更好。就像森林裡的樹木一樣，需要有空間才能長大。",2,1,1,2,1,7
