題目,作答,立意,結構,修辭,敘述,啟發,總分
"關於地球的記憶
被文字固禁在課本裡
我們的筆尖游走在山脈和海洋
翻譯每片花瓣的嬌嫩和露水的清新
所有的言語 答案
都靜放在我們的課本裡
等待我們翻起這一切的序幕（節錄自薛憶婷〈我們的課本〉）

    以上這首詩，從課本啟動天馬行空的遐想，瞥見知識豐富的樣貌。科學頑童費曼（Richard P. Feynman）曾說觀察轉動的餐盤，讓他得到很大的啟發，領略了興之所至的樂趣。物理課可讓我們發現萬物運行的迷人，生物課帶領我們進入細胞核遊歷，外語課讓我們聽見世界不同的文化。國文課堂上「採菊東籬下，悠然見南山」或「輕羅小扇撲流螢」，詩中情境也往往能讓人神遊於現實之外。過往的課程內容，是否曾經點燃你對知識的熱情？打開課本時，不知能否如〈我們的課本〉所述，揭開知識想像的序幕。
    若能從不同角度切入課本，進入知識的想像，或許可以讓課本帶領我們經歷驚奇的旅程。請以「當我打開課本」為題，寫一篇文章，敘述任一學科課本對你的意義，書寫你探索課本內容、知識的經驗與體會。
文長至少600字。


","當我打開課本



從小到大，英文一直是我最頭痛的科目。每當我打開英文課本，總是覺得很無聊，常常會想睡覺。雖然課本上有很多單字和文法，但是對我來說都很難懂。



記得在國小的時候，我的英文成績還不錯，可是到了國中以後，課本裡的內容就變得很困難。我常常看不懂課文在說什麼，也記不住那些文法規則。老師上課的時候我都聽不太懂，慢慢地就對英文失去了興趣。



到了高中，情況變得更糟，我的英文成績開始被當。我覺得用課本學習英文真的很無趣，只會讓人想睡覺。每次上課都是死記硬背，這樣的學習方式一點意思都沒有。



經過這些年的學習經驗，我發現學習英文不能只靠課本。我覺得要學好英文，應該要多看英文影片或是跟外國人說話，這樣才能真正學會這個語言。雖然我從課本上沒學到多少東西，但是這個經驗讓我明白了學習的方法很重要。



總的來說，英文課本讓我學到了一個道理：學習不能只靠死讀書，要用更生活化的方式去學習，這樣才能真正學會一個語言。",2,2,1,2,1,8
