題目,作答,立意,結構,修辭,敘述,啟發,總分
"    我覺得童年是一種氣味的記憶。
    我的童年，有許多果樹氣味的記憶。夏天暑熱的午後，廟埕後有一棵巨大的龍眼樹。我從小學翻牆出來，背著書包，爬上龍眼樹，躲在密密的枝葉裡。外面日光葉影搖晃，隱約聽見老師或母親尋來，在樹下叫著我的名字，但那呼喚的聲音，被蟬聲的高音淹沒了。我一動不動，找到一處適合蜷窩身體的枝椏，好像變成樹的一部分，而那時，龍眼樹密密的甜熟的氣味就包圍著我。我閉起眼睛，好像在假寐，也像在作夢，夢裡一串一串纍纍的龍眼，招來許多蜜蜂果蠅。我童年的夢，很甜很香，好像一整個夏天都窩在那棵樹上，包圍在濃郁的氣味裡做了一個醒不來的夢。（改寫自蔣勳《給青年藝術家的信》）
    生活中充斥各種氣味。氣味透過嗅覺傳遞，喚起人們的記憶和感受，一如文中龍眼樹甜熟的氣味喚起作者的童年記憶。請以「花草樹木的氣味記憶」為題，寫一篇文章，書寫你熟悉的花草樹木的氣味，及其所召喚的記憶和感受。

文長至少600字。

","花草樹木的氣味記憶



氣味是時光的魔法師，能在瞬間喚醒沉睡的記憶，牽引我們回到過往。在我的生命裡，玉蘭花的芬芳一直是最特別的存在，它不僅是一種香氣，更是我生命中重要時刻的見證者。



每當我嗅到玉蘭花的香氣，腦海中總會浮現出家中陽台的景象。那裡有一株玉蘭樹，是我童年時光最忠實的傾聽者。記得小時候，每當與哥哥吵架或被媽媽責備，我總會躲到陽台，依偎在玉蘭樹旁。溫柔的花香彷彿母親的撫慰，輕輕安撫著我躁動的心靈。我會為它澆水，跟它分享我的喜怒哀樂，而它則以清雅的香氣回應著我的每一句傾訴。



直到現在，這份與玉蘭花的情誼依然深刻。記得那年夏天，課業的重擔讓我喘不過氣，整個人像一座蓄勢待發的火山。正當煩悶難耐之際，一場午後雷陣雨不期而至。我打開窗戶，讓雨水的清新與玉蘭花的芳香交織成一曲安魂曲。雨絲輕拂臉龐，花香縈繞鼻間，彷彿時光倒流，我又回到了那個在陽台訴說心事的小女孩。



玉蘭花的香氣總是在最需要的時候出現，像一位睿智的長者，默默地守護著我的成長。它教會我，生命中的煩惱如同雨季，終會過去；而那些美好的時刻，就像花香一般，會在記憶中永遠芬芳。當我再次踏上許久未至的陽台，熟悉的花香依舊如故。這次，我不再需要訴苦，只是靜靜地感受這份天然的芳香，讓它撫平內心的躁動，找回那份最初的寧靜與純真。



花香是大自然最溫柔的語言，而玉蘭花的氣味，則是我生命中最動人的詩篇。它不僅是我童年的見證，更是我生命中永恆的慰藉。每一次的相遇，都讓我重新體會生命中最單純的美好，那是超越時空的感動，也是最珍貴的氣味記憶。",4,4,4,4,4,20
