題目,作答,立意,結構,修辭,敘述,啟發,總分
"甲
(陶潛)為彭澤令。不以家累自隨，送一力給其子，書曰：「汝旦夕之費，自給為難。今遣此力，助汝薪水（打柴汲水）之勞。此亦人子也，可善遇之。」(《南史．隱逸．陶潛傳》)
乙
飯後，眾人各自有事離去，留下貞觀靜坐桌前獃想。她今日的這番感慨，實是前未曾有的。
阿啟伯摘瓜，乃她親眼所見。今早，她突發奇想，陪著外公去巡魚塭，回來時，祖孫二人，都在門口停住了，因為後門虛掩，阿啟伯拿著菜刀，正在棚下摘瓜，並未發覺他們，祖孫二個都閃到門背後。貞觀當時是真愣住了，在那種情況下，是前進呢？抑是後退？她不能很快作選擇。然而這種遲疑也只有幾秒鐘，她一下就被外公拉到門後，正是屏息靜氣時，老人家又帶了她拐出小巷口，走到前街來。
貞觀人到了大路上，心下才逐漸明白：外公躲那人的心，竟比那偷瓜的人所做的遮遮掩掩更甚！貞觀以為懂得了外公的心意：他怕阿啟伯當下撞見自己的那種難堪。事實上，他還有另一層深意，貪當然不好，而貧的本身沒有錯。外公不以阿啟伯為不是，是知道他家中十口，有菜就沒飯，有飯就沒菜。(改寫自蕭麗紅《千江有水千江月》)
陶潛或者外公對他人的善意，你可能也曾見聞或經歷過，請以「溫暖的心」為題，寫一篇文章，分享你的經驗及體會。
文長至少600字。

","溫暖的心



在人生的旅途中，我們常常會遇到需要伸出援手的時刻。這些時刻，或許考驗著我們的道德判斷，又或許挑戰著我們的價值觀，但正是這些經歷，讓我深刻體會到善意的複雜面向。



記得在國中二年級時，我們班上來了一位轉學生。他是我國小時期的舊識，因為在前一所學校遭遇了一些困境而轉到我們班上。雖然他的課業成績在班上名列後段，但開朗樂觀的性格讓他很快就融入了班級。當時的我擔任地理科小老師，負責批改平時考試和登記成績，這個職務賦予了我一定的權限。



在一次期末考的平時測驗中，看著這位同學勉強答完的考卷，我悄悄地在計分時多加了幾分，讓他那學期的地理成績得以壓線及格。這個決定並非出自他的請求，而是源於我內心spontaneous的善意。然而，在做出這個決定後，我卻陷入了深深的道德困境。



這樣的善意究竟是幫助還是傷害？我不斷地反思。他來自清寒家庭，或許因為少了一科不及格而有機會進入較好的高中，但若是超出能力所及的學習環境，最終又能堅持多久？這個問題一直縈繞在我心頭，直到他在國三時再度轉學，我始終未能得知這個善意舉動的最終影響。



經過多年的思考，我逐漸理解到，善意的價值不應該單純用對錯來衡量。在這個充滿規則與制度的社會中，確實存在著需要靠人情來潤滑的縫隙。就像陶潛對兒子說的「此亦人子也，可善遇之」，或是題目中外公對偷瓜者的體諒，這些看似違反常規的善意，往往蘊含著對人性最深層的理解與同理。



現在的我明白，善意就像是撒在人間的溫暖種子，雖然不是每一顆都能開花結果，但正是這些微小的善意交織，才能編織出更有溫度的社會網絡。或許未來的某一天，我也會需要他人的善意，而這正是人與人之間最珍貴的情感聯繫。",5,4,4,4,4,21
