題目,作答,立意,結構,修辭,敘述,啟發,總分
"二十一世紀資訊量以驚人的速度暴增，有人認為網路資訊易於取得，會使記憶力與思考力衰退，不利於認知學習；也有人視網際網路為人類的外接大腦記憶體，意味著我們毋須記憶大量知識，可以專注在更重要、更有創造力的事物上。對於以上兩種不同的觀點，你的看法為何？請以「網海浮沉之我思」為題，結合自己的相關經驗，探討創造力與思考力之間的關係。
文長至少600字。

","網路現在發展得很快，大家都在用手機和電腦。我覺得這樣不太好，因為會讓人變笨。



我以前在安親班當老師，看到小朋友都不會寫作文，連說話都說不好。我覺得這是因為他們整天都在玩手機，都不看書。我小時候沒有這麼多網路，所以要看書才能學到東西，現在的小朋友都不用功。



網路雖然可以讓我們很快找到資料，但是這樣不好，因為人會變得很懶。就像蝴蝶要自己破繭才能飛，如果有人幫忙，蝴蝶就會掉下來。所以我們也是一樣，要自己學習才會進步。



我覺得網路不能用太多，要自己想事情。如果都靠網路，以後就什麼都不會了。而且網路上的東西也不一定對，所以還是要自己讀書比較好。



總之，我認為網路雖然方便，但是不能太依賴它。我們要多看書，多思考，這樣才能真的學到東西。",2,1,1,2,1,7
