題目,作答,立意,結構,修辭,敘述,啟發,總分
"甲
我們的感情是冰箱，打開來看，明亮可喜，關起門後是嗡嗡的黑暗。什麼都不會壞掉，埋在霜雪的角落。我們的感情是冰箱，有時很滿有時很空，一切都可以保存很久，冷冷的，可是很新鮮，看起來都像昨天。（柯裕棻〈冰箱〉）
乙
農曆年前我媽換了新冰箱。雖然舊的其實也還好，十數年如一日修長高冷玉面如銀，該凍肉時凍肉，該製冰時製冰，門沒關緊永遠忠實地響警告聲。燈泡甚至沒有壞過一次。只是我媽長期嫌它不得力，冷藏室裝一隻生雞一鍋燉肉就周轉不過來，胃口那樣地小，像一個節食的人，廚房裡最不需要的就是一個節食的人。我常常看見她蹲在那兒，腳邊圍滿生鮮，鬥盡心智排列組合，在最有限空間裡籌備出最大的寬容，冰箱門好像看牙醫的嘴開太久不斷嗶嗶叫，簡直像在哭了。感覺兩方都十分苦惱。
我認為運用如常的器物毋需特別汰換，也主張大家都不妨少吃一點。顯然我媽不作此想。她說：「總之我就是想要一臺大冰箱啦。」但如此一來，我反倒領悟了，這完全是某商品宣傳詞「豈止於大」（Bigger than bigger）的道理：一座夠大的新冰箱也豈止於冰箱，它是一種想像，一種意境，一種可能性，它富有召喚家庭生活最好願景的潛力。（改寫自黃麗群〈如果在冬天，一座新冰箱〉）
    冰箱可以很滿，可以很空，當你打開冰箱，通常想尋找什麼？又看見什麼？假如有一座屬於你的新冰箱，你會有怎樣的想像？冰藏什麼（虛實皆可）會符合你所期待的美好生活？請以「如果我有一座新冰箱」為題，撰文一篇，
文長至少600字。

","如果我有一座新冰箱



我家的冰箱已經用了很久了，外表看起來很舊，門上貼了很多磁鐵和電話號碼。每次打開冰箱都會聞到一些奇怪的味道，有時是麻油的味道，有時是其他食物的味道，但最多的是冰箱本身的味道。



我們常常要清理冰箱裡壞掉的食物，把它們丟掉。但是過沒多久，又會有新的食物放進去，然後再次被遺忘，最後又要被丟掉。這樣的情況一直在重複。



我家的冰箱是雙開門的，門上還有一個小窗戶可以拿東西，但是現在這個小窗戶的開關已經壞掉了。每到過年過節的時候，冰箱總是要塞很多東西，有禮盒也有食物。



我和弟弟常常說要換新冰箱，但是看到新冰箱的價格就不敢買了，因為太貴了。我們只能等到這台冰箱真的不能用了才能換新的。如果真的可以換新冰箱，我希望新的冰箱可以更好用一點。",1,1,1,1,1,5
