題目,作答,立意,結構,修辭,敘述,啟發,總分
"甲
　　夜飲東坡醒復醉，歸來彷彿三更。家童鼻息已雷鳴，敲門都不應，倚杖聽江聲。　　長恨此身非我有，何時忘卻營營？夜闌風靜縠紋平，小舟從此逝，江海寄餘生。（蘇軾〈臨江仙〉）
乙
　　山居中的恬靜最使人心生歡喜，覺得充滿了幸福。但這種感覺完全是屬於我個人私己的，難以和他人分享。當深夜沉寂，偶爾會有一部卡車從山腰轟隆急馳而過，聲音在峽谷間響應激盪，久久停留，我往往就會從安寧的心緒中驚覺過來。車上至少有一個聚精會神在奔波的人，重山曲流外就是苦樂混合著沸騰的紅塵，那裡面也有著我的妻女和親友，而我卻一個人上山來獨自享受清靜。那麼，我的幸福是不是純由逃避式的懶散得來的呢？山居只是自己刻意經營的一種看似空靈其實奢侈的生活？心安理得會不會是虛幻而脆弱的？
　　至少，我不希望如此，因為人間是我的根本用情處。（陳列《地上歲月‧山中書》）
請回答下列問題：
甲文中，蘇軾面對夜闌風靜，意欲「小舟從此逝」，遠離塵世；乙文中，陳列則從山居中的恬靜，興發「人間是我的根本用情處」的情思，二者顯然不同。請以「靜夜情懷」為題，連結甲文或乙文的體悟，寫一篇文章抒發你對靜夜的體驗及感受。
文長至少600字。


","靜夜情懷



在這個繁華的世界裡，總有兩種截然不同的夜：一種是都市裡燈火通明的不夜城，另一種是遠離塵囂的寧靜森林。而我，在一個命運的轉折點，得以在靜謐的夜色中，尋得了生命的另一種可能。



童年時期，我因為矮小的身材和細弱的嗓音，總是成為同儕間戲謔的對象。那些年，校園生活對我而言，不只是求知的過程，更像是一場難熬的煎熬。嘲諷與排擠如影隨形，每一天都在為新添的傷口上藥。絕望曾經像濃霧般籠罩著我，讓我幾乎看不見生命中的任何光亮。



就在我即將走上一條不歸路時，命運之神向我伸出了援手。一位同齡的男孩，彷彿預知我的心事般，拉著我奔向一個未知的地方。當時的我並不知道，這個看似偶然的邂逅，竟會徹底改變我的人生軌跡。



穿過層層樹林，我們來到了一處彷彿被時光遺忘的秘境。在這裡，參天古木如同守護神般佇立，清澈的湖泊倒映著星空，四周點點螢火如同大地的脈動。在這片寧靜的夜色中，我們肆意奔跑，我的小巧身形反而成了穿梭林間的優勢；我們放聲歌唱，我的清亮嗓音在林間迴盪，竟顯得格外動人。



在這片靜謐的夜色中，我驚訝地發現，那些我一直認為是缺陷的特質，竟能在不同的環境中綻放出獨特的光彩。就像陳列在山居中體悟到的，寧靜不是逃避，而是一種重新認識自我的契機。每個人都像是一把獨特的鑰匙，終將找到屬於自己的鎖孔。



如今，每當夜幕低垂，我總會想起那片教會我認識自己的森林。靜夜的意義，不在於遠離喧囂，而在於讓我們能夠在寂靜中聆聽內心最真實的聲音，找到生命最珍貴的價值。那些曾經被視為缺陷的特質，或許正是上天賜予我們最獨特的禮物。",4,4,4,4,4,20
