題目,作答,立意,結構,修辭,敘述,啟發,總分
"糖對身體是有好處的，運動過後或飢餓時，適當地補充糖會讓我們迅速恢復體力。科學研究也發現，大腦細胞的能量來源主要來自葡萄糖，當血糖濃度降低時，大腦難以順利運轉，容易注意力不集中，學習或做事效果不佳。不過，哈佛醫學院等多個研究機構指出，高糖飲食會增加罹患乳癌及憂鬱症等疾病的風險；世界衛生組織也指出，高糖飲食是造成體重過重、第二型糖尿病、蛀牙、心臟病的元兇，並建議每日飲食中「添加糖」的攝取量不宜超過總熱量的10%。以每日熱量攝取量2000大卡為例，也就是50公克糖。
讀完以上材料，對於「中、小學校園禁止含糖飲料」，你贊成或反對？請撰寫一篇短文，提出你的看法與論述。文長600字以上。","我贊成學校不要賣含糖飲料，因為喝太多含糖飲料對身體不好。現在很多學生都喜歡喝含糖飲料，每天都要喝，這樣很容易生病。



我覺得學校應該要管制這些飲料，因為喝太多會得很多病，像是蛀牙和糖尿病。而且學生在學校待很久，如果學校賣這些飲料，他們一定會去買來喝。所以學校最好不要賣這些飲料。



雖然學生可以在校外買到含糖飲料，但是至少在學校不要賣。這樣可以讓學生少喝一點含糖飲料。而且學校應該要教學生喝含糖飲料不好，這樣他們以後就會知道要少喝。



總之，我覺得學校不要賣含糖飲料是對的，因為這樣可以保護學生的健康。希望學校可以繼續這樣做，讓學生可以更健康。",2,1,1,2,1,7
