題目,作答,立意,結構,修辭,敘述,啟發,總分
"二十一世紀資訊量以驚人的速度暴增，有人認為網路資訊易於取得，會使記憶力與思考力衰退，不利於認知學習；也有人視網際網路為人類的外接大腦記憶體，意味著我們毋須記憶大量知識，可以專注在更重要、更有創造力的事物上。對於以上兩種不同的觀點，你的看法為何？請以「網海浮沉之我思」為題，結合自己的相關經驗，探討創造力與思考力之間的關係。
文長至少600字。

","網海浮沉之我思



現在的網路發展很快，每天都有很多新的資訊出現。有些人說網路會讓我們變笨，因為大家都不想記東西了；有些人說網路很好，可以讓我們不用記那麼多東西，可以做別的事情。



我覺得這兩種想法都有道理。我自己就有這樣的經驗，以前我在學校的時候，什麼都想要上網查，覺得很方便。但是後來發現，這樣子其實不太好，因為都沒有自己的想法。



像我以前參加比賽的時候，就一直在網路上看別人怎麼唱歌。雖然學到了一些東西，但是都是在模仿別人，沒有自己的特色。我覺得這樣不太好，因為人還是要有自己的想法比較重要。



網路雖然很方便，可以讓我們很快找到想要的資料，不用像以前一樣要去問很多人。但是如果都只會用網路，不用自己的腦袋想，這樣對我們來說不是好事。我們應該要自己多想一點，不能都靠網路。



所以我認為，網路是好東西，但是不能太依賴它。我們要記住，最重要的還是要有自己的想法，這樣才能進步。",2,2,1,2,1,8
