題目,作答,立意,結構,修辭,敘述,啟發,總分
"    我覺得童年是一種氣味的記憶。
    我的童年，有許多果樹氣味的記憶。夏天暑熱的午後，廟埕後有一棵巨大的龍眼樹。我從小學翻牆出來，背著書包，爬上龍眼樹，躲在密密的枝葉裡。外面日光葉影搖晃，隱約聽見老師或母親尋來，在樹下叫著我的名字，但那呼喚的聲音，被蟬聲的高音淹沒了。我一動不動，找到一處適合蜷窩身體的枝椏，好像變成樹的一部分，而那時，龍眼樹密密的甜熟的氣味就包圍著我。我閉起眼睛，好像在假寐，也像在作夢，夢裡一串一串纍纍的龍眼，招來許多蜜蜂果蠅。我童年的夢，很甜很香，好像一整個夏天都窩在那棵樹上，包圍在濃郁的氣味裡做了一個醒不來的夢。（改寫自蔣勳《給青年藝術家的信》）
    生活中充斥各種氣味。氣味透過嗅覺傳遞，喚起人們的記憶和感受，一如文中龍眼樹甜熟的氣味喚起作者的童年記憶。請以「花草樹木的氣味記憶」為題，寫一篇文章，書寫你熟悉的花草樹木的氣味，及其所召喚的記憶和感受。

文長至少600字。

","花草樹木的氣味記憶



我覺得氣味的記憶很特別，因為它會讓人想起以前的事情。有時候是看到的東西，有時候是聽到的聲音，但是氣味最容易讓人記住。



我最熟悉的是草的味道。每次聞到草的味道，就會想起以前在學校的時候。學校的操場旁邊都會有草皮，草長得很快，所以常常要割草。割草的時候會有一種特別的味道，雖然不是很香，但是很熟悉。



有一次我走在路上，聽到割草機的聲音，走近一看，真的是在割草。那個草味又飄過來了，讓我想起以前在學校的時候，每次聞到這個味道就知道工友在割草。雖然這個味道不是很好聞，但是卻讓我想起很多以前的事情。",1,1,1,1,1,5
