題目,作答,立意,結構,修辭,敘述,啟發,總分
"林語堂說：「（我）所愛的不是晚秋，是初秋，那時暄氣初消，月正圓，蟹正肥，桂花皎潔，也未陷入懍烈蕭瑟氣態，這是最值得賞樂的。」楊牧則是在美麗的春天世界裡，萬物復甦，卻聽到「一片樹葉提早轉黃的聲音。」（〈夭〉）普魯斯特（Proust, M.）在《追憶逝水年華》中說：「一小時不僅僅是一個小時，它是一只充滿香氣、聲響、念頭和氛圍的花缽」，說明時間的認知與感官知覺及感受有關。請以「季節的感思」為題，寫一篇文章，描寫你對季節的感知經驗，並抒發心中的感受與領會。
文長至少600字。

","季節的感思



每個季節都有不同的特色，我最喜歡的是春天。春天來了以後，天氣變暖和，花也開了，很漂亮。



我記得小時候和家人去看花海，那時候覺得很無聊。後來看到很多花，有紅的黃的紫的，覺得很漂亮。還有蝴蝶在飛來飛去，空氣中有花香，讓我覺得很舒服。



春天真的很好，因為冬天很冷，到了春天就暖和了。春天的時候，可以看到很多動物跑出來玩，花也開得很漂亮。我覺得春天可以讓人心情變好，因為到處都很漂亮。



我覺得春天可以讓人變得開心，因為看到花開了，心情就會變好。而且春天的時候，可以看到很多人一起出來玩，大家都很開心。所以我覺得春天是最好的季節。",2,1,2,2,1,8
