題目,作答,立意,結構,修辭,敘述,啟發,總分
"關於地球的記憶
被文字固禁在課本裡
我們的筆尖游走在山脈和海洋
翻譯每片花瓣的嬌嫩和露水的清新
所有的言語 答案
都靜放在我們的課本裡
等待我們翻起這一切的序幕（節錄自薛憶婷〈我們的課本〉）

    以上這首詩，從課本啟動天馬行空的遐想，瞥見知識豐富的樣貌。科學頑童費曼（Richard P. Feynman）曾說觀察轉動的餐盤，讓他得到很大的啟發，領略了興之所至的樂趣。物理課可讓我們發現萬物運行的迷人，生物課帶領我們進入細胞核遊歷，外語課讓我們聽見世界不同的文化。國文課堂上「採菊東籬下，悠然見南山」或「輕羅小扇撲流螢」，詩中情境也往往能讓人神遊於現實之外。過往的課程內容，是否曾經點燃你對知識的熱情？打開課本時，不知能否如〈我們的課本〉所述，揭開知識想像的序幕。
    若能從不同角度切入課本，進入知識的想像，或許可以讓課本帶領我們經歷驚奇的旅程。請以「當我打開課本」為題，寫一篇文章，敘述任一學科課本對你的意義，書寫你探索課本內容、知識的經驗與體會。
文長至少600字。


","當我打開課本



我最喜歡的課本是國文課本，因為裡面有很多有趣的故事。有一次我在課本裡看到《小王子》，這個故事我以前就看過，所以很開心可以再看一次。



《小王子》裡面講了很多道理，像是朋友的意義。狐狸跟小王子說，看到麥田就會想到他的金色頭髮。我覺得這個故事很感人，因為朋友真的很重要。還有狐狸說獵人每個星期六去跳舞，所以他可以在那天很開心。我覺得這個也很有道理，因為生活需要有特別的事情。



我以前也有一些特別的經驗。國中畢業的時候，我的田徑教練送了我一個水壺。現在我看到這個水壺，就會想起以前跟同學一起練習的時候。雖然很累，但是很開心。這讓我覺得做什麼事情都要堅持。



我覺得課本不只是要考試用的，裡面的故事可以讓我們學到很多東西。我們可以想想如果是自己遇到這些事情會怎麼做。這樣可以讓我們的生活變得更好。",2,1,1,2,1,7
