題目,作答,立意,結構,修辭,敘述,啟發,總分
"甲
我們的感情是冰箱，打開來看，明亮可喜，關起門後是嗡嗡的黑暗。什麼都不會壞掉，埋在霜雪的角落。我們的感情是冰箱，有時很滿有時很空，一切都可以保存很久，冷冷的，可是很新鮮，看起來都像昨天。（柯裕棻〈冰箱〉）
乙
農曆年前我媽換了新冰箱。雖然舊的其實也還好，十數年如一日修長高冷玉面如銀，該凍肉時凍肉，該製冰時製冰，門沒關緊永遠忠實地響警告聲。燈泡甚至沒有壞過一次。只是我媽長期嫌它不得力，冷藏室裝一隻生雞一鍋燉肉就周轉不過來，胃口那樣地小，像一個節食的人，廚房裡最不需要的就是一個節食的人。我常常看見她蹲在那兒，腳邊圍滿生鮮，鬥盡心智排列組合，在最有限空間裡籌備出最大的寬容，冰箱門好像看牙醫的嘴開太久不斷嗶嗶叫，簡直像在哭了。感覺兩方都十分苦惱。
我認為運用如常的器物毋需特別汰換，也主張大家都不妨少吃一點。顯然我媽不作此想。她說：「總之我就是想要一臺大冰箱啦。」但如此一來，我反倒領悟了，這完全是某商品宣傳詞「豈止於大」（Bigger than bigger）的道理：一座夠大的新冰箱也豈止於冰箱，它是一種想像，一種意境，一種可能性，它富有召喚家庭生活最好願景的潛力。（改寫自黃麗群〈如果在冬天，一座新冰箱〉）
    冰箱可以很滿，可以很空，當你打開冰箱，通常想尋找什麼？又看見什麼？假如有一座屬於你的新冰箱，你會有怎樣的想像？冰藏什麼（虛實皆可）會符合你所期待的美好生活？請以「如果我有一座新冰箱」為題，撰文一篇，
文長至少600字。

","如果我有一座新冰箱



冰箱是每個家裡都會有的東西，我也很想要一台新的冰箱。因為舊的冰箱已經不太好用了，有時候會發出奇怪的聲音，而且冷凍的效果也不太好。



如果我有一座新冰箱，我會把它放在廚房裡面。我會在裡面放很多東西，像是蔬菜、水果、肉類還有飲料。這樣回家的時候就可以喝到冰涼的飲料，很舒服。我最喜歡喝可樂和汽水，所以一定要買很多放進去。



每次打開冰箱的時候，看到裡面有很多食物，心情就會變得很好。因為這代表我有很多東西可以吃，不會餓肚子。而且冰箱裡面的東西都是新鮮的，不會壞掉，這樣比較衛生。



我覺得有一台新冰箱很重要，因為可以讓生活變得比較方便。不用每天都去買菜，可以一次買很多放在冰箱裡。而且夏天的時候，可以做很多冰塊，喝飲料的時候就可以加冰塊，這樣比較涼快。



所以我希望可以有一台新冰箱，這樣生活就會變得更好。我會好好照顧這台冰箱，讓它可以用很久。",2,2,1,2,1,8
