題目,作答,立意,結構,修辭,敘述,啟發,總分
"    我覺得童年是一種氣味的記憶。
    我的童年，有許多果樹氣味的記憶。夏天暑熱的午後，廟埕後有一棵巨大的龍眼樹。我從小學翻牆出來，背著書包，爬上龍眼樹，躲在密密的枝葉裡。外面日光葉影搖晃，隱約聽見老師或母親尋來，在樹下叫著我的名字，但那呼喚的聲音，被蟬聲的高音淹沒了。我一動不動，找到一處適合蜷窩身體的枝椏，好像變成樹的一部分，而那時，龍眼樹密密的甜熟的氣味就包圍著我。我閉起眼睛，好像在假寐，也像在作夢，夢裡一串一串纍纍的龍眼，招來許多蜜蜂果蠅。我童年的夢，很甜很香，好像一整個夏天都窩在那棵樹上，包圍在濃郁的氣味裡做了一個醒不來的夢。（改寫自蔣勳《給青年藝術家的信》）
    生活中充斥各種氣味。氣味透過嗅覺傳遞，喚起人們的記憶和感受，一如文中龍眼樹甜熟的氣味喚起作者的童年記憶。請以「花草樹木的氣味記憶」為題，寫一篇文章，書寫你熟悉的花草樹木的氣味，及其所召喚的記憶和感受。

文長至少600字。

","花草樹木的氣味記憶



我記得小時候去過一次芭樂園。那天天氣很熱，我和媽媽一起去的。我一開始不想去，因為我覺得芭樂很普通，不像其他水果那麼好吃。



到了果園以後，我看到很多芭樂樹。樹上的葉子有一種味道，不是很香，要靠近才聞得到。我覺得這個味道還不錯，雖然不像玫瑰花那麼香。媽媽說芭樂很需要照顧，要用網子把它包起來，不然會被蟲子咬。



我在果園裡面走來走去，發現芭樂樹很特別。它不會發出很強的香味，但是聞起來有一點點甜甜的感覺。這讓我想到自己也應該要這樣，不用太張揚，安安靜靜的就好。



現在我已經很久沒去芭樂園了，但是有時候坐車的時候，我會想起那個味道。雖然現在已經聞不到了，但是我還記得那個感覺。這個記憶讓我覺得很溫暖。",1,1,1,1,1,5
