題目,作答,立意,結構,修辭,敘述,啟發,總分
"林語堂說：「（我）所愛的不是晚秋，是初秋，那時暄氣初消，月正圓，蟹正肥，桂花皎潔，也未陷入懍烈蕭瑟氣態，這是最值得賞樂的。」楊牧則是在美麗的春天世界裡，萬物復甦，卻聽到「一片樹葉提早轉黃的聲音。」（〈夭〉）普魯斯特（Proust, M.）在《追憶逝水年華》中說：「一小時不僅僅是一個小時，它是一只充滿香氣、聲響、念頭和氛圍的花缽」，說明時間的認知與感官知覺及感受有關。請以「季節的感思」為題，寫一篇文章，描寫你對季節的感知經驗，並抒發心中的感受與領會。
文長至少600字。

","季節的感思



我最喜歡的季節是秋天，因為我是在秋天出生的。每年到了這個時候，我就會特別想要寫點什麼。



春天的時候有很多蝴蝶，我很害怕。夏天太熱了，吃冰的時候肚子會痛。冬天很冷，我種的花都長不好。但是秋天就比較舒服，天氣不會太熱也不會太冷。



秋天的時候，很多東西都會改變。樹葉會變黃，貓狗的毛會變厚，賣冰的店會改賣羊肉爐。我覺得這些變化很有趣，讓我感覺生活很不一樣。



我從小到大都是在秋天開學。每次換新學校都會有點緊張，因為要認識新朋友。現在我上大學了，看到學校裡的一切都覺得很新鮮。



秋天來了，我覺得自己也要開始新的生活了。希望這個秋天可以過得開心一點。",2,1,1,2,1,7
