題目,作答,立意,結構,修辭,敘述,啟發,總分
"林語堂說：「（我）所愛的不是晚秋，是初秋，那時暄氣初消，月正圓，蟹正肥，桂花皎潔，也未陷入懍烈蕭瑟氣態，這是最值得賞樂的。」楊牧則是在美麗的春天世界裡，萬物復甦，卻聽到「一片樹葉提早轉黃的聲音。」（〈夭〉）普魯斯特（Proust, M.）在《追憶逝水年華》中說：「一小時不僅僅是一個小時，它是一只充滿香氣、聲響、念頭和氛圍的花缽」，說明時間的認知與感官知覺及感受有關。請以「季節的感思」為題，寫一篇文章，描寫你對季節的感知經驗，並抒發心中的感受與領會。
文長至少600字。

","季節的感思



我出生在秋天九月，每年這個時候都會特別想很多事情。



我不太過生日，但是每到秋天就會變得很感性。春天有很多蝴蝶我很害怕，夏天吃冰會肚子痛，冬天種的花都長不好。秋天跟其他季節不一樣，感覺比較特別。秋天的時候，樹葉會變黃掉下來，天氣也變涼了，剉冰店改賣羊肉爐。



從小到大，每年秋天開學我都比別人大一點。每次看到秋天的東西都覺得很感傷，像是貓咪掉毛、下午不會再下雨、水果變便宜了、涼席要收起來。我今年上大學了，也是在秋天開始的。



秋天的風吹來的時候，就代表新的生活要開始了。我覺得我已經準備好迎接秋天了。",1,1,1,1,1,5
