題目,作答,立意,結構,修辭,敘述,啟發,總分
"    我覺得童年是一種氣味的記憶。
    我的童年，有許多果樹氣味的記憶。夏天暑熱的午後，廟埕後有一棵巨大的龍眼樹。我從小學翻牆出來，背著書包，爬上龍眼樹，躲在密密的枝葉裡。外面日光葉影搖晃，隱約聽見老師或母親尋來，在樹下叫著我的名字，但那呼喚的聲音，被蟬聲的高音淹沒了。我一動不動，找到一處適合蜷窩身體的枝椏，好像變成樹的一部分，而那時，龍眼樹密密的甜熟的氣味就包圍著我。我閉起眼睛，好像在假寐，也像在作夢，夢裡一串一串纍纍的龍眼，招來許多蜜蜂果蠅。我童年的夢，很甜很香，好像一整個夏天都窩在那棵樹上，包圍在濃郁的氣味裡做了一個醒不來的夢。（改寫自蔣勳《給青年藝術家的信》）
    生活中充斥各種氣味。氣味透過嗅覺傳遞，喚起人們的記憶和感受，一如文中龍眼樹甜熟的氣味喚起作者的童年記憶。請以「花草樹木的氣味記憶」為題，寫一篇文章，書寫你熟悉的花草樹木的氣味，及其所召喚的記憶和感受。

文長至少600字。

","花草樹木的氣味記憶



我覺得植物的氣味可以讓人想起很多事情。我最喜歡的是桂花和松樹的味道，因為它們讓我想起小時候的事。



我家門口以前有一棵桂花樹，每年秋天都會開花。那個味道很香很甜，整個院子都是桂花的香味。我奶奶那時候會做桂花湯圓給我吃，所以每次聞到桂花香，我就會想起奶奶。奶奶做的湯圓很好吃，我很想念那個味道。



夏天的時候，爸爸媽媽會帶我去山上玩。山上有很多松樹，松樹的味道很特別。我那時候很喜歡在樹林裡跑來跑去，覺得很開心。現在有時候聞到松樹的味道，就會想起以前去山上玩的事情。



我覺得這些植物的味道很重要，因為它們可以讓我想起以前的事情。每次聞到這些味道的時候，就好像回到了小時候一樣。雖然現在長大了，但是這些味道還是會讓我很懷念以前的時光。",2,2,1,2,1,8
