題目,作答,立意,結構,修辭,敘述,啟發,總分
"二十一世紀資訊量以驚人的速度暴增，有人認為網路資訊易於取得，會使記憶力與思考力衰退，不利於認知學習；也有人視網際網路為人類的外接大腦記憶體，意味著我們毋須記憶大量知識，可以專注在更重要、更有創造力的事物上。對於以上兩種不同的觀點，你的看法為何？請以「網海浮沉之我思」為題，結合自己的相關經驗，探討創造力與思考力之間的關係。
文長至少600字。

","網海浮沉之我思



現在的人每天都在用網路，好像什麼事情都離不開網路。我覺得這樣不太好，因為人應該要自己想辦法解決問題，不能都靠網路。



網路雖然很方便，可以讓我們找到很多資料，但是我覺得這樣會讓人變懶惰。像我自己也常常遇到問題就直接上網查，都不會先想一想。我看到很多同學也是這樣，什麼事情都先問Google，好像自己的腦袋都不用了。



我認為網路不可能解決所有問題，因為生活中有很多事情是需要靠經驗的。比如說跟人溝通的問題，網路上的答案不一定適合每個人。而且網路上的答案都是固定的，但是現實生活中的問題都不一樣。



雖然網路帶來很多方便，但是我覺得人還是要靠自己的腦袋想事情。如果都只會查網路，遇到網路查不到的問題就不會處理，那不是很糟糕嗎？所以我們應該要學會好好運用網路，不要太依賴它。



總之，網路是好東西，但是不能讓它變成我們思考的替代品。我們要記住，人的腦袋才是最重要的工具！",2,2,1,2,1,8
