題目,作答,立意,結構,修辭,敘述,啟發,總分
"關於地球的記憶
被文字固禁在課本裡
我們的筆尖游走在山脈和海洋
翻譯每片花瓣的嬌嫩和露水的清新
所有的言語 答案
都靜放在我們的課本裡
等待我們翻起這一切的序幕（節錄自薛憶婷〈我們的課本〉）

    以上這首詩，從課本啟動天馬行空的遐想，瞥見知識豐富的樣貌。科學頑童費曼（Richard P. Feynman）曾說觀察轉動的餐盤，讓他得到很大的啟發，領略了興之所至的樂趣。物理課可讓我們發現萬物運行的迷人，生物課帶領我們進入細胞核遊歷，外語課讓我們聽見世界不同的文化。國文課堂上「採菊東籬下，悠然見南山」或「輕羅小扇撲流螢」，詩中情境也往往能讓人神遊於現實之外。過往的課程內容，是否曾經點燃你對知識的熱情？打開課本時，不知能否如〈我們的課本〉所述，揭開知識想像的序幕。
    若能從不同角度切入課本，進入知識的想像，或許可以讓課本帶領我們經歷驚奇的旅程。請以「當我打開課本」為題，寫一篇文章，敘述任一學科課本對你的意義，書寫你探索課本內容、知識的經驗與體會。
文長至少600字。


","當我打開課本



我打開國文課本時，看到很多文字。以前我不知道為什麼要學這些東西，覺得很無聊，但是後來發現這些文字可以讓我學到很多知識。



我覺得文字很奇怪，剛開始看的時候都不懂，但是慢慢看就會明白一些意思。課文裡面有故事和道理，需要我去想才能懂。



我最喜歡的課文是背影，講的是父親的愛。還有論語也教了我一些做人的道理，讓我知道要做個好孩子。



看課本的時候，我好像在看以前的人寫的東西。可以知道以前的人生活是什麼樣子。看課本不只是在讀字而已，還可以學到很多東西，讓我慢慢長大。",1,1,1,1,1,5
