題目,作答,立意,結構,修辭,敘述,啟發,總分
"林語堂說：「（我）所愛的不是晚秋，是初秋，那時暄氣初消，月正圓，蟹正肥，桂花皎潔，也未陷入懍烈蕭瑟氣態，這是最值得賞樂的。」楊牧則是在美麗的春天世界裡，萬物復甦，卻聽到「一片樹葉提早轉黃的聲音。」（〈夭〉）普魯斯特（Proust, M.）在《追憶逝水年華》中說：「一小時不僅僅是一個小時，它是一只充滿香氣、聲響、念頭和氛圍的花缽」，說明時間的認知與感官知覺及感受有關。請以「季節的感思」為題，寫一篇文章，描寫你對季節的感知經驗，並抒發心中的感受與領會。
文長至少600字。

","季節的感思



冬天真的好冷，每天早上都不想起床去上課。走在路上的時候，風一直吹，吹得我全身都在發抖。我最討厭冬天了，因為天氣太冷了，而且路上都沒有什麼人，感覺很孤單。



到了中午的時候，太陽出來了，感覺好一點。我去吃了熱熱的午餐，喝了一杯熱奶茶，身體暖和了一些。餐廳裡面有很多人，感覺比較熱鬧，不像外面那麼冷清。但是吃完飯出來，又變得很冷了。



晚上的時候更冷，風吹得更大了。我覺得冬天的晚上最難過了，因為太冷了，大家都躲在家裡，沒有人在外面。每天就只能吃飯、睡覺，沒有什麼其他事情可以做。



雖然冬天很冷很難過，但是冬天過了就會有春天來了。所以我覺得冬天雖然不好，但是也要忍耐，等待春天的到來。",2,1,1,2,1,7
