題目,作答,立意,結構,修辭,敘述,啟發,總分
"關於地球的記憶
被文字固禁在課本裡
我們的筆尖游走在山脈和海洋
翻譯每片花瓣的嬌嫩和露水的清新
所有的言語 答案
都靜放在我們的課本裡
等待我們翻起這一切的序幕（節錄自薛憶婷〈我們的課本〉）

    以上這首詩，從課本啟動天馬行空的遐想，瞥見知識豐富的樣貌。科學頑童費曼（Richard P. Feynman）曾說觀察轉動的餐盤，讓他得到很大的啟發，領略了興之所至的樂趣。物理課可讓我們發現萬物運行的迷人，生物課帶領我們進入細胞核遊歷，外語課讓我們聽見世界不同的文化。國文課堂上「採菊東籬下，悠然見南山」或「輕羅小扇撲流螢」，詩中情境也往往能讓人神遊於現實之外。過往的課程內容，是否曾經點燃你對知識的熱情？打開課本時，不知能否如〈我們的課本〉所述，揭開知識想像的序幕。
    若能從不同角度切入課本，進入知識的想像，或許可以讓課本帶領我們經歷驚奇的旅程。請以「當我打開課本」為題，寫一篇文章，敘述任一學科課本對你的意義，書寫你探索課本內容、知識的經驗與體會。
文長至少600字。


","當我打開課本



每天上課，老師都會說：「同學們翻開課本。」這句話從小就一直聽到，讓我覺得很無聊。每次上課鈴聲響起，就代表要開始一段很長的時間，但我會想辦法找點事情做。



國文課本裡面都是詩詞和文言文，每次打開都會想睡覺。所以我就在課本上亂畫東西，有時候會在作者的照片上畫鬍子和眼鏡，這樣比較好玩。雖然偶爾也會聽老師講課，記住一些詩句，但大部分時間都在發呆。



現在看看我的課本，上面都是我畫的東西，從小時候畫的到長大後畫的都有。雖然沒有學到很多東西，但是這些塗鴉也算是我的回憶吧。反正學習不一定要死讀書，我覺得這樣也不錯。",1,1,1,1,1,5
