題目,作答,立意,結構,修辭,敘述,啟發,總分
"玩具種類繁多，大致可以分成古典玩具、積木玩具與擬仿玩具這三大基本分類。古典玩具其特徵是造型簡單，不刻意模仿現實事物，提供兒童以各種方式耍弄，即常見的童玩（七巧板、陀螺等）。相反地，擬仿玩具不同於積木玩具的單元式或化約式排列組合，這類玩具試圖模擬現實上或想像上的事物樣貌。模仿的對象從名人偶像、卡漫人物到槍砲刀劍、交通工具、軍事武器等應有盡有，並分別發展為自成一格的複雜體系。
擬仿玩具不只是提供存在的物質本身，更包含其背後所蘊含的意象、敘事、歷史記憶等脈絡。例如卡漫玩具主角衍生自整套卡漫文本；交通玩具（跑車、工程車等）則可引發對某種生活方式、社會地位與品味的認同；軍事武器則關聯於對戰爭史和科技發展史的知性興趣。
各個時代的孩子都會拿日常生活中取得的物品製作玩具，或者是自己設計、就地取材。專門替小孩製作玩具這種現代化形式，一直到啟蒙主義時代才出現。當時德國人對兒童的教育非常嚴格，但不久便有人開始對這種教育方式產生質疑，並重新思考孩子的本質及教育的意義。這些人肯定遊戲對孩子不可或缺，同時也提倡學習應該是快樂而非枯燥、無趣，因此接著又出現強調合宜的玩具對孩子具有重要性的聲音，福祿貝爾就是支持此種主張的人士，於是造型簡單的積木於焉誕生。
　　玩具的存在體現價值觀的變遷而反應在玩具的型態上，那麼要怎麼看待孩子玩玩具？小時候常常聽到大人告誡不要再玩玩具了，趕快去用功讀書，但現今也常常聽到許多專家學者不斷鼓吹玩出創造力，即使還是有許多人認為買玩具是一種奢侈、享樂主義式的行為。
　　現今對於玩具是否是一種可以玩出大能力的中介物，還是仍認為它是享樂？這都顯示出不同類型的人對玩具消費看法的差異，它到底是玩物喪志？還是玩物養志？顯然仍各說各話。（改寫自張盈堃〈物體系：玩具的文化分析〉）
玩具對你而言，較偏向「玩物喪志」或「玩物養志」？請就你的成長經驗，說明你的看法，並就這三類玩具的特質，說明你的看法。
文長至少600字。



","玩具對我來說是很好的東西，我覺得玩玩具不會讓人變壞，反而可以讓人變聰明。我小時候也很喜歡玩玩具，所以我知道玩玩具的好處。



玩具有三種，第一種是古典玩具，就是那種很簡單的玩具，像是陀螺啊、七巧板這些。第二種是積木玩具，就是可以拼來拼去的那種，我以前很喜歡玩樂高。第三種是擬仿玩具，就是像真的一樣的玩具，比如說玩具車、玩具槍這些。



我覺得玩玩具很好玩，而且可以讓小朋友變聰明。因為玩玩具的時候要動腦筋，要想怎麼玩才好玩。像是玩積木的時候，要想要怎麼拼才會變成想要的東西。所以我覺得玩玩具不會讓人變笨。



有些大人會說玩玩具不好，要叫小朋友去讀書。但是我覺得玩玩具也是在學習，因為玩玩具可以讓小朋友開心，開心的時候學習才會比較好。而且玩玩具也可以交到朋友，這樣對小朋友的成長也很好。



所以我覺得玩玩具是很好的事情，不會讓人變壞，反而會讓人變得更聰明。希望大人可以讓小朋友多玩一點玩具，這樣對小朋友比較好。",2,1,1,2,1,7
