題目,作答,立意,結構,修辭,敘述,啟發,總分
"    我覺得童年是一種氣味的記憶。
    我的童年，有許多果樹氣味的記憶。夏天暑熱的午後，廟埕後有一棵巨大的龍眼樹。我從小學翻牆出來，背著書包，爬上龍眼樹，躲在密密的枝葉裡。外面日光葉影搖晃，隱約聽見老師或母親尋來，在樹下叫著我的名字，但那呼喚的聲音，被蟬聲的高音淹沒了。我一動不動，找到一處適合蜷窩身體的枝椏，好像變成樹的一部分，而那時，龍眼樹密密的甜熟的氣味就包圍著我。我閉起眼睛，好像在假寐，也像在作夢，夢裡一串一串纍纍的龍眼，招來許多蜜蜂果蠅。我童年的夢，很甜很香，好像一整個夏天都窩在那棵樹上，包圍在濃郁的氣味裡做了一個醒不來的夢。（改寫自蔣勳《給青年藝術家的信》）
    生活中充斥各種氣味。氣味透過嗅覺傳遞，喚起人們的記憶和感受，一如文中龍眼樹甜熟的氣味喚起作者的童年記憶。請以「花草樹木的氣味記憶」為題，寫一篇文章，書寫你熟悉的花草樹木的氣味，及其所召喚的記憶和感受。

文長至少600字。

","外婆家的芒果樹香氣



我外婆家在台南郊區，有一棟房子。房子前面有花圃，花圃裡種了很多植物。有些貴的植物放在漂亮的盆栽裡面。不過我最喜歡的是花圃角落的芒果樹。



我小時候暑假會去外婆家住兩個禮拜。那邊沒什麼事可以做，因為手機訊號很差。每天下午外婆會去澆花，我就跟著她去玩。玩累了就坐在芒果樹下休息，那裡有一堆紅磚可以坐。



芒果樹下很涼快，可以躲太陽。風吹來的時候會有芒果的香味。我會站起來聞芒果的味道，因為聞起來很香。現在在城市裡，如果聞到芒果的味道，就會想起以前在外婆家的日子。那時候外婆在澆花，外公騎腳踏車去買東西回來，我覺得很開心。",1,1,1,1,1,5
