題目,作答,立意,結構,修辭,敘述,啟發,總分
"二十一世紀資訊量以驚人的速度暴增，有人認為網路資訊易於取得，會使記憶力與思考力衰退，不利於認知學習；也有人視網際網路為人類的外接大腦記憶體，意味著我們毋須記憶大量知識，可以專注在更重要、更有創造力的事物上。對於以上兩種不同的觀點，你的看法為何？請以「網海浮沉之我思」為題，結合自己的相關經驗，探討創造力與思考力之間的關係。
文長至少600字。

","網海浮沉之我思



現在的人每天都在用手機和網路。我每天早上醒來第一件事就是看手機，看看有沒有新訊息，看看有什麼新聞。我每天花很多時間在網路上。



網路讓我們學習變得很方便。以前要學東西要看書或問別人，現在只要用手機上網查就可以了。但是這樣太快了，我們都只想要快點知道答案，不會去想為什麼。而且網路上的東西不一定對，如果我們都相信網路上的東西，會被騙。



現在很多人喜歡看短影片，因為大家都想要快點看完。但是這樣不好，因為我們沒有好好思考。就像爬山一樣，如果只想要快點到山頂，就會錯過路上的風景。如果我們都只想要快，不去想過程，那就沒有意思了。



所以我覺得我們應該少用一點網路。走路的時候可以不要一直看手機，看看路上的風景也不錯。我們不需要每件事都那麼快，慢慢來也可以。",1,1,1,1,1,5
