題目,作答,立意,結構,修辭,敘述,啟發,總分
"二十一世紀資訊量以驚人的速度暴增，有人認為網路資訊易於取得，會使記憶力與思考力衰退，不利於認知學習；也有人視網際網路為人類的外接大腦記憶體，意味著我們毋須記憶大量知識，可以專注在更重要、更有創造力的事物上。對於以上兩種不同的觀點，你的看法為何？請以「網海浮沉之我思」為題，結合自己的相關經驗，探討創造力與思考力之間的關係。
文長至少600字。

","網海浮沉之我思



現在的人每天都在用手機和網路，我也是其中一個。每天早上醒來第一件事就是看手機，看看有什麼新消息，不然就覺得好像錯過了什麼重要的事情。



網路雖然很方便，想要知道什麼都可以馬上查到，不用去翻書或是問別人。但是我覺得這樣不太好，因為大家都變得很懶惰，只想要快速知道答案，都不願意去思考。而且網路上的資料也不一定是對的，如果都不會判斷，就會被騙。



現在很多人都喜歡看短影片，因為大家都覺得看書太慢了。可是這樣不好，因為學習應該要慢慢來，要好好想一想。如果只是為了快，那就學不到真正的東西。就像爬山一樣，如果只想要到山頂，不去看路上的風景，那就太可惜了。



我覺得我們應該要少用一點網路，多看看周圍的事物。比如說去上學的時候，可以不要一直看手機，多看看路上的風景。這樣才能讓我們的腦袋多想一些事情，不會被網路控制住。



所以我認為網路雖然方便，但是不能太依賴它。我們要學會自己思考，不能什麼都靠網路。這樣才不會讓自己的大腦變得很笨。",2,2,1,2,1,8
