題目,作答,立意,結構,修辭,敘述,啟發,總分
"關於地球的記憶
被文字固禁在課本裡
我們的筆尖游走在山脈和海洋
翻譯每片花瓣的嬌嫩和露水的清新
所有的言語 答案
都靜放在我們的課本裡
等待我們翻起這一切的序幕（節錄自薛憶婷〈我們的課本〉）

    以上這首詩，從課本啟動天馬行空的遐想，瞥見知識豐富的樣貌。科學頑童費曼（Richard P. Feynman）曾說觀察轉動的餐盤，讓他得到很大的啟發，領略了興之所至的樂趣。物理課可讓我們發現萬物運行的迷人，生物課帶領我們進入細胞核遊歷，外語課讓我們聽見世界不同的文化。國文課堂上「採菊東籬下，悠然見南山」或「輕羅小扇撲流螢」，詩中情境也往往能讓人神遊於現實之外。過往的課程內容，是否曾經點燃你對知識的熱情？打開課本時，不知能否如〈我們的課本〉所述，揭開知識想像的序幕。
    若能從不同角度切入課本，進入知識的想像，或許可以讓課本帶領我們經歷驚奇的旅程。請以「當我打開課本」為題，寫一篇文章，敘述任一學科課本對你的意義，書寫你探索課本內容、知識的經驗與體會。
文長至少600字。


","當我打開課本



課本是學生每天都要用的東西，裡面有很多知識。每個科目都有不同的課本，像是國文、數學、英文等等。雖然很多人都不喜歡課本，但是它可以教我們很多東西。



我是資訊科的學生，所以我的課本有數位邏輯和程式設計。每次拿到新課本的時候，都會覺得很煩，因為又要開始學新的東西了。不過課本裡面的內容還是要學，因為這些都是考試要考的。



有時候讀國文課本的時候，會看到一些詩，但是都看不太懂在說什麼。歷史課本講的都是以前的事情，雖然很多但是都記不住。我覺得課本很無聊，每次打開都想睡覺。



老師說課本很重要，要好好讀書才能考到好成績。我知道要讀書，但是課本實在太難了，很多地方都看不懂。希望以後的課本可以寫得簡單一點，這樣我們就比較容易學習了。",1,1,1,1,1,5
