題目,作答,立意,結構,修辭,敘述,啟發,總分
"二十一世紀資訊量以驚人的速度暴增，有人認為網路資訊易於取得，會使記憶力與思考力衰退，不利於認知學習；也有人視網際網路為人類的外接大腦記憶體，意味著我們毋須記憶大量知識，可以專注在更重要、更有創造力的事物上。對於以上兩種不同的觀點，你的看法為何？請以「網海浮沉之我思」為題，結合自己的相關經驗，探討創造力與思考力之間的關係。
文長至少600字。

","網海浮沉之我思



現在的網路很方便，想要什麼資料都可以找得到。但是這樣的方便也會有好處和壞處。



我每天都會用手機上網找資料。有時候不懂的問題就直接查，很快就能知道答案。但是網路上的資料太多了，有些是對的有些是錯的，所以要小心使用。



我覺得網路雖然方便，但是不能太依賴它。如果什麼都靠網路查，可能會讓我們變笨。不過如果會用網路找資料，也可以學到很多新知識。



網路就像是一個大腦，可以幫我們記住很多東西。但是我們還是要自己思考，不能只是一直查資料而已。要把查到的資料變成自己的知識才行。



總之網路很方便，但是要會分辨對錯，不能太依賴它。如果能好好使用，網路就會變成很好的工具。",1,1,1,1,1,5
