題目,作答,立意,結構,修辭,敘述,啟發,總分
"二十一世紀資訊量以驚人的速度暴增，有人認為網路資訊易於取得，會使記憶力與思考力衰退，不利於認知學習；也有人視網際網路為人類的外接大腦記憶體，意味著我們毋須記憶大量知識，可以專注在更重要、更有創造力的事物上。對於以上兩種不同的觀點，你的看法為何？請以「網海浮沉之我思」為題，結合自己的相關經驗，探討創造力與思考力之間的關係。
文長至少600字。

","網海浮沉之我思



現在的網路很方便，大家都在用手機和電腦上網找資料。我覺得這樣不太好，因為人會變得很懶惰，什麼都不想記。



我自己也常常用YOUTUBE和Google，像是找作業答案、找美食，還有看別的國家的風景。以前的人沒有網路，只能靠自己去看去聽，但是現在上網就可以知道很多事情，這樣真的很方便。不過方便也有壞處，因為網路上有很多假消息，像是我在臉書上常常看到一些騙人的標題，還有一些假廣告，很多老人家和粉絲都會被騙。



所以我覺得我們要小心使用網路，不要什麼都相信。網路雖然方便，但是我們還是要自己想一想，不能完全相信網路上的東西。這樣才不會被騙，也不會讓自己變笨。",2,1,2,2,1,8
