題目,作答,立意,結構,修辭,敘述,啟發,總分
"甲
　　夜飲東坡醒復醉，歸來彷彿三更。家童鼻息已雷鳴，敲門都不應，倚杖聽江聲。　　長恨此身非我有，何時忘卻營營？夜闌風靜縠紋平，小舟從此逝，江海寄餘生。（蘇軾〈臨江仙〉）
乙
　　山居中的恬靜最使人心生歡喜，覺得充滿了幸福。但這種感覺完全是屬於我個人私己的，難以和他人分享。當深夜沉寂，偶爾會有一部卡車從山腰轟隆急馳而過，聲音在峽谷間響應激盪，久久停留，我往往就會從安寧的心緒中驚覺過來。車上至少有一個聚精會神在奔波的人，重山曲流外就是苦樂混合著沸騰的紅塵，那裡面也有著我的妻女和親友，而我卻一個人上山來獨自享受清靜。那麼，我的幸福是不是純由逃避式的懶散得來的呢？山居只是自己刻意經營的一種看似空靈其實奢侈的生活？心安理得會不會是虛幻而脆弱的？
　　至少，我不希望如此，因為人間是我的根本用情處。（陳列《地上歲月‧山中書》）
請回答下列問題：
甲文中，蘇軾面對夜闌風靜，意欲「小舟從此逝」，遠離塵世；乙文中，陳列則從山居中的恬靜，興發「人間是我的根本用情處」的情思，二者顯然不同。請以「靜夜情懷」為題，連結甲文或乙文的體悟，寫一篇文章抒發你對靜夜的體驗及感受。
文長至少600字。


","深夜情懷



深夜很安靜，我很喜歡這種感覺。在深夜的時候，我可以好好想一想事情。



蘇軾和陳列都寫過關於深夜的文章，他們都很喜歡深夜，但是想法不一樣。蘇軾想要離開人群，但是陳列覺得還是要跟人在一起。



我記得有一個夏天的晚上，那天很熱，我躺在窗邊。外面很安靜，只有樹葉的聲音。這時候我就不會想到白天的煩惱，但是有時候會覺得很孤單。



我覺得深夜的時候可以好好想一想自己。平常白天太忙了，都沒有時間想事情。到了晚上才可以想一想自己想要什麼。這樣想一想，有時候會覺得不開心，有時候會覺得很平靜。



我覺得陳列說得對，雖然安靜的生活很好，但是如果一直一個人也不行。我們還是要跟別人在一起，這樣才會快樂。深夜的時候可以想一想這些事情。



每個人在深夜的時候都會想不一樣的事情。有的人想要離開人群，有的人想要跟人在一起。我覺得這都沒有關係，重要的是要知道自己想要什麼。",2,1,1,2,1,7
