題目,作答,立意,結構,修辭,敘述,啟發,總分
"林語堂說：「（我）所愛的不是晚秋，是初秋，那時暄氣初消，月正圓，蟹正肥，桂花皎潔，也未陷入懍烈蕭瑟氣態，這是最值得賞樂的。」楊牧則是在美麗的春天世界裡，萬物復甦，卻聽到「一片樹葉提早轉黃的聲音。」（〈夭〉）普魯斯特（Proust, M.）在《追憶逝水年華》中說：「一小時不僅僅是一個小時，它是一只充滿香氣、聲響、念頭和氛圍的花缽」，說明時間的認知與感官知覺及感受有關。請以「季節的感思」為題，寫一篇文章，描寫你對季節的感知經驗，並抒發心中的感受與領會。
文長至少600字。

","季節的感思



春天來了，天氣變暖和，很多花都開了。我最喜歡春天的時候，因為可以看到很多漂亮的景色。



我記得小時候看到樹上有很多白花，風一吹就掉下來了。有小女生會把花撿起來，放在頭髮上，覺得自己很漂亮。



以前我和家人常常去看油桐花，那時候空氣很好，可以在山上走一走。地上都是白色的花，有些花還很漂亮，有些已經被踩壞了。我們會把花撿起來，做成花圈戴在頭上，或是在地上排成圖案，我覺得很好玩。下雨的時候，我會擔心花會不會都掉光了。



現在長大了，很久沒有去看油桐花了。有時候都不知道春天什麼時候來，什麼時候走。可能是因為太忙了，也可能是因為長大了，對這些事情沒有以前那麼有感覺了。",2,1,1,2,1,7
