題目,作答,立意,結構,修辭,敘述,啟發,總分
"    記憶可以被編輯或刪除嗎？2004年美國電影《王牌冤家》（Eternal Sunshine of the Spotless Mind），敘述一對怨偶在一次激烈的爭吵後，先後踏入提供記憶刪除服務的「忘情診所」，主動要求洗去記憶。女主角成功地洗去兩人的戀愛記憶，男主角則在記憶清掃的過程中，因為看見舊日時光的美好，想保留一切甜蜜與悲傷的記憶，而開始和電腦清除系統搏鬥。2017年，臺灣導演陳玉勳將自己的短片〈海馬洗頭〉改為長片《健忘村》。〈海馬洗頭〉的創意發想，來自於「人的記憶都存在大腦的海馬迴裡」，電影中因此有「海馬洗頭店」，專職幫人洗去記憶。《健忘村》則有一件寶物「忘憂神器」，可以清除記憶。村長為了一己私利，引誘村人「忘憂」，刪除村人的部分記憶。
    電影裡的想像也許有一天會發生。2019年澳洲皇家墨爾本理工大學的研究團隊，利用「光遺傳學」技術影響海馬迴，開發類腦晶片，可模仿大腦儲存和刪除訊息的方式，能精準刪除老鼠腦中特定的記憶。這項科技將有望應用於心理創傷者、藥物成癮者的治療，清除其長時間的負面與病理性記憶。此外，也有政治哲學教授諾齊克提出「經驗機器」思想實驗：假設有一臺機器可以提供所有想要的幸福經驗，甚至可以定期修改，無論是領袖群倫、環遊世界……，使用者想要的「幸福人生」，都可以事先設定。面對這樣的機器，人類將如何抉擇？
假設「經驗機器」存在並且運作穩定，可以讓人享受虛擬的「幸福人生」，你認為將對人類產生什麼影響？權衡利弊，你會支持開放這樣的機器上市嗎？請以「編織記憶：幸福可以被設定！？」為題，運用文中相關資訊，並結合經驗與見聞，闡明自己的意見。
文長至少600字。

","編織記憶：幸福可以被設定！？



我覺得經驗機器不是一個好東西。雖然它可以讓人變得很快樂，但是那些快樂都是假的，所以我不喜歡。



如果有了這種機器，可能很多人都會去用，因為大家都想要快樂。但是我認為這樣不對，因為人生不能都是假的東西。就像看電影一樣，看完之後還是要回到現實生活。而且用了這種機器之後，人可能就不想面對真實的生活了。



我有一次看了一首歌叫做轉生蘋果，裡面講的人一直想要變成別人，但是最後發現自己原本的樣子就很好。所以我覺得我們不需要經驗機器，因為每個人都應該過自己的生活。



我認為這種機器如果上市的話會讓很多人變得不想努力，因為他們可以直接用機器得到快樂。這樣對社會不好，所以我反對這種機器。我們應該要自己去找快樂，不能靠機器。



總之，我覺得經驗機器不應該被發明出來，因為那樣會讓人變得不真實。雖然可能會讓人快樂，但那種快樂是假的，所以我不支持。",2,1,1,2,1,7
