題目,作答,立意,結構,修辭,敘述,啟發,總分
"甲
(陶潛)為彭澤令。不以家累自隨，送一力給其子，書曰：「汝旦夕之費，自給為難。今遣此力，助汝薪水（打柴汲水）之勞。此亦人子也，可善遇之。」(《南史．隱逸．陶潛傳》)
乙
飯後，眾人各自有事離去，留下貞觀靜坐桌前獃想。她今日的這番感慨，實是前未曾有的。
阿啟伯摘瓜，乃她親眼所見。今早，她突發奇想，陪著外公去巡魚塭，回來時，祖孫二人，都在門口停住了，因為後門虛掩，阿啟伯拿著菜刀，正在棚下摘瓜，並未發覺他們，祖孫二個都閃到門背後。貞觀當時是真愣住了，在那種情況下，是前進呢？抑是後退？她不能很快作選擇。然而這種遲疑也只有幾秒鐘，她一下就被外公拉到門後，正是屏息靜氣時，老人家又帶了她拐出小巷口，走到前街來。
貞觀人到了大路上，心下才逐漸明白：外公躲那人的心，竟比那偷瓜的人所做的遮遮掩掩更甚！貞觀以為懂得了外公的心意：他怕阿啟伯當下撞見自己的那種難堪。事實上，他還有另一層深意，貪當然不好，而貧的本身沒有錯。外公不以阿啟伯為不是，是知道他家中十口，有菜就沒飯，有飯就沒菜。(改寫自蕭麗紅《千江有水千江月》)
陶潛或者外公對他人的善意，你可能也曾見聞或經歷過，請以「溫暖的心」為題，寫一篇文章，分享你的經驗及體會。
文長至少600字。

","溫暖的心



地震是很可怕的事情，每次發生都會讓很多人受傷或是死亡。我記得以前看新聞，台灣和日本都常常發生地震，像是九二一大地震和三一一大地震，造成很多房子倒塌，很多人都沒有家可以住。



這些災難雖然很可怕，但是也讓我看到人與人之間的溫暖。當日本發生三一一大地震的時候，台灣和其他國家都有派人去幫忙救災。他們不怕危險，只想要救出更多的人。後來台灣發生地震的時候，日本也有派人來幫忙我們，這就是人與人之間互相幫助的溫暖。



我覺得這樣子互相幫助很好，因為地震這麼可怕，如果大家都不幫忙的話，一定會死更多人。希望以後大家都可以像這樣子互相幫助，讓世界變得更溫暖一點。",2,1,1,2,1,7
