題目,作答,立意,結構,修辭,敘述,啟發,總分
"甲
生活中，人們習慣使用「標籤」將複雜的事物簡化、分類，再附上標記。然而，有時我們也將「標籤」使用在人的身上。哲學家叔本華說：「人們都從一個人所擁有的職位、從事的生意、隸屬的民族和家庭—亦即總體上從世俗常規所給予此人的角色和位置判斷他。所以，一個人就像商品一樣地被貼上標籤，並受到商品式的對待。至於根據其個人素質，這個人本身是個什麼樣的人，人們只是依自己的需要隨意地提及，亦即在大多數時候被擱置一邊，或者視而不見。」
人們或傳播媒體貼的標籤，有時會形成「刻板印象」，其中真假對錯值得深思。例如稱某個世代為「草莓族」，提到南美洲就想到「這些民族很會踢足球」。
乙
社會學家貝克指出：「人們一旦被貼上某種標籤，就會成為標籤所標定的人。」標籤對人的個性意識、自我認同有強烈的影響，因此當人被一種詞語或名稱貼上標籤時，他可能會往標籤所喻示的方向發展。許多企業因而賦予員工職稱正向的標籤，以放大標籤的力量。例如，蘋果（Apple）直營零售店中，為顧客的產品進行故障診斷的工程師，職稱是「Genius（天才）」，這個職稱間接鼓勵員工不斷了解最新技術知識，以提供顧客更好建議和技術支持。星巴克（Starbucks）店員則有「咖啡大師」、「咖啡大使」等名稱識別，象徵其所擁有的咖啡知識與對其專業服務的肯定。
你我也可以為自己貼上標籤，定義對自己的期待，並調整行為以符應標籤的內容，讓他人留下深刻印象，以擁有更多展現個人價值的機會。

    日常生活中不乏「貼標籤」或「被貼標籤」的實例，請以「貼標籤」為題，寫一篇文章，並融入上文「標籤」於人身上的正面與負面作用，並舉例闡述你對標籤現象的看法。
文長至少600字。


","標籤



現在的社會裡面，每個人都會被貼上標籤。有些標籤是好的，有些標籤是不好的。標籤可以讓人快點認識別人，但是也會讓人有不好的感覺。



我覺得標籤有時候會讓人很困擾。比如說以前的時候，同性戀的人都會被別人說不好。大家都會用奇怪的眼光看他們，覺得他們不正常。有些爸爸媽媽還會帶小孩去看醫生，想要把小孩變正常。



但是現在的人比較不會這樣想了。大家開始覺得每個人喜歡誰都是自己的事情。我在網路上看到有人說要尊重別人的選擇，我覺得這句話說得對。不管是喜歡男生還是女生，都是自己的選擇。



所以我覺得標籤不應該影響我們看一個人。每個人都應該可以做自己想做的事情，不要因為別人的標籤就改變自己。現在在街上也可以看到同性的情侶，這就是一個好的改變。",1,1,1,1,1,5
