題目,作答,立意,結構,修辭,敘述,啟發,總分
"林語堂說：「（我）所愛的不是晚秋，是初秋，那時暄氣初消，月正圓，蟹正肥，桂花皎潔，也未陷入懍烈蕭瑟氣態，這是最值得賞樂的。」楊牧則是在美麗的春天世界裡，萬物復甦，卻聽到「一片樹葉提早轉黃的聲音。」（〈夭〉）普魯斯特（Proust, M.）在《追憶逝水年華》中說：「一小時不僅僅是一個小時，它是一只充滿香氣、聲響、念頭和氛圍的花缽」，說明時間的認知與感官知覺及感受有關。請以「季節的感思」為題，寫一篇文章，描寫你對季節的感知經驗，並抒發心中的感受與領會。
文長至少600字。

","季節的感思



每個季節都有不同的特色，夏天很熱，冬天很冷，春天溫暖，秋天則是樹葉會變黃。在這些季節中，我最喜歡的是夏天，因為可以做很多事情。



夏天可以去河邊玩水、運動、在家吹冷氣，這些都讓我很開心。我記得有一次和田徑隊的同學一起從郵局跑步到冷泉，雖然路上很熱很累，但是想到可以玩水和烤肉，大家就很努力地跑。到了冷泉後，我們都跳進水裡玩，雖然一開始有點害怕，但後來就覺得很好玩。



夏天還有一件讓我印象深刻的事，就是在暑假最後一場比賽。那天天氣很好，我和隊友們在一千六百公尺接力賽跑得很好，每個人都完成了自己的任務。



我真的很喜歡夏天，因為可以做很多有趣的事情。不過玩的時候也要小心安全，記得要多喝水。夏天雖然很熱，但是可以和朋友一起玩，真的很開心。",2,1,1,2,1,7
