題目,作答,立意,結構,修辭,敘述,啟發,總分
"    我覺得童年是一種氣味的記憶。
    我的童年，有許多果樹氣味的記憶。夏天暑熱的午後，廟埕後有一棵巨大的龍眼樹。我從小學翻牆出來，背著書包，爬上龍眼樹，躲在密密的枝葉裡。外面日光葉影搖晃，隱約聽見老師或母親尋來，在樹下叫著我的名字，但那呼喚的聲音，被蟬聲的高音淹沒了。我一動不動，找到一處適合蜷窩身體的枝椏，好像變成樹的一部分，而那時，龍眼樹密密的甜熟的氣味就包圍著我。我閉起眼睛，好像在假寐，也像在作夢，夢裡一串一串纍纍的龍眼，招來許多蜜蜂果蠅。我童年的夢，很甜很香，好像一整個夏天都窩在那棵樹上，包圍在濃郁的氣味裡做了一個醒不來的夢。（改寫自蔣勳《給青年藝術家的信》）
    生活中充斥各種氣味。氣味透過嗅覺傳遞，喚起人們的記憶和感受，一如文中龍眼樹甜熟的氣味喚起作者的童年記憶。請以「花草樹木的氣味記憶」為題，寫一篇文章，書寫你熟悉的花草樹木的氣味，及其所召喚的記憶和感受。

文長至少600字。

","花草樹木的氣味記憶



我覺得氣味可以讓人想起很多事情。每個人都有鼻子可以聞到不同的味道，我也是一樣。



我家附近有很多玉蘭花，每次開花的時候都會有香味。我打開窗戶就可以聞到花香，走到外面的時候香味更大。我很喜歡這個味道，因為可以讓我忘記煩惱的事情。我媽媽也很喜歡玉蘭花的味道。



我媽媽會摘一些玉蘭花放在家裡的各個地方，也會放在她的口袋裡。我睡覺的時候會靠在媽媽身上，可以聞到她身上有玉蘭花的香味。雖然後來花都乾掉了，但是我還是覺得很香。



玉蘭花的味道讓我想到家和家人，讓我覺得很舒服。每次我出門的時候聞到玉蘭花香，就會想到家裡。這個味道對我來說很重要。



我覺得氣味就像是一本書的目錄一樣，可以讓我想起以前的事情。當我聞到熟悉的味道時，就會想起和這個味道有關的回憶。",1,1,1,1,1,5
