題目,作答,立意,結構,修辭,敘述,啟發,總分
"林語堂說：「（我）所愛的不是晚秋，是初秋，那時暄氣初消，月正圓，蟹正肥，桂花皎潔，也未陷入懍烈蕭瑟氣態，這是最值得賞樂的。」楊牧則是在美麗的春天世界裡，萬物復甦，卻聽到「一片樹葉提早轉黃的聲音。」（〈夭〉）普魯斯特（Proust, M.）在《追憶逝水年華》中說：「一小時不僅僅是一個小時，它是一只充滿香氣、聲響、念頭和氛圍的花缽」，說明時間的認知與感官知覺及感受有關。請以「季節的感思」為題，寫一篇文章，描寫你對季節的感知經驗，並抒發心中的感受與領會。
文長至少600字。

","季節的感思



在四季輪轉的歲月長河中，每個人都有屬於自己的季節偏愛。而我，獨鍾冬日的蕭瑟與溫情。在這個被人們戲稱只剩「夏天和更熱的夏天」的台灣，冬季的到來總是特別珍貴，彷彿一位久違的故人，帶著寒風與暖意同時造訪。



當寒流襲來，街道上行人裹緊大衣快步前行之際，我的心靈深處卻醞釀著一股暖流。在我的感知裡，冬天不是蒼白的、寂寥的，而是溫暖的黃色。這抹黃，是晨曦透過窗簾灑進房間的微光；是圍爐時火鍋裊裊上升的熱氣；是全家人擠在暖爐旁分享烤地瓜的歡笑。這些瑣碎的溫暖片段，在歲月的沉澱中愈發珍貴。



隨著年歲漸長，家人各自擁有不同的生活軌跡，團聚的時光變得彌足珍貴。而冬季，特別是農曆新年，成了串起遊子思鄉情懷的金線。在這個特殊的季節裡，離散的家人得以重聚，共享天倫之樂。寒冷的天氣反而讓心與心的距離更加貼近，讓思念有了寄託的港灣。



冬天還帶來了獨特的味覺饗宴。青綠外衣的冬棗，輕輕擦拭便可品嚐，甜美的汁液在唇齿間流轉，是冬日限定的美味。而一碗暖呼呼的豆腐湯，看似平凡，卻在寒冷時節成為最動人的慰藉。滾燙的湯汁裹著嫩滑的豆腐，每一口都是對味蕾的溫柔安撫，也是對心靈的撫慰。



冬天是個充滿矛盾美的季節。它用凜冽的寒風喚醒我們的感官，又用細膩的溫情觸動我們的心靈。它像是一首優美的二重奏，寒冷與溫暖交織，蕭瑟與溫馨共舞。在這個季節裡，我們得以在物質的寒冷中，感受心靈的溫度；在時光的流逝中，珍惜當下的美好。



這就是我所感知的冬天，一個讓人又愛又怕的季節。它教會我們，生命中最珍貴的溫暖，往往誕生於最寒冷的時刻。而正是這樣的反差與平衡，讓我們更懂得珍惜，也更懂得生活的真諦。",5,5,4,4,5,23
