題目,作答,立意,結構,修辭,敘述,啟發,總分
"
記憶可以被編輯或刪除嗎？2004年美國電影《王牌冤家》（Eternal Sunshine of the Spotless Mind），敘述一對怨偶在一次激烈的爭吵後，先後踏入提供記憶刪除服務的「忘情診所」，主動要求洗去記憶。女主角成功地洗去兩人的戀愛記憶，男主角則在記憶清掃的過程中，因為看見舊日時光的美好，想保留一切甜蜜與悲傷的記憶，而開始和電腦清除系統搏鬥。2017年，臺灣導演陳玉勳將自己的短片〈海馬洗頭〉改為長片《健忘村》。〈海馬洗頭〉的創意發想，來自於「人的記憶都存在大腦的海馬迴裡」，電影中因此有「海馬洗頭店」，專職幫人洗去記憶。《健忘村》則有一件寶物「忘憂神器」，可以清除記憶。村長為了一己私利，引誘村人「忘憂」，刪除村人的部分記憶。
電影裡的想像也許有一天會發生。2019年澳洲皇家墨爾本理工大學的研究團隊，利用「光遺傳學」技術影響海馬迴，開發類腦晶片，可模仿大腦儲存和刪除訊息的方式，能精準刪除老鼠腦中特定的記憶。這項科技將有望應用於心理創傷者、藥物成癮者的治療，清除其長時間的負面與病理性記憶。此外，也有政治哲學教授諾齊克提出「經驗機器」思想實驗：假設有一臺機器可以提供所有想要的幸福經驗，甚至可以定期修改，無論是領袖群倫、環遊世界……，使用者想要的「幸福人生」，都可以事先設定。面對這樣的機器，人類將如何抉擇？

假設「經驗機器」存在並且運作穩定，可以讓人享受虛擬的「幸福人生」，你認為將對人類產生什麼影響？權衡利弊，你會支持開放這樣的機器上市嗎？請闡明自己的意見。文長600字以上。
","我覺得經驗機器不是一個好東西，因為它會讓人變得很懶惰。現在的人都喜歡追求簡單的事情，如果有這種機器，大家一定都會去用，這樣對社會不好。



我認為幸福是要靠自己努力得到的。像是我們讀書要考試，如果考得好就會很開心，這種感覺是真的。但是用機器得到的幸福是假的，因為都是設定好的，一點意義都沒有。而且每個人用機器的時候都會設定差不多的東西，這樣大家都變得一樣了。



還有，如果人們都用機器來得到幸福，就不會想要做其他事情了。比如說工作很辛苦，但是用機器就可以感覺自己很成功，這樣誰還要認真工作？這對社會發展一定不好。而且人如果都不經歷困難，以後遇到問題就不知道怎麼解決。



所以我覺得這種機器不應該讓大家使用。雖然它可以讓人感覺很快樂，但是這種快樂是假的。我們應該要靠自己的努力來得到真正的幸福，這樣才對。",2,1,1,2,1,7
