題目,作答,立意,結構,修辭,敘述,啟發,總分
"二十一世紀資訊量以驚人的速度暴增，有人認為網路資訊易於取得，會使記憶力與思考力衰退，不利於認知學習；也有人視網際網路為人類的外接大腦記憶體，意味著我們毋須記憶大量知識，可以專注在更重要、更有創造力的事物上。對於以上兩種不同的觀點，你的看法為何？請以「網海浮沉之我思」為題，結合自己的相關經驗，探討創造力與思考力之間的關係。
文長至少600字。

","網路對我們的生活影響很大，現在的人都離不開網路。我覺得網路有好有壞，好的是可以讓我們找到很多資料，壞的是會讓人變懶。



我自己也常常用網路，像是查作業答案或是找資料。以前要找答案都要自己想很久，現在只要用手機查一下就有答案了。這樣雖然方便，但是我覺得不太好，因為會讓人不想動腦。



現在很多人都太依賴網路了，什麼事情都要上網查。而且網路上還有很多壞人，會做一些不好的事情。我覺得我們要小心使用網路，不能什麼都相信網路。



我認為網路只是一個工具，重要的是我們要會自己思考。如果只會用網路，不會思考，那就不好了。我們應該要學會正確使用網路，這樣才能讓網路變成對我們有幫助的東西。



所以我覺得網路雖然方便，但是不能太依賴它。我們要記得自己思考，這樣才不會被網路控制。",2,1,1,2,1,7
