題目,作答,立意,結構,修辭,敘述,啟發,總分
"甲
我們的感情是冰箱，打開來看，明亮可喜，關起門後是嗡嗡的黑暗。什麼都不會壞掉，埋在霜雪的角落。我們的感情是冰箱，有時很滿有時很空，一切都可以保存很久，冷冷的，可是很新鮮，看起來都像昨天。（柯裕棻〈冰箱〉）
乙
農曆年前我媽換了新冰箱。雖然舊的其實也還好，十數年如一日修長高冷玉面如銀，該凍肉時凍肉，該製冰時製冰，門沒關緊永遠忠實地響警告聲。燈泡甚至沒有壞過一次。只是我媽長期嫌它不得力，冷藏室裝一隻生雞一鍋燉肉就周轉不過來，胃口那樣地小，像一個節食的人，廚房裡最不需要的就是一個節食的人。我常常看見她蹲在那兒，腳邊圍滿生鮮，鬥盡心智排列組合，在最有限空間裡籌備出最大的寬容，冰箱門好像看牙醫的嘴開太久不斷嗶嗶叫，簡直像在哭了。感覺兩方都十分苦惱。
我認為運用如常的器物毋需特別汰換，也主張大家都不妨少吃一點。顯然我媽不作此想。她說：「總之我就是想要一臺大冰箱啦。」但如此一來，我反倒領悟了，這完全是某商品宣傳詞「豈止於大」（Bigger than bigger）的道理：一座夠大的新冰箱也豈止於冰箱，它是一種想像，一種意境，一種可能性，它富有召喚家庭生活最好願景的潛力。（改寫自黃麗群〈如果在冬天，一座新冰箱〉）
    冰箱可以很滿，可以很空，當你打開冰箱，通常想尋找什麼？又看見什麼？假如有一座屬於你的新冰箱，你會有怎樣的想像？冰藏什麼（虛實皆可）會符合你所期待的美好生活？請以「如果我有一座新冰箱」為題，撰文一篇，
文長至少600字。

","如果我有一座新冰箱



每個人的生命中，總有些珍貴的片段想要永恆保存。當我凝視著這座嶄新的冰箱，彷彿看見了一個神奇的時光保險箱，它不只能夠保存食物的鮮美，更能封存歲月的溫度與生命的況味。



打開這扇潔白的門扉，我最想珍藏的是那些與外婆相處的溫暖時光。猶記得幼時，外婆總是那個在我跌跌撞撞學步時，張開雙臂守護著我的人。她的身影，像是一道永恆的暖陽，照亮了我童年的每一個角落。即使在我跌倒時，她不會立即將我扶起，而是用溫柔的目光鼓勵我自己站起來，教會我面對挫折時的勇氣與堅毅。



在這座時光冰箱裡，我要將外婆的每一個微笑、每一次擁抱都仔細封存。那些她為我縫補衣服時的針線聲，準備晚餐時的鍋碗交響，甚至是午後陪我讀故事時的輕柔嗓音，都要一一冰封在記憶的晶體中。這些回憶就像是精心醃製的美味，時間愈久，愈發香醇動人。



現在的我雖然已經搬離了childhood home，但每當打開這座記憶的冰箱，那些溫暖的片段就會重現眼前，鮮活如昨。外婆教會我的不只是如何堅強，更是如何在生命中保持一顆溫暖而感恩的心。這些珍貴的教誨，永遠新鮮地存放在我心靈的冰箱中，成為我面對人生的養分與動力。



在這個快速變遷的世界裡，許多事物都在急促地流逝，但在我的記憶冰箱中，那些珍貴的愛與溫暖永遠不會融化。每一次開啟，都能讓我重新感受那份純粹的幸福，讓我在前行的路上始終保持著溫暖與勇氣。這座冰箱不只存放著過往，更珍藏著那些塑造現在的我的重要時刻，讓我永遠記得：生命中最珍貴的不是物質的豐盈，而是那些充滿愛與溫度的回憶。",5,5,4,4,5,23
