題目,作答,立意,結構,修辭,敘述,啟發,總分
"甲
(陶潛)為彭澤令。不以家累自隨，送一力給其子，書曰：「汝旦夕之費，自給為難。今遣此力，助汝薪水（打柴汲水）之勞。此亦人子也，可善遇之。」(《南史．隱逸．陶潛傳》)
乙
飯後，眾人各自有事離去，留下貞觀靜坐桌前獃想。她今日的這番感慨，實是前未曾有的。
阿啟伯摘瓜，乃她親眼所見。今早，她突發奇想，陪著外公去巡魚塭，回來時，祖孫二人，都在門口停住了，因為後門虛掩，阿啟伯拿著菜刀，正在棚下摘瓜，並未發覺他們，祖孫二個都閃到門背後。貞觀當時是真愣住了，在那種情況下，是前進呢？抑是後退？她不能很快作選擇。然而這種遲疑也只有幾秒鐘，她一下就被外公拉到門後，正是屏息靜氣時，老人家又帶了她拐出小巷口，走到前街來。
貞觀人到了大路上，心下才逐漸明白：外公躲那人的心，竟比那偷瓜的人所做的遮遮掩掩更甚！貞觀以為懂得了外公的心意：他怕阿啟伯當下撞見自己的那種難堪。事實上，他還有另一層深意，貪當然不好，而貧的本身沒有錯。外公不以阿啟伯為不是，是知道他家中十口，有菜就沒飯，有飯就沒菜。(改寫自蕭麗紅《千江有水千江月》)
陶潛或者外公對他人的善意，你可能也曾見聞或經歷過，請以「溫暖的心」為題，寫一篇文章，分享你的經驗及體會。
文長至少600字。

","溫暖的心



每個人都會遇到別人對自己好，這些好意會讓我們很感動。我遇過一個很好的老師，她對我很好，讓我覺得很溫暖。



這個老師以前教過我，雖然現在不是我的老師了，但是我們還是會聯絡。她在我上高中的時候，傳了很多訊息給我，跟我說加油，還說我有問題可以找她。我覺得她真的很好，讓我很感動。



老師不一定要每天都見到面，但是她教我的東西我都記得很清楚。她給我的鼓勵讓我覺得很溫暖，讓我知道遇到困難的時候可以找她。我很幸運可以遇到這麼好的老師，她可能是因為自己也讀過高中，所以知道我的感受。



我覺得老師真的很重要，因為她們會教我們很多東西。我很高興可以遇到這個老師，她給我的鼓勵我一直都記得。這就是我遇到的溫暖的事情，讓我覺得很感動。",2,1,2,2,1,8
