題目,作答,立意,結構,修辭,敘述,啟發,總分
"林語堂說：「（我）所愛的不是晚秋，是初秋，那時暄氣初消，月正圓，蟹正肥，桂花皎潔，也未陷入懍烈蕭瑟氣態，這是最值得賞樂的。」楊牧則是在美麗的春天世界裡，萬物復甦，卻聽到「一片樹葉提早轉黃的聲音。」（〈夭〉）普魯斯特（Proust, M.）在《追憶逝水年華》中說：「一小時不僅僅是一個小時，它是一只充滿香氣、聲響、念頭和氛圍的花缽」，說明時間的認知與感官知覺及感受有關。請以「季節的感思」為題，寫一篇文章，描寫你對季節的感知經驗，並抒發心中的感受與領會。
文長至少600字。

","網路對我們的生活影響很大，有人說網路會讓我們變笨，有人說網路很好用。我覺得網路不太好，因為會讓我們變笨。



我國中的時候有了第一支手機，那時候很開心，每天都在玩手機。我功課不會做的時候就上網查答案，有什麼不懂的也都查網路。後來我發現這樣不太好，因為我什麼都記不住，也不會自己想辦法解決問題。我覺得網路雖然方便，但是會讓我們的腦袋變差。



我覺得思考和創造力是很重要的。如果我們會思考，就會有創意；如果我們有創意，也會更會思考。但是網路會讓這兩個能力都變差，這樣對我們的生活和工作都不好。



現在的科技一直在進步，我們雖然離不開網路，但是還是要少用一點。我們可以多看書，多做題目，這樣才能讓大腦變好。這樣才是最好的。",2,1,1,2,1,7
