題目,作答,立意,結構,修辭,敘述,啟發,總分
"林語堂說：「（我）所愛的不是晚秋，是初秋，那時暄氣初消，月正圓，蟹正肥，桂花皎潔，也未陷入懍烈蕭瑟氣態，這是最值得賞樂的。」楊牧則是在美麗的春天世界裡，萬物復甦，卻聽到「一片樹葉提早轉黃的聲音。」（〈夭〉）普魯斯特（Proust, M.）在《追憶逝水年華》中說：「一小時不僅僅是一個小時，它是一只充滿香氣、聲響、念頭和氛圍的花缽」，說明時間的認知與感官知覺及感受有關。請以「季節的感思」為題，寫一篇文章，描寫你對季節的感知經驗，並抒發心中的感受與領會。
文長至少600字。

","季節的感思



一年有四個季節，每個季節都不一樣。春天開花，夏天很熱，秋天葉子掉落，冬天很冷。



我最喜歡冬天。冬天雖然很冷，但是可以看到梅花開。冬天代表結束，結束後就會有新的開始。冬天過了就是春天，所以我覺得冬天讓人有希望。



冬天來的時候，就表示新年快到了。每天等待新年來臨很有趣，我喜歡這種等待的感覺。希望舊的一年可以平安過去，新的一年可以快點來。



人的生命很短暫，冬天讓我想到人生的老年時期。我希望老了以後可以過得輕鬆自在，不要有煩惱。我喜歡冬天，因為它讓我每天都有期待的感覺。



四季輪流來，春天、夏天、秋天、冬天都各有特色。但是冬天給我最多想法，讓我學到很多東西。",1,1,1,1,1,5
