題目,作答,立意,結構,修辭,敘述,啟發,總分
"二十一世紀資訊量以驚人的速度暴增，有人認為網路資訊易於取得，會使記憶力與思考力衰退，不利於認知學習；也有人視網際網路為人類的外接大腦記憶體，意味著我們毋須記憶大量知識，可以專注在更重要、更有創造力的事物上。對於以上兩種不同的觀點，你的看法為何？請以「網海浮沉之我思」為題，結合自己的相關經驗，探討創造力與思考力之間的關係。
文長至少600字。

","網海浮沉之我思



現在的生活中，科技和網路變得很重要。大家都在用手機和電腦，這些東西改變了我們的生活方式。



我覺得網路讓我們變懶惰了。以前上課要認真聽講，現在很多同學都覺得反正可以上網查，就不用記那麼多。老師教的東西聽不懂也不會問，回家就查網路。這樣子的學習方式不太好，因為都沒有真的理解。



我有一個同學很喜歡化學，他整天都在網路上找化學的資料。後來他考到了很好的成績，還得到了獎牌。這個例子告訴我們，網路其實也可以幫助我們學習，就看我們怎麼用。



我認為網路就像是一個大腦，可以幫我們記住很多東西。不過我們不能太依賴它，要自己多想一想。如果只會查網路，不會思考，那就不好了。



所以我覺得網路有好有壞，重要的是我們要好好使用它，不要變得太懶惰。",1,1,1,1,1,5
