題目,作答,立意,結構,修辭,敘述,啟發,總分
"    我覺得童年是一種氣味的記憶。
    我的童年，有許多果樹氣味的記憶。夏天暑熱的午後，廟埕後有一棵巨大的龍眼樹。我從小學翻牆出來，背著書包，爬上龍眼樹，躲在密密的枝葉裡。外面日光葉影搖晃，隱約聽見老師或母親尋來，在樹下叫著我的名字，但那呼喚的聲音，被蟬聲的高音淹沒了。我一動不動，找到一處適合蜷窩身體的枝椏，好像變成樹的一部分，而那時，龍眼樹密密的甜熟的氣味就包圍著我。我閉起眼睛，好像在假寐，也像在作夢，夢裡一串一串纍纍的龍眼，招來許多蜜蜂果蠅。我童年的夢，很甜很香，好像一整個夏天都窩在那棵樹上，包圍在濃郁的氣味裡做了一個醒不來的夢。（改寫自蔣勳《給青年藝術家的信》）
    生活中充斥各種氣味。氣味透過嗅覺傳遞，喚起人們的記憶和感受，一如文中龍眼樹甜熟的氣味喚起作者的童年記憶。請以「花草樹木的氣味記憶」為題，寫一篇文章，書寫你熟悉的花草樹木的氣味，及其所召喚的記憶和感受。

文長至少600字。

","花草樹木的氣味記憶



氣味是一種很奇怪的東西，有時候會讓人想起以前的事情。有些氣味和我們的生活有關係，就像一條路一樣，連接過去和現在。



我小時候在學校打球，因為沒有體育館，所以常常要在外面練習。下雨的時候最麻煩，地上都是泥巴，跑起來很累。每次下完雨，地上都會有泥土的味道，空氣也是濕濕的。這些味道讓我想起以前打球的日子。



現在我已經不打球了，但是有時候下完雨，聞到泥土的味道，就會想起以前的事情。那時候我很喜歡打球，雖然很辛苦也不會放棄。這些回憶讓我覺得很特別。



氣味雖然看不見，但是可以讓我們想起很多事情。就像是一條看不見的線，把我們和以前的回憶連在一起。氣味不只是一種味道，還包含了很多回憶。",1,1,1,1,1,5
