題目,作答,立意,結構,修辭,敘述,啟發,總分
"甲
(陶潛)為彭澤令。不以家累自隨，送一力給其子，書曰：「汝旦夕之費，自給為難。今遣此力，助汝薪水（打柴汲水）之勞。此亦人子也，可善遇之。」(《南史．隱逸．陶潛傳》)
乙
飯後，眾人各自有事離去，留下貞觀靜坐桌前獃想。她今日的這番感慨，實是前未曾有的。
阿啟伯摘瓜，乃她親眼所見。今早，她突發奇想，陪著外公去巡魚塭，回來時，祖孫二人，都在門口停住了，因為後門虛掩，阿啟伯拿著菜刀，正在棚下摘瓜，並未發覺他們，祖孫二個都閃到門背後。貞觀當時是真愣住了，在那種情況下，是前進呢？抑是後退？她不能很快作選擇。然而這種遲疑也只有幾秒鐘，她一下就被外公拉到門後，正是屏息靜氣時，老人家又帶了她拐出小巷口，走到前街來。
貞觀人到了大路上，心下才逐漸明白：外公躲那人的心，竟比那偷瓜的人所做的遮遮掩掩更甚！貞觀以為懂得了外公的心意：他怕阿啟伯當下撞見自己的那種難堪。事實上，他還有另一層深意，貪當然不好，而貧的本身沒有錯。外公不以阿啟伯為不是，是知道他家中十口，有菜就沒飯，有飯就沒菜。(改寫自蕭麗紅《千江有水千江月》)
陶潛或者外公對他人的善意，你可能也曾見聞或經歷過，請以「溫暖的心」為題，寫一篇文章，分享你的經驗及體會。
文長至少600字。

","「溫暖的心」



在這個社會中，我看到了一些溫暖，但也看到了很多冷漠。有時候走在路上，會看到一些人很自私，讓我覺得這個世界不太好。



像是在路上開車的時候，很多人都不遵守交通規則。有的人變換車道不打方向燈，有的人闖紅燈，這些都讓我覺得很困擾。我覺得如果大家可以多為別人著想，這個社會就會變得更好。



我記得有一次在路上看到一個老奶奶要過馬路，有一個好心的司機停下來讓她過。這讓我覺得世界上還是有好人的，只是比較少見到而已。如果大家都可以像這個司機一樣有愛心，這個社會就會變得更溫暖。



所以我希望大家可以多關心別人，不要只想到自己。這樣我們的生活才會更美好，社會也會變得更好。雖然現在的人比較自私，但是我相信只要我們願意，還是可以讓這個世界變得更溫暖的。",2,1,2,2,1,8
