題目,作答,立意,結構,修辭,敘述,啟發,總分
"林語堂說：「（我）所愛的不是晚秋，是初秋，那時暄氣初消，月正圓，蟹正肥，桂花皎潔，也未陷入懍烈蕭瑟氣態，這是最值得賞樂的。」楊牧則是在美麗的春天世界裡，萬物復甦，卻聽到「一片樹葉提早轉黃的聲音。」（〈夭〉）普魯斯特（Proust, M.）在《追憶逝水年華》中說：「一小時不僅僅是一個小時，它是一只充滿香氣、聲響、念頭和氛圍的花缽」，說明時間的認知與感官知覺及感受有關。請以「季節的感思」為題，寫一篇文章，描寫你對季節的感知經驗，並抒發心中的感受與領會。
文長至少600字。

","季節的感思



季節的變換，總是讓我想到很多事情。春天的時候，花開了，樹也長出新葉子，讓人覺得很舒服。夏天很熱，但是可以吃冰，游泳，也是不錯的季節。秋天天氣涼爽，可以看到楓葉變紅，冬天雖然冷，但是可以喝熱湯。



我最喜歡的是春天，因為春天的天氣不會太熱也不會太冷。每年春天來的時候，我都會看到很多花開，覺得很漂亮。春天也是開學的季節，可以見到很久不見的同學，感覺很開心。



夏天雖然很熱，但是可以吃很多冰品，像是冰淇淋和刨冰。放暑假的時候，我常常跟朋友去游泳，雖然很熱但是玩得很開心。秋天的時候，天氣變涼了，可以去郊遊。冬天很冷，但是可以吃火鍋，也可以跟家人一起看電視。



每個季節都有不同的感覺，讓我們的生活變得比較有趣。雖然有時候天氣不好，但是每個季節都有好玩的事情可以做。希望大家也能感受到不同季節的美好。",1,1,1,1,1,5
