題目,作答,立意,結構,修辭,敘述,啟發,總分
"    看到山上那麼多參天大樹時，會勾起我的惻隱之心。在無法順暢呼吸的空間裡，樹木之間為了生存必須展開激烈的競爭。為了能多接受一些陽光，它們只能拼命向上生長。
但是，只為生存而競爭的森林卻漸次死亡，因為陽光無法到達地面，所以溫度不夠高，無法讓幼小的生命萌芽。小樹和花、草，以及與它們一起生活的小昆蟲沒有生存的空間。雖然表面上看起來非常完美，但這種森林其實與沒有希望的不孕之地無異。
根據我的經驗，密集栽種的樹苗體型壯大數十倍時，就需要開始砍樹，否則樹木會抱怨空間太窄，活不下去。要想確保樹木能充分接受陽光照射的空間，就必須做出犧牲。因此，幾年期間強行進行砍伐，樹木間距剛開始時是一公尺，現已擴大到七公尺。也就是說，即使是粗略估算，也可知七棵樹中有六棵為之消失。
森林要想成為孕育新生命的希望之地，就需要有縫隙。如果樹木壽命結束或因為意外災害而倒下，該位置就會產生空間，那麼，溫暖的陽光就會照射進來，被陽光照射的地面混雜著前一年秋天凋落的樹葉，於是積聚起能夠孕育新生命的養分。因此，樹木的縫隙，既是結束和開始共存的空間，也是由缺乏轉化為希望的空間。（改寫自禹鐘榮著、盧鴻金譯《樹木教我的人生課》）
    根據上文所述，為什麼森林需要縫隙？由此聯想，人生是否也需要縫隙？請以「縫隙的聯想」為題，寫一篇文章，結合生活經驗或見聞，書寫你的感思與體悟。
文長至少600字。


","縫隙的聯想



大自然的運行自有其法則，森林中的縫隙不僅是一種空間的騰讓，更是生命延續的必要之道。觀察這片綠意盎然的天地，縫隙的存在彷彿在向我們揭示一個深刻的哲理：生命的更迭與創新，往往需要適度的空間與犧牲。



森林裡，當參天大樹倒下，陽光得以穿透枝葉的屏障，灑落在久未見光的地表。這看似的缺憾，卻為新生命提供了萌芽的契機。這讓我聯想到科技發展與人類文明的演進，舊有的思維與制度，就像那些遮蔽陽光的大樹，若不適時讓出空間，新興的創意與革新便難以萌發。



在這個日新月異的時代，「縫隙」的重要性更顯關鍵。它不僅是一種物理空間的讓渡，更象徵著思維的開放與包容。就像森林需要適度的疏伐來維持生態平衡，人類社會也需要不斷創造縫隙，讓新思維、新技術有成長的空間。這些縫隙，既是舊事物的謝幕，也是新生命的序章。



然而，值得注意的是，縫隙並非意味著全盤否定過往。就如同倒下的大樹會化作養分，滋養新生的幼苗，舊有的智慧與經驗同樣能轉化為創新的基石。這種承先啟後的更迭過程，正是生命與文明得以永續發展的關鍵。



在個人生活中，我們也常需要主動創造縫隙。或許是在緊湊的工作中預留思考的空間，或是在既定的生活模式中開闢新的可能。這些自主創造的縫隙，往往能帶來意想不到的收穫與突破。



縫隙，不僅是一種空間的存在，更是一種智慧的體現。它提醒我們：唯有在適當的時候學會放手，為新事物預留生長的空間，才能讓生命與文明在更迭中持續綻放光彩。這或許就是大自然給予我們最寶貴的啟示。",5,4,4,4,4,21
