題目,作答,立意,結構,修辭,敘述,啟發,總分
"關於地球的記憶
被文字固禁在課本裡
我們的筆尖游走在山脈和海洋
翻譯每片花瓣的嬌嫩和露水的清新
所有的言語 答案
都靜放在我們的課本裡
等待我們翻起這一切的序幕（節錄自薛憶婷〈我們的課本〉）

    以上這首詩，從課本啟動天馬行空的遐想，瞥見知識豐富的樣貌。科學頑童費曼（Richard P. Feynman）曾說觀察轉動的餐盤，讓他得到很大的啟發，領略了興之所至的樂趣。物理課可讓我們發現萬物運行的迷人，生物課帶領我們進入細胞核遊歷，外語課讓我們聽見世界不同的文化。國文課堂上「採菊東籬下，悠然見南山」或「輕羅小扇撲流螢」，詩中情境也往往能讓人神遊於現實之外。過往的課程內容，是否曾經點燃你對知識的熱情？打開課本時，不知能否如〈我們的課本〉所述，揭開知識想像的序幕。
    若能從不同角度切入課本，進入知識的想像，或許可以讓課本帶領我們經歷驚奇的旅程。請以「當我打開課本」為題，寫一篇文章，敘述任一學科課本對你的意義，書寫你探索課本內容、知識的經驗與體會。
文長至少600字。


","當我打開課本



每次打開課本，我都會看到很多有趣的內容。我最喜歡的是國文和歷史課本，因為裡面有很多故事可以看。



國文課本裡有西遊記，講孫悟空的故事很好玩。還有魯迅寫的狂人日記，雖然我不太懂他在說什麼，但老師說這是很重要的作品。這些故事讓我知道以前的人生活和現在不一樣。



歷史課本也很有趣，因為有很多圖片可以看。每次上課的時候，老師講故事我都很認真聽。看著課本的圖片，感覺自己好像回到以前一樣。



有些課本很無聊，看了就想睡覺。但是國文和歷史課本我覺得還不錯，因為可以學到很多東西。每個人都有自己喜歡的科目，我覺得只要找到自己喜歡的，就會想要學習。



我希望以後可以繼續學習更多有趣的知識，這樣就不會覺得讀書很無聊了。",2,1,2,1,1,7
