題目,作答,立意,結構,修辭,敘述,啟發,總分
"甲
(陶潛)為彭澤令。不以家累自隨，送一力給其子，書曰：「汝旦夕之費，自給為難。今遣此力，助汝薪水（打柴汲水）之勞。此亦人子也，可善遇之。」(《南史．隱逸．陶潛傳》)
乙
飯後，眾人各自有事離去，留下貞觀靜坐桌前獃想。她今日的這番感慨，實是前未曾有的。
阿啟伯摘瓜，乃她親眼所見。今早，她突發奇想，陪著外公去巡魚塭，回來時，祖孫二人，都在門口停住了，因為後門虛掩，阿啟伯拿著菜刀，正在棚下摘瓜，並未發覺他們，祖孫二個都閃到門背後。貞觀當時是真愣住了，在那種情況下，是前進呢？抑是後退？她不能很快作選擇。然而這種遲疑也只有幾秒鐘，她一下就被外公拉到門後，正是屏息靜氣時，老人家又帶了她拐出小巷口，走到前街來。
貞觀人到了大路上，心下才逐漸明白：外公躲那人的心，竟比那偷瓜的人所做的遮遮掩掩更甚！貞觀以為懂得了外公的心意：他怕阿啟伯當下撞見自己的那種難堪。事實上，他還有另一層深意，貪當然不好，而貧的本身沒有錯。外公不以阿啟伯為不是，是知道他家中十口，有菜就沒飯，有飯就沒菜。(改寫自蕭麗紅《千江有水千江月》)
陶潛或者外公對他人的善意，你可能也曾見聞或經歷過，請以「溫暖的心」為題，寫一篇文章，分享你的經驗及體會。
文長至少600字。

","溫暖的心



我覺得幫助別人是一件好事情。因為幫助別人可以讓這個世界變得更好。



我小時候住在鄉下，那裡很多人都是種田的。有一年香蕉賣不掉，很多農民都很擔心。我爸爸知道這件事情後就買了很多香蕉。他把香蕉送給看病的病人，我媽媽也做了很多香蕉點心。我那時候不知道爸爸為什麼要買這麼多香蕉，我想要買玩具比較好。



最近我在網路上看到一個影片，是說有些店快要倒閉了，但是因為有人幫忙所以沒有倒閉。我看了這個影片才知道，原來幫助別人是很重要的事情。



我希望大家都可以幫助別人，這樣世界就會變得更好。雖然有時候幫助別人的事情很小，但是對別人來說可能很重要。",1,1,1,1,1,5
