題目,作答,立意,結構,修辭,敘述,啟發,總分
"二十一世紀資訊量以驚人的速度暴增，有人認為網路資訊易於取得，會使記憶力與思考力衰退，不利於認知學習；也有人視網際網路為人類的外接大腦記憶體，意味著我們毋須記憶大量知識，可以專注在更重要、更有創造力的事物上。對於以上兩種不同的觀點，你的看法為何？請以「網海浮沉之我思」為題，結合自己的相關經驗，探討創造力與思考力之間的關係。
文長至少600字。

","網海浮沉之我思



現在的科技越來越進步，大家都在用網路找資料。我覺得這樣很方便，但是也有不好的地方。



我自己是學生，常常要做報告。以前要找資料很麻煩，要去圖書館找書，現在只要用手機上網就可以了。最近還有一個叫做CHATGPT的東西，它可以幫我們整理資料，寫報告變得更容易了。



但是我覺得這樣子不太好，因為大家都不想自己動腦了。像我以前做報告的時候，都要自己看很多資料，然後想一想要怎麼寫。現在大家都直接問CHATGPT，這樣子會讓我們變笨。



我認為我們要小心一點，不能太依賴網路。雖然網路很方便，但是我們還是要自己思考。這樣才不會被科技控制，變成不會思考的人。



所以我希望大家可以想一想，怎麼樣才能好好使用網路，不要被網路變笨。這樣我們才能在這個時代生存下去。",2,1,2,2,1,8
