題目,作答,立意,結構,修辭,敘述,啟發,總分
"    記憶可以被編輯或刪除嗎？2004年美國電影《王牌冤家》（Eternal Sunshine of the Spotless Mind），敘述一對怨偶在一次激烈的爭吵後，先後踏入提供記憶刪除服務的「忘情診所」，主動要求洗去記憶。女主角成功地洗去兩人的戀愛記憶，男主角則在記憶清掃的過程中，因為看見舊日時光的美好，想保留一切甜蜜與悲傷的記憶，而開始和電腦清除系統搏鬥。2017年，臺灣導演陳玉勳將自己的短片〈海馬洗頭〉改為長片《健忘村》。〈海馬洗頭〉的創意發想，來自於「人的記憶都存在大腦的海馬迴裡」，電影中因此有「海馬洗頭店」，專職幫人洗去記憶。《健忘村》則有一件寶物「忘憂神器」，可以清除記憶。村長為了一己私利，引誘村人「忘憂」，刪除村人的部分記憶。
    電影裡的想像也許有一天會發生。2019年澳洲皇家墨爾本理工大學的研究團隊，利用「光遺傳學」技術影響海馬迴，開發類腦晶片，可模仿大腦儲存和刪除訊息的方式，能精準刪除老鼠腦中特定的記憶。這項科技將有望應用於心理創傷者、藥物成癮者的治療，清除其長時間的負面與病理性記憶。此外，也有政治哲學教授諾齊克提出「經驗機器」思想實驗：假設有一臺機器可以提供所有想要的幸福經驗，甚至可以定期修改，無論是領袖群倫、環遊世界……，使用者想要的「幸福人生」，都可以事先設定。面對這樣的機器，人類將如何抉擇？
假設「經驗機器」存在並且運作穩定，可以讓人享受虛擬的「幸福人生」，你認為將對人類產生什麼影響？權衡利弊，你會支持開放這樣的機器上市嗎？請以「編織記憶：幸福可以被設定！？」為題，運用文中相關資訊，並結合經驗與見聞，闡明自己的意見。
文長至少600字。

","編織記憶：幸福可以被設定！？



記憶是人生中很重要的東西，每個人都會有好的和不好的記憶。如果真的有經驗機器可以讓我們選擇想要的記憶，我覺得這樣很好。



我支持這種機器上市，因為可以幫助很多人。像是有些人遇到很不好的事情，心裡很難過，這個機器就可以幫他們把不好的記憶刪掉。這樣他們就不會一直很傷心了。



我覺得這個機器最有用的地方是可以幫助有心理問題的人。因為他們常常會想到不好的事情，所以很痛苦。用這個機器可以讓他們忘記不好的事，變得比較開心。雖然有人說要說出來才會好，但是有些人說出來反而更難過。



我認為用機器得到幸福沒有什麼不好。因為這樣可以讓壞人變少，世界變得更好。很多人做壞事是因為他們從小就不快樂，如果可以讓他們快樂一點，就不會做壞事了。



所以我覺得這種機器應該要讓大家用，這樣每個人都可以過自己想要的生活，世界也會變得更好。",1,1,1,1,1,5
