題目,作答,立意,結構,修辭,敘述,啟發,總分
"二十一世紀資訊量以驚人的速度暴增，有人認為網路資訊易於取得，會使記憶力與思考力衰退，不利於認知學習；也有人視網際網路為人類的外接大腦記憶體，意味著我們毋須記憶大量知識，可以專注在更重要、更有創造力的事物上。對於以上兩種不同的觀點，你的看法為何？請以「網海浮沉之我思」為題，結合自己的相關經驗，探討創造力與思考力之間的關係。
文長至少600字。

","網海浮沉之我思



現在的網路發展很快，每天都有很多新的資訊出現。有些人說網路不好，會讓人變笨，有些人說網路很好，可以幫助我們記東西。我覺得網路對我們來說是很重要的工具。



去年因為新冠肺炎，我們都要在家裡上網課。雖然不能直接問老師問題，但是我發現用網路查資料也不錯。老師教的東西通常只有一種答案，但是網路上有很多不同的說法，可以讓我們看到更多觀點。



我覺得網路上的知識比較客觀，因為沒有加入太多個人想法。這樣我們就可以自己思考問題，找出自己覺得對的答案。有時候還可以想到一些新的想法，這樣也不錯。



所以我認為網路是很重要的工具，可以幫助我們學習和思考。但是我們也要小心使用，不能完全依賴網路。最重要的是要自己動腦想，這樣才能真的學到東西。",2,2,1,2,1,8
