題目,作答,立意,結構,修辭,敘述,啟發,總分
"甲
我們的感情是冰箱，打開來看，明亮可喜，關起門後是嗡嗡的黑暗。什麼都不會壞掉，埋在霜雪的角落。我們的感情是冰箱，有時很滿有時很空，一切都可以保存很久，冷冷的，可是很新鮮，看起來都像昨天。（柯裕棻〈冰箱〉）
乙
農曆年前我媽換了新冰箱。雖然舊的其實也還好，十數年如一日修長高冷玉面如銀，該凍肉時凍肉，該製冰時製冰，門沒關緊永遠忠實地響警告聲。燈泡甚至沒有壞過一次。只是我媽長期嫌它不得力，冷藏室裝一隻生雞一鍋燉肉就周轉不過來，胃口那樣地小，像一個節食的人，廚房裡最不需要的就是一個節食的人。我常常看見她蹲在那兒，腳邊圍滿生鮮，鬥盡心智排列組合，在最有限空間裡籌備出最大的寬容，冰箱門好像看牙醫的嘴開太久不斷嗶嗶叫，簡直像在哭了。感覺兩方都十分苦惱。
我認為運用如常的器物毋需特別汰換，也主張大家都不妨少吃一點。顯然我媽不作此想。她說：「總之我就是想要一臺大冰箱啦。」但如此一來，我反倒領悟了，這完全是某商品宣傳詞「豈止於大」（Bigger than bigger）的道理：一座夠大的新冰箱也豈止於冰箱，它是一種想像，一種意境，一種可能性，它富有召喚家庭生活最好願景的潛力。（改寫自黃麗群〈如果在冬天，一座新冰箱〉）
    冰箱可以很滿，可以很空，當你打開冰箱，通常想尋找什麼？又看見什麼？假如有一座屬於你的新冰箱，你會有怎樣的想像？冰藏什麼（虛實皆可）會符合你所期待的美好生活？請以「如果我有一座新冰箱」為題，撰文一篇，
文長至少600字。

","如果我有一座新冰箱



我家的冰箱裡面都是媽媽準備的食物，每次打開都可以看到很多東西。媽媽會煮很多菜放在裡面，有時候還會做酸梅汁給我喝，讓我很開心。



以前我都不會珍惜媽媽煮的菜，常常跟媽媽吵架的時候就亂吃飯，把菜弄得很亂。吃完飯就走掉了，也不管桌上的菜變得很難看。那些菜最後都被倒掉了，很浪費。



有一次媽媽生病住院，我和弟弟要自己煮飯吃。我打開冰箱拿食材想要煮跟媽媽一樣的菜，但是我煮得不好吃。雖然用一樣的材料和方法，但是就是煮不出媽媽的味道。我一邊吃一邊哭，因為想念媽媽煮的菜。



如果我以後有自己的冰箱，我希望可以放媽媽煮的菜。如果我以後當媽媽了，我也要學會煮媽媽的菜給我的小孩吃。這樣我就可以知道當媽媽是什麼感覺。",1,1,1,1,1,5
