題目,作答,立意,結構,修辭,敘述,啟發,總分
"關於地球的記憶
被文字固禁在課本裡
我們的筆尖游走在山脈和海洋
翻譯每片花瓣的嬌嫩和露水的清新
所有的言語 答案
都靜放在我們的課本裡
等待我們翻起這一切的序幕（節錄自薛憶婷〈我們的課本〉）

    以上這首詩，從課本啟動天馬行空的遐想，瞥見知識豐富的樣貌。科學頑童費曼（Richard P. Feynman）曾說觀察轉動的餐盤，讓他得到很大的啟發，領略了興之所至的樂趣。物理課可讓我們發現萬物運行的迷人，生物課帶領我們進入細胞核遊歷，外語課讓我們聽見世界不同的文化。國文課堂上「採菊東籬下，悠然見南山」或「輕羅小扇撲流螢」，詩中情境也往往能讓人神遊於現實之外。過往的課程內容，是否曾經點燃你對知識的熱情？打開課本時，不知能否如〈我們的課本〉所述，揭開知識想像的序幕。
    若能從不同角度切入課本，進入知識的想像，或許可以讓課本帶領我們經歷驚奇的旅程。請以「當我打開課本」為題，寫一篇文章，敘述任一學科課本對你的意義，書寫你探索課本內容、知識的經驗與體會。
文長至少600字。


","當我打開課本



我每次打開課本的時候，都會聞到新書的味道，這讓我很開心。課本裡面有很多圖片和文字，讓我覺得很新奇，想要多看一點。



我最喜歡國文課本，因為裡面有很多故事。像是李白和朋友說再見的故事，還有陶淵明不要當官的故事。我也喜歡讀岳飛的文章，因為他很愛國家。這些故事都教會我很多道理。



國文課本還有一些比較新的文章，像是朱自清寫他爸爸的故事，讓我知道爸爸很愛小孩。還有張愛玲和徐志摩的故事，他們寫的東西我不太懂，但是感覺很厲害。



我覺得課本很重要，因為可以讓我學到很多東西。每次看課本都會有新的發現，讓我變得更聰明。雖然有時候看不懂，但是我還是會努力讀下去，希望自己可以學得更好。",2,1,1,2,1,7
