題目,作答,立意,結構,修辭,敘述,啟發,總分
"二十一世紀資訊量以驚人的速度暴增，有人認為網路資訊易於取得，會使記憶力與思考力衰退，不利於認知學習；也有人視網際網路為人類的外接大腦記憶體，意味著我們毋須記憶大量知識，可以專注在更重要、更有創造力的事物上。對於以上兩種不同的觀點，你的看法為何？請以「網海浮沉之我思」為題，結合自己的相關經驗，探討創造力與思考力之間的關係。
文長至少600字。

","網路浮沉之我思



現在的網路很方便，大家都在用網路。我覺得網路雖然好用，但是也有不好的地方。像是我看過小叮噹的卡通，大雄用了一個可以幫助記憶的機器，結果差點變成沒有思考能力的人。這讓我想到現在的人都太依賴網路了。



網路確實很厲害，可以幫我們記很多東西，畫圖也比人類畫得好。但是我覺得人還是要自己思考，不能都靠網路。如果都靠網路的話，我們的大腦就會變得很笨。



思考力就是人的腦袋在想事情，創造力就是可以做出新的東西。我認為這兩個東西都很重要，如果沒有思考力，就不會有創造力。就像是電腦一樣，要有人輸入程式才會動，所以人要自己會思考才行。



所以我覺得網路應該要當成工具來用，不能讓它變成我們的大腦。我們要多用自己的腦袋想事情，這樣才不會被網路控制。",2,1,1,2,1,7
