題目,作答,立意,結構,修辭,敘述,啟發,總分
"二十一世紀資訊量以驚人的速度暴增，有人認為網路資訊易於取得，會使記憶力與思考力衰退，不利於認知學習；也有人視網際網路為人類的外接大腦記憶體，意味著我們毋須記憶大量知識，可以專注在更重要、更有創造力的事物上。對於以上兩種不同的觀點，你的看法為何？請以「網海浮沉之我思」為題，結合自己的相關經驗，探討創造力與思考力之間的關係。
文長至少600字。

","網海浮沉之我思



現在的科技很方便，但是也有壞處。我覺得科技對人類來說還是好的比較多。



以前沒有網路的時候，我們要記很多東西在腦袋裡。要找資料就要去翻很多書，書包也會變得很重。現在有了網路，找資料變得很容易。只要打幾個字，馬上就可以找到想要的東西。翻譯也變得很簡單，拍個照片就可以知道意思。看地圖和新聞也都變得很方便。



但是科技也有不好的地方。像我自己就是一個例子，因為網路太方便了，我都不想看書了。以前我很喜歡看書思考，現在都只會在網路上看一看就算了。所以我覺得科技只是一個工具，不應該太依賴它。



生活變得很快很忙，我們應該要放慢腳步。雖然有網路可以查資料，但是看書還是很重要。有了翻譯軟體，還是要好好學習。有了電子地圖和新聞，也要實際出去看看世界。



總之，科技就像海浪一樣，要適當使用才能幫助我們前進。",1,1,1,1,1,5
