題目,作答,立意,結構,修辭,敘述,啟發,總分
"    我覺得童年是一種氣味的記憶。
    我的童年，有許多果樹氣味的記憶。夏天暑熱的午後，廟埕後有一棵巨大的龍眼樹。我從小學翻牆出來，背著書包，爬上龍眼樹，躲在密密的枝葉裡。外面日光葉影搖晃，隱約聽見老師或母親尋來，在樹下叫著我的名字，但那呼喚的聲音，被蟬聲的高音淹沒了。我一動不動，找到一處適合蜷窩身體的枝椏，好像變成樹的一部分，而那時，龍眼樹密密的甜熟的氣味就包圍著我。我閉起眼睛，好像在假寐，也像在作夢，夢裡一串一串纍纍的龍眼，招來許多蜜蜂果蠅。我童年的夢，很甜很香，好像一整個夏天都窩在那棵樹上，包圍在濃郁的氣味裡做了一個醒不來的夢。（改寫自蔣勳《給青年藝術家的信》）
    生活中充斥各種氣味。氣味透過嗅覺傳遞，喚起人們的記憶和感受，一如文中龍眼樹甜熟的氣味喚起作者的童年記憶。請以「花草樹木的氣味記憶」為題，寫一篇文章，書寫你熟悉的花草樹木的氣味，及其所召喚的記憶和感受。

文長至少600字。

","花草樹木的氣味記憶



我記得國中時學校有木棉花樹，每到春天就會開花。木棉花平常都不太明顯，我都沒注意到它們。



後來發現木棉花開了紅色的花，香味很淡。因為學校種了很多木棉花樹，所以整個校園都有花香。木棉花開完後，花絮會掉下來，被風吹得到處都是，看起來像下雪一樣。



我最記得國三準備會考的時候，木棉花也開了。那時候我們都在讀書，看到木棉花開得很漂亮，感覺它是在鼓勵我們。



現在每次聞到木棉花的味道，我就會想起那時候紅紅的花和像下雪一樣的場景。那些回憶讓我覺得很特別。",1,1,1,1,1,5
