題目,作答,立意,結構,修辭,敘述,啟發,總分
"    我覺得童年是一種氣味的記憶。
    我的童年，有許多果樹氣味的記憶。夏天暑熱的午後，廟埕後有一棵巨大的龍眼樹。我從小學翻牆出來，背著書包，爬上龍眼樹，躲在密密的枝葉裡。外面日光葉影搖晃，隱約聽見老師或母親尋來，在樹下叫著我的名字，但那呼喚的聲音，被蟬聲的高音淹沒了。我一動不動，找到一處適合蜷窩身體的枝椏，好像變成樹的一部分，而那時，龍眼樹密密的甜熟的氣味就包圍著我。我閉起眼睛，好像在假寐，也像在作夢，夢裡一串一串纍纍的龍眼，招來許多蜜蜂果蠅。我童年的夢，很甜很香，好像一整個夏天都窩在那棵樹上，包圍在濃郁的氣味裡做了一個醒不來的夢。（改寫自蔣勳《給青年藝術家的信》）
    生活中充斥各種氣味。氣味透過嗅覺傳遞，喚起人們的記憶和感受，一如文中龍眼樹甜熟的氣味喚起作者的童年記憶。請以「花草樹木的氣味記憶」為題，寫一篇文章，書寫你熟悉的花草樹木的氣味，及其所召喚的記憶和感受。

文長至少600字。

","花草樹木的氣味記憶



我要說說木棉花的氣味，因為我國中的時候學校有很多木棉花樹。



木棉花樹平常都沒什麼特別的，就是一棵樹而已。我剛開始都沒注意到它們，因為它們就在路邊，我每天都會經過，但是都沒有特別去看。後來到了春天的時候，它們就開花了，我才發現原來學校有這麼多木棉花樹。



木棉花開的時候很漂亮，紅紅的花開了很多。雖然木棉花的香味不是很重，但是因為學校的樹很多，所以整個學校都有一點點香味。後來花開完了以後，就會掉很多白色的棉絮，風一吹的時候，這些棉絮就會飛來飛去，看起來像下雪一樣。



我最記得國三要考會考的時候，木棉花也是這樣開花。那時候我們都在準備考試，看到木棉花開得這麼漂亮，感覺好像是在鼓勵我們一樣。現在每次聞到木棉花的味道，我就會想起那時候的情景。",2,1,1,2,1,7
