題目,作答,立意,結構,修辭,敘述,啟發,總分
"二十一世紀資訊量以驚人的速度暴增，有人認為網路資訊易於取得，會使記憶力與思考力衰退，不利於認知學習；也有人視網際網路為人類的外接大腦記憶體，意味著我們毋須記憶大量知識，可以專注在更重要、更有創造力的事物上。對於以上兩種不同的觀點，你的看法為何？請以「網海浮沉之我思」為題，結合自己的相關經驗，探討創造力與思考力之間的關係。
文長至少600字。

","網海浮沉之我思



現在的網路資訊很多，大家都在討論網路對我們的影響。有人說網路會讓我們變笨，有人說網路可以幫助我們。我想說說我的看法。



我覺得網路很方便，可以讓我們找到很多資料。像是我要寫報告的時候，只要用手機或電腦就可以找到很多資料，不用跑圖書館。而且網路上的資料很多，可以看到不同的想法。



但是網路上也有很多假的資訊，所以我們要小心。像是有些新聞是假的，有些是詐騙的。所以我們要學會分辨真假。這樣才不會被騙。



我覺得網路就像是一個大腦，可以幫我們記住很多東西。這樣我們就不用記那麼多東西，可以做別的事情。但是我們還是要小心使用網路，不要被騙。",1,1,1,1,1,5
