題目,作答,立意,結構,修辭,敘述,啟發,總分
"甲
(陶潛)為彭澤令。不以家累自隨，送一力給其子，書曰：「汝旦夕之費，自給為難。今遣此力，助汝薪水（打柴汲水）之勞。此亦人子也，可善遇之。」(《南史．隱逸．陶潛傳》)
乙
飯後，眾人各自有事離去，留下貞觀靜坐桌前獃想。她今日的這番感慨，實是前未曾有的。
阿啟伯摘瓜，乃她親眼所見。今早，她突發奇想，陪著外公去巡魚塭，回來時，祖孫二人，都在門口停住了，因為後門虛掩，阿啟伯拿著菜刀，正在棚下摘瓜，並未發覺他們，祖孫二個都閃到門背後。貞觀當時是真愣住了，在那種情況下，是前進呢？抑是後退？她不能很快作選擇。然而這種遲疑也只有幾秒鐘，她一下就被外公拉到門後，正是屏息靜氣時，老人家又帶了她拐出小巷口，走到前街來。
貞觀人到了大路上，心下才逐漸明白：外公躲那人的心，竟比那偷瓜的人所做的遮遮掩掩更甚！貞觀以為懂得了外公的心意：他怕阿啟伯當下撞見自己的那種難堪。事實上，他還有另一層深意，貪當然不好，而貧的本身沒有錯。外公不以阿啟伯為不是，是知道他家中十口，有菜就沒飯，有飯就沒菜。(改寫自蕭麗紅《千江有水千江月》)
陶潛或者外公對他人的善意，你可能也曾見聞或經歷過，請以「溫暖的心」為題，寫一篇文章，分享你的經驗及體會。
文長至少600字。

","溫暖的心



在人生的旅途上，我們總會遇到挫折與困境，那些令人焦慮不安的時刻，往往讓人感到孤立無援。然而，正是在這些時刻，一個善意的眼神、一個溫暖的舉動，都可能成為照亮他人生命的明燈，讓人重拾前行的勇氣。



我深刻體會到這份溫暖，源自於求學時期的一次難忘經歷。上台報告對我而言，一直是最難跨越的心理關卡。即使經過無數次的演練，把內容背得滾瓜爛熟，每晚都在腦海中預演無數遍，甚至廣邀朋友們提供建議，但每當站上講台的那一刻，依然會緊張得連手中的講稿都在顫抖。



這種恐懼不僅來自於老師嚴肅的目光，更源於同學們或評判或期待的眼神。彷彿無數聚光燈齊刷刷地打在身上，讓人無處遁形。然而，就在一次報告中，當我因緊張而語塞，腦中一片空白之際，我注意到台下一位同學專注的眼神。他微微前傾身子，雙手支著下巴，目光中充滿鼓勵與支持。那一刻，彷彿整個世界只剩下這道溫暖的目光，給了我繼續前進的力量。



這次經歷讓我深刻明白，溫暖他人不需要驚天動地的壯舉。有時候，一個善意的微笑，一個肯定的眼神，或是一句輕聲的鼓勵，都能成為他人在困境中的明燈。就像陶潛對兒子的體貼，或是外公對阿啟伯的寬容，這些細微的善意，都在傳遞著人性最珍貴的溫度。



生命中的溫暖，往往就存在於這些看似微小卻意義重大的時刻。當我們願意敞開心扉，用同理心去感受他人的處境，伸出援手或給予支持時，不僅能幫助他人走出困境，更能讓這個世界多一份暖意。這種善意如同漣漪般擴散，讓更多人感受到生命中的美好。



在這個時代，我們更應該學會用溫暖的心去關懷他人，因為每個人都可能成為別人生命中的那道光，照亮他人的同時，也溫暖了自己的心靈。",4,4,4,4,4,20
