題目,作答,立意,結構,修辭,敘述,啟發,總分
"關於地球的記憶
被文字固禁在課本裡
我們的筆尖游走在山脈和海洋
翻譯每片花瓣的嬌嫩和露水的清新
所有的言語 答案
都靜放在我們的課本裡
等待我們翻起這一切的序幕（節錄自薛憶婷〈我們的課本〉）

    以上這首詩，從課本啟動天馬行空的遐想，瞥見知識豐富的樣貌。科學頑童費曼（Richard P. Feynman）曾說觀察轉動的餐盤，讓他得到很大的啟發，領略了興之所至的樂趣。物理課可讓我們發現萬物運行的迷人，生物課帶領我們進入細胞核遊歷，外語課讓我們聽見世界不同的文化。國文課堂上「採菊東籬下，悠然見南山」或「輕羅小扇撲流螢」，詩中情境也往往能讓人神遊於現實之外。過往的課程內容，是否曾經點燃你對知識的熱情？打開課本時，不知能否如〈我們的課本〉所述，揭開知識想像的序幕。
    若能從不同角度切入課本，進入知識的想像，或許可以讓課本帶領我們經歷驚奇的旅程。請以「當我打開課本」為題，寫一篇文章，敘述任一學科課本對你的意義，書寫你探索課本內容、知識的經驗與體會。
文長至少600字。


","當我打開課本



我每天都要打開課本讀書，雖然有時候覺得很無聊，但是課本裡面還是有一些有趣的東西。像是物理課本，雖然很多公式都看不懂，但是有時候看到一些圖片還蠻有趣的。



我記得第一次看物理課本的時候，裡面有很多公式，雖然不知道在寫什麼，但是看到球在滾動的圖片，還有飛機飛的圖片，感覺還不錯。有時候老師講解的時候，我也會想到生活中的一些事情，比如說騎腳踏車的時候為什麼會往前跑。



國文課本也有一些好看的詩，雖然很多字都不認識，但是有些詩讀起來感覺很舒服。像是「採菊東籬下，悠然見南山」，雖然不太懂在說什麼，但是感覺很輕鬆。



所以我覺得課本還是有一些好處的，雖然很多東西都看不懂，但是有時候翻一翻，還是可以學到一些東西。希望以後可以多看一些課本，學到更多知識。",2,1,1,2,1,7
