題目,作答,立意,結構,修辭,敘述,啟發,總分
"關於地球的記憶
被文字固禁在課本裡
我們的筆尖游走在山脈和海洋
翻譯每片花瓣的嬌嫩和露水的清新
所有的言語 答案
都靜放在我們的課本裡
等待我們翻起這一切的序幕（節錄自薛憶婷〈我們的課本〉）

    以上這首詩，從課本啟動天馬行空的遐想，瞥見知識豐富的樣貌。科學頑童費曼（Richard P. Feynman）曾說觀察轉動的餐盤，讓他得到很大的啟發，領略了興之所至的樂趣。物理課可讓我們發現萬物運行的迷人，生物課帶領我們進入細胞核遊歷，外語課讓我們聽見世界不同的文化。國文課堂上「採菊東籬下，悠然見南山」或「輕羅小扇撲流螢」，詩中情境也往往能讓人神遊於現實之外。過往的課程內容，是否曾經點燃你對知識的熱情？打開課本時，不知能否如〈我們的課本〉所述，揭開知識想像的序幕。
    若能從不同角度切入課本，進入知識的想像，或許可以讓課本帶領我們經歷驚奇的旅程。請以「當我打開課本」為題，寫一篇文章，敘述任一學科課本對你的意義，書寫你探索課本內容、知識的經驗與體會。
文長至少600字。


","當我打開課本



我覺得課本是很重要的東西，因為它可以教我們很多知識。每次打開課本的時候，我都會看到很多字，雖然有時候看不太懂，但是老師說這些都是很重要的東西。



我最喜歡的是公民課本，因為裡面有講很多法律的事情。法律是很久以前的人定的規矩，可以讓大家知道什麼事情可以做，什麼事情不可以做。我記得課本裡面有講到美國的漢米爾頓，他寫了美國的憲法，這些規定到現在還在用。



我覺得課本裡面的東西都是很多人想出來的，像是法律啊、規定啊，都是以前的人想很久才想出來的。雖然我不知道為什麼要這樣規定，但是老師說這些都是對的，所以我們要好好學習。



現在的人都要讀書，要學習課本裡面的東西，這樣才能變聰明。如果沒有課本，我們就不知道要學什麼了。所以我覺得課本很重要，每個人都應該要好好讀課本。",1,1,1,1,1,5
