題目,作答,立意,結構,修辭,敘述,啟發,總分
"    看到山上那麼多參天大樹時，會勾起我的惻隱之心。在無法順暢呼吸的空間裡，樹木之間為了生存必須展開激烈的競爭。為了能多接受一些陽光，它們只能拼命向上生長。
但是，只為生存而競爭的森林卻漸次死亡，因為陽光無法到達地面，所以溫度不夠高，無法讓幼小的生命萌芽。小樹和花、草，以及與它們一起生活的小昆蟲沒有生存的空間。雖然表面上看起來非常完美，但這種森林其實與沒有希望的不孕之地無異。
根據我的經驗，密集栽種的樹苗體型壯大數十倍時，就需要開始砍樹，否則樹木會抱怨空間太窄，活不下去。要想確保樹木能充分接受陽光照射的空間，就必須做出犧牲。因此，幾年期間強行進行砍伐，樹木間距剛開始時是一公尺，現已擴大到七公尺。也就是說，即使是粗略估算，也可知七棵樹中有六棵為之消失。
森林要想成為孕育新生命的希望之地，就需要有縫隙。如果樹木壽命結束或因為意外災害而倒下，該位置就會產生空間，那麼，溫暖的陽光就會照射進來，被陽光照射的地面混雜著前一年秋天凋落的樹葉，於是積聚起能夠孕育新生命的養分。因此，樹木的縫隙，既是結束和開始共存的空間，也是由缺乏轉化為希望的空間。（改寫自禹鐘榮著、盧鴻金譯《樹木教我的人生課》）
    根據上文所述，為什麼森林需要縫隙？由此聯想，人生是否也需要縫隙？請以「縫隙的聯想」為題，寫一篇文章，結合生活經驗或見聞，書寫你的感思與體悟。
文長至少600字。


","縫隙的聯想



樹林裡面有很多樹，它們都在搶著要長大。如果樹長得太密，小樹就會長不大，所以需要空隙讓小樹長大。



我覺得樹和樹之間要有空隙才好。因為有空隙，樹才能長得好。如果沒有空隙的話，樹就會長不好。就像課文說的，樹太密會死掉，所以要砍掉一些樹才行。



小樹要長大很辛苦，因為大樹都擋住陽光了。如果有空隙的話，陽光就可以照到小樹，小樹就比較容易長大。所以空隙對小樹來說很重要。



人生也需要空隙。我每天都要讀書，功課很多，壓力很大。有時候真的很累，需要休息。休息的時候，我會聽音樂或是玩遊戲，這樣才能繼續讀書。



所以我認為，不管是樹還是人，都需要一些空隙。這樣才能讓自己過得比較好。",1,1,1,1,1,5
