題目,作答,立意,結構,修辭,敘述,啟發,總分
"二十一世紀資訊量以驚人的速度暴增，有人認為網路資訊易於取得，會使記憶力與思考力衰退，不利於認知學習；也有人視網際網路為人類的外接大腦記憶體，意味著我們毋須記憶大量知識，可以專注在更重要、更有創造力的事物上。對於以上兩種不同的觀點，你的看法為何？請以「網海浮沉之我思」為題，結合自己的相關經驗，探討創造力與思考力之間的關係。
文長至少600字。

","網海浮沉之我思



現在的科技發展很快，大家都很依賴網路。我們可以在網路上找到很多資訊，但是因為資訊太多了，所以我們遇到問題就直接上網找答案或是問AI。



網路上有很多假資訊，像是假新聞就常常誤導大家。這些不實的資訊有時候會害到人，所以我們要小心使用網路。



現在的工作也越來越依賴科技，很多人說以後服務員都會變成機器人。但是我覺得不是每個工作都可以用機器取代，這樣會讓人變得很懶惰。我希望科技發展可以慢一點。



創造力可以讓生活變得比較特別，但是要讓別人看到你的想法就需要用到網路。網路雖然方便，但是也有不好的地方，所以我們要好好使用。



總之，網路讓我們可以學到很多東西，但是我們要記得不要太依賴它，這樣才能跟著世界一起進步。",1,1,1,1,1,5
