題目,作答,立意,結構,修辭,敘述,啟發,總分
"關於地球的記憶
被文字固禁在課本裡
我們的筆尖游走在山脈和海洋
翻譯每片花瓣的嬌嫩和露水的清新
所有的言語 答案
都靜放在我們的課本裡
等待我們翻起這一切的序幕（節錄自薛憶婷〈我們的課本〉）

    以上這首詩，從課本啟動天馬行空的遐想，瞥見知識豐富的樣貌。科學頑童費曼（Richard P. Feynman）曾說觀察轉動的餐盤，讓他得到很大的啟發，領略了興之所至的樂趣。物理課可讓我們發現萬物運行的迷人，生物課帶領我們進入細胞核遊歷，外語課讓我們聽見世界不同的文化。國文課堂上「採菊東籬下，悠然見南山」或「輕羅小扇撲流螢」，詩中情境也往往能讓人神遊於現實之外。過往的課程內容，是否曾經點燃你對知識的熱情？打開課本時，不知能否如〈我們的課本〉所述，揭開知識想像的序幕。
    若能從不同角度切入課本，進入知識的想像，或許可以讓課本帶領我們經歷驚奇的旅程。請以「當我打開課本」為題，寫一篇文章，敘述任一學科課本對你的意義，書寫你探索課本內容、知識的經驗與體會。
文長至少600字。


","當我打開課本



我覺得課本是一個很重要的東西，因為它可以讓我學到很多知識。每次上課的時候，我都會認真看課本，因為裡面有很多有趣的故事和詩詞。



我最喜歡國文課本，因為裡面有很多古代的故事。雖然有些字很難懂，但是老師會教我們怎麼讀，還會解釋故事的意思。我覺得這樣很好，可以讓我知道以前的人在想什麼。



課本雖然很厚，但是裡面的內容都很豐富。有時候看到一些故事，我會覺得很感動。像是課本裡的一些詩詞，讀起來很優美，讓我可以想像很多畫面。



我覺得每個人看課本的感覺都不一樣。有些人可能覺得課本很無聊，但是我覺得只要用心去讀，就可以學到很多東西。課本就像是一個寶藏，裡面藏著很多知識。



所以我希望大家都可以好好看課本，不要覺得它很無聊。因為課本可以教會我們很多事情，讓我們變得更聰明。",2,2,1,2,1,8
