題目,作答,立意,結構,修辭,敘述,啟發,總分
"    我覺得童年是一種氣味的記憶。
    我的童年，有許多果樹氣味的記憶。夏天暑熱的午後，廟埕後有一棵巨大的龍眼樹。我從小學翻牆出來，背著書包，爬上龍眼樹，躲在密密的枝葉裡。外面日光葉影搖晃，隱約聽見老師或母親尋來，在樹下叫著我的名字，但那呼喚的聲音，被蟬聲的高音淹沒了。我一動不動，找到一處適合蜷窩身體的枝椏，好像變成樹的一部分，而那時，龍眼樹密密的甜熟的氣味就包圍著我。我閉起眼睛，好像在假寐，也像在作夢，夢裡一串一串纍纍的龍眼，招來許多蜜蜂果蠅。我童年的夢，很甜很香，好像一整個夏天都窩在那棵樹上，包圍在濃郁的氣味裡做了一個醒不來的夢。（改寫自蔣勳《給青年藝術家的信》）
    生活中充斥各種氣味。氣味透過嗅覺傳遞，喚起人們的記憶和感受，一如文中龍眼樹甜熟的氣味喚起作者的童年記憶。請以「花草樹木的氣味記憶」為題，寫一篇文章，書寫你熟悉的花草樹木的氣味，及其所召喚的記憶和感受。

文長至少600字。

","花草樹木的氣味記憶



我小時候住在鄉下，那時候常常聞到很多樹木的味道。我最喜歡的是芒果樹的味道，因為每到夏天，爺爺都會帶我去果園玩。



記得那時候，我和爺爺騎著腳踏車去果園。果園裡有很多芒果樹，樹上的芒果聞起來很香。爺爺在旁邊跟我說以前的事情，但是我都沒有在聽，因為我只想聞芒果的味道。那時候的芒果味道真的很好聞，讓我一直想往樹林裡面走。



現在我長大了，再回去鄉下看，發現很多事情都變了。以前種稻子的田都沒有人種了，爺爺也變老了，走路都不方便。以前認識的鄰居也都搬走了。但是那些芒果樹還在那裡，聞起來還是跟以前一樣香。這讓我想起小時候的事情。



雖然現在很多東西都變了，但是在我的記憶裡，那個果園和芒果的味道永遠都不會變。這些回憶對我來說很重要，讓我覺得很溫暖。",2,2,1,2,1,8
